tcpdump -n -i eth0
17:06:18.306967 IP 68.183.205.32.22 > 99.230.36.4.54786: Flags [P.], seq 26945680:26945892, ack 15337, win 501, options [nop,nop,TS val 3769979136 ecr 827633594], length 212
17:06:18.307004 IP 68.183.205.32.22 > 99.230.36.4.54786: Flags [P.], seq 26945892:26946104, ack 15337, win 501, options [nop,nop,TS val 3769979136 ecr 827633594], length 212
17:06:18.307044 IP 68.183.205.32.22 > 99.230.36.4.54786: Flags [P.], seq 26946104:26946316, ack 15337, win 501, options [nop,nop,TS val 3769979136 ecr 827633594], length 212
17:06:18.307081 IP 68.183.205.32.22 > 99.230.36.4.54786: Flags [P.], seq 26946316:26946528, ack 15337, win 501, options [nop,nop,TS val 3769979136 ecr 827633594], length 212
17:06:18.307122 IP 68.183.205.32.22 > 99.230.36.4.54786: Flags [P.], seq 26946528:26946740, ack 15337, win 501, options [nop,nop,TS val 3769979136 ecr 827633594], length 212
17:06:18.307158 IP 68.183.205.32.22 > 99.230.36.4.54786: Flags [P.], seq 26946740:26946952, ack 15337, win 501, options [nop,nop,TS val 3769979136 ecr 827633594], length 212
17:06:18.307211 IP 68.183.205.32.22 > 99.230.36.4.54786: Flags [P.], seq 26946952:26947164, ack 15337, win 501, options [nop,nop,TS val 3769979136 ecr 827633594], length 212
17:06:18.307252 IP 68.183.205.32.22 > 99.230.36.4.54786: Flags [P.], seq 26947164:26947376, ack 15337, win 501, options [nop,nop,TS val 3769979136 ecr 827633594], length 212
17:06:18.307292 IP 68.183.205.32.22 > 99.230.36.4.54786: Flags [P.], seq 26947376:26947588, ack 15337, win 501, options [nop,nop,TS val 3769979136 ecr 827633594], length 212
17:06:18.307330 IP 68.183.205.32.22 > 99.230.36.4.54786: Flags [P.], seq 26947588:26947800, ack 15337, win 501, options [nop,nop,TS val 3769979136 ecr 827633594], length 212
17:06:18.307368 IP 68.183.205.32.22 > 99.230.36.4.54786: Flags [P.], seq 26947800:26948012, ack 15337, win 501, options [nop,nop,TS val 3769979136 ecr 827633594], length 212
17:06:18.307405 IP 68.183.205.32.22 > 99.230.36.4.54786: Flags [P.], seq 26948012:26948224, ack 15337, win 501, options [nop,nop,TS val 3769979136 ecr 827633594], length 212
17:06:18.307454 IP 68.183.205.32.22 > 99.230.36.4.54786: Flags [P.], seq 26948224:26948436, ack 15337, win 501, options [nop,nop,TS val 3769979136 ecr 827633594], length 212
17:06:18.307493 IP 68.183.205.32.22 > 99.230.36.4.54786: Flags [P.], seq 26948436:26948648, ack 15337, win 501, options [nop,nop,TS val 3769979136 ecr 827633594], length 212
17:06:18.307530 IP 68.183.205.32.22 > 99.230.36.4.54786: Flags [P.], seq 26948648:26948860, ack 15337, win 501, options [nop,nop,TS val 3769979136 ecr 827633594], length 212
17:06:18.307566 IP 68.183.205.32.22 > 99.230.36.4.54786: Flags [P.], seq 26948860:26949072, ack 15337, win 501, options [nop,nop,TS val 3769979136 ecr 827633594], length 212
17:06:18.307609 IP 68.183.205.32.22 > 99.230.36.4.54786: Flags [P.], seq 26949072:26949284, ack 15337, win 501, options [nop,nop,TS val 3769979137 ecr 827633594], length 212
17:06:18.307646 IP 68.183.205.32.22 > 99.230.36.4.54786: Flags [P.], seq 26949284:26949496, ack 15337, win 501, options [nop,nop,TS val 3769979137 ecr 827633594], length 212
17:06:18.307685 IP 68.183.205.32.22 > 99.230.36.4.54786: Flags [P.], seq 26949496:26949708, ack 15337, win 501, options [nop,nop,TS val 3769979137 ecr 827633594], length 212
17:06:18.307721 IP 68.183.205.32.22 > 99.230.36.4.54786: Flags [P.], seq 26949708:26949920, ack 15337, win 501, options [nop,nop,TS val 3769979137 ecr 827633594], length 212
17:06:18.307760 IP 68.183.205.32.22 > 99.230.36.4.54786: Flags [P.], seq 26949920:26950132, ack 15337, win 501, options [nop,nop,TS val 3769979137 ecr 827633594], length 212
17:06:18.307796 IP 68.183.205.32.22 > 99.230.36.4.54786: Flags [P.], seq 26950132:26950344, ack 15337, win 501, options [nop,nop,TS val 3769979137 ecr 827633594], length 212
17:06:18.307835 IP 68.183.205.32.22 > 99.230.36.4.54786: Flags [P.], seq 26950344:26950556, ack 15337, win 501, options [nop,nop,TS val 3769979137 ecr 827633594], length 212
17:06:18.307873 IP 68.183.205.32.22 > 99.230.36.4.54786: Flags [P.], seq 26950556:26950768, ack 15337, win 501, options [nop,nop,TS val 3769979137 ecr 827633594], length 212
17:06:18.307913 IP 68.183.205.32.22 > 99.230.36.4.54786: Flags [P.], seq 26950768:26950980, ack 15337, win 501, options [nop,nop,TS val 3769979137 ecr 827633594], length 212
17:06:18.307953 IP 68.183.205.32.22 > 99.230.36.4.54786: Flags [P.], seq 26950980:26951192, ack 15337, win 501, options [nop,nop,TS val 3769979137 ecr 827633594], length 212
17:06:18.307989 IP 68.183.205.32.22 > 99.230.36.4.54786: Flags [P.], seq 26951192:26951404, ack 15337, win 501, options [nop,nop,TS val 3769979137 ecr 827633594], length 212
17:06:18.308025 IP 68.183.205.32.22 > 99.230.36.4.54786: Flags [P.], seq 26951404:26951616, ack 15337, win 501, options [nop,nop,TS val 3769979137 ecr 827633594], length 212
17:06:18.308067 IP 68.183.205.32.22 > 99.230.36.4.54786: Flags [P.], seq 26951616:26951828, ack 15337, win 501, options [nop,nop,TS val 3769979137 ecr 827633594], length 212
17:06:18.308105 IP 68.183.205.32.22 > 99.230.36.4.54786: Flags [P.], seq 26951828:26952040, ack 15337, win 501, options [nop,nop,TS val 3769979137 ecr 827633594], length 212
17:06:18.308144 IP 68.183.205.32.22 > 99.230.36.4.54786: Flags [P.], seq 26952040:26952252, ack 15337, win 501, options [nop,nop,TS val 3769979137 ecr 827633594], length 212
17:06:18.308181 IP 68.183.205.32.22 > 99.230.36.4.54786: Flags [P.], seq 26952252:26952464, ack 15337, win 501, options [nop,nop,TS val 3769979137 ecr 827633594], length 212
17:06:18.308224 IP 68.183.205.32.22 > 99.230.36.4.54786: Flags [P.], seq 26952464:26952676, ack 15337, win 501, options [nop,nop,TS val 3769979137 ecr 827633594], length 212
17:06:18.308262 IP 68.183.205.32.22 > 99.230.36.4.54786: Flags [P.], seq 26952676:26952888, ack 15337, win 501, options [nop,nop,TS val 3769979137 ecr 827633594], length 212
17:06:18.311276 IP 99.230.36.4.54786 > 68.183.205.32.22: Flags [.], ack 26575344, win 37094, options [nop,nop,TS val 827633608 ecr 3769978991], length 0
17:06:18.311511 IP 68.183.205.32.22 > 99.230.36.4.54786: Flags [P.], seq 26952888:26953100, ack 15337, win 501, options [nop,nop,TS val 3769979140 ecr 827633608], length 212
17:06:18.311552 IP 68.183.205.32.22 > 99.230.36.4.54786: Flags [P.], seq 26953100:26953288, ack 15337, win 501, options [nop,nop,TS val 3769979140 ecr 827633608], length 188
17:06:18.311609 IP 68.183.205.32.22 > 99.230.36.4.54786: Flags [P.], seq 26953288:26953676, ack 15337, win 501, options [nop,nop,TS val 3769979141 ecr 827633608], length 388
17:06:18.311649 IP 68.183.205.32.22 > 99.230.36.4.54786: Flags [P.], seq 26953676:26953888, ack 15337, win 501, options [nop,nop,TS val 3769979141 ecr 827633608], length 212
17:06:18.311689 IP 68.183.205.32.22 > 99.230.36.4.54786: Flags [P.], seq 26953888:26954100, ack 15337, win 501, options [nop,nop,TS val 3769979141 ecr 827633608], length 212
17:06:18.311727 IP 68.183.205.32.22 > 99.230.36.4.54786: Flags [P.], seq 26954100:26954312, ack 15337, win 501, options [nop,nop,TS val 3769979141 ecr 827633608], length 212
17:06:18.311764 IP 68.183.205.32.22 > 99.230.36.4.54786: Flags [P.], seq 26954312:26954524, ack 15337, win 501, options [nop,nop,TS val 3769979141 ecr 827633608], length 212
17:06:18.311806 IP 68.183.205.32.22 > 99.230.36.4.54786: Flags [P.], seq 26954524:26954736, ack 15337, win 501, options [nop,nop,TS val 3769979141 ecr 827633608], length 212
17:06:18.311843 IP 68.183.205.32.22 > 99.230.36.4.54786: Flags [P.], seq 26954736:26954948, ack 15337, win 501, options [nop,nop,TS val 3769979141 ecr 827633608], length 212
17:06:18.311880 IP 68.183.205.32.22 > 99.230.36.4.54786: Flags [P.], seq 26954948:26955160, ack 15337, win 501, options [nop,nop,TS val 3769979141 ecr 827633608], length 212
17:06:18.311918 IP 68.183.205.32.22 > 99.230.36.4.54786: Flags [P.], seq 26955160:26955372, ack 15337, win 501, options [nop,nop,TS val 3769979141 ecr 827633608], length 212
17:06:18.311960 IP 68.183.205.32.22 > 99.230.36.4.54786: Flags [P.], seq 26955372:26955584, ack 15337, win 501, options [nop,nop,TS val 3769979141 ecr 827633608], length 212
17:06:18.311996 IP 68.183.205.32.22 > 99.230.36.4.54786: Flags [P.], seq 26955584:26955796, ack 15337, win 501, options [nop,nop,TS val 3769979141 ecr 827633608], length 212
17:06:18.312036 IP 68.183.205.32.22 > 99.230.36.4.54786: Flags [P.], seq 26955796:26956008, ack 15337, win 501, options [nop,nop,TS val 3769979141 ecr 827633608], length 212
17:06:18.312072 IP 68.183.205.32.22 > 99.230.36.4.54786: Flags [P.], seq 26956008:26956220, ack 15337, win 501, options [nop,nop,TS val 3769979141 ecr 827633608], length 212
17:06:18.312109 IP 68.183.205.32.22 > 99.230.36.4.54786: Flags [P.], seq 26956220:26956432, ack 15337, win 501, options [nop,nop,TS val 3769979141 ecr 827633608], length 212
17:06:18.312146 IP 68.183.205.32.22 > 99.230.36.4.54786: Flags [P.], seq 26956432:26956644, ack 15337, win 501, options [nop,nop,TS val 3769979141 ecr 827633608], length 212
17:06:18.312185 IP 68.183.205.32.22 > 99.230.36.4.54786: Flags [P.], seq 26956644:26956856, ack 15337, win 501, options [nop,nop,TS val 3769979141 ecr 827633608], length 212
17:06:18.312222 IP 68.183.205.32.22 > 99.230.36.4.54786: Flags [P.], seq 26956856:26957068, ack 15337, win 501, options [nop,nop,TS val 3769979141 ecr 827633608], length 212
17:06:18.312263 IP 68.183.205.32.22 > 99.230.36.4.54786: Flags [P.], seq 26957068:26957280, ack 15337, win 501, options [nop,nop,TS val 3769979141 ecr 827633608], length 212
17:06:18.312299 IP 68.183.205.32.22 > 99.230.36.4.54786: Flags [P.], seq 26957280:26957492, ack 15337, win 501, options [nop,nop,TS val 3769979141 ecr 827633608], length 212
17:06:18.312348 IP 68.183.205.32.22 > 99.230.36.4.54786: Flags [P.], seq 26957492:26957704, ack 15337, win 501, options [nop,nop,TS val 3769979141 ecr 827633608], length 212
17:06:18.312385 IP 68.183.205.32.22 > 99.230.36.4.54786: Flags [P.], seq 26957704:26957916, ack 15337, win 501, options [nop,nop,TS val 3769979141 ecr 827633608], length 212
17:06:18.312421 IP 68.183.205.32.22 > 99.230.36.4.54786: Flags [P.], seq 26957916:26958128, ack 15337, win 501, options [nop,nop,TS val 3769979141 ecr 827633608], length 212
17:06:18.312460 IP 68.183.205.32.22 > 99.230.36.4.54786: Flags [P.], seq 26958128:26958340, ack 15337, win 501, options [nop,nop,TS val 3769979141 ecr 827633608], length 212
17:06:18.312497 IP 68.183.205.32.22 > 99.230.36.4.54786: Flags [P.], seq 26958340:26958552, ack 15337, win 501, options [nop,nop,TS val 3769979141 ecr 827633608], length 212
17:06:18.312536 IP 68.183.205.32.22 > 99.230.36.4.54786: Flags [P.], seq 26958552:26958764, ack 15337, win 501, options [nop,nop,TS val 3769979141 ecr 827633608], length 212
17:06:18.312576 IP 68.183.205.32.22 > 99.230.36.4.54786: Flags [P.], seq 26958764:26958976, ack 15337, win 501, options [nop,nop,TS val 3769979142 ecr 827633608], length 212
17:06:18.312616 IP 68.183.205.32.22 > 99.230.36.4.54786: Flags [P.], seq 26958976:26959188, ack 15337, win 501, options [nop,nop,TS val 3769979142 ecr 827633608], length 212
17:06:18.312653 IP 68.183.205.32.22 > 99.230.36.4.54786: Flags [P.], seq 26959188:26959400, ack 15337, win 501, options [nop,nop,TS val 3769979142 ecr 827633608], length 212
17:06:18.312693 IP 68.183.205.32.22 > 99.230.36.4.54786: Flags [P.], seq 26959400:26959612, ack 15337, win 501, options [nop,nop,TS val 3769979142 ecr 827633608], length 212
17:06:18.312732 IP 68.183.205.32.22 > 99.230.36.4.54786: Flags [P.], seq 26959612:26959824, ack 15337, win 501, options [nop,nop,TS val 3769979142 ecr 827633608], length 212
17:06:18.312769 IP 68.183.205.32.22 > 99.230.36.4.54786: Flags [P.], seq 26959824:26960036, ack 15337, win 501, options [nop,nop,TS val 3769979142 ecr 827633608], length 212
17:06:18.312811 IP 68.183.205.32.22 > 99.230.36.4.54786: Flags [P.], seq 26960036:26960248, ack 15337, win 501, options [nop,nop,TS val 3769979142 ecr 827633608], length 212
17:06:18.312865 IP 68.183.205.32.22 > 99.230.36.4.54786: Flags [P.], seq 26960248:26960460, ack 15337, win 501, options [nop,nop,TS val 3769979142 ecr 827633608], length 212
17:06:18.312919 IP 68.183.205.32.22 > 99.230.36.4.54786: Flags [P.], seq 26960460:26960672, ack 15337, win 501, options [nop,nop,TS val 3769979142 ecr 827633608], length 212
17:06:18.312965 IP 68.183.205.32.22 > 99.230.36.4.54786: Flags [P.], seq 26960672:26960884, ack 15337, win 501, options [nop,nop,TS val 3769979142 ecr 827633608], length 212
17:06:18.313015 IP 68.183.205.32.22 > 99.230.36.4.54786: Flags [P.], seq 26960884:26961096, ack 15337, win 501, options [nop,nop,TS val 3769979142 ecr 827633608], length 212
17:06:18.313057 IP 68.183.205.32.22 > 99.230.36.4.54786: Flags [P.], seq 26961096:26961308, ack 15337, win 501, options [nop,nop,TS val 3769979142 ecr 827633608], length 212
17:06:18.313102 IP 68.183.205.32.22 > 99.230.36.4.54786: Flags [P.], seq 26961308:26961520, ack 15337, win 501, options [nop,nop,TS val 3769979142 ecr 827633608], length 212
17:06:18.313148 IP 68.183.205.32.22 > 99.230.36.4.54786: Flags [P.], seq 26961520:26961732, ack 15337, win 501, options [nop,nop,TS val 3769979142 ecr 827633608], length 212
17:06:18.313191 IP 68.183.205.32.22 > 99.230.36.4.54786: Flags [P.], seq 26961732:26961944, ack 15337, win 501, options [nop,nop,TS val 3769979142 ecr 827633608], length 212
17:06:18.313235 IP 68.183.205.32.22 > 99.230.36.4.54786: Flags [P.], seq 26961944:26962156, ack 15337, win 501, options [nop,nop,TS val 3769979142 ecr 827633608], length 212
17:06:18.313278 IP 68.183.205.32.22 > 99.230.36.4.54786: Flags [P.], seq 26962156:26962368, ack 15337, win 501, options [nop,nop,TS val 3769979142 ecr 827633608], length 212
17:06:18.313323 IP 68.183.205.32.22 > 99.230.36.4.54786: Flags [P.], seq 26962368:26962580, ack 15337, win 501, options [nop,nop,TS val 3769979142 ecr 827633608], length 212
17:06:18.313365 IP 68.183.205.32.22 > 99.230.36.4.54786: Flags [P.], seq 26962580:26962792, ack 15337, win 501, options [nop,nop,TS val 3769979142 ecr 827633608], length 212
17:06:18.313412 IP 68.183.205.32.22 > 99.230.36.4.54786: Flags [P.], seq 26962792:26963004, ack 15337, win 501, options [nop,nop,TS val 3769979142 ecr 827633608], length 212
17:06:18.313456 IP 68.183.205.32.22 > 99.230.36.4.54786: Flags [P.], seq 26963004:26963216, ack 15337, win 501, options [nop,nop,TS val 3769979142 ecr 827633608], length 212
17:06:18.313499 IP 68.183.205.32.22 > 99.230.36.4.54786: Flags [P.], seq 26963216:26963428, ack 15337, win 501, options [nop,nop,TS val 3769979142 ecr 827633608], length 212
17:06:18.313544 IP 68.183.205.32.22 > 99.230.36.4.54786: Flags [P.], seq 26963428:26963640, ack 15337, win 501, options [nop,nop,TS val 3769979142 ecr 827633608], length 212
17:06:18.313587 IP 68.183.205.32.22 > 99.230.36.4.54786: Flags [P.], seq 26963640:26963852, ack 15337, win 501, options [nop,nop,TS val 3769979143 ecr 827633608], length 212
17:06:18.313631 IP 68.183.205.32.22 > 99.230.36.4.54786: Flags [P.], seq 26963852:26964064, ack 15337, win 501, options [nop,nop,TS val 3769979143 ecr 827633608], length 212
17:06:18.313675 IP 68.183.205.32.22 > 99.230.36.4.54786: Flags [P.], seq 26964064:26964276, ack 15337, win 501, options [nop,nop,TS val 3769979143 ecr 827633608], length 212
17:06:18.313720 IP 68.183.205.32.22 > 99.230.36.4.54786: Flags [P.], seq 26964276:26964488, ack 15337, win 501, options [nop,nop,TS val 3769979143 ecr 827633608], length 212
17:06:18.313762 IP 68.183.205.32.22 > 99.230.36.4.54786: Flags [P.], seq 26964488:26964700, ack 15337, win 501, options [nop,nop,TS val 3769979143 ecr 827633608], length 212
17:06:18.313808 IP 68.183.205.32.22 > 99.230.36.4.54786: Flags [P.], seq 26964700:26964912, ack 15337, win 501, options [nop,nop,TS val 3769979143 ecr 827633608], length 212
17:06:18.313851 IP 68.183.205.32.22 > 99.230.36.4.54786: Flags [P.], seq 26964912:26965124, ack 15337, win 501, options [nop,nop,TS val 3769979143 ecr 827633608], length 212
17:06:18.313895 IP 68.183.205.32.22 > 99.230.36.4.54786: Flags [P.], seq 26965124:26965336, ack 15337, win 501, options [nop,nop,TS val 3769979143 ecr 827633608], length 212
17:06:18.313942 IP 68.183.205.32.22 > 99.230.36.4.54786: Flags [P.], seq 26965336:26965548, ack 15337, win 501, options [nop,nop,TS val 3769979143 ecr 827633608], length 212
17:06:18.313986 IP 68.183.205.32.22 > 99.230.36.4.54786: Flags [P.], seq 26965548:26965760, ack 15337, win 501, options [nop,nop,TS val 3769979143 ecr 827633608], length 212
17:06:18.314032 IP 68.183.205.32.22 > 99.230.36.4.54786: Flags [P.], seq 26965760:26965972, ack 15337, win 501, options [nop,nop,TS val 3769979143 ecr 827633608], length 212
17:06:18.314084 IP 68.183.205.32.22 > 99.230.36.4.54786: Flags [P.], seq 26965972:26966184, ack 15337, win 501, options [nop,nop,TS val 3769979143 ecr 827633608], length 212
17:06:18.314131 IP 68.183.205.32.22 > 99.230.36.4.54786: Flags [P.], seq 26966184:26966396, ack 15337, win 501, options [nop,nop,TS val 3769979143 ecr 827633608], length 212
17:06:18.314176 IP 68.183.205.32.22 > 99.230.36.4.54786: Flags [P.], seq 26966396:26966608, ack 15337, win 501, options [nop,nop,TS val 3769979143 ecr 827633608], length 212
17:06:18.314219 IP 68.183.205.32.22 > 99.230.36.4.54786: Flags [P.], seq 26966608:26966820, ack 15337, win 501, options [nop,nop,TS val 3769979143 ecr 827633608], length 212
17:06:18.314263 IP 68.183.205.32.22 > 99.230.36.4.54786: Flags [P.], seq 26966820:26967032, ack 15337, win 501, options [nop,nop,TS val 3769979143 ecr 827633608], length 212
17:06:18.314305 IP 68.183.205.32.22 > 99.230.36.4.54786: Flags [P.], seq 26967032:26967244, ack 15337, win 501, options [nop,nop,TS val 3769979143 ecr 827633608], length 212
17:06:18.314351 IP 68.183.205.32.22 > 99.230.36.4.54786: Flags [P.], seq 26967244:26967456, ack 15337, win 501, options [nop,nop,TS val 3769979143 ecr 827633608], length 212
17:06:18.314393 IP 68.183.205.32.22 > 99.230.36.4.54786: Flags [P.], seq 26967456:26967668, ack 15337, win 501, options [nop,nop,TS val 3769979143 ecr 827633608], length 212
17:06:18.314439 IP 68.183.205.32.22 > 99.230.36.4.54786: Flags [P.], seq 26967668:26967880, ack 15337, win 501, options [nop,nop,TS val 3769979143 ecr 827633608], length 212
17:06:18.314481 IP 68.183.205.32.22 > 99.230.36.4.54786: Flags [P.], seq 26967880:26968092, ack 15337, win 501, options [nop,nop,TS val 3769979143 ecr 827633608], length 212
17:06:18.314526 IP 68.183.205.32.22 > 99.230.36.4.54786: Flags [P.], seq 26968092:26968304, ack 15337, win 501, options [nop,nop,TS val 3769979143 ecr 827633608], length 212
17:06:18.314568 IP 68.183.205.32.22 > 99.230.36.4.54786: Flags [P.], seq 26968304:26968516, ack 15337, win 501, options [nop,nop,TS val 3769979144 ecr 827633608], length 212
17:06:18.314614 IP 68.183.205.32.22 > 99.230.36.4.54786: Flags [P.], seq 26968516:26968728, ack 15337, win 501, options [nop,nop,TS val 3769979144 ecr 827633608], length 212
17:06:18.314658 IP 68.183.205.32.22 > 99.230.36.4.54786: Flags [P.], seq 26968728:26968940, ack 15337, win 501, options [nop,nop,TS val 3769979144 ecr 827633608], length 212
17:06:18.314701 IP 68.183.205.32.22 > 99.230.36.4.54786: Flags [P.], seq 26968940:26969152, ack 15337, win 501, options [nop,nop,TS val 3769979144 ecr 827633608], length 212
17:06:18.314747 IP 68.183.205.32.22 > 99.230.36.4.54786: Flags [P.], seq 26969152:26969364, ack 15337, win 501, options [nop,nop,TS val 3769979144 ecr 827633608], length 212
17:06:18.314791 IP 68.183.205.32.22 > 99.230.36.4.54786: Flags [P.], seq 26969364:26969576, ack 15337, win 501, options [nop,nop,TS val 3769979144 ecr 827633608], length 212
17:06:18.314834 IP 68.183.205.32.22 > 99.230.36.4.54786: Flags [P.], seq 26969576:26969788, ack 15337, win 501, options [nop,nop,TS val 3769979144 ecr 827633608], length 212
17:06:18.314879 IP 68.183.205.32.22 > 99.230.36.4.54786: Flags [P.], seq 26969788:26970000, ack 15337, win 501, options [nop,nop,TS val 3769979144 ecr 827633608], length 212
17:06:18.314923 IP 68.183.205.32.22 > 99.230.36.4.54786: Flags [P.], seq 26970000:26970212, ack 15337, win 501, options [nop,nop,TS val 3769979144 ecr 827633608], length 212
17:06:18.314967 IP 68.183.205.32.22 > 99.230.36.4.54786: Flags [P.], seq 26970212:26970424, ack 15337, win 501, options [nop,nop,TS val 3769979144 ecr 827633608], length 212
17:06:18.315011 IP 68.183.205.32.22 > 99.230.36.4.54786: Flags [P.], seq 26970424:26970636, ack 15337, win 501, options [nop,nop,TS val 3769979144 ecr 827633608], length 212
17:06:18.315056 IP 68.183.205.32.22 > 99.230.36.4.54786: Flags [P.], seq 26970636:26970848, ack 15337, win 501, options [nop,nop,TS val 3769979144 ecr 827633608], length 212
17:06:18.315098 IP 68.183.205.32.22 > 99.230.36.4.54786: Flags [P.], seq 26970848:26971060, ack 15337, win 501, options [nop,nop,TS val 3769979144 ecr 827633608], length 212
17:06:18.315143 IP 68.183.205.32.22 > 99.230.36.4.54786: Flags [P.], seq 26971060:26971272, ack 15337, win 501, options [nop,nop,TS val 3769979144 ecr 827633608], length 212
17:06:18.315210 IP 68.183.205.32.22 > 99.230.36.4.54786: Flags [P.], seq 26971272:26971484, ack 15337, win 501, options [nop,nop,TS val 3769979144 ecr 827633608], length 212
17:06:18.315253 IP 68.183.205.32.22 > 99.230.36.4.54786: Flags [P.], seq 26971484:26971696, ack 15337, win 501, options [nop,nop,TS val 3769979144 ecr 827633608], length 212
17:06:18.315298 IP 68.183.205.32.22 > 99.230.36.4.54786: Flags [P.], seq 26971696:26971908, ack 15337, win 501, options [nop,nop,TS val 3769979144 ecr 827633608], length 212
17:06:18.315341 IP 68.183.205.32.22 > 99.230.36.4.54786: Flags [P.], seq 26971908:26972120, ack 15337, win 501, options [nop,nop,TS val 3769979144 ecr 827633608], length 212
17:06:18.315386 IP 68.183.205.32.22 > 99.230.36.4.54786: Flags [P.], seq 26972120:26972332, ack 15337, win 501, options [nop,nop,TS val 3769979144 ecr 827633608], length 212
17:06:18.315429 IP 68.183.205.32.22 > 99.230.36.4.54786: Flags [P.], seq 26972332:26972544, ack 15337, win 501, options [nop,nop,TS val 3769979144 ecr 827633608], length 212
17:06:18.315480 IP 68.183.205.32.22 > 99.230.36.4.54786: Flags [P.], seq 26972544:26972756, ack 15337, win 501, options [nop,nop,TS val 3769979144 ecr 827633608], length 212
17:06:18.315523 IP 68.183.205.32.22 > 99.230.36.4.54786: Flags [P.], seq 26972756:26972968, ack 15337, win 501, options [nop,nop,TS val 3769979144 ecr 827633608], length 212
17:06:18.315567 IP 68.183.205.32.22 > 99.230.36.4.54786: Flags [P.], seq 26972968:26973180, ack 15337, win 501, options [nop,nop,TS val 3769979144 ecr 827633608], length 212
17:06:18.315611 IP 68.183.205.32.22 > 99.230.36.4.54786: Flags [P.], seq 26973180:26973392, ack 15337, win 501, options [nop,nop,TS val 3769979145 ecr 827633608], length 212
17:06:18.315656 IP 68.183.205.32.22 > 99.230.36.4.54786: Flags [P.], seq 26973392:26973604, ack 15337, win 501, options [nop,nop,TS val 3769979145 ecr 827633608], length 212
17:06:18.315704 IP 68.183.205.32.22 > 99.230.36.4.54786: Flags [P.], seq 26973604:26973816, ack 15337, win 501, options [nop,nop,TS val 3769979145 ecr 827633608], length 212
17:06:18.315748 IP 68.183.205.32.22 > 99.230.36.4.54786: Flags [P.], seq 26973816:26974028, ack 15337, win 501, options [nop,nop,TS val 3769979145 ecr 827633608], length 212
17:06:18.315792 IP 68.183.205.32.22 > 99.230.36.4.54786: Flags [P.], seq 26974028:26974240, ack 15337, win 501, options [nop,nop,TS val 3769979145 ecr 827633608], length 212
17:06:18.315837 IP 68.183.205.32.22 > 99.230.36.4.54786: Flags [P.], seq 26974240:26974452, ack 15337, win 501, options [nop,nop,TS val 3769979145 ecr 827633608], length 212
17:06:18.315880 IP 68.183.205.32.22 > 99.230.36.4.54786: Flags [P.], seq 26974452:26974664, ack 15337, win 501, options [nop,nop,TS val 3769979145 ecr 827633608], length 212
17:06:18.315923 IP 68.183.205.32.22 > 99.230.36.4.54786: Flags [P.], seq 26974664:26974876, ack 15337, win 501, options [nop,nop,TS val 3769979145 ecr 827633608], length 212
17:06:18.315966 IP 68.183.205.32.22 > 99.230.36.4.54786: Flags [P.], seq 26974876:26975088, ack 15337, win 501, options [nop,nop,TS val 3769979145 ecr 827633608], length 212
17:06:18.316011 IP 68.183.205.32.22 > 99.230.36.4.54786: Flags [P.], seq 26975088:26975300, ack 15337, win 501, options [nop,nop,TS val 3769979145 ecr 827633608], length 212
17:06:18.316054 IP 68.183.205.32.22 > 99.230.36.4.54786: Flags [P.], seq 26975300:26975512, ack 15337, win 501, options [nop,nop,TS val 3769979145 ecr 827633608], length 212
17:06:18.316100 IP 68.183.205.32.22 > 99.230.36.4.54786: Flags [P.], seq 26975512:26975724, ack 15337, win 501, options [nop,nop,TS val 3769979145 ecr 827633608], length 212
17:06:18.316147 IP 68.183.205.32.22 > 99.230.36.4.54786: Flags [P.], seq 26975724:26975936, ack 15337, win 501, options [nop,nop,TS val 3769979145 ecr 827633608], length 212
17:06:18.316188 IP 68.183.205.32.22 > 99.230.36.4.54786: Flags [P.], seq 26975936:26976148, ack 15337, win 501, options [nop,nop,TS val 3769979145 ecr 827633608], length 212
17:06:18.316225 IP 68.183.205.32.22 > 99.230.36.4.54786: Flags [P.], seq 26976148:26976360, ack 15337, win 501, options [nop,nop,TS val 3769979145 ecr 827633608], length 212
17:06:18.316271 IP 68.183.205.32.22 > 99.230.36.4.54786: Flags [P.], seq 26976360:26976572, ack 15337, win 501, options [nop,nop,TS val 3769979145 ecr 827633608], length 212
17:06:18.316336 IP 68.183.205.32.22 > 99.230.36.4.54786: Flags [P.], seq 26976572:26976784, ack 15337, win 501, options [nop,nop,TS val 3769979145 ecr 827633608], length 212
17:06:18.316388 IP 68.183.205.32.22 > 99.230.36.4.54786: Flags [P.], seq 26976784:26976996, ack 15337, win 501, options [nop,nop,TS val 3769979145 ecr 827633608], length 212
17:06:18.316427 IP 68.183.205.32.22 > 99.230.36.4.54786: Flags [P.], seq 26976996:26977208, ack 15337, win 501, options [nop,nop,TS val 3769979145 ecr 827633608], length 212
17:06:18.319068 IP 99.230.36.4.54786 > 68.183.205.32.22: Flags [.], ack 26588852, win 37094, options [nop,nop,TS val 827633613 ecr 3769978994], length 0
17:06:18.319269 IP 68.183.205.32.22 > 99.230.36.4.54786: Flags [P.], seq 26977208:26977420, ack 15337, win 501, options [nop,nop,TS val 3769979148 ecr 827633613], length 212
17:06:18.319312 IP 68.183.205.32.22 > 99.230.36.4.54786: Flags [P.], seq 26977420:26977608, ack 15337, win 501, options [nop,nop,TS val 3769979148 ecr 827633613], length 188
17:06:18.319369 IP 68.183.205.32.22 > 99.230.36.4.54786: Flags [P.], seq 26977608:26977996, ack 15337, win 501, options [nop,nop,TS val 3769979148 ecr 827633613], length 388
17:06:18.319412 IP 68.183.205.32.22 > 99.230.36.4.54786: Flags [P.], seq 26977996:26978208, ack 15337, win 501, options [nop,nop,TS val 3769979148 ecr 827633613], length 212
17:06:18.319450 IP 68.183.205.32.22 > 99.230.36.4.54786: Flags [P.], seq 26978208:26978420, ack 15337, win 501, options [nop,nop,TS val 3769979148 ecr 827633613], length 212
17:06:18.319495 IP 68.183.205.32.22 > 99.230.36.4.54786: Flags [P.], seq 26978420:26978632, ack 15337, win 501, options [nop,nop,TS val 3769979148 ecr 827633613], length 212
17:06:18.319535 IP 68.183.205.32.22 > 99.230.36.4.54786: Flags [P.], seq 26978632:26978844, ack 15337, win 501, options [nop,nop,TS val 3769979148 ecr 827633613], length 212
17:06:18.319575 IP 68.183.205.32.22 > 99.230.36.4.54786: Flags [P.], seq 26978844:26979056, ack 15337, win 501, options [nop,nop,TS val 3769979149 ecr 827633613], length 212
17:06:18.319614 IP 68.183.205.32.22 > 99.230.36.4.54786: Flags [P.], seq 26979056:26979268, ack 15337, win 501, options [nop,nop,TS val 3769979149 ecr 827633613], length 212
17:06:18.319653 IP 68.183.205.32.22 > 99.230.36.4.54786: Flags [P.], seq 26979268:26979480, ack 15337, win 501, options [nop,nop,TS val 3769979149 ecr 827633613], length 212
17:06:18.319691 IP 68.183.205.32.22 > 99.230.36.4.54786: Flags [P.], seq 26979480:26979692, ack 15337, win 501, options [nop,nop,TS val 3769979149 ecr 827633613], length 212
17:06:18.319731 IP 68.183.205.32.22 > 99.230.36.4.54786: Flags [P.], seq 26979692:26979904, ack 15337, win 501, options [nop,nop,TS val 3769979149 ecr 827633613], length 212
17:06:18.319770 IP 68.183.205.32.22 > 99.230.36.4.54786: Flags [P.], seq 26979904:26980116, ack 15337, win 501, options [nop,nop,TS val 3769979149 ecr 827633613], length 212
17:06:18.319811 IP 68.183.205.32.22 > 99.230.36.4.54786: Flags [P.], seq 26980116:26980328, ack 15337, win 501, options [nop,nop,TS val 3769979149 ecr 827633613], length 212
17:06:18.319848 IP 68.183.205.32.22 > 99.230.36.4.54786: Flags [P.], seq 26980328:26980540, ack 15337, win 501, options [nop,nop,TS val 3769979149 ecr 827633613], length 212
17:06:18.319887 IP 68.183.205.32.22 > 99.230.36.4.54786: Flags [P.], seq 26980540:26980752, ack 15337, win 501, options [nop,nop,TS val 3769979149 ecr 827633613], length 212
17:06:18.319925 IP 68.183.205.32.22 > 99.230.36.4.54786: Flags [P.], seq 26980752:26980964, ack 15337, win 501, options [nop,nop,TS val 3769979149 ecr 827633613], length 212
17:06:18.319964 IP 68.183.205.32.22 > 99.230.36.4.54786: Flags [P.], seq 26980964:26981176, ack 15337, win 501, options [nop,nop,TS val 3769979149 ecr 827633613], length 212
17:06:18.320003 IP 68.183.205.32.22 > 99.230.36.4.54786: Flags [P.], seq 26981176:26981388, ack 15337, win 501, options [nop,nop,TS val 3769979149 ecr 827633613], length 212
17:06:18.320043 IP 68.183.205.32.22 > 99.230.36.4.54786: Flags [P.], seq 26981388:26981600, ack 15337, win 501, options [nop,nop,TS val 3769979149 ecr 827633613], length 212
17:06:18.320081 IP 68.183.205.32.22 > 99.230.36.4.54786: Flags [P.], seq 26981600:26981812, ack 15337, win 501, options [nop,nop,TS val 3769979149 ecr 827633613], length 212
17:06:18.320120 IP 68.183.205.32.22 > 99.230.36.4.54786: Flags [P.], seq 26981812:26982024, ack 15337, win 501, options [nop,nop,TS val 3769979149 ecr 827633613], length 212
17:06:18.320157 IP 68.183.205.32.22 > 99.230.36.4.54786: Flags [P.], seq 26982024:26982236, ack 15337, win 501, options [nop,nop,TS val 3769979149 ecr 827633613], length 212
17:06:18.320195 IP 68.183.205.32.22 > 99.230.36.4.54786: Flags [P.], seq 26982236:26982448, ack 15337, win 501, options [nop,nop,TS val 3769979149 ecr 827633613], length 212
17:06:18.320233 IP 68.183.205.32.22 > 99.230.36.4.54786: Flags [P.], seq 26982448:26982660, ack 15337, win 501, options [nop,nop,TS val 3769979149 ecr 827633613], length 212
17:06:18.320273 IP 68.183.205.32.22 > 99.230.36.4.54786: Flags [P.], seq 26982660:26982872, ack 15337, win 501, options [nop,nop,TS val 3769979149 ecr 827633613], length 212
17:06:18.320326 IP 68.183.205.32.22 > 99.230.36.4.54786: Flags [P.], seq 26982872:26983084, ack 15337, win 501, options [nop,nop,TS val 3769979149 ecr 827633613], length 212
17:06:18.320364 IP 68.183.205.32.22 > 99.230.36.4.54786: Flags [P.], seq 26983084:26983296, ack 15337, win 501, options [nop,nop,TS val 3769979149 ecr 827633613], length 212
17:06:18.320402 IP 68.183.205.32.22 > 99.230.36.4.54786: Flags [P.], seq 26983296:26983508, ack 15337, win 501, options [nop,nop,TS val 3769979149 ecr 827633613], length 212
17:06:18.320473 IP 68.183.205.32.22 > 99.230.36.4.54786: Flags [P.], seq 26983508:26983720, ack 15337, win 501, options [nop,nop,TS val 3769979149 ecr 827633613], length 212
17:06:18.320537 IP 68.183.205.32.22 > 99.230.36.4.54786: Flags [P.], seq 26983720:26983932, ack 15337, win 501, options [nop,nop,TS val 3769979149 ecr 827633613], length 212
17:06:18.320596 IP 68.183.205.32.22 > 99.230.36.4.54786: Flags [P.], seq 26983932:26984144, ack 15337, win 501, options [nop,nop,TS val 3769979150 ecr 827633613], length 212
17:06:18.320648 IP 68.183.205.32.22 > 99.230.36.4.54786: Flags [P.], seq 26984144:26984356, ack 15337, win 501, options [nop,nop,TS val 3769979150 ecr 827633613], length 212
17:06:18.320705 IP 68.183.205.32.22 > 99.230.36.4.54786: Flags [P.], seq 26984356:26984568, ack 15337, win 501, options [nop,nop,TS val 3769979150 ecr 827633613], length 212
17:06:18.320760 IP 68.183.205.32.22 > 99.230.36.4.54786: Flags [P.], seq 26984568:26984780, ack 15337, win 501, options [nop,nop,TS val 3769979150 ecr 827633613], length 212
17:06:18.320814 IP 68.183.205.32.22 > 99.230.36.4.54786: Flags [P.], seq 26984780:26984992, ack 15337, win 501, options [nop,nop,TS val 3769979150 ecr 827633613], length 212
17:06:18.320858 IP 68.183.205.32.22 > 99.230.36.4.54786: Flags [P.], seq 26984992:26985204, ack 15337, win 501, options [nop,nop,TS val 3769979150 ecr 827633613], length 212
17:06:18.320905 IP 68.183.205.32.22 > 99.230.36.4.54786: Flags [P.], seq 26985204:26985416, ack 15337, win 501, options [nop,nop,TS val 3769979150 ecr 827633613], length 212
17:06:18.320962 IP 68.183.205.32.22 > 99.230.36.4.54786: Flags [P.], seq 26985416:26985628, ack 15337, win 501, options [nop,nop,TS val 3769979150 ecr 827633613], length 212
17:06:18.321019 IP 68.183.205.32.22 > 99.230.36.4.54786: Flags [P.], seq 26985628:26985840, ack 15337, win 501, options [nop,nop,TS val 3769979150 ecr 827633613], length 212
17:06:18.321085 IP 68.183.205.32.22 > 99.230.36.4.54786: Flags [P.], seq 26985840:26986052, ack 15337, win 501, options [nop,nop,TS val 3769979150 ecr 827633613], length 212
17:06:18.321130 IP 68.183.205.32.22 > 99.230.36.4.54786: Flags [P.], seq 26986052:26986264, ack 15337, win 501, options [nop,nop,TS val 3769979150 ecr 827633613], length 212
17:06:18.321185 IP 68.183.205.32.22 > 99.230.36.4.54786: Flags [P.], seq 26986264:26986476, ack 15337, win 501, options [nop,nop,TS val 3769979150 ecr 827633613], length 212
17:06:18.321229 IP 68.183.205.32.22 > 99.230.36.4.54786: Flags [P.], seq 26986476:26986688, ack 15337, win 501, options [nop,nop,TS val 3769979150 ecr 827633613], length 212
17:06:18.321267 IP 68.183.205.32.22 > 99.230.36.4.54786: Flags [P.], seq 26986688:26986900, ack 15337, win 501, options [nop,nop,TS val 3769979150 ecr 827633613], length 212
17:06:18.321306 IP 68.183.205.32.22 > 99.230.36.4.54786: Flags [P.], seq 26986900:26987112, ack 15337, win 501, options [nop,nop,TS val 3769979150 ecr 827633613], length 212
17:06:18.321344 IP 68.183.205.32.22 > 99.230.36.4.54786: Flags [P.], seq 26987112:26987324, ack 15337, win 501, options [nop,nop,TS val 3769979150 ecr 827633613], length 212
17:06:18.321383 IP 68.183.205.32.22 > 99.230.36.4.54786: Flags [P.], seq 26987324:26987536, ack 15337, win 501, options [nop,nop,TS val 3769979150 ecr 827633613], length 212
17:06:18.321421 IP 68.183.205.32.22 > 99.230.36.4.54786: Flags [P.], seq 26987536:26987748, ack 15337, win 501, options [nop,nop,TS val 3769979150 ecr 827633613], length 212
17:06:18.321458 IP 68.183.205.32.22 > 99.230.36.4.54786: Flags [P.], seq 26987748:26987960, ack 15337, win 501, options [nop,nop,TS val 3769979150 ecr 827633613], length 212
17:06:18.321498 IP 68.183.205.32.22 > 99.230.36.4.54786: Flags [P.], seq 26987960:26988172, ack 15337, win 501, options [nop,nop,TS val 3769979150 ecr 827633613], length 212
17:06:18.321535 IP 68.183.205.32.22 > 99.230.36.4.54786: Flags [P.], seq 26988172:26988384, ack 15337, win 501, options [nop,nop,TS val 3769979150 ecr 827633613], length 212
17:06:18.321574 IP 68.183.205.32.22 > 99.230.36.4.54786: Flags [P.], seq 26988384:26988596, ack 15337, win 501, options [nop,nop,TS val 3769979151 ecr 827633613], length 212
17:06:18.321612 IP 68.183.205.32.22 > 99.230.36.4.54786: Flags [P.], seq 26988596:26988808, ack 15337, win 501, options [nop,nop,TS val 3769979151 ecr 827633613], length 212
17:06:18.321655 IP 68.183.205.32.22 > 99.230.36.4.54786: Flags [P.], seq 26988808:26989020, ack 15337, win 501, options [nop,nop,TS val 3769979151 ecr 827633613], length 212
17:06:18.321693 IP 68.183.205.32.22 > 99.230.36.4.54786: Flags [P.], seq 26989020:26989232, ack 15337, win 501, options [nop,nop,TS val 3769979151 ecr 827633613], length 212
17:06:18.321734 IP 68.183.205.32.22 > 99.230.36.4.54786: Flags [P.], seq 26989232:26989444, ack 15337, win 501, options [nop,nop,TS val 3769979151 ecr 827633613], length 212
17:06:18.321770 IP 68.183.205.32.22 > 99.230.36.4.54786: Flags [P.], seq 26989444:26989656, ack 15337, win 501, options [nop,nop,TS val 3769979151 ecr 827633613], length 212
17:06:18.321810 IP 68.183.205.32.22 > 99.230.36.4.54786: Flags [P.], seq 26989656:26989868, ack 15337, win 501, options [nop,nop,TS val 3769979151 ecr 827633613], length 212
17:06:18.321853 IP 68.183.205.32.22 > 99.230.36.4.54786: Flags [P.], seq 26989868:26990080, ack 15337, win 501, options [nop,nop,TS val 3769979151 ecr 827633613], length 212
17:06:18.321892 IP 68.183.205.32.22 > 99.230.36.4.54786: Flags [P.], seq 26990080:26990292, ack 15337, win 501, options [nop,nop,TS val 3769979151 ecr 827633613], length 212
17:06:18.321938 IP 68.183.205.32.22 > 99.230.36.4.54786: Flags [P.], seq 26990292:26990504, ack 15337, win 501, options [nop,nop,TS val 3769979151 ecr 827633613], length 212
17:06:18.321975 IP 68.183.205.32.22 > 99.230.36.4.54786: Flags [P.], seq 26990504:26990716, ack 15337, win 501, options [nop,nop,TS val 3769979151 ecr 827633613], length 212
17:06:18.325985 IP 99.230.36.4.54786 > 68.183.205.32.22: Flags [P.], seq 15337:15373, ack 26588852, win 37094, options [nop,nop,TS val 827633613 ecr 3769978994], length 36
17:06:18.326026 IP 99.230.36.4.54786 > 68.183.205.32.22: Flags [.], ack 26611260, win 37094, options [nop,nop,TS val 827633619 ecr 3769979008], length 0
17:06:18.326085 IP 99.230.36.4.54786 > 68.183.205.32.22: Flags [.], ack 26615812, win 37094, options [nop,nop,TS val 827633620 ecr 3769979010], length 0
17:06:18.326249 IP 68.183.205.32.22 > 99.230.36.4.54786: Flags [P.], seq 26990716:26990928, ack 15373, win 501, options [nop,nop,TS val 3769979155 ecr 827633613], length 212
17:06:18.326308 IP 68.183.205.32.22 > 99.230.36.4.54786: Flags [P.], seq 26990928:26991444, ack 15373, win 501, options [nop,nop,TS val 3769979155 ecr 827633613], length 516
17:06:18.326391 IP 68.183.205.32.22 > 99.230.36.4.54786: Flags [P.], seq 26991444:26991832, ack 15373, win 501, options [nop,nop,TS val 3769979155 ecr 827633613], length 388
17:06:18.326455 IP 68.183.205.32.22 > 99.230.36.4.54786: Flags [P.], seq 26991832:26992044, ack 15373, win 501, options [nop,nop,TS val 3769979155 ecr 827633613], length 212
17:06:18.326509 IP 68.183.205.32.22 > 99.230.36.4.54786: Flags [P.], seq 26992044:26992256, ack 15373, win 501, options [nop,nop,TS val 3769979155 ecr 827633613], length 212
17:06:18.326573 IP 68.183.205.32.22 > 99.230.36.4.54786: Flags [P.], seq 26992256:26992468, ack 15373, win 501, options [nop,nop,TS val 3769979156 ecr 827633613], length 212
17:06:18.326624 IP 68.183.205.32.22 > 99.230.36.4.54786: Flags [P.], seq 26992468:26992680, ack 15373, win 501, options [nop,nop,TS val 3769979156 ecr 827633613], length 212
17:06:18.326665 IP 68.183.205.32.22 > 99.230.36.4.54786: Flags [P.], seq 26992680:26992892, ack 15373, win 501, options [nop,nop,TS val 3769979156 ecr 827633613], length 212
17:06:18.326706 IP 68.183.205.32.22 > 99.230.36.4.54786: Flags [P.], seq 26992892:26993104, ack 15373, win 501, options [nop,nop,TS val 3769979156 ecr 827633613], length 212
17:06:18.326746 IP 68.183.205.32.22 > 99.230.36.4.54786: Flags [P.], seq 26993104:26993316, ack 15373, win 501, options [nop,nop,TS val 3769979156 ecr 827633613], length 212
17:06:18.326784 IP 68.183.205.32.22 > 99.230.36.4.54786: Flags [P.], seq 26993316:26993528, ack 15373, win 501, options [nop,nop,TS val 3769979156 ecr 827633613], length 212
17:06:18.326828 IP 68.183.205.32.22 > 99.230.36.4.54786: Flags [P.], seq 26993528:26993740, ack 15373, win 501, options [nop,nop,TS val 3769979156 ecr 827633613], length 212
17:06:18.326866 IP 68.183.205.32.22 > 99.230.36.4.54786: Flags [P.], seq 26993740:26993952, ack 15373, win 501, options [nop,nop,TS val 3769979156 ecr 827633613], length 212
17:06:18.326908 IP 68.183.205.32.22 > 99.230.36.4.54786: Flags [P.], seq 26993952:26994164, ack 15373, win 501, options [nop,nop,TS val 3769979156 ecr 827633613], length 212
17:06:18.326950 IP 68.183.205.32.22 > 99.230.36.4.54786: Flags [P.], seq 26994164:26994376, ack 15373, win 501, options [nop,nop,TS val 3769979156 ecr 827633613], length 212
17:06:18.327008 IP 68.183.205.32.22 > 99.230.36.4.54786: Flags [P.], seq 26994376:26994588, ack 15373, win 501, options [nop,nop,TS val 3769979156 ecr 827633613], length 212
17:06:18.327054 IP 68.183.205.32.22 > 99.230.36.4.54786: Flags [P.], seq 26994588:26994800, ack 15373, win 501, options [nop,nop,TS val 3769979156 ecr 827633613], length 212
17:06:18.327093 IP 68.183.205.32.22 > 99.230.36.4.54786: Flags [P.], seq 26994800:26995012, ack 15373, win 501, options [nop,nop,TS val 3769979156 ecr 827633613], length 212
17:06:18.327133 IP 68.183.205.32.22 > 99.230.36.4.54786: Flags [P.], seq 26995012:26995224, ack 15373, win 501, options [nop,nop,TS val 3769979156 ecr 827633613], length 212
17:06:18.327186 IP 68.183.205.32.22 > 99.230.36.4.54786: Flags [P.], seq 26995224:26995436, ack 15373, win 501, options [nop,nop,TS val 3769979156 ecr 827633613], length 212
17:06:18.327228 IP 68.183.205.32.22 > 99.230.36.4.54786: Flags [P.], seq 26995436:26995648, ack 15373, win 501, options [nop,nop,TS val 3769979156 ecr 827633613], length 212
17:06:18.327267 IP 68.183.205.32.22 > 99.230.36.4.54786: Flags [P.], seq 26995648:26995860, ack 15373, win 501, options [nop,nop,TS val 3769979156 ecr 827633613], length 212
17:06:18.327308 IP 68.183.205.32.22 > 99.230.36.4.54786: Flags [P.], seq 26995860:26996072, ack 15373, win 501, options [nop,nop,TS val 3769979156 ecr 827633613], length 212
17:06:18.327345 IP 68.183.205.32.22 > 99.230.36.4.54786: Flags [P.], seq 26996072:26996284, ack 15373, win 501, options [nop,nop,TS val 3769979156 ecr 827633613], length 212
17:06:18.327382 IP 68.183.205.32.22 > 99.230.36.4.54786: Flags [P.], seq 26996284:26996496, ack 15373, win 501, options [nop,nop,TS val 3769979156 ecr 827633613], length 212
17:06:18.327422 IP 68.183.205.32.22 > 99.230.36.4.54786: Flags [P.], seq 26996496:26996708, ack 15373, win 501, options [nop,nop,TS val 3769979156 ecr 827633613], length 212
17:06:18.327459 IP 68.183.205.32.22 > 99.230.36.4.54786: Flags [P.], seq 26996708:26996920, ack 15373, win 501, options [nop,nop,TS val 3769979156 ecr 827633613], length 212
17:06:18.327497 IP 68.183.205.32.22 > 99.230.36.4.54786: Flags [P.], seq 26996920:26997132, ack 15373, win 501, options [nop,nop,TS val 3769979156 ecr 827633613], length 212
17:06:18.327536 IP 68.183.205.32.22 > 99.230.36.4.54786: Flags [P.], seq 26997132:26997344, ack 15373, win 501, options [nop,nop,TS val 3769979156 ecr 827633613], length 212
17:06:18.327573 IP 68.183.205.32.22 > 99.230.36.4.54786: Flags [P.], seq 26997344:26997556, ack 15373, win 501, options [nop,nop,TS val 3769979157 ecr 827633613], length 212
17:06:18.327613 IP 68.183.205.32.22 > 99.230.36.4.54786: Flags [P.], seq 26997556:26997768, ack 15373, win 501, options [nop,nop,TS val 3769979157 ecr 827633613], length 212
17:06:18.327650 IP 68.183.205.32.22 > 99.230.36.4.54786: Flags [P.], seq 26997768:26997980, ack 15373, win 501, options [nop,nop,TS val 3769979157 ecr 827633613], length 212
17:06:18.327689 IP 68.183.205.32.22 > 99.230.36.4.54786: Flags [P.], seq 26997980:26998192, ack 15373, win 501, options [nop,nop,TS val 3769979157 ecr 827633613], length 212
17:06:18.327726 IP 68.183.205.32.22 > 99.230.36.4.54786: Flags [P.], seq 26998192:26998404, ack 15373, win 501, options [nop,nop,TS val 3769979157 ecr 827633613], length 212
17:06:18.327764 IP 68.183.205.32.22 > 99.230.36.4.54786: Flags [P.], seq 26998404:26998616, ack 15373, win 501, options [nop,nop,TS val 3769979157 ecr 827633613], length 212
17:06:18.327802 IP 68.183.205.32.22 > 99.230.36.4.54786: Flags [P.], seq 26998616:26998828, ack 15373, win 501, options [nop,nop,TS val 3769979157 ecr 827633613], length 212
17:06:18.327851 IP 68.183.205.32.22 > 99.230.36.4.54786: Flags [P.], seq 26998828:26999040, ack 15373, win 501, options [nop,nop,TS val 3769979157 ecr 827633613], length 212
17:06:18.327888 IP 68.183.205.32.22 > 99.230.36.4.54786: Flags [P.], seq 26999040:26999252, ack 15373, win 501, options [nop,nop,TS val 3769979157 ecr 827633613], length 212
17:06:18.327926 IP 68.183.205.32.22 > 99.230.36.4.54786: Flags [P.], seq 26999252:26999464, ack 15373, win 501, options [nop,nop,TS val 3769979157 ecr 827633613], length 212
17:06:18.327962 IP 68.183.205.32.22 > 99.230.36.4.54786: Flags [P.], seq 26999464:26999676, ack 15373, win 501, options [nop,nop,TS val 3769979157 ecr 827633613], length 212
17:06:18.328002 IP 68.183.205.32.22 > 99.230.36.4.54786: Flags [P.], seq 26999676:26999888, ack 15373, win 501, options [nop,nop,TS val 3769979157 ecr 827633613], length 212
17:06:18.328039 IP 68.183.205.32.22 > 99.230.36.4.54786: Flags [P.], seq 26999888:27000100, ack 15373, win 501, options [nop,nop,TS val 3769979157 ecr 827633613], length 212
17:06:18.328078 IP 68.183.205.32.22 > 99.230.36.4.54786: Flags [P.], seq 27000100:27000312, ack 15373, win 501, options [nop,nop,TS val 3769979157 ecr 827633613], length 212
17:06:18.328115 IP 68.183.205.32.22 > 99.230.36.4.54786: Flags [P.], seq 27000312:27000524, ack 15373, win 501, options [nop,nop,TS val 3769979157 ecr 827633613], length 212
17:06:18.328154 IP 68.183.205.32.22 > 99.230.36.4.54786: Flags [P.], seq 27000524:27000736, ack 15373, win 501, options [nop,nop,TS val 3769979157 ecr 827633613], length 212
17:06:18.328190 IP 68.183.205.32.22 > 99.230.36.4.54786: Flags [P.], seq 27000736:27000948, ack 15373, win 501, options [nop,nop,TS val 3769979157 ecr 827633613], length 212
17:06:18.328232 IP 68.183.205.32.22 > 99.230.36.4.54786: Flags [P.], seq 27000948:27001160, ack 15373, win 501, options [nop,nop,TS val 3769979157 ecr 827633613], length 212
17:06:18.328272 IP 68.183.205.32.22 > 99.230.36.4.54786: Flags [P.], seq 27001160:27001372, ack 15373, win 501, options [nop,nop,TS val 3769979157 ecr 827633613], length 212
17:06:18.328327 IP 68.183.205.32.22 > 99.230.36.4.54786: Flags [P.], seq 27001372:27001584, ack 15373, win 501, options [nop,nop,TS val 3769979157 ecr 827633613], length 212
17:06:18.328364 IP 68.183.205.32.22 > 99.230.36.4.54786: Flags [P.], seq 27001584:27001796, ack 15373, win 501, options [nop,nop,TS val 3769979157 ecr 827633613], length 212
17:06:18.328402 IP 68.183.205.32.22 > 99.230.36.4.54786: Flags [P.], seq 27001796:27002008, ack 15373, win 501, options [nop,nop,TS val 3769979157 ecr 827633613], length 212
17:06:18.328440 IP 68.183.205.32.22 > 99.230.36.4.54786: Flags [P.], seq 27002008:27002220, ack 15373, win 501, options [nop,nop,TS val 3769979157 ecr 827633613], length 212
17:06:18.328477 IP 68.183.205.32.22 > 99.230.36.4.54786: Flags [P.], seq 27002220:27002432, ack 15373, win 501, options [nop,nop,TS val 3769979157 ecr 827633613], length 212
17:06:18.328516 IP 68.183.205.32.22 > 99.230.36.4.54786: Flags [P.], seq 27002432:27002644, ack 15373, win 501, options [nop,nop,TS val 3769979157 ecr 827633613], length 212
17:06:18.328555 IP 68.183.205.32.22 > 99.230.36.4.54786: Flags [P.], seq 27002644:27002856, ack 15373, win 501, options [nop,nop,TS val 3769979157 ecr 827633613], length 212
17:06:18.328594 IP 68.183.205.32.22 > 99.230.36.4.54786: Flags [P.], seq 27002856:27003068, ack 15373, win 501, options [nop,nop,TS val 3769979158 ecr 827633613], length 212
17:06:18.328631 IP 68.183.205.32.22 > 99.230.36.4.54786: Flags [P.], seq 27003068:27003280, ack 15373, win 501, options [nop,nop,TS val 3769979158 ecr 827633613], length 212
17:06:18.328671 IP 68.183.205.32.22 > 99.230.36.4.54786: Flags [P.], seq 27003280:27003492, ack 15373, win 501, options [nop,nop,TS val 3769979158 ecr 827633613], length 212
17:06:18.328708 IP 68.183.205.32.22 > 99.230.36.4.54786: Flags [P.], seq 27003492:27003704, ack 15373, win 501, options [nop,nop,TS val 3769979158 ecr 827633613], length 212
17:06:18.328744 IP 68.183.205.32.22 > 99.230.36.4.54786: Flags [P.], seq 27003704:27003916, ack 15373, win 501, options [nop,nop,TS val 3769979158 ecr 827633613], length 212
17:06:18.328783 IP 68.183.205.32.22 > 99.230.36.4.54786: Flags [P.], seq 27003916:27004128, ack 15373, win 501, options [nop,nop,TS val 3769979158 ecr 827633613], length 212
17:06:18.328821 IP 68.183.205.32.22 > 99.230.36.4.54786: Flags [P.], seq 27004128:27004340, ack 15373, win 501, options [nop,nop,TS val 3769979158 ecr 827633613], length 212
17:06:18.328860 IP 68.183.205.32.22 > 99.230.36.4.54786: Flags [P.], seq 27004340:27004552, ack 15373, win 501, options [nop,nop,TS val 3769979158 ecr 827633613], length 212
17:06:18.328921 IP 68.183.205.32.22 > 99.230.36.4.54786: Flags [P.], seq 27004552:27004764, ack 15373, win 501, options [nop,nop,TS val 3769979158 ecr 827633613], length 212
17:06:18.328997 IP 68.183.205.32.22 > 99.230.36.4.54786: Flags [P.], seq 27004764:27004976, ack 15373, win 501, options [nop,nop,TS val 3769979158 ecr 827633613], length 212
17:06:18.329045 IP 68.183.205.32.22 > 99.230.36.4.54786: Flags [P.], seq 27004976:27005188, ack 15373, win 501, options [nop,nop,TS val 3769979158 ecr 827633613], length 212
17:06:18.329085 IP 68.183.205.32.22 > 99.230.36.4.54786: Flags [P.], seq 27005188:27005400, ack 15373, win 501, options [nop,nop,TS val 3769979158 ecr 827633613], length 212
17:06:18.329126 IP 68.183.205.32.22 > 99.230.36.4.54786: Flags [P.], seq 27005400:27005612, ack 15373, win 501, options [nop,nop,TS val 3769979158 ecr 827633613], length 212
17:06:18.329163 IP 68.183.205.32.22 > 99.230.36.4.54786: Flags [P.], seq 27005612:27005824, ack 15373, win 501, options [nop,nop,TS val 3769979158 ecr 827633613], length 212
17:06:18.329202 IP 68.183.205.32.22 > 99.230.36.4.54786: Flags [P.], seq 27005824:27006036, ack 15373, win 501, options [nop,nop,TS val 3769979158 ecr 827633613], length 212
17:06:18.329241 IP 68.183.205.32.22 > 99.230.36.4.54786: Flags [P.], seq 27006036:27006248, ack 15373, win 501, options [nop,nop,TS val 3769979158 ecr 827633613], length 212
17:06:18.329277 IP 68.183.205.32.22 > 99.230.36.4.54786: Flags [P.], seq 27006248:27006460, ack 15373, win 501, options [nop,nop,TS val 3769979158 ecr 827633613], length 212
17:06:18.329350 IP 68.183.205.32.22 > 99.230.36.4.54786: Flags [P.], seq 27006460:27006672, ack 15373, win 501, options [nop,nop,TS val 3769979158 ecr 827633613], length 212
17:06:18.329401 IP 68.183.205.32.22 > 99.230.36.4.54786: Flags [P.], seq 27006672:27006884, ack 15373, win 501, options [nop,nop,TS val 3769979158 ecr 827633613], length 212
17:06:18.329443 IP 68.183.205.32.22 > 99.230.36.4.54786: Flags [P.], seq 27006884:27007096, ack 15373, win 501, options [nop,nop,TS val 3769979158 ecr 827633613], length 212
17:06:18.329481 IP 68.183.205.32.22 > 99.230.36.4.54786: Flags [P.], seq 27007096:27007308, ack 15373, win 501, options [nop,nop,TS val 3769979158 ecr 827633613], length 212
17:06:18.329520 IP 68.183.205.32.22 > 99.230.36.4.54786: Flags [P.], seq 27007308:27007520, ack 15373, win 501, options [nop,nop,TS val 3769979158 ecr 827633613], length 212
17:06:18.329557 IP 68.183.205.32.22 > 99.230.36.4.54786: Flags [P.], seq 27007520:27007732, ack 15373, win 501, options [nop,nop,TS val 3769979158 ecr 827633613], length 212
17:06:18.329596 IP 68.183.205.32.22 > 99.230.36.4.54786: Flags [P.], seq 27007732:27007944, ack 15373, win 501, options [nop,nop,TS val 3769979159 ecr 827633613], length 212
17:06:18.329635 IP 68.183.205.32.22 > 99.230.36.4.54786: Flags [P.], seq 27007944:27008156, ack 15373, win 501, options [nop,nop,TS val 3769979159 ecr 827633613], length 212
17:06:18.329673 IP 68.183.205.32.22 > 99.230.36.4.54786: Flags [P.], seq 27008156:27008368, ack 15373, win 501, options [nop,nop,TS val 3769979159 ecr 827633613], length 212
17:06:18.329713 IP 68.183.205.32.22 > 99.230.36.4.54786: Flags [P.], seq 27008368:27008580, ack 15373, win 501, options [nop,nop,TS val 3769979159 ecr 827633613], length 212
17:06:18.329751 IP 68.183.205.32.22 > 99.230.36.4.54786: Flags [P.], seq 27008580:27008792, ack 15373, win 501, options [nop,nop,TS val 3769979159 ecr 827633613], length 212
17:06:18.329792 IP 68.183.205.32.22 > 99.230.36.4.54786: Flags [P.], seq 27008792:27009004, ack 15373, win 501, options [nop,nop,TS val 3769979159 ecr 827633613], length 212
17:06:18.329829 IP 68.183.205.32.22 > 99.230.36.4.54786: Flags [P.], seq 27009004:27009216, ack 15373, win 501, options [nop,nop,TS val 3769979159 ecr 827633613], length 212
17:06:18.329868 IP 68.183.205.32.22 > 99.230.36.4.54786: Flags [P.], seq 27009216:27009428, ack 15373, win 501, options [nop,nop,TS val 3769979159 ecr 827633613], length 212
17:06:18.329906 IP 68.183.205.32.22 > 99.230.36.4.54786: Flags [P.], seq 27009428:27009640, ack 15373, win 501, options [nop,nop,TS val 3769979159 ecr 827633613], length 212
17:06:18.329943 IP 68.183.205.32.22 > 99.230.36.4.54786: Flags [P.], seq 27009640:27009852, ack 15373, win 501, options [nop,nop,TS val 3769979159 ecr 827633613], length 212
17:06:18.329983 IP 68.183.205.32.22 > 99.230.36.4.54786: Flags [P.], seq 27009852:27010064, ack 15373, win 501, options [nop,nop,TS val 3769979159 ecr 827633613], length 212
17:06:18.330020 IP 68.183.205.32.22 > 99.230.36.4.54786: Flags [P.], seq 27010064:27010276, ack 15373, win 501, options [nop,nop,TS val 3769979159 ecr 827633613], length 212
17:06:18.330060 IP 68.183.205.32.22 > 99.230.36.4.54786: Flags [P.], seq 27010276:27010488, ack 15373, win 501, options [nop,nop,TS val 3769979159 ecr 827633613], length 212
17:06:18.330097 IP 68.183.205.32.22 > 99.230.36.4.54786: Flags [P.], seq 27010488:27010700, ack 15373, win 501, options [nop,nop,TS val 3769979159 ecr 827633613], length 212
17:06:18.330137 IP 68.183.205.32.22 > 99.230.36.4.54786: Flags [P.], seq 27010700:27010912, ack 15373, win 501, options [nop,nop,TS val 3769979159 ecr 827633613], length 212
17:06:18.330174 IP 68.183.205.32.22 > 99.230.36.4.54786: Flags [P.], seq 27010912:27011124, ack 15373, win 501, options [nop,nop,TS val 3769979159 ecr 827633613], length 212
17:06:18.330224 IP 68.183.205.32.22 > 99.230.36.4.54786: Flags [P.], seq 27011124:27011336, ack 15373, win 501, options [nop,nop,TS val 3769979159 ecr 827633613], length 212
17:06:18.330286 IP 68.183.205.32.22 > 99.230.36.4.54786: Flags [P.], seq 27011336:27011548, ack 15373, win 501, options [nop,nop,TS val 3769979159 ecr 827633613], length 212
17:06:18.330339 IP 68.183.205.32.22 > 99.230.36.4.54786: Flags [P.], seq 27011548:27011760, ack 15373, win 501, options [nop,nop,TS val 3769979159 ecr 827633613], length 212
17:06:18.330378 IP 68.183.205.32.22 > 99.230.36.4.54786: Flags [P.], seq 27011760:27011972, ack 15373, win 501, options [nop,nop,TS val 3769979159 ecr 827633613], length 212
17:06:18.330416 IP 68.183.205.32.22 > 99.230.36.4.54786: Flags [P.], seq 27011972:27012184, ack 15373, win 501, options [nop,nop,TS val 3769979159 ecr 827633613], length 212
17:06:18.330455 IP 68.183.205.32.22 > 99.230.36.4.54786: Flags [P.], seq 27012184:27012396, ack 15373, win 501, options [nop,nop,TS val 3769979159 ecr 827633613], length 212
17:06:18.330493 IP 68.183.205.32.22 > 99.230.36.4.54786: Flags [P.], seq 27012396:27012608, ack 15373, win 501, options [nop,nop,TS val 3769979159 ecr 827633613], length 212
17:06:18.330533 IP 68.183.205.32.22 > 99.230.36.4.54786: Flags [P.], seq 27012608:27012820, ack 15373, win 501, options [nop,nop,TS val 3769979159 ecr 827633613], length 212
17:06:18.330572 IP 68.183.205.32.22 > 99.230.36.4.54786: Flags [P.], seq 27012820:27013032, ack 15373, win 501, options [nop,nop,TS val 3769979160 ecr 827633613], length 212
17:06:18.330609 IP 68.183.205.32.22 > 99.230.36.4.54786: Flags [P.], seq 27013032:27013244, ack 15373, win 501, options [nop,nop,TS val 3769979160 ecr 827633613], length 212
17:06:18.330648 IP 68.183.205.32.22 > 99.230.36.4.54786: Flags [P.], seq 27013244:27013456, ack 15373, win 501, options [nop,nop,TS val 3769979160 ecr 827633613], length 212
17:06:18.330688 IP 68.183.205.32.22 > 99.230.36.4.54786: Flags [P.], seq 27013456:27013668, ack 15373, win 501, options [nop,nop,TS val 3769979160 ecr 827633613], length 212
17:06:18.330727 IP 68.183.205.32.22 > 99.230.36.4.54786: Flags [P.], seq 27013668:27013880, ack 15373, win 501, options [nop,nop,TS val 3769979160 ecr 827633613], length 212
17:06:18.330764 IP 68.183.205.32.22 > 99.230.36.4.54786: Flags [P.], seq 27013880:27014092, ack 15373, win 501, options [nop,nop,TS val 3769979160 ecr 827633613], length 212
17:06:18.330803 IP 68.183.205.32.22 > 99.230.36.4.54786: Flags [P.], seq 27014092:27014304, ack 15373, win 501, options [nop,nop,TS val 3769979160 ecr 827633613], length 212
17:06:18.330842 IP 68.183.205.32.22 > 99.230.36.4.54786: Flags [P.], seq 27014304:27014516, ack 15373, win 501, options [nop,nop,TS val 3769979160 ecr 827633613], length 212
17:06:18.330882 IP 68.183.205.32.22 > 99.230.36.4.54786: Flags [P.], seq 27014516:27014728, ack 15373, win 501, options [nop,nop,TS val 3769979160 ecr 827633613], length 212
17:06:18.330918 IP 68.183.205.32.22 > 99.230.36.4.54786: Flags [P.], seq 27014728:27014940, ack 15373, win 501, options [nop,nop,TS val 3769979160 ecr 827633613], length 212
17:06:18.330957 IP 68.183.205.32.22 > 99.230.36.4.54786: Flags [P.], seq 27014940:27015152, ack 15373, win 501, options [nop,nop,TS val 3769979160 ecr 827633613], length 212
17:06:18.331001 IP 68.183.205.32.22 > 99.230.36.4.54786: Flags [P.], seq 27015152:27015364, ack 15373, win 501, options [nop,nop,TS val 3769979160 ecr 827633613], length 212
17:06:18.331038 IP 68.183.205.32.22 > 99.230.36.4.54786: Flags [P.], seq 27015364:27015576, ack 15373, win 501, options [nop,nop,TS val 3769979160 ecr 827633613], length 212
17:06:18.331075 IP 68.183.205.32.22 > 99.230.36.4.54786: Flags [P.], seq 27015576:27015788, ack 15373, win 501, options [nop,nop,TS val 3769979160 ecr 827633613], length 212
17:06:18.331115 IP 68.183.205.32.22 > 99.230.36.4.54786: Flags [P.], seq 27015788:27016000, ack 15373, win 501, options [nop,nop,TS val 3769979160 ecr 827633613], length 212
17:06:18.331157 IP 68.183.205.32.22 > 99.230.36.4.54786: Flags [P.], seq 27016000:27016212, ack 15373, win 501, options [nop,nop,TS val 3769979160 ecr 827633613], length 212
17:06:18.331205 IP 68.183.205.32.22 > 99.230.36.4.54786: Flags [P.], seq 27016212:27016424, ack 15373, win 501, options [nop,nop,TS val 3769979160 ecr 827633613], length 212
17:06:18.331245 IP 68.183.205.32.22 > 99.230.36.4.54786: Flags [P.], seq 27016424:27016636, ack 15373, win 501, options [nop,nop,TS val 3769979160 ecr 827633613], length 212
17:06:18.331282 IP 68.183.205.32.22 > 99.230.36.4.54786: Flags [P.], seq 27016636:27016848, ack 15373, win 501, options [nop,nop,TS val 3769979160 ecr 827633613], length 212
17:06:18.331323 IP 68.183.205.32.22 > 99.230.36.4.54786: Flags [P.], seq 27016848:27017060, ack 15373, win 501, options [nop,nop,TS val 3769979160 ecr 827633613], length 212
17:06:18.331361 IP 68.183.205.32.22 > 99.230.36.4.54786: Flags [P.], seq 27017060:27017272, ack 15373, win 501, options [nop,nop,TS val 3769979160 ecr 827633613], length 212
17:06:18.331587 IP 99.230.36.4.54786 > 68.183.205.32.22: Flags [P.], seq 15373:15409, ack 26615812, win 37094, options [nop,nop,TS val 827633620 ecr 3769979010], length 36
17:06:18.331605 IP 99.230.36.4.54786 > 68.183.205.32.22: Flags [.], ack 26628532, win 37094, options [nop,nop,TS val 827633623 ecr 3769979012], length 0
17:06:18.331648 IP 99.230.36.4.54786 > 68.183.205.32.22: Flags [.], ack 26642024, win 37094, options [nop,nop,TS val 827633627 ecr 3769979014], length 0
^C
128104 packets captured
128115 packets received by filter
10 packets dropped by kernel