tcpdump -i eth0 src 68.183.205.32
17:10:18.180837 IP 68.183.205.32.ssh > cpe00fc8d483dd3-cm00fc8d483dd0.cpe.net.cable.rogers.com.54786: Flags [P.], seq 15254452:15254712, ack 9001, win 501, options [nop,nop,TS val 3770219010 ecr 827868783], length 260
17:10:18.180899 IP 68.183.205.32.ssh > cpe00fc8d483dd3-cm00fc8d483dd0.cpe.net.cable.rogers.com.54786: Flags [P.], seq 15254712:15254972, ack 9001, win 501, options [nop,nop,TS val 3770219010 ecr 827868783], length 260
17:10:18.180960 IP 68.183.205.32.ssh > cpe00fc8d483dd3-cm00fc8d483dd0.cpe.net.cable.rogers.com.54786: Flags [P.], seq 15254972:15255232, ack 9001, win 501, options [nop,nop,TS val 3770219010 ecr 827868783], length 260
17:10:18.181031 IP 68.183.205.32.ssh > cpe00fc8d483dd3-cm00fc8d483dd0.cpe.net.cable.rogers.com.54786: Flags [P.], seq 15255232:15255492, ack 9001, win 501, options [nop,nop,TS val 3770219010 ecr 827868783], length 260
17:10:18.181099 IP 68.183.205.32.ssh > cpe00fc8d483dd3-cm00fc8d483dd0.cpe.net.cable.rogers.com.54786: Flags [P.], seq 15255492:15255752, ack 9001, win 501, options [nop,nop,TS val 3770219010 ecr 827868783], length 260
17:10:18.181165 IP 68.183.205.32.ssh > cpe00fc8d483dd3-cm00fc8d483dd0.cpe.net.cable.rogers.com.54786: Flags [P.], seq 15255752:15256012, ack 9001, win 501, options [nop,nop,TS val 3770219010 ecr 827868783], length 260
17:10:18.181229 IP 68.183.205.32.ssh > cpe00fc8d483dd3-cm00fc8d483dd0.cpe.net.cable.rogers.com.54786: Flags [P.], seq 15256012:15256272, ack 9001, win 501, options [nop,nop,TS val 3770219010 ecr 827868783], length 260
17:10:18.181295 IP 68.183.205.32.ssh > cpe00fc8d483dd3-cm00fc8d483dd0.cpe.net.cable.rogers.com.54786: Flags [P.], seq 15256272:15256532, ack 9001, win 501, options [nop,nop,TS val 3770219010 ecr 827868783], length 260
17:10:18.181358 IP 68.183.205.32.ssh > cpe00fc8d483dd3-cm00fc8d483dd0.cpe.net.cable.rogers.com.54786: Flags [P.], seq 15256532:15256792, ack 9001, win 501, options [nop,nop,TS val 3770219010 ecr 827868783], length 260
17:10:18.181424 IP 68.183.205.32.ssh > cpe00fc8d483dd3-cm00fc8d483dd0.cpe.net.cable.rogers.com.54786: Flags [P.], seq 15256792:15257052, ack 9001, win 501, options [nop,nop,TS val 3770219010 ecr 827868783], length 260
17:10:18.181487 IP 68.183.205.32.ssh > cpe00fc8d483dd3-cm00fc8d483dd0.cpe.net.cable.rogers.com.54786: Flags [P.], seq 15257052:15257312, ack 9001, win 501, options [nop,nop,TS val 3770219010 ecr 827868783], length 260
17:10:18.181554 IP 68.183.205.32.ssh > cpe00fc8d483dd3-cm00fc8d483dd0.cpe.net.cable.rogers.com.54786: Flags [P.], seq 15257312:15257572, ack 9001, win 501, options [nop,nop,TS val 3770219010 ecr 827868783], length 260
17:10:18.181616 IP 68.183.205.32.ssh > cpe00fc8d483dd3-cm00fc8d483dd0.cpe.net.cable.rogers.com.54786: Flags [P.], seq 15257572:15257832, ack 9001, win 501, options [nop,nop,TS val 3770219011 ecr 827868783], length 260
17:10:18.181681 IP 68.183.205.32.ssh > cpe00fc8d483dd3-cm00fc8d483dd0.cpe.net.cable.rogers.com.54786: Flags [P.], seq 15257832:15258092, ack 9001, win 501, options [nop,nop,TS val 3770219011 ecr 827868783], length 260
17:10:18.181744 IP 68.183.205.32.ssh > cpe00fc8d483dd3-cm00fc8d483dd0.cpe.net.cable.rogers.com.54786: Flags [P.], seq 15258092:15258352, ack 9001, win 501, options [nop,nop,TS val 3770219011 ecr 827868783], length 260
17:10:18.181811 IP 68.183.205.32.ssh > cpe00fc8d483dd3-cm00fc8d483dd0.cpe.net.cable.rogers.com.54786: Flags [P.], seq 15258352:15258612, ack 9001, win 501, options [nop,nop,TS val 3770219011 ecr 827868783], length 260
17:10:18.181872 IP 68.183.205.32.ssh > cpe00fc8d483dd3-cm00fc8d483dd0.cpe.net.cable.rogers.com.54786: Flags [P.], seq 15258612:15258872, ack 9001, win 501, options [nop,nop,TS val 3770219011 ecr 827868783], length 260
17:10:18.182123 IP 68.183.205.32.ssh > cpe00fc8d483dd3-cm00fc8d483dd0.cpe.net.cable.rogers.com.54786: Flags [P.], seq 15258872:15259132, ack 9001, win 501, options [nop,nop,TS val 3770219011 ecr 827868790], length 260
17:10:18.182194 IP 68.183.205.32.ssh > cpe00fc8d483dd3-cm00fc8d483dd0.cpe.net.cable.rogers.com.54786: Flags [P.], seq 15259132:15259392, ack 9001, win 501, options [nop,nop,TS val 3770219011 ecr 827868790], length 260
17:10:18.182265 IP 68.183.205.32.ssh > cpe00fc8d483dd3-cm00fc8d483dd0.cpe.net.cable.rogers.com.54786: Flags [P.], seq 15259392:15259652, ack 9001, win 501, options [nop,nop,TS val 3770219011 ecr 827868790], length 260
17:10:18.182334 IP 68.183.205.32.ssh > cpe00fc8d483dd3-cm00fc8d483dd0.cpe.net.cable.rogers.com.54786: Flags [P.], seq 15259652:15259912, ack 9001, win 501, options [nop,nop,TS val 3770219011 ecr 827868790], length 260
17:10:18.182400 IP 68.183.205.32.ssh > cpe00fc8d483dd3-cm00fc8d483dd0.cpe.net.cable.rogers.com.54786: Flags [P.], seq 15259912:15260172, ack 9001, win 501, options [nop,nop,TS val 3770219011 ecr 827868790], length 260
17:10:18.182477 IP 68.183.205.32.ssh > cpe00fc8d483dd3-cm00fc8d483dd0.cpe.net.cable.rogers.com.54786: Flags [P.], seq 15260172:15260432, ack 9001, win 501, options [nop,nop,TS val 3770219011 ecr 827868790], length 260
17:10:18.182542 IP 68.183.205.32.ssh > cpe00fc8d483dd3-cm00fc8d483dd0.cpe.net.cable.rogers.com.54786: Flags [P.], seq 15260432:15260692, ack 9001, win 501, options [nop,nop,TS val 3770219011 ecr 827868790], length 260
17:10:18.182611 IP 68.183.205.32.ssh > cpe00fc8d483dd3-cm00fc8d483dd0.cpe.net.cable.rogers.com.54786: Flags [P.], seq 15260692:15260952, ack 9001, win 501, options [nop,nop,TS val 3770219012 ecr 827868790], length 260
17:10:18.182677 IP 68.183.205.32.ssh > cpe00fc8d483dd3-cm00fc8d483dd0.cpe.net.cable.rogers.com.54786: Flags [P.], seq 15260952:15261212, ack 9001, win 501, options [nop,nop,TS val 3770219012 ecr 827868790], length 260
17:10:18.182740 IP 68.183.205.32.ssh > cpe00fc8d483dd3-cm00fc8d483dd0.cpe.net.cable.rogers.com.54786: Flags [P.], seq 15261212:15261472, ack 9001, win 501, options [nop,nop,TS val 3770219012 ecr 827868790], length 260
17:10:18.182802 IP 68.183.205.32.ssh > cpe00fc8d483dd3-cm00fc8d483dd0.cpe.net.cable.rogers.com.54786: Flags [P.], seq 15261472:15261732, ack 9001, win 501, options [nop,nop,TS val 3770219012 ecr 827868790], length 260
17:10:18.182865 IP 68.183.205.32.ssh > cpe00fc8d483dd3-cm00fc8d483dd0.cpe.net.cable.rogers.com.54786: Flags [P.], seq 15261732:15261992, ack 9001, win 501, options [nop,nop,TS val 3770219012 ecr 827868790], length 260
17:10:18.182934 IP 68.183.205.32.ssh > cpe00fc8d483dd3-cm00fc8d483dd0.cpe.net.cable.rogers.com.54786: Flags [P.], seq 15261992:15262252, ack 9001, win 501, options [nop,nop,TS val 3770219012 ecr 827868790], length 260
17:10:18.182994 IP 68.183.205.32.ssh > cpe00fc8d483dd3-cm00fc8d483dd0.cpe.net.cable.rogers.com.54786: Flags [P.], seq 15262252:15262512, ack 9001, win 501, options [nop,nop,TS val 3770219012 ecr 827868790], length 260
17:10:18.183060 IP 68.183.205.32.ssh > cpe00fc8d483dd3-cm00fc8d483dd0.cpe.net.cable.rogers.com.54786: Flags [P.], seq 15262512:15262772, ack 9001, win 501, options [nop,nop,TS val 3770219012 ecr 827868790], length 260
17:10:18.183122 IP 68.183.205.32.ssh > cpe00fc8d483dd3-cm00fc8d483dd0.cpe.net.cable.rogers.com.54786: Flags [P.], seq 15262772:15263032, ack 9001, win 501, options [nop,nop,TS val 3770219012 ecr 827868790], length 260
17:10:18.183187 IP 68.183.205.32.ssh > cpe00fc8d483dd3-cm00fc8d483dd0.cpe.net.cable.rogers.com.54786: Flags [P.], seq 15263032:15263292, ack 9001, win 501, options [nop,nop,TS val 3770219012 ecr 827868790], length 260
17:10:18.183250 IP 68.183.205.32.ssh > cpe00fc8d483dd3-cm00fc8d483dd0.cpe.net.cable.rogers.com.54786: Flags [P.], seq 15263292:15263552, ack 9001, win 501, options [nop,nop,TS val 3770219012 ecr 827868790], length 260
17:10:18.183322 IP 68.183.205.32.ssh > cpe00fc8d483dd3-cm00fc8d483dd0.cpe.net.cable.rogers.com.54786: Flags [P.], seq 15263552:15263812, ack 9001, win 501, options [nop,nop,TS val 3770219012 ecr 827868790], length 260
17:10:18.183384 IP 68.183.205.32.ssh > cpe00fc8d483dd3-cm00fc8d483dd0.cpe.net.cable.rogers.com.54786: Flags [P.], seq 15263812:15264072, ack 9001, win 501, options [nop,nop,TS val 3770219012 ecr 827868790], length 260
17:10:18.183447 IP 68.183.205.32.ssh > cpe00fc8d483dd3-cm00fc8d483dd0.cpe.net.cable.rogers.com.54786: Flags [P.], seq 15264072:15264332, ack 9001, win 501, options [nop,nop,TS val 3770219012 ecr 827868790], length 260
17:10:18.183513 IP 68.183.205.32.ssh > cpe00fc8d483dd3-cm00fc8d483dd0.cpe.net.cable.rogers.com.54786: Flags [P.], seq 15264332:15264592, ack 9001, win 501, options [nop,nop,TS val 3770219012 ecr 827868790], length 260
17:10:18.183574 IP 68.183.205.32.ssh > cpe00fc8d483dd3-cm00fc8d483dd0.cpe.net.cable.rogers.com.54786: Flags [P.], seq 15264592:15264852, ack 9001, win 501, options [nop,nop,TS val 3770219013 ecr 827868790], length 260
17:10:18.183641 IP 68.183.205.32.ssh > cpe00fc8d483dd3-cm00fc8d483dd0.cpe.net.cable.rogers.com.54786: Flags [P.], seq 15264852:15265112, ack 9001, win 501, options [nop,nop,TS val 3770219013 ecr 827868790], length 260
17:10:18.183704 IP 68.183.205.32.ssh > cpe00fc8d483dd3-cm00fc8d483dd0.cpe.net.cable.rogers.com.54786: Flags [P.], seq 15265112:15265372, ack 9001, win 501, options [nop,nop,TS val 3770219013 ecr 827868790], length 260
17:10:18.183794 IP 68.183.205.32.ssh > cpe00fc8d483dd3-cm00fc8d483dd0.cpe.net.cable.rogers.com.54786: Flags [P.], seq 15265372:15265632, ack 9001, win 501, options [nop,nop,TS val 3770219013 ecr 827868790], length 260
17:10:18.183857 IP 68.183.205.32.ssh > cpe00fc8d483dd3-cm00fc8d483dd0.cpe.net.cable.rogers.com.54786: Flags [P.], seq 15265632:15265892, ack 9001, win 501, options [nop,nop,TS val 3770219013 ecr 827868790], length 260
17:10:18.183922 IP 68.183.205.32.ssh > cpe00fc8d483dd3-cm00fc8d483dd0.cpe.net.cable.rogers.com.54786: Flags [P.], seq 15265892:15266152, ack 9001, win 501, options [nop,nop,TS val 3770219013 ecr 827868790], length 260
17:10:18.183992 IP 68.183.205.32.ssh > cpe00fc8d483dd3-cm00fc8d483dd0.cpe.net.cable.rogers.com.54786: Flags [P.], seq 15266152:15266412, ack 9001, win 501, options [nop,nop,TS val 3770219013 ecr 827868790], length 260
17:10:18.184053 IP 68.183.205.32.ssh > cpe00fc8d483dd3-cm00fc8d483dd0.cpe.net.cable.rogers.com.54786: Flags [P.], seq 15266412:15266672, ack 9001, win 501, options [nop,nop,TS val 3770219013 ecr 827868790], length 260
17:10:18.184114 IP 68.183.205.32.ssh > cpe00fc8d483dd3-cm00fc8d483dd0.cpe.net.cable.rogers.com.54786: Flags [P.], seq 15266672:15266932, ack 9001, win 501, options [nop,nop,TS val 3770219013 ecr 827868790], length 260
17:10:18.184178 IP 68.183.205.32.ssh > cpe00fc8d483dd3-cm00fc8d483dd0.cpe.net.cable.rogers.com.54786: Flags [P.], seq 15266932:15267192, ack 9001, win 501, options [nop,nop,TS val 3770219013 ecr 827868790], length 260
17:10:18.184251 IP 68.183.205.32.ssh > cpe00fc8d483dd3-cm00fc8d483dd0.cpe.net.cable.rogers.com.54786: Flags [P.], seq 15267192:15267452, ack 9001, win 501, options [nop,nop,TS val 3770219013 ecr 827868790], length 260
17:10:18.184341 IP 68.183.205.32.ssh > cpe00fc8d483dd3-cm00fc8d483dd0.cpe.net.cable.rogers.com.54786: Flags [P.], seq 15267452:15267712, ack 9001, win 501, options [nop,nop,TS val 3770219013 ecr 827868790], length 260
17:10:18.184413 IP 68.183.205.32.ssh > cpe00fc8d483dd3-cm00fc8d483dd0.cpe.net.cable.rogers.com.54786: Flags [P.], seq 15267712:15267972, ack 9001, win 501, options [nop,nop,TS val 3770219013 ecr 827868790], length 260
17:10:18.184479 IP 68.183.205.32.ssh > cpe00fc8d483dd3-cm00fc8d483dd0.cpe.net.cable.rogers.com.54786: Flags [P.], seq 15267972:15268232, ack 9001, win 501, options [nop,nop,TS val 3770219013 ecr 827868790], length 260
17:10:18.184551 IP 68.183.205.32.ssh > cpe00fc8d483dd3-cm00fc8d483dd0.cpe.net.cable.rogers.com.54786: Flags [P.], seq 15268232:15268492, ack 9001, win 501, options [nop,nop,TS val 3770219013 ecr 827868790], length 260
17:10:18.184616 IP 68.183.205.32.ssh > cpe00fc8d483dd3-cm00fc8d483dd0.cpe.net.cable.rogers.com.54786: Flags [P.], seq 15268492:15268752, ack 9001, win 501, options [nop,nop,TS val 3770219014 ecr 827868790], length 260
17:10:18.184687 IP 68.183.205.32.ssh > cpe00fc8d483dd3-cm00fc8d483dd0.cpe.net.cable.rogers.com.54786: Flags [P.], seq 15268752:15269012, ack 9001, win 501, options [nop,nop,TS val 3770219014 ecr 827868790], length 260
17:10:18.184752 IP 68.183.205.32.ssh > cpe00fc8d483dd3-cm00fc8d483dd0.cpe.net.cable.rogers.com.54786: Flags [P.], seq 15269012:15269272, ack 9001, win 501, options [nop,nop,TS val 3770219014 ecr 827868790], length 260
17:10:18.184820 IP 68.183.205.32.ssh > cpe00fc8d483dd3-cm00fc8d483dd0.cpe.net.cable.rogers.com.54786: Flags [P.], seq 15269272:15269532, ack 9001, win 501, options [nop,nop,TS val 3770219014 ecr 827868790], length 260
17:10:18.184886 IP 68.183.205.32.ssh > cpe00fc8d483dd3-cm00fc8d483dd0.cpe.net.cable.rogers.com.54786: Flags [P.], seq 15269532:15269792, ack 9001, win 501, options [nop,nop,TS val 3770219014 ecr 827868790], length 260
17:10:18.184950 IP 68.183.205.32.ssh > cpe00fc8d483dd3-cm00fc8d483dd0.cpe.net.cable.rogers.com.54786: Flags [P.], seq 15269792:15270052, ack 9001, win 501, options [nop,nop,TS val 3770219014 ecr 827868790], length 260
17:10:18.185018 IP 68.183.205.32.ssh > cpe00fc8d483dd3-cm00fc8d483dd0.cpe.net.cable.rogers.com.54786: Flags [P.], seq 15270052:15270312, ack 9001, win 501, options [nop,nop,TS val 3770219014 ecr 827868790], length 260
17:10:18.185085 IP 68.183.205.32.ssh > cpe00fc8d483dd3-cm00fc8d483dd0.cpe.net.cable.rogers.com.54786: Flags [P.], seq 15270312:15270572, ack 9001, win 501, options [nop,nop,TS val 3770219014 ecr 827868790], length 260
17:10:18.185152 IP 68.183.205.32.ssh > cpe00fc8d483dd3-cm00fc8d483dd0.cpe.net.cable.rogers.com.54786: Flags [P.], seq 15270572:15270832, ack 9001, win 501, options [nop,nop,TS val 3770219014 ecr 827868790], length 260
17:10:18.185213 IP 68.183.205.32.ssh > cpe00fc8d483dd3-cm00fc8d483dd0.cpe.net.cable.rogers.com.54786: Flags [P.], seq 15270832:15271092, ack 9001, win 501, options [nop,nop,TS val 3770219014 ecr 827868790], length 260
17:10:18.185276 IP 68.183.205.32.ssh > cpe00fc8d483dd3-cm00fc8d483dd0.cpe.net.cable.rogers.com.54786: Flags [P.], seq 15271092:15271352, ack 9001, win 501, options [nop,nop,TS val 3770219014 ecr 827868790], length 260
17:10:18.185338 IP 68.183.205.32.ssh > cpe00fc8d483dd3-cm00fc8d483dd0.cpe.net.cable.rogers.com.54786: Flags [P.], seq 15271352:15271612, ack 9001, win 501, options [nop,nop,TS val 3770219014 ecr 827868790], length 260
17:10:18.185404 IP 68.183.205.32.ssh > cpe00fc8d483dd3-cm00fc8d483dd0.cpe.net.cable.rogers.com.54786: Flags [P.], seq 15271612:15271872, ack 9001, win 501, options [nop,nop,TS val 3770219014 ecr 827868790], length 260
17:10:18.185465 IP 68.183.205.32.ssh > cpe00fc8d483dd3-cm00fc8d483dd0.cpe.net.cable.rogers.com.54786: Flags [P.], seq 15271872:15272132, ack 9001, win 501, options [nop,nop,TS val 3770219014 ecr 827868790], length 260
17:10:18.185532 IP 68.183.205.32.ssh > cpe00fc8d483dd3-cm00fc8d483dd0.cpe.net.cable.rogers.com.54786: Flags [P.], seq 15272132:15272392, ack 9001, win 501, options [nop,nop,TS val 3770219014 ecr 827868790], length 260
17:10:18.185595 IP 68.183.205.32.ssh > cpe00fc8d483dd3-cm00fc8d483dd0.cpe.net.cable.rogers.com.54786: Flags [P.], seq 15272392:15272652, ack 9001, win 501, options [nop,nop,TS val 3770219015 ecr 827868790], length 260
17:10:18.185662 IP 68.183.205.32.ssh > cpe00fc8d483dd3-cm00fc8d483dd0.cpe.net.cable.rogers.com.54786: Flags [P.], seq 15272652:15272912, ack 9001, win 501, options [nop,nop,TS val 3770219015 ecr 827868790], length 260
17:10:18.185724 IP 68.183.205.32.ssh > cpe00fc8d483dd3-cm00fc8d483dd0.cpe.net.cable.rogers.com.54786: Flags [P.], seq 15272912:15273172, ack 9001, win 501, options [nop,nop,TS val 3770219015 ecr 827868790], length 260
17:10:18.185786 IP 68.183.205.32.ssh > cpe00fc8d483dd3-cm00fc8d483dd0.cpe.net.cable.rogers.com.54786: Flags [P.], seq 15273172:15273432, ack 9001, win 501, options [nop,nop,TS val 3770219015 ecr 827868790], length 260
17:10:18.185853 IP 68.183.205.32.ssh > cpe00fc8d483dd3-cm00fc8d483dd0.cpe.net.cable.rogers.com.54786: Flags [P.], seq 15273432:15273692, ack 9001, win 501, options [nop,nop,TS val 3770219015 ecr 827868790], length 260
17:10:18.185914 IP 68.183.205.32.ssh > cpe00fc8d483dd3-cm00fc8d483dd0.cpe.net.cable.rogers.com.54786: Flags [P.], seq 15273692:15273952, ack 9001, win 501, options [nop,nop,TS val 3770219015 ecr 827868790], length 260
17:10:18.185980 IP 68.183.205.32.ssh > cpe00fc8d483dd3-cm00fc8d483dd0.cpe.net.cable.rogers.com.54786: Flags [P.], seq 15273952:15274212, ack 9001, win 501, options [nop,nop,TS val 3770219015 ecr 827868790], length 260
17:10:18.186043 IP 68.183.205.32.ssh > cpe00fc8d483dd3-cm00fc8d483dd0.cpe.net.cable.rogers.com.54786: Flags [P.], seq 15274212:15274472, ack 9001, win 501, options [nop,nop,TS val 3770219015 ecr 827868790], length 260
17:10:18.186106 IP 68.183.205.32.ssh > cpe00fc8d483dd3-cm00fc8d483dd0.cpe.net.cable.rogers.com.54786: Flags [P.], seq 15274472:15274732, ack 9001, win 501, options [nop,nop,TS val 3770219015 ecr 827868790], length 260
17:10:18.186170 IP 68.183.205.32.ssh > cpe00fc8d483dd3-cm00fc8d483dd0.cpe.net.cable.rogers.com.54786: Flags [P.], seq 15274732:15274992, ack 9001, win 501, options [nop,nop,TS val 3770219015 ecr 827868790], length 260
17:10:18.186235 IP 68.183.205.32.ssh > cpe00fc8d483dd3-cm00fc8d483dd0.cpe.net.cable.rogers.com.54786: Flags [P.], seq 15274992:15275252, ack 9001, win 501, options [nop,nop,TS val 3770219015 ecr 827868790], length 260
17:10:18.186298 IP 68.183.205.32.ssh > cpe00fc8d483dd3-cm00fc8d483dd0.cpe.net.cable.rogers.com.54786: Flags [P.], seq 15275252:15275512, ack 9001, win 501, options [nop,nop,TS val 3770219015 ecr 827868790], length 260
17:10:18.186366 IP 68.183.205.32.ssh > cpe00fc8d483dd3-cm00fc8d483dd0.cpe.net.cable.rogers.com.54786: Flags [P.], seq 15275512:15275772, ack 9001, win 501, options [nop,nop,TS val 3770219015 ecr 827868790], length 260
17:10:18.186427 IP 68.183.205.32.ssh > cpe00fc8d483dd3-cm00fc8d483dd0.cpe.net.cable.rogers.com.54786: Flags [P.], seq 15275772:15276032, ack 9001, win 501, options [nop,nop,TS val 3770219015 ecr 827868790], length 260
17:10:18.186500 IP 68.183.205.32.ssh > cpe00fc8d483dd3-cm00fc8d483dd0.cpe.net.cable.rogers.com.54786: Flags [P.], seq 15276032:15276292, ack 9001, win 501, options [nop,nop,TS val 3770219015 ecr 827868790], length 260
17:10:18.186566 IP 68.183.205.32.ssh > cpe00fc8d483dd3-cm00fc8d483dd0.cpe.net.cable.rogers.com.54786: Flags [P.], seq 15276292:15276552, ack 9001, win 501, options [nop,nop,TS val 3770219015 ecr 827868790], length 260
17:10:18.186628 IP 68.183.205.32.ssh > cpe00fc8d483dd3-cm00fc8d483dd0.cpe.net.cable.rogers.com.54786: Flags [P.], seq 15276552:15276812, ack 9001, win 501, options [nop,nop,TS val 3770219016 ecr 827868790], length 260
17:10:18.186696 IP 68.183.205.32.ssh > cpe00fc8d483dd3-cm00fc8d483dd0.cpe.net.cable.rogers.com.54786: Flags [P.], seq 15276812:15277072, ack 9001, win 501, options [nop,nop,TS val 3770219016 ecr 827868790], length 260
17:10:18.186766 IP 68.183.205.32.ssh > cpe00fc8d483dd3-cm00fc8d483dd0.cpe.net.cable.rogers.com.54786: Flags [P.], seq 15277072:15277332, ack 9001, win 501, options [nop,nop,TS val 3770219016 ecr 827868790], length 260
17:10:18.186828 IP 68.183.205.32.ssh > cpe00fc8d483dd3-cm00fc8d483dd0.cpe.net.cable.rogers.com.54786: Flags [P.], seq 15277332:15277592, ack 9001, win 501, options [nop,nop,TS val 3770219016 ecr 827868790], length 260
17:10:18.186890 IP 68.183.205.32.ssh > cpe00fc8d483dd3-cm00fc8d483dd0.cpe.net.cable.rogers.com.54786: Flags [P.], seq 15277592:15277852, ack 9001, win 501, options [nop,nop,TS val 3770219016 ecr 827868790], length 260
17:10:18.186952 IP 68.183.205.32.ssh > cpe00fc8d483dd3-cm00fc8d483dd0.cpe.net.cable.rogers.com.54786: Flags [P.], seq 15277852:15278112, ack 9001, win 501, options [nop,nop,TS val 3770219016 ecr 827868790], length 260
17:10:18.187020 IP 68.183.205.32.ssh > cpe00fc8d483dd3-cm00fc8d483dd0.cpe.net.cable.rogers.com.54786: Flags [P.], seq 15278112:15278372, ack 9001, win 501, options [nop,nop,TS val 3770219016 ecr 827868790], length 260
17:10:18.187083 IP 68.183.205.32.ssh > cpe00fc8d483dd3-cm00fc8d483dd0.cpe.net.cable.rogers.com.54786: Flags [P.], seq 15278372:15278632, ack 9001, win 501, options [nop,nop,TS val 3770219016 ecr 827868790], length 260
17:10:18.187154 IP 68.183.205.32.ssh > cpe00fc8d483dd3-cm00fc8d483dd0.cpe.net.cable.rogers.com.54786: Flags [P.], seq 15278632:15278892, ack 9001, win 501, options [nop,nop,TS val 3770219016 ecr 827868790], length 260
17:10:18.187221 IP 68.183.205.32.ssh > cpe00fc8d483dd3-cm00fc8d483dd0.cpe.net.cable.rogers.com.54786: Flags [P.], seq 15278892:15279152, ack 9001, win 501, options [nop,nop,TS val 3770219016 ecr 827868790], length 260
17:10:18.187291 IP 68.183.205.32.ssh > cpe00fc8d483dd3-cm00fc8d483dd0.cpe.net.cable.rogers.com.54786: Flags [P.], seq 15279152:15279412, ack 9001, win 501, options [nop,nop,TS val 3770219016 ecr 827868790], length 260
17:10:18.187356 IP 68.183.205.32.ssh > cpe00fc8d483dd3-cm00fc8d483dd0.cpe.net.cable.rogers.com.54786: Flags [P.], seq 15279412:15279672, ack 9001, win 501, options [nop,nop,TS val 3770219016 ecr 827868790], length 260
17:10:18.187427 IP 68.183.205.32.ssh > cpe00fc8d483dd3-cm00fc8d483dd0.cpe.net.cable.rogers.com.54786: Flags [P.], seq 15279672:15279932, ack 9001, win 501, options [nop,nop,TS val 3770219016 ecr 827868790], length 260
17:10:18.187493 IP 68.183.205.32.ssh > cpe00fc8d483dd3-cm00fc8d483dd0.cpe.net.cable.rogers.com.54786: Flags [P.], seq 15279932:15280192, ack 9001, win 501, options [nop,nop,TS val 3770219016 ecr 827868790], length 260
17:10:18.187564 IP 68.183.205.32.ssh > cpe00fc8d483dd3-cm00fc8d483dd0.cpe.net.cable.rogers.com.54786: Flags [P.], seq 15280192:15280452, ack 9001, win 501, options [nop,nop,TS val 3770219016 ecr 827868790], length 260
17:10:18.187633 IP 68.183.205.32.ssh > cpe00fc8d483dd3-cm00fc8d483dd0.cpe.net.cable.rogers.com.54786: Flags [P.], seq 15280452:15280712, ack 9001, win 501, options [nop,nop,TS val 3770219017 ecr 827868790], length 260
17:10:18.187699 IP 68.183.205.32.ssh > cpe00fc8d483dd3-cm00fc8d483dd0.cpe.net.cable.rogers.com.54786: Flags [P.], seq 15280712:15280972, ack 9001, win 501, options [nop,nop,TS val 3770219017 ecr 827868790], length 260
17:10:18.187778 IP 68.183.205.32.ssh > cpe00fc8d483dd3-cm00fc8d483dd0.cpe.net.cable.rogers.com.54786: Flags [P.], seq 15280972:15281232, ack 9001, win 501, options [nop,nop,TS val 3770219017 ecr 827868790], length 260
17:10:18.187841 IP 68.183.205.32.ssh > cpe00fc8d483dd3-cm00fc8d483dd0.cpe.net.cable.rogers.com.54786: Flags [P.], seq 15281232:15281492, ack 9001, win 501, options [nop,nop,TS val 3770219017 ecr 827868790], length 260
17:10:18.187903 IP 68.183.205.32.ssh > cpe00fc8d483dd3-cm00fc8d483dd0.cpe.net.cable.rogers.com.54786: Flags [P.], seq 15281492:15281752, ack 9001, win 501, options [nop,nop,TS val 3770219017 ecr 827868790], length 260
17:10:18.187964 IP 68.183.205.32.ssh > cpe00fc8d483dd3-cm00fc8d483dd0.cpe.net.cable.rogers.com.54786: Flags [P.], seq 15281752:15282012, ack 9001, win 501, options [nop,nop,TS val 3770219017 ecr 827868790], length 260
17:10:18.188024 IP 68.183.205.32.ssh > cpe00fc8d483dd3-cm00fc8d483dd0.cpe.net.cable.rogers.com.54786: Flags [P.], seq 15282012:15282272, ack 9001, win 501, options [nop,nop,TS val 3770219017 ecr 827868790], length 260
17:10:18.188091 IP 68.183.205.32.ssh > cpe00fc8d483dd3-cm00fc8d483dd0.cpe.net.cable.rogers.com.54786: Flags [P.], seq 15282272:15282532, ack 9001, win 501, options [nop,nop,TS val 3770219017 ecr 827868790], length 260
17:10:18.188154 IP 68.183.205.32.ssh > cpe00fc8d483dd3-cm00fc8d483dd0.cpe.net.cable.rogers.com.54786: Flags [P.], seq 15282532:15282792, ack 9001, win 501, options [nop,nop,TS val 3770219017 ecr 827868790], length 260
17:10:18.188217 IP 68.183.205.32.ssh > cpe00fc8d483dd3-cm00fc8d483dd0.cpe.net.cable.rogers.com.54786: Flags [P.], seq 15282792:15283052, ack 9001, win 501, options [nop,nop,TS val 3770219017 ecr 827868790], length 260
17:10:18.188278 IP 68.183.205.32.ssh > cpe00fc8d483dd3-cm00fc8d483dd0.cpe.net.cable.rogers.com.54786: Flags [P.], seq 15283052:15283312, ack 9001, win 501, options [nop,nop,TS val 3770219017 ecr 827868790], length 260
17:10:18.188374 IP 68.183.205.32.ssh > cpe00fc8d483dd3-cm00fc8d483dd0.cpe.net.cable.rogers.com.54786: Flags [P.], seq 15283312:15283572, ack 9001, win 501, options [nop,nop,TS val 3770219017 ecr 827868790], length 260
17:10:18.188446 IP 68.183.205.32.ssh > cpe00fc8d483dd3-cm00fc8d483dd0.cpe.net.cable.rogers.com.54786: Flags [P.], seq 15283572:15283832, ack 9001, win 501, options [nop,nop,TS val 3770219017 ecr 827868790], length 260
17:10:18.188518 IP 68.183.205.32.ssh > cpe00fc8d483dd3-cm00fc8d483dd0.cpe.net.cable.rogers.com.54786: Flags [P.], seq 15283832:15284092, ack 9001, win 501, options [nop,nop,TS val 3770219017 ecr 827868790], length 260
17:10:18.188588 IP 68.183.205.32.ssh > cpe00fc8d483dd3-cm00fc8d483dd0.cpe.net.cable.rogers.com.54786: Flags [P.], seq 15284092:15284352, ack 9001, win 501, options [nop,nop,TS val 3770219018 ecr 827868790], length 260
17:10:18.188663 IP 68.183.205.32.ssh > cpe00fc8d483dd3-cm00fc8d483dd0.cpe.net.cable.rogers.com.54786: Flags [P.], seq 15284352:15284612, ack 9001, win 501, options [nop,nop,TS val 3770219018 ecr 827868790], length 260
17:10:18.188731 IP 68.183.205.32.ssh > cpe00fc8d483dd3-cm00fc8d483dd0.cpe.net.cable.rogers.com.54786: Flags [P.], seq 15284612:15284872, ack 9001, win 501, options [nop,nop,TS val 3770219018 ecr 827868790], length 260
17:10:18.188798 IP 68.183.205.32.ssh > cpe00fc8d483dd3-cm00fc8d483dd0.cpe.net.cable.rogers.com.54786: Flags [P.], seq 15284872:15285132, ack 9001, win 501, options [nop,nop,TS val 3770219018 ecr 827868790], length 260
17:10:18.188865 IP 68.183.205.32.ssh > cpe00fc8d483dd3-cm00fc8d483dd0.cpe.net.cable.rogers.com.54786: Flags [P.], seq 15285132:15285392, ack 9001, win 501, options [nop,nop,TS val 3770219018 ecr 827868790], length 260
17:10:18.188930 IP 68.183.205.32.ssh > cpe00fc8d483dd3-cm00fc8d483dd0.cpe.net.cable.rogers.com.54786: Flags [P.], seq 15285392:15285652, ack 9001, win 501, options [nop,nop,TS val 3770219018 ecr 827868790], length 260
17:10:18.188995 IP 68.183.205.32.ssh > cpe00fc8d483dd3-cm00fc8d483dd0.cpe.net.cable.rogers.com.54786: Flags [P.], seq 15285652:15285912, ack 9001, win 501, options [nop,nop,TS val 3770219018 ecr 827868790], length 260
17:10:18.189063 IP 68.183.205.32.ssh > cpe00fc8d483dd3-cm00fc8d483dd0.cpe.net.cable.rogers.com.54786: Flags [P.], seq 15285912:15286172, ack 9001, win 501, options [nop,nop,TS val 3770219018 ecr 827868790], length 260
17:10:18.189128 IP 68.183.205.32.ssh > cpe00fc8d483dd3-cm00fc8d483dd0.cpe.net.cable.rogers.com.54786: Flags [P.], seq 15286172:15286432, ack 9001, win 501, options [nop,nop,TS val 3770219018 ecr 827868790], length 260
17:10:18.189192 IP 68.183.205.32.ssh > cpe00fc8d483dd3-cm00fc8d483dd0.cpe.net.cable.rogers.com.54786: Flags [P.], seq 15286432:15286692, ack 9001, win 501, options [nop,nop,TS val 3770219018 ecr 827868790], length 260
17:10:18.189261 IP 68.183.205.32.ssh > cpe00fc8d483dd3-cm00fc8d483dd0.cpe.net.cable.rogers.com.54786: Flags [P.], seq 15286692:15286952, ack 9001, win 501, options [nop,nop,TS val 3770219018 ecr 827868790], length 260
17:10:18.189324 IP 68.183.205.32.ssh > cpe00fc8d483dd3-cm00fc8d483dd0.cpe.net.cable.rogers.com.54786: Flags [P.], seq 15286952:15287212, ack 9001, win 501, options [nop,nop,TS val 3770219018 ecr 827868790], length 260
17:10:18.189391 IP 68.183.205.32.ssh > cpe00fc8d483dd3-cm00fc8d483dd0.cpe.net.cable.rogers.com.54786: Flags [P.], seq 15287212:15287472, ack 9001, win 501, options [nop,nop,TS val 3770219018 ecr 827868790], length 260
17:10:18.189452 IP 68.183.205.32.ssh > cpe00fc8d483dd3-cm00fc8d483dd0.cpe.net.cable.rogers.com.54786: Flags [P.], seq 15287472:15287732, ack 9001, win 501, options [nop,nop,TS val 3770219018 ecr 827868790], length 260
17:10:18.189517 IP 68.183.205.32.ssh > cpe00fc8d483dd3-cm00fc8d483dd0.cpe.net.cable.rogers.com.54786: Flags [P.], seq 15287732:15287992, ack 9001, win 501, options [nop,nop,TS val 3770219018 ecr 827868790], length 260
17:10:18.189578 IP 68.183.205.32.ssh > cpe00fc8d483dd3-cm00fc8d483dd0.cpe.net.cable.rogers.com.54786: Flags [P.], seq 15287992:15288252, ack 9001, win 501, options [nop,nop,TS val 3770219019 ecr 827868790], length 260
17:10:18.189645 IP 68.183.205.32.ssh > cpe00fc8d483dd3-cm00fc8d483dd0.cpe.net.cable.rogers.com.54786: Flags [P.], seq 15288252:15288512, ack 9001, win 501, options [nop,nop,TS val 3770219019 ecr 827868790], length 260
17:10:18.189787 IP 68.183.205.32.ssh > cpe00fc8d483dd3-cm00fc8d483dd0.cpe.net.cable.rogers.com.54786: Flags [P.], seq 15288512:15288772, ack 9037, win 501, options [nop,nop,TS val 3770219019 ecr 827868790], length 260
17:10:18.189861 IP 68.183.205.32.ssh > cpe00fc8d483dd3-cm00fc8d483dd0.cpe.net.cable.rogers.com.54786: Flags [P.], seq 15288772:15289032, ack 9037, win 501, options [nop,nop,TS val 3770219019 ecr 827868790], length 260
17:10:18.189924 IP 68.183.205.32.ssh > cpe00fc8d483dd3-cm00fc8d483dd0.cpe.net.cable.rogers.com.54786: Flags [P.], seq 15289032:15289292, ack 9037, win 501, options [nop,nop,TS val 3770219019 ecr 827868790], length 260
17:10:18.189985 IP 68.183.205.32.ssh > cpe00fc8d483dd3-cm00fc8d483dd0.cpe.net.cable.rogers.com.54786: Flags [P.], seq 15289292:15289552, ack 9037, win 501, options [nop,nop,TS val 3770219019 ecr 827868790], length 260
17:10:18.190045 IP 68.183.205.32.ssh > cpe00fc8d483dd3-cm00fc8d483dd0.cpe.net.cable.rogers.com.54786: Flags [P.], seq 15289552:15289812, ack 9037, win 501, options [nop,nop,TS val 3770219019 ecr 827868790], length 260
17:10:18.190112 IP 68.183.205.32.ssh > cpe00fc8d483dd3-cm00fc8d483dd0.cpe.net.cable.rogers.com.54786: Flags [P.], seq 15289812:15290072, ack 9037, win 501, options [nop,nop,TS val 3770219019 ecr 827868790], length 260
17:10:18.190178 IP 68.183.205.32.ssh > cpe00fc8d483dd3-cm00fc8d483dd0.cpe.net.cable.rogers.com.54786: Flags [P.], seq 15290072:15290332, ack 9037, win 501, options [nop,nop,TS val 3770219019 ecr 827868790], length 260
17:10:18.190316 IP 68.183.205.32.ssh > cpe00fc8d483dd3-cm00fc8d483dd0.cpe.net.cable.rogers.com.54786: Flags [P.], seq 15290332:15290592, ack 9037, win 501, options [nop,nop,TS val 3770219019 ecr 827868790], length 260
17:10:18.190390 IP 68.183.205.32.ssh > cpe00fc8d483dd3-cm00fc8d483dd0.cpe.net.cable.rogers.com.54786: Flags [P.], seq 15290592:15290852, ack 9037, win 501, options [nop,nop,TS val 3770219019 ecr 827868790], length 260
17:10:18.190453 IP 68.183.205.32.ssh > cpe00fc8d483dd3-cm00fc8d483dd0.cpe.net.cable.rogers.com.54786: Flags [P.], seq 15290852:15291112, ack 9037, win 501, options [nop,nop,TS val 3770219019 ecr 827868790], length 260
17:10:18.190517 IP 68.183.205.32.ssh > cpe00fc8d483dd3-cm00fc8d483dd0.cpe.net.cable.rogers.com.54786: Flags [P.], seq 15291112:15291372, ack 9037, win 501, options [nop,nop,TS val 3770219019 ecr 827868790], length 260
17:10:18.190580 IP 68.183.205.32.ssh > cpe00fc8d483dd3-cm00fc8d483dd0.cpe.net.cable.rogers.com.54786: Flags [P.], seq 15291372:15291632, ack 9037, win 501, options [nop,nop,TS val 3770219020 ecr 827868790], length 260
17:10:18.190646 IP 68.183.205.32.ssh > cpe00fc8d483dd3-cm00fc8d483dd0.cpe.net.cable.rogers.com.54786: Flags [P.], seq 15291632:15291892, ack 9037, win 501, options [nop,nop,TS val 3770219020 ecr 827868790], length 260
17:10:18.190719 IP 68.183.205.32.ssh > cpe00fc8d483dd3-cm00fc8d483dd0.cpe.net.cable.rogers.com.54786: Flags [P.], seq 15291892:15292152, ack 9037, win 501, options [nop,nop,TS val 3770219020 ecr 827868790], length 260
17:10:18.190785 IP 68.183.205.32.ssh > cpe00fc8d483dd3-cm00fc8d483dd0.cpe.net.cable.rogers.com.54786: Flags [P.], seq 15292152:15292412, ack 9037, win 501, options [nop,nop,TS val 3770219020 ecr 827868790], length 260
17:10:18.190847 IP 68.183.205.32.ssh > cpe00fc8d483dd3-cm00fc8d483dd0.cpe.net.cable.rogers.com.54786: Flags [P.], seq 15292412:15292672, ack 9037, win 501, options [nop,nop,TS val 3770219020 ecr 827868790], length 260
17:10:18.190912 IP 68.183.205.32.ssh > cpe00fc8d483dd3-cm00fc8d483dd0.cpe.net.cable.rogers.com.54786: Flags [P.], seq 15292672:15292932, ack 9037, win 501, options [nop,nop,TS val 3770219020 ecr 827868790], length 260
17:10:18.190981 IP 68.183.205.32.ssh > cpe00fc8d483dd3-cm00fc8d483dd0.cpe.net.cable.rogers.com.54786: Flags [P.], seq 15292932:15293192, ack 9037, win 501, options [nop,nop,TS val 3770219020 ecr 827868790], length 260
17:10:18.191051 IP 68.183.205.32.ssh > cpe00fc8d483dd3-cm00fc8d483dd0.cpe.net.cable.rogers.com.54786: Flags [P.], seq 15293192:15293452, ack 9037, win 501, options [nop,nop,TS val 3770219020 ecr 827868790], length 260
17:10:18.191117 IP 68.183.205.32.ssh > cpe00fc8d483dd3-cm00fc8d483dd0.cpe.net.cable.rogers.com.54786: Flags [P.], seq 15293452:15293712, ack 9037, win 501, options [nop,nop,TS val 3770219020 ecr 827868790], length 260
17:10:18.191186 IP 68.183.205.32.ssh > cpe00fc8d483dd3-cm00fc8d483dd0.cpe.net.cable.rogers.com.54786: Flags [P.], seq 15293712:15293972, ack 9037, win 501, options [nop,nop,TS val 3770219020 ecr 827868790], length 260
17:10:18.191254 IP 68.183.205.32.ssh > cpe00fc8d483dd3-cm00fc8d483dd0.cpe.net.cable.rogers.com.54786: Flags [P.], seq 15293972:15294232, ack 9037, win 501, options [nop,nop,TS val 3770219020 ecr 827868790], length 260
17:10:18.191329 IP 68.183.205.32.ssh > cpe00fc8d483dd3-cm00fc8d483dd0.cpe.net.cable.rogers.com.54786: Flags [P.], seq 15294232:15294492, ack 9037, win 501, options [nop,nop,TS val 3770219020 ecr 827868790], length 260
17:10:18.191397 IP 68.183.205.32.ssh > cpe00fc8d483dd3-cm00fc8d483dd0.cpe.net.cable.rogers.com.54786: Flags [P.], seq 15294492:15294752, ack 9037, win 501, options [nop,nop,TS val 3770219020 ecr 827868790], length 260
17:10:18.191466 IP 68.183.205.32.ssh > cpe00fc8d483dd3-cm00fc8d483dd0.cpe.net.cable.rogers.com.54786: Flags [P.], seq 15294752:15295012, ack 9037, win 501, options [nop,nop,TS val 3770219020 ecr 827868790], length 260
17:10:18.191534 IP 68.183.205.32.ssh > cpe00fc8d483dd3-cm00fc8d483dd0.cpe.net.cable.rogers.com.54786: Flags [P.], seq 15295012:15295272, ack 9037, win 501, options [nop,nop,TS val 3770219020 ecr 827868790], length 260
17:10:18.191606 IP 68.183.205.32.ssh > cpe00fc8d483dd3-cm00fc8d483dd0.cpe.net.cable.rogers.com.54786: Flags [P.], seq 15295272:15295532, ack 9037, win 501, options [nop,nop,TS val 3770219021 ecr 827868790], length 260
17:10:18.191675 IP 68.183.205.32.ssh > cpe00fc8d483dd3-cm00fc8d483dd0.cpe.net.cable.rogers.com.54786: Flags [P.], seq 15295532:15295792, ack 9037, win 501, options [nop,nop,TS val 3770219021 ecr 827868790], length 260
17:10:18.191760 IP 68.183.205.32.ssh > cpe00fc8d483dd3-cm00fc8d483dd0.cpe.net.cable.rogers.com.54786: Flags [P.], seq 15295792:15296052, ack 9037, win 501, options [nop,nop,TS val 3770219021 ecr 827868790], length 260
17:10:18.191829 IP 68.183.205.32.ssh > cpe00fc8d483dd3-cm00fc8d483dd0.cpe.net.cable.rogers.com.54786: Flags [P.], seq 15296052:15296312, ack 9037, win 501, options [nop,nop,TS val 3770219021 ecr 827868790], length 260
17:10:18.191895 IP 68.183.205.32.ssh > cpe00fc8d483dd3-cm00fc8d483dd0.cpe.net.cable.rogers.com.54786: Flags [P.], seq 15296312:15296572, ack 9037, win 501, options [nop,nop,TS val 3770219021 ecr 827868790], length 260
17:10:18.191958 IP 68.183.205.32.ssh > cpe00fc8d483dd3-cm00fc8d483dd0.cpe.net.cable.rogers.com.54786: Flags [P.], seq 15296572:15296832, ack 9037, win 501, options [nop,nop,TS val 3770219021 ecr 827868790], length 260
17:10:18.192028 IP 68.183.205.32.ssh > cpe00fc8d483dd3-cm00fc8d483dd0.cpe.net.cable.rogers.com.54786: Flags [P.], seq 15296832:15297092, ack 9037, win 501, options [nop,nop,TS val 3770219021 ecr 827868790], length 260
17:10:18.192099 IP 68.183.205.32.ssh > cpe00fc8d483dd3-cm00fc8d483dd0.cpe.net.cable.rogers.com.54786: Flags [P.], seq 15297092:15297352, ack 9037, win 501, options [nop,nop,TS val 3770219021 ecr 827868790], length 260
17:10:18.192168 IP 68.183.205.32.ssh > cpe00fc8d483dd3-cm00fc8d483dd0.cpe.net.cable.rogers.com.54786: Flags [P.], seq 15297352:15297612, ack 9037, win 501, options [nop,nop,TS val 3770219021 ecr 827868790], length 260
17:10:18.192265 IP 68.183.205.32.ssh > cpe00fc8d483dd3-cm00fc8d483dd0.cpe.net.cable.rogers.com.54786: Flags [P.], seq 15297612:15297872, ack 9037, win 501, options [nop,nop,TS val 3770219021 ecr 827868790], length 260
17:10:18.192356 IP 68.183.205.32.ssh > cpe00fc8d483dd3-cm00fc8d483dd0.cpe.net.cable.rogers.com.54786: Flags [P.], seq 15297872:15298132, ack 9037, win 501, options [nop,nop,TS val 3770219021 ecr 827868790], length 260
17:10:18.192422 IP 68.183.205.32.ssh > cpe00fc8d483dd3-cm00fc8d483dd0.cpe.net.cable.rogers.com.54786: Flags [P.], seq 15298132:15298392, ack 9037, win 501, options [nop,nop,TS val 3770219021 ecr 827868790], length 260
17:10:18.192488 IP 68.183.205.32.ssh > cpe00fc8d483dd3-cm00fc8d483dd0.cpe.net.cable.rogers.com.54786: Flags [P.], seq 15298392:15298652, ack 9037, win 501, options [nop,nop,TS val 3770219021 ecr 827868790], length 260
17:10:18.192564 IP 68.183.205.32.ssh > cpe00fc8d483dd3-cm00fc8d483dd0.cpe.net.cable.rogers.com.54786: Flags [P.], seq 15298652:15298912, ack 9037, win 501, options [nop,nop,TS val 3770219021 ecr 827868790], length 260
17:10:18.192632 IP 68.183.205.32.ssh > cpe00fc8d483dd3-cm00fc8d483dd0.cpe.net.cable.rogers.com.54786: Flags [P.], seq 15298912:15299172, ack 9037, win 501, options [nop,nop,TS val 3770219022 ecr 827868790], length 260
17:10:18.192705 IP 68.183.205.32.ssh > cpe00fc8d483dd3-cm00fc8d483dd0.cpe.net.cable.rogers.com.54786: Flags [P.], seq 15299172:15299432, ack 9037, win 501, options [nop,nop,TS val 3770219022 ecr 827868790], length 260
17:10:18.192770 IP 68.183.205.32.ssh > cpe00fc8d483dd3-cm00fc8d483dd0.cpe.net.cable.rogers.com.54786: Flags [P.], seq 15299432:15299692, ack 9037, win 501, options [nop,nop,TS val 3770219022 ecr 827868790], length 260
17:10:18.192841 IP 68.183.205.32.ssh > cpe00fc8d483dd3-cm00fc8d483dd0.cpe.net.cable.rogers.com.54786: Flags [P.], seq 15299692:15299952, ack 9037, win 501, options [nop,nop,TS val 3770219022 ecr 827868790], length 260
17:10:18.192917 IP 68.183.205.32.ssh > cpe00fc8d483dd3-cm00fc8d483dd0.cpe.net.cable.rogers.com.54786: Flags [P.], seq 15299952:15300212, ack 9037, win 501, options [nop,nop,TS val 3770219022 ecr 827868790], length 260
17:10:18.192981 IP 68.183.205.32.ssh > cpe00fc8d483dd3-cm00fc8d483dd0.cpe.net.cable.rogers.com.54786: Flags [P.], seq 15300212:15300472, ack 9037, win 501, options [nop,nop,TS val 3770219022 ecr 827868790], length 260
17:10:18.193045 IP 68.183.205.32.ssh > cpe00fc8d483dd3-cm00fc8d483dd0.cpe.net.cable.rogers.com.54786: Flags [P.], seq 15300472:15300732, ack 9037, win 501, options [nop,nop,TS val 3770219022 ecr 827868790], length 260
17:10:18.193114 IP 68.183.205.32.ssh > cpe00fc8d483dd3-cm00fc8d483dd0.cpe.net.cable.rogers.com.54786: Flags [P.], seq 15300732:15300992, ack 9037, win 501, options [nop,nop,TS val 3770219022 ecr 827868790], length 260
17:10:18.193178 IP 68.183.205.32.ssh > cpe00fc8d483dd3-cm00fc8d483dd0.cpe.net.cable.rogers.com.54786: Flags [P.], seq 15300992:15301252, ack 9037, win 501, options [nop,nop,TS val 3770219022 ecr 827868790], length 260
17:10:18.193246 IP 68.183.205.32.ssh > cpe00fc8d483dd3-cm00fc8d483dd0.cpe.net.cable.rogers.com.54786: Flags [P.], seq 15301252:15301512, ack 9037, win 501, options [nop,nop,TS val 3770219022 ecr 827868790], length 260
17:10:18.193310 IP 68.183.205.32.ssh > cpe00fc8d483dd3-cm00fc8d483dd0.cpe.net.cable.rogers.com.54786: Flags [P.], seq 15301512:15301772, ack 9037, win 501, options [nop,nop,TS val 3770219022 ecr 827868790], length 260
17:10:18.193376 IP 68.183.205.32.ssh > cpe00fc8d483dd3-cm00fc8d483dd0.cpe.net.cable.rogers.com.54786: Flags [P.], seq 15301772:15302032, ack 9037, win 501, options [nop,nop,TS val 3770219022 ecr 827868790], length 260
17:10:18.193445 IP 68.183.205.32.ssh > cpe00fc8d483dd3-cm00fc8d483dd0.cpe.net.cable.rogers.com.54786: Flags [P.], seq 15302032:15302292, ack 9037, win 501, options [nop,nop,TS val 3770219022 ecr 827868790], length 260
17:10:18.193507 IP 68.183.205.32.ssh > cpe00fc8d483dd3-cm00fc8d483dd0.cpe.net.cable.rogers.com.54786: Flags [P.], seq 15302292:15302552, ack 9037, win 501, options [nop,nop,TS val 3770219022 ecr 827868790], length 260
17:10:18.193578 IP 68.183.205.32.ssh > cpe00fc8d483dd3-cm00fc8d483dd0.cpe.net.cable.rogers.com.54786: Flags [P.], seq 15302552:15302812, ack 9037, win 501, options [nop,nop,TS val 3770219023 ecr 827868790], length 260
17:10:18.193640 IP 68.183.205.32.ssh > cpe00fc8d483dd3-cm00fc8d483dd0.cpe.net.cable.rogers.com.54786: Flags [P.], seq 15302812:15303072, ack 9037, win 501, options [nop,nop,TS val 3770219023 ecr 827868790], length 260
17:10:18.193707 IP 68.183.205.32.ssh > cpe00fc8d483dd3-cm00fc8d483dd0.cpe.net.cable.rogers.com.54786: Flags [P.], seq 15303072:15303332, ack 9037, win 501, options [nop,nop,TS val 3770219023 ecr 827868790], length 260
17:10:18.193770 IP 68.183.205.32.ssh > cpe00fc8d483dd3-cm00fc8d483dd0.cpe.net.cable.rogers.com.54786: Flags [P.], seq 15303332:15303592, ack 9037, win 501, options [nop,nop,TS val 3770219023 ecr 827868790], length 260
17:10:18.193839 IP 68.183.205.32.ssh > cpe00fc8d483dd3-cm00fc8d483dd0.cpe.net.cable.rogers.com.54786: Flags [P.], seq 15303592:15303852, ack 9037, win 501, options [nop,nop,TS val 3770219023 ecr 827868790], length 260
17:10:18.193901 IP 68.183.205.32.ssh > cpe00fc8d483dd3-cm00fc8d483dd0.cpe.net.cable.rogers.com.54786: Flags [P.], seq 15303852:15304112, ack 9037, win 501, options [nop,nop,TS val 3770219023 ecr 827868790], length 260
17:10:18.193966 IP 68.183.205.32.ssh > cpe00fc8d483dd3-cm00fc8d483dd0.cpe.net.cable.rogers.com.54786: Flags [P.], seq 15304112:15304372, ack 9037, win 501, options [nop,nop,TS val 3770219023 ecr 827868790], length 260
17:10:18.194028 IP 68.183.205.32.ssh > cpe00fc8d483dd3-cm00fc8d483dd0.cpe.net.cable.rogers.com.54786: Flags [P.], seq 15304372:15304632, ack 9037, win 501, options [nop,nop,TS val 3770219023 ecr 827868790], length 260
17:10:18.194093 IP 68.183.205.32.ssh > cpe00fc8d483dd3-cm00fc8d483dd0.cpe.net.cable.rogers.com.54786: Flags [P.], seq 15304632:15304892, ack 9037, win 501, options [nop,nop,TS val 3770219023 ecr 827868790], length 260
17:10:18.194156 IP 68.183.205.32.ssh > cpe00fc8d483dd3-cm00fc8d483dd0.cpe.net.cable.rogers.com.54786: Flags [P.], seq 15304892:15305152, ack 9037, win 501, options [nop,nop,TS val 3770219023 ecr 827868790], length 260
17:10:18.194220 IP 68.183.205.32.ssh > cpe00fc8d483dd3-cm00fc8d483dd0.cpe.net.cable.rogers.com.54786: Flags [P.], seq 15305152:15305412, ack 9037, win 501, options [nop,nop,TS val 3770219023 ecr 827868790], length 260
17:10:18.194281 IP 68.183.205.32.ssh > cpe00fc8d483dd3-cm00fc8d483dd0.cpe.net.cable.rogers.com.54786: Flags [P.], seq 15305412:15305672, ack 9037, win 501, options [nop,nop,TS val 3770219023 ecr 827868790], length 260
17:10:18.194347 IP 68.183.205.32.ssh > cpe00fc8d483dd3-cm00fc8d483dd0.cpe.net.cable.rogers.com.54786: Flags [P.], seq 15305672:15305932, ack 9037, win 501, options [nop,nop,TS val 3770219023 ecr 827868790], length 260
17:10:18.194412 IP 68.183.205.32.ssh > cpe00fc8d483dd3-cm00fc8d483dd0.cpe.net.cable.rogers.com.54786: Flags [P.], seq 15305932:15306192, ack 9037, win 501, options [nop,nop,TS val 3770219023 ecr 827868790], length 260
17:10:18.194477 IP 68.183.205.32.ssh > cpe00fc8d483dd3-cm00fc8d483dd0.cpe.net.cable.rogers.com.54786: Flags [P.], seq 15306192:15306452, ack 9037, win 501, options [nop,nop,TS val 3770219023 ecr 827868790], length 260
17:10:18.194545 IP 68.183.205.32.ssh > cpe00fc8d483dd3-cm00fc8d483dd0.cpe.net.cable.rogers.com.54786: Flags [P.], seq 15306452:15306712, ack 9037, win 501, options [nop,nop,TS val 3770219023 ecr 827868790], length 260
17:10:18.194611 IP 68.183.205.32.ssh > cpe00fc8d483dd3-cm00fc8d483dd0.cpe.net.cable.rogers.com.54786: Flags [P.], seq 15306712:15306972, ack 9037, win 501, options [nop,nop,TS val 3770219024 ecr 827868790], length 260
17:10:18.194675 IP 68.183.205.32.ssh > cpe00fc8d483dd3-cm00fc8d483dd0.cpe.net.cable.rogers.com.54786: Flags [P.], seq 15306972:15307232, ack 9037, win 501, options [nop,nop,TS val 3770219024 ecr 827868790], length 260
17:10:18.194738 IP 68.183.205.32.ssh > cpe00fc8d483dd3-cm00fc8d483dd0.cpe.net.cable.rogers.com.54786: Flags [P.], seq 15307232:15307492, ack 9037, win 501, options [nop,nop,TS val 3770219024 ecr 827868790], length 260
17:10:18.194807 IP 68.183.205.32.ssh > cpe00fc8d483dd3-cm00fc8d483dd0.cpe.net.cable.rogers.com.54786: Flags [P.], seq 15307492:15307752, ack 9037, win 501, options [nop,nop,TS val 3770219024 ecr 827868790], length 260
17:10:18.194869 IP 68.183.205.32.ssh > cpe00fc8d483dd3-cm00fc8d483dd0.cpe.net.cable.rogers.com.54786: Flags [P.], seq 15307752:15308012, ack 9037, win 501, options [nop,nop,TS val 3770219024 ecr 827868790], length 260
17:10:18.194933 IP 68.183.205.32.ssh > cpe00fc8d483dd3-cm00fc8d483dd0.cpe.net.cable.rogers.com.54786: Flags [P.], seq 15308012:15308272, ack 9037, win 501, options [nop,nop,TS val 3770219024 ecr 827868790], length 260
17:10:18.194994 IP 68.183.205.32.ssh > cpe00fc8d483dd3-cm00fc8d483dd0.cpe.net.cable.rogers.com.54786: Flags [P.], seq 15308272:15308532, ack 9037, win 501, options [nop,nop,TS val 3770219024 ecr 827868790], length 260
17:10:18.195057 IP 68.183.205.32.ssh > cpe00fc8d483dd3-cm00fc8d483dd0.cpe.net.cable.rogers.com.54786: Flags [P.], seq 15308532:15308792, ack 9037, win 501, options [nop,nop,TS val 3770219024 ecr 827868790], length 260
17:10:18.195127 IP 68.183.205.32.ssh > cpe00fc8d483dd3-cm00fc8d483dd0.cpe.net.cable.rogers.com.54786: Flags [P.], seq 15308792:15309052, ack 9037, win 501, options [nop,nop,TS val 3770219024 ecr 827868790], length 260
17:10:18.195188 IP 68.183.205.32.ssh > cpe00fc8d483dd3-cm00fc8d483dd0.cpe.net.cable.rogers.com.54786: Flags [P.], seq 15309052:15309312, ack 9037, win 501, options [nop,nop,TS val 3770219024 ecr 827868790], length 260
17:10:18.195256 IP 68.183.205.32.ssh > cpe00fc8d483dd3-cm00fc8d483dd0.cpe.net.cable.rogers.com.54786: Flags [P.], seq 15309312:15309572, ack 9037, win 501, options [nop,nop,TS val 3770219024 ecr 827868790], length 260
17:10:18.195318 IP 68.183.205.32.ssh > cpe00fc8d483dd3-cm00fc8d483dd0.cpe.net.cable.rogers.com.54786: Flags [P.], seq 15309572:15309832, ack 9037, win 501, options [nop,nop,TS val 3770219024 ecr 827868790], length 260
17:10:18.195383 IP 68.183.205.32.ssh > cpe00fc8d483dd3-cm00fc8d483dd0.cpe.net.cable.rogers.com.54786: Flags [P.], seq 15309832:15310092, ack 9037, win 501, options [nop,nop,TS val 3770219024 ecr 827868790], length 260
17:10:18.195445 IP 68.183.205.32.ssh > cpe00fc8d483dd3-cm00fc8d483dd0.cpe.net.cable.rogers.com.54786: Flags [P.], seq 15310092:15310352, ack 9037, win 501, options [nop,nop,TS val 3770219024 ecr 827868790], length 260
17:10:18.195510 IP 68.183.205.32.ssh > cpe00fc8d483dd3-cm00fc8d483dd0.cpe.net.cable.rogers.com.54786: Flags [P.], seq 15310352:15310612, ack 9037, win 501, options [nop,nop,TS val 3770219024 ecr 827868790], length 260
17:10:18.195571 IP 68.183.205.32.ssh > cpe00fc8d483dd3-cm00fc8d483dd0.cpe.net.cable.rogers.com.54786: Flags [P.], seq 15310612:15310872, ack 9037, win 501, options [nop,nop,TS val 3770219025 ecr 827868790], length 260
17:10:18.195642 IP 68.183.205.32.ssh > cpe00fc8d483dd3-cm00fc8d483dd0.cpe.net.cable.rogers.com.54786: Flags [P.], seq 15310872:15311132, ack 9037, win 501, options [nop,nop,TS val 3770219025 ecr 827868790], length 260
17:10:18.195707 IP 68.183.205.32.ssh > cpe00fc8d483dd3-cm00fc8d483dd0.cpe.net.cable.rogers.com.54786: Flags [P.], seq 15311132:15311392, ack 9037, win 501, options [nop,nop,TS val 3770219025 ecr 827868790], length 260
17:10:18.195792 IP 68.183.205.32.ssh > cpe00fc8d483dd3-cm00fc8d483dd0.cpe.net.cable.rogers.com.54786: Flags [P.], seq 15311392:15311652, ack 9037, win 501, options [nop,nop,TS val 3770219025 ecr 827868790], length 260
17:10:18.195857 IP 68.183.205.32.ssh > cpe00fc8d483dd3-cm00fc8d483dd0.cpe.net.cable.rogers.com.54786: Flags [P.], seq 15311652:15311912, ack 9037, win 501, options [nop,nop,TS val 3770219025 ecr 827868790], length 260
17:10:18.195923 IP 68.183.205.32.ssh > cpe00fc8d483dd3-cm00fc8d483dd0.cpe.net.cable.rogers.com.54786: Flags [P.], seq 15311912:15312172, ack 9037, win 501, options [nop,nop,TS val 3770219025 ecr 827868790], length 260
17:10:18.195993 IP 68.183.205.32.ssh > cpe00fc8d483dd3-cm00fc8d483dd0.cpe.net.cable.rogers.com.54786: Flags [P.], seq 15312172:15312432, ack 9037, win 501, options [nop,nop,TS val 3770219025 ecr 827868790], length 260
17:10:18.196058 IP 68.183.205.32.ssh > cpe00fc8d483dd3-cm00fc8d483dd0.cpe.net.cable.rogers.com.54786: Flags [P.], seq 15312432:15312692, ack 9037, win 501, options [nop,nop,TS val 3770219025 ecr 827868790], length 260
17:10:18.196122 IP 68.183.205.32.ssh > cpe00fc8d483dd3-cm00fc8d483dd0.cpe.net.cable.rogers.com.54786: Flags [P.], seq 15312692:15312952, ack 9037, win 501, options [nop,nop,TS val 3770219025 ecr 827868790], length 260
17:10:18.196186 IP 68.183.205.32.ssh > cpe00fc8d483dd3-cm00fc8d483dd0.cpe.net.cable.rogers.com.54786: Flags [P.], seq 15312952:15313212, ack 9037, win 501, options [nop,nop,TS val 3770219025 ecr 827868790], length 260
17:10:18.196252 IP 68.183.205.32.ssh > cpe00fc8d483dd3-cm00fc8d483dd0.cpe.net.cable.rogers.com.54786: Flags [P.], seq 15313212:15313472, ack 9037, win 501, options [nop,nop,TS val 3770219025 ecr 827868790], length 260
17:10:18.196345 IP 68.183.205.32.ssh > cpe00fc8d483dd3-cm00fc8d483dd0.cpe.net.cable.rogers.com.54786: Flags [P.], seq 15313472:15313732, ack 9037, win 501, options [nop,nop,TS val 3770219025 ecr 827868790], length 260
17:10:18.196408 IP 68.183.205.32.ssh > cpe00fc8d483dd3-cm00fc8d483dd0.cpe.net.cable.rogers.com.54786: Flags [P.], seq 15313732:15313992, ack 9037, win 501, options [nop,nop,TS val 3770219025 ecr 827868790], length 260
17:10:18.196472 IP 68.183.205.32.ssh > cpe00fc8d483dd3-cm00fc8d483dd0.cpe.net.cable.rogers.com.54786: Flags [P.], seq 15313992:15314252, ack 9037, win 501, options [nop,nop,TS val 3770219025 ecr 827868790], length 260
17:10:18.196538 IP 68.183.205.32.ssh > cpe00fc8d483dd3-cm00fc8d483dd0.cpe.net.cable.rogers.com.54786: Flags [P.], seq 15314252:15314512, ack 9037, win 501, options [nop,nop,TS val 3770219025 ecr 827868790], length 260
17:10:18.196721 IP 68.183.205.32.ssh > cpe00fc8d483dd3-cm00fc8d483dd0.cpe.net.cable.rogers.com.54786: Flags [P.], seq 15314512:15314772, ack 9037, win 501, options [nop,nop,TS val 3770219026 ecr 827868799], length 260
17:10:18.196792 IP 68.183.205.32.ssh > cpe00fc8d483dd3-cm00fc8d483dd0.cpe.net.cable.rogers.com.54786: Flags [P.], seq 15314772:15315032, ack 9037, win 501, options [nop,nop,TS val 3770219026 ecr 827868799], length 260
17:10:18.196854 IP 68.183.205.32.ssh > cpe00fc8d483dd3-cm00fc8d483dd0.cpe.net.cable.rogers.com.54786: Flags [P.], seq 15315032:15315292, ack 9037, win 501, options [nop,nop,TS val 3770219026 ecr 827868799], length 260
17:10:18.196917 IP 68.183.205.32.ssh > cpe00fc8d483dd3-cm00fc8d483dd0.cpe.net.cable.rogers.com.54786: Flags [P.], seq 15315292:15315552, ack 9037, win 501, options [nop,nop,TS val 3770219026 ecr 827868799], length 260
17:10:18.196981 IP 68.183.205.32.ssh > cpe00fc8d483dd3-cm00fc8d483dd0.cpe.net.cable.rogers.com.54786: Flags [P.], seq 15315552:15315812, ack 9037, win 501, options [nop,nop,TS val 3770219026 ecr 827868799], length 260
17:10:18.197047 IP 68.183.205.32.ssh > cpe00fc8d483dd3-cm00fc8d483dd0.cpe.net.cable.rogers.com.54786: Flags [P.], seq 15315812:15316072, ack 9037, win 501, options [nop,nop,TS val 3770219026 ecr 827868799], length 260
17:10:18.197111 IP 68.183.205.32.ssh > cpe00fc8d483dd3-cm00fc8d483dd0.cpe.net.cable.rogers.com.54786: Flags [P.], seq 15316072:15316332, ack 9037, win 501, options [nop,nop,TS val 3770219026 ecr 827868799], length 260
17:10:18.197174 IP 68.183.205.32.ssh > cpe00fc8d483dd3-cm00fc8d483dd0.cpe.net.cable.rogers.com.54786: Flags [P.], seq 15316332:15316592, ack 9037, win 501, options [nop,nop,TS val 3770219026 ecr 827868799], length 260
17:10:18.197237 IP 68.183.205.32.ssh > cpe00fc8d483dd3-cm00fc8d483dd0.cpe.net.cable.rogers.com.54786: Flags [P.], seq 15316592:15316852, ack 9037, win 501, options [nop,nop,TS val 3770219026 ecr 827868799], length 260
17:10:18.197304 IP 68.183.205.32.ssh > cpe00fc8d483dd3-cm00fc8d483dd0.cpe.net.cable.rogers.com.54786: Flags [P.], seq 15316852:15317112, ack 9037, win 501, options [nop,nop,TS val 3770219026 ecr 827868799], length 260
17:10:18.197368 IP 68.183.205.32.ssh > cpe00fc8d483dd3-cm00fc8d483dd0.cpe.net.cable.rogers.com.54786: Flags [P.], seq 15317112:15317372, ack 9037, win 501, options [nop,nop,TS val 3770219026 ecr 827868799], length 260
17:10:18.197431 IP 68.183.205.32.ssh > cpe00fc8d483dd3-cm00fc8d483dd0.cpe.net.cable.rogers.com.54786: Flags [P.], seq 15317372:15317632, ack 9037, win 501, options [nop,nop,TS val 3770219026 ecr 827868799], length 260
17:10:18.197493 IP 68.183.205.32.ssh > cpe00fc8d483dd3-cm00fc8d483dd0.cpe.net.cable.rogers.com.54786: Flags [P.], seq 15317632:15317892, ack 9037, win 501, options [nop,nop,TS val 3770219026 ecr 827868799], length 260
17:10:18.197554 IP 68.183.205.32.ssh > cpe00fc8d483dd3-cm00fc8d483dd0.cpe.net.cable.rogers.com.54786: Flags [P.], seq 15317892:15318152, ack 9037, win 501, options [nop,nop,TS val 3770219026 ecr 827868799], length 260
17:10:18.197618 IP 68.183.205.32.ssh > cpe00fc8d483dd3-cm00fc8d483dd0.cpe.net.cable.rogers.com.54786: Flags [P.], seq 15318152:15318412, ack 9037, win 501, options [nop,nop,TS val 3770219027 ecr 827868799], length 260
17:10:18.197686 IP 68.183.205.32.ssh > cpe00fc8d483dd3-cm00fc8d483dd0.cpe.net.cable.rogers.com.54786: Flags [P.], seq 15318412:15318672, ack 9037, win 501, options [nop,nop,TS val 3770219027 ecr 827868799], length 260
17:10:18.197753 IP 68.183.205.32.ssh > cpe00fc8d483dd3-cm00fc8d483dd0.cpe.net.cable.rogers.com.54786: Flags [P.], seq 15318672:15318932, ack 9037, win 501, options [nop,nop,TS val 3770219027 ecr 827868799], length 260
17:10:18.197814 IP 68.183.205.32.ssh > cpe00fc8d483dd3-cm00fc8d483dd0.cpe.net.cable.rogers.com.54786: Flags [P.], seq 15318932:15319192, ack 9037, win 501, options [nop,nop,TS val 3770219027 ecr 827868799], length 260
17:10:18.197883 IP 68.183.205.32.ssh > cpe00fc8d483dd3-cm00fc8d483dd0.cpe.net.cable.rogers.com.54786: Flags [P.], seq 15319192:15319452, ack 9037, win 501, options [nop,nop,TS val 3770219027 ecr 827868799], length 260
17:10:18.197946 IP 68.183.205.32.ssh > cpe00fc8d483dd3-cm00fc8d483dd0.cpe.net.cable.rogers.com.54786: Flags [P.], seq 15319452:15319712, ack 9037, win 501, options [nop,nop,TS val 3770219027 ecr 827868799], length 260
17:10:18.198013 IP 68.183.205.32.ssh > cpe00fc8d483dd3-cm00fc8d483dd0.cpe.net.cable.rogers.com.54786: Flags [P.], seq 15319712:15319972, ack 9037, win 501, options [nop,nop,TS val 3770219027 ecr 827868799], length 260
17:10:18.198074 IP 68.183.205.32.ssh > cpe00fc8d483dd3-cm00fc8d483dd0.cpe.net.cable.rogers.com.54786: Flags [P.], seq 15319972:15320232, ack 9037, win 501, options [nop,nop,TS val 3770219027 ecr 827868799], length 260
17:10:18.198140 IP 68.183.205.32.ssh > cpe00fc8d483dd3-cm00fc8d483dd0.cpe.net.cable.rogers.com.54786: Flags [P.], seq 15320232:15320492, ack 9037, win 501, options [nop,nop,TS val 3770219027 ecr 827868799], length 260
17:10:18.198202 IP 68.183.205.32.ssh > cpe00fc8d483dd3-cm00fc8d483dd0.cpe.net.cable.rogers.com.54786: Flags [P.], seq 15320492:15320752, ack 9037, win 501, options [nop,nop,TS val 3770219027 ecr 827868799], length 260
17:10:18.198269 IP 68.183.205.32.ssh > cpe00fc8d483dd3-cm00fc8d483dd0.cpe.net.cable.rogers.com.54786: Flags [P.], seq 15320752:15321012, ack 9037, win 501, options [nop,nop,TS val 3770219027 ecr 827868799], length 260
17:10:18.198332 IP 68.183.205.32.ssh > cpe00fc8d483dd3-cm00fc8d483dd0.cpe.net.cable.rogers.com.54786: Flags [P.], seq 15321012:15321272, ack 9037, win 501, options [nop,nop,TS val 3770219027 ecr 827868799], length 260
17:10:18.198397 IP 68.183.205.32.ssh > cpe00fc8d483dd3-cm00fc8d483dd0.cpe.net.cable.rogers.com.54786: Flags [P.], seq 15321272:15321532, ack 9037, win 501, options [nop,nop,TS val 3770219027 ecr 827868799], length 260
17:10:18.198459 IP 68.183.205.32.ssh > cpe00fc8d483dd3-cm00fc8d483dd0.cpe.net.cable.rogers.com.54786: Flags [P.], seq 15321532:15321792, ack 9037, win 501, options [nop,nop,TS val 3770219027 ecr 827868799], length 260
17:10:18.198534 IP 68.183.205.32.ssh > cpe00fc8d483dd3-cm00fc8d483dd0.cpe.net.cable.rogers.com.54786: Flags [P.], seq 15321792:15322052, ack 9037, win 501, options [nop,nop,TS val 3770219027 ecr 827868799], length 260
17:10:18.198612 IP 68.183.205.32.ssh > cpe00fc8d483dd3-cm00fc8d483dd0.cpe.net.cable.rogers.com.54786: Flags [P.], seq 15322052:15322312, ack 9037, win 501, options [nop,nop,TS val 3770219028 ecr 827868799], length 260
17:10:18.198677 IP 68.183.205.32.ssh > cpe00fc8d483dd3-cm00fc8d483dd0.cpe.net.cable.rogers.com.54786: Flags [P.], seq 15322312:15322572, ack 9037, win 501, options [nop,nop,TS val 3770219028 ecr 827868799], length 260
17:10:18.198746 IP 68.183.205.32.ssh > cpe00fc8d483dd3-cm00fc8d483dd0.cpe.net.cable.rogers.com.54786: Flags [P.], seq 15322572:15322832, ack 9037, win 501, options [nop,nop,TS val 3770219028 ecr 827868799], length 260
17:10:18.198809 IP 68.183.205.32.ssh > cpe00fc8d483dd3-cm00fc8d483dd0.cpe.net.cable.rogers.com.54786: Flags [P.], seq 15322832:15323092, ack 9037, win 501, options [nop,nop,TS val 3770219028 ecr 827868799], length 260
17:10:18.198874 IP 68.183.205.32.ssh > cpe00fc8d483dd3-cm00fc8d483dd0.cpe.net.cable.rogers.com.54786: Flags [P.], seq 15323092:15323352, ack 9037, win 501, options [nop,nop,TS val 3770219028 ecr 827868799], length 260
17:10:18.198935 IP 68.183.205.32.ssh > cpe00fc8d483dd3-cm00fc8d483dd0.cpe.net.cable.rogers.com.54786: Flags [P.], seq 15323352:15323612, ack 9037, win 501, options [nop,nop,TS val 3770219028 ecr 827868799], length 260
17:10:18.198999 IP 68.183.205.32.ssh > cpe00fc8d483dd3-cm00fc8d483dd0.cpe.net.cable.rogers.com.54786: Flags [P.], seq 15323612:15323872, ack 9037, win 501, options [nop,nop,TS val 3770219028 ecr 827868799], length 260
17:10:18.199068 IP 68.183.205.32.ssh > cpe00fc8d483dd3-cm00fc8d483dd0.cpe.net.cable.rogers.com.54786: Flags [P.], seq 15323872:15324132, ack 9037, win 501, options [nop,nop,TS val 3770219028 ecr 827868799], length 260
17:10:18.199130 IP 68.183.205.32.ssh > cpe00fc8d483dd3-cm00fc8d483dd0.cpe.net.cable.rogers.com.54786: Flags [P.], seq 15324132:15324392, ack 9037, win 501, options [nop,nop,TS val 3770219028 ecr 827868799], length 260
17:10:18.199197 IP 68.183.205.32.ssh > cpe00fc8d483dd3-cm00fc8d483dd0.cpe.net.cable.rogers.com.54786: Flags [P.], seq 15324392:15324652, ack 9037, win 501, options [nop,nop,TS val 3770219028 ecr 827868799], length 260
17:10:18.199259 IP 68.183.205.32.ssh > cpe00fc8d483dd3-cm00fc8d483dd0.cpe.net.cable.rogers.com.54786: Flags [P.], seq 15324652:15324912, ack 9037, win 501, options [nop,nop,TS val 3770219028 ecr 827868799], length 260
17:10:18.199326 IP 68.183.205.32.ssh > cpe00fc8d483dd3-cm00fc8d483dd0.cpe.net.cable.rogers.com.54786: Flags [P.], seq 15324912:15325172, ack 9037, win 501, options [nop,nop,TS val 3770219028 ecr 827868799], length 260
17:10:18.199386 IP 68.183.205.32.ssh > cpe00fc8d483dd3-cm00fc8d483dd0.cpe.net.cable.rogers.com.54786: Flags [P.], seq 15325172:15325432, ack 9037, win 501, options [nop,nop,TS val 3770219028 ecr 827868799], length 260
17:10:18.199454 IP 68.183.205.32.ssh > cpe00fc8d483dd3-cm00fc8d483dd0.cpe.net.cable.rogers.com.54786: Flags [P.], seq 15325432:15325692, ack 9037, win 501, options [nop,nop,TS val 3770219028 ecr 827868799], length 260
17:10:18.199518 IP 68.183.205.32.ssh > cpe00fc8d483dd3-cm00fc8d483dd0.cpe.net.cable.rogers.com.54786: Flags [P.], seq 15325692:15325952, ack 9037, win 501, options [nop,nop,TS val 3770219028 ecr 827868799], length 260
17:10:18.199586 IP 68.183.205.32.ssh > cpe00fc8d483dd3-cm00fc8d483dd0.cpe.net.cable.rogers.com.54786: Flags [P.], seq 15325952:15326212, ack 9037, win 501, options [nop,nop,TS val 3770219029 ecr 827868799], length 260
17:10:18.199650 IP 68.183.205.32.ssh > cpe00fc8d483dd3-cm00fc8d483dd0.cpe.net.cable.rogers.com.54786: Flags [P.], seq 15326212:15326472, ack 9037, win 501, options [nop,nop,TS val 3770219029 ecr 827868799], length 260
17:10:18.199753 IP 68.183.205.32.ssh > cpe00fc8d483dd3-cm00fc8d483dd0.cpe.net.cable.rogers.com.54786: Flags [P.], seq 15326472:15326732, ack 9037, win 501, options [nop,nop,TS val 3770219029 ecr 827868799], length 260
17:10:18.199816 IP 68.183.205.32.ssh > cpe00fc8d483dd3-cm00fc8d483dd0.cpe.net.cable.rogers.com.54786: Flags [P.], seq 15326732:15326992, ack 9037, win 501, options [nop,nop,TS val 3770219029 ecr 827868799], length 260
17:10:18.199879 IP 68.183.205.32.ssh > cpe00fc8d483dd3-cm00fc8d483dd0.cpe.net.cable.rogers.com.54786: Flags [P.], seq 15326992:15327252, ack 9037, win 501, options [nop,nop,TS val 3770219029 ecr 827868799], length 260
17:10:18.199944 IP 68.183.205.32.ssh > cpe00fc8d483dd3-cm00fc8d483dd0.cpe.net.cable.rogers.com.54786: Flags [P.], seq 15327252:15327512, ack 9037, win 501, options [nop,nop,TS val 3770219029 ecr 827868799], length 260
17:10:18.200007 IP 68.183.205.32.ssh > cpe00fc8d483dd3-cm00fc8d483dd0.cpe.net.cable.rogers.com.54786: Flags [P.], seq 15327512:15327772, ack 9037, win 501, options [nop,nop,TS val 3770219029 ecr 827868799], length 260
17:10:18.200068 IP 68.183.205.32.ssh > cpe00fc8d483dd3-cm00fc8d483dd0.cpe.net.cable.rogers.com.54786: Flags [P.], seq 15327772:15328032, ack 9037, win 501, options [nop,nop,TS val 3770219029 ecr 827868799], length 260
17:10:18.200138 IP 68.183.205.32.ssh > cpe00fc8d483dd3-cm00fc8d483dd0.cpe.net.cable.rogers.com.54786: Flags [P.], seq 15328032:15328292, ack 9037, win 501, options [nop,nop,TS val 3770219029 ecr 827868799], length 260
17:10:18.200200 IP 68.183.205.32.ssh > cpe00fc8d483dd3-cm00fc8d483dd0.cpe.net.cable.rogers.com.54786: Flags [P.], seq 15328292:15328552, ack 9037, win 501, options [nop,nop,TS val 3770219029 ecr 827868799], length 260
17:10:18.200265 IP 68.183.205.32.ssh > cpe00fc8d483dd3-cm00fc8d483dd0.cpe.net.cable.rogers.com.54786: Flags [P.], seq 15328552:15328812, ack 9037, win 501, options [nop,nop,TS val 3770219029 ecr 827868799], length 260
17:10:18.200352 IP 68.183.205.32.ssh > cpe00fc8d483dd3-cm00fc8d483dd0.cpe.net.cable.rogers.com.54786: Flags [P.], seq 15328812:15329072, ack 9037, win 501, options [nop,nop,TS val 3770219029 ecr 827868799], length 260
17:10:18.200416 IP 68.183.205.32.ssh > cpe00fc8d483dd3-cm00fc8d483dd0.cpe.net.cable.rogers.com.54786: Flags [P.], seq 15329072:15329332, ack 9037, win 501, options [nop,nop,TS val 3770219029 ecr 827868799], length 260
17:10:18.200479 IP 68.183.205.32.ssh > cpe00fc8d483dd3-cm00fc8d483dd0.cpe.net.cable.rogers.com.54786: Flags [P.], seq 15329332:15329592, ack 9037, win 501, options [nop,nop,TS val 3770219029 ecr 827868799], length 260
17:10:18.200548 IP 68.183.205.32.ssh > cpe00fc8d483dd3-cm00fc8d483dd0.cpe.net.cable.rogers.com.54786: Flags [P.], seq 15329592:15329852, ack 9037, win 501, options [nop,nop,TS val 3770219029 ecr 827868799], length 260
17:10:18.200617 IP 68.183.205.32.ssh > cpe00fc8d483dd3-cm00fc8d483dd0.cpe.net.cable.rogers.com.54786: Flags [P.], seq 15329852:15330112, ack 9037, win 501, options [nop,nop,TS val 3770219030 ecr 827868799], length 260
17:10:18.200680 IP 68.183.205.32.ssh > cpe00fc8d483dd3-cm00fc8d483dd0.cpe.net.cable.rogers.com.54786: Flags [P.], seq 15330112:15330372, ack 9037, win 501, options [nop,nop,TS val 3770219030 ecr 827868799], length 260
17:10:18.200746 IP 68.183.205.32.ssh > cpe00fc8d483dd3-cm00fc8d483dd0.cpe.net.cable.rogers.com.54786: Flags [P.], seq 15330372:15330632, ack 9037, win 501, options [nop,nop,TS val 3770219030 ecr 827868799], length 260
17:10:18.200807 IP 68.183.205.32.ssh > cpe00fc8d483dd3-cm00fc8d483dd0.cpe.net.cable.rogers.com.54786: Flags [P.], seq 15330632:15330892, ack 9037, win 501, options [nop,nop,TS val 3770219030 ecr 827868799], length 260
17:10:18.200936 IP 68.183.205.32.ssh > cpe00fc8d483dd3-cm00fc8d483dd0.cpe.net.cable.rogers.com.54786: Flags [P.], seq 15330892:15331152, ack 9037, win 501, options [nop,nop,TS val 3770219030 ecr 827868799], length 260
17:10:18.201006 IP 68.183.205.32.ssh > cpe00fc8d483dd3-cm00fc8d483dd0.cpe.net.cable.rogers.com.54786: Flags [P.], seq 15331152:15331412, ack 9037, win 501, options [nop,nop,TS val 3770219030 ecr 827868799], length 260
17:10:18.201070 IP 68.183.205.32.ssh > cpe00fc8d483dd3-cm00fc8d483dd0.cpe.net.cable.rogers.com.54786: Flags [P.], seq 15331412:15331672, ack 9037, win 501, options [nop,nop,TS val 3770219030 ecr 827868799], length 260
17:10:18.201138 IP 68.183.205.32.ssh > cpe00fc8d483dd3-cm00fc8d483dd0.cpe.net.cable.rogers.com.54786: Flags [P.], seq 15331672:15331932, ack 9037, win 501, options [nop,nop,TS val 3770219030 ecr 827868799], length 260
17:10:18.201205 IP 68.183.205.32.ssh > cpe00fc8d483dd3-cm00fc8d483dd0.cpe.net.cable.rogers.com.54786: Flags [P.], seq 15331932:15332192, ack 9037, win 501, options [nop,nop,TS val 3770219030 ecr 827868799], length 260
17:10:18.201267 IP 68.183.205.32.ssh > cpe00fc8d483dd3-cm00fc8d483dd0.cpe.net.cable.rogers.com.54786: Flags [P.], seq 15332192:15332452, ack 9037, win 501, options [nop,nop,TS val 3770219030 ecr 827868799], length 260
17:10:18.201337 IP 68.183.205.32.ssh > cpe00fc8d483dd3-cm00fc8d483dd0.cpe.net.cable.rogers.com.54786: Flags [P.], seq 15332452:15332712, ack 9037, win 501, options [nop,nop,TS val 3770219030 ecr 827868799], length 260
17:10:18.201410 IP 68.183.205.32.ssh > cpe00fc8d483dd3-cm00fc8d483dd0.cpe.net.cable.rogers.com.54786: Flags [P.], seq 15332712:15332972, ack 9037, win 501, options [nop,nop,TS val 3770219030 ecr 827868799], length 260
17:10:18.201476 IP 68.183.205.32.ssh > cpe00fc8d483dd3-cm00fc8d483dd0.cpe.net.cable.rogers.com.54786: Flags [P.], seq 15332972:15333232, ack 9037, win 501, options [nop,nop,TS val 3770219030 ecr 827868799], length 260
17:10:18.201536 IP 68.183.205.32.ssh > cpe00fc8d483dd3-cm00fc8d483dd0.cpe.net.cable.rogers.com.54786: Flags [P.], seq 15333232:15333492, ack 9037, win 501, options [nop,nop,TS val 3770219030 ecr 827868799], length 260
17:10:18.201602 IP 68.183.205.32.ssh > cpe00fc8d483dd3-cm00fc8d483dd0.cpe.net.cable.rogers.com.54786: Flags [P.], seq 15333492:15333752, ack 9037, win 501, options [nop,nop,TS val 3770219031 ecr 827868799], length 260
17:10:18.201677 IP 68.183.205.32.ssh > cpe00fc8d483dd3-cm00fc8d483dd0.cpe.net.cable.rogers.com.54786: Flags [P.], seq 15333752:15334012, ack 9037, win 501, options [nop,nop,TS val 3770219031 ecr 827868799], length 260
17:10:18.201745 IP 68.183.205.32.ssh > cpe00fc8d483dd3-cm00fc8d483dd0.cpe.net.cable.rogers.com.54786: Flags [P.], seq 15334012:15334272, ack 9037, win 501, options [nop,nop,TS val 3770219031 ecr 827868799], length 260
17:10:18.201817 IP 68.183.205.32.ssh > cpe00fc8d483dd3-cm00fc8d483dd0.cpe.net.cable.rogers.com.54786: Flags [P.], seq 15334272:15334532, ack 9037, win 501, options [nop,nop,TS val 3770219031 ecr 827868799], length 260
17:10:18.201886 IP 68.183.205.32.ssh > cpe00fc8d483dd3-cm00fc8d483dd0.cpe.net.cable.rogers.com.54786: Flags [P.], seq 15334532:15334792, ack 9037, win 501, options [nop,nop,TS val 3770219031 ecr 827868799], length 260
17:10:18.201954 IP 68.183.205.32.ssh > cpe00fc8d483dd3-cm00fc8d483dd0.cpe.net.cable.rogers.com.54786: Flags [P.], seq 15334792:15335052, ack 9037, win 501, options [nop,nop,TS val 3770219031 ecr 827868799], length 260
17:10:18.202027 IP 68.183.205.32.ssh > cpe00fc8d483dd3-cm00fc8d483dd0.cpe.net.cable.rogers.com.54786: Flags [P.], seq 15335052:15335312, ack 9037, win 501, options [nop,nop,TS val 3770219031 ecr 827868799], length 260
17:10:18.202093 IP 68.183.205.32.ssh > cpe00fc8d483dd3-cm00fc8d483dd0.cpe.net.cable.rogers.com.54786: Flags [P.], seq 15335312:15335572, ack 9037, win 501, options [nop,nop,TS val 3770219031 ecr 827868799], length 260
17:10:18.202163 IP 68.183.205.32.ssh > cpe00fc8d483dd3-cm00fc8d483dd0.cpe.net.cable.rogers.com.54786: Flags [P.], seq 15335572:15335832, ack 9037, win 501, options [nop,nop,TS val 3770219031 ecr 827868799], length 260
17:10:18.202235 IP 68.183.205.32.ssh > cpe00fc8d483dd3-cm00fc8d483dd0.cpe.net.cable.rogers.com.54786: Flags [P.], seq 15335832:15336092, ack 9037, win 501, options [nop,nop,TS val 3770219031 ecr 827868799], length 260
17:10:18.202299 IP 68.183.205.32.ssh > cpe00fc8d483dd3-cm00fc8d483dd0.cpe.net.cable.rogers.com.54786: Flags [P.], seq 15336092:15336352, ack 9037, win 501, options [nop,nop,TS val 3770219031 ecr 827868799], length 260
17:10:18.202364 IP 68.183.205.32.ssh > cpe00fc8d483dd3-cm00fc8d483dd0.cpe.net.cable.rogers.com.54786: Flags [P.], seq 15336352:15336612, ack 9037, win 501, options [nop,nop,TS val 3770219031 ecr 827868799], length 260
17:10:18.202427 IP 68.183.205.32.ssh > cpe00fc8d483dd3-cm00fc8d483dd0.cpe.net.cable.rogers.com.54786: Flags [P.], seq 15336612:15336872, ack 9037, win 501, options [nop,nop,TS val 3770219031 ecr 827868799], length 260
17:10:18.202494 IP 68.183.205.32.ssh > cpe00fc8d483dd3-cm00fc8d483dd0.cpe.net.cable.rogers.com.54786: Flags [P.], seq 15336872:15337132, ack 9037, win 501, options [nop,nop,TS val 3770219031 ecr 827868799], length 260
17:10:18.202603 IP 68.183.205.32.ssh > cpe00fc8d483dd3-cm00fc8d483dd0.cpe.net.cable.rogers.com.54786: Flags [P.], seq 15337132:15337392, ack 9037, win 501, options [nop,nop,TS val 3770219032 ecr 827868799], length 260
17:10:18.202666 IP 68.183.205.32.ssh > cpe00fc8d483dd3-cm00fc8d483dd0.cpe.net.cable.rogers.com.54786: Flags [P.], seq 15337392:15337652, ack 9037, win 501, options [nop,nop,TS val 3770219032 ecr 827868799], length 260
17:10:18.202726 IP 68.183.205.32.ssh > cpe00fc8d483dd3-cm00fc8d483dd0.cpe.net.cable.rogers.com.54786: Flags [P.], seq 15337652:15337912, ack 9037, win 501, options [nop,nop,TS val 3770219032 ecr 827868799], length 260
17:10:18.202787 IP 68.183.205.32.ssh > cpe00fc8d483dd3-cm00fc8d483dd0.cpe.net.cable.rogers.com.54786: Flags [P.], seq 15337912:15338172, ack 9037, win 501, options [nop,nop,TS val 3770219032 ecr 827868799], length 260
17:10:18.202852 IP 68.183.205.32.ssh > cpe00fc8d483dd3-cm00fc8d483dd0.cpe.net.cable.rogers.com.54786: Flags [P.], seq 15338172:15338432, ack 9037, win 501, options [nop,nop,TS val 3770219032 ecr 827868799], length 260
17:10:18.202916 IP 68.183.205.32.ssh > cpe00fc8d483dd3-cm00fc8d483dd0.cpe.net.cable.rogers.com.54786: Flags [P.], seq 15338432:15338692, ack 9037, win 501, options [nop,nop,TS val 3770219032 ecr 827868799], length 260
17:10:18.202984 IP 68.183.205.32.ssh > cpe00fc8d483dd3-cm00fc8d483dd0.cpe.net.cable.rogers.com.54786: Flags [P.], seq 15338692:15338952, ack 9037, win 501, options [nop,nop,TS val 3770219032 ecr 827868799], length 260
17:10:18.203049 IP 68.183.205.32.ssh > cpe00fc8d483dd3-cm00fc8d483dd0.cpe.net.cable.rogers.com.54786: Flags [P.], seq 15338952:15339212, ack 9037, win 501, options [nop,nop,TS val 3770219032 ecr 827868799], length 260
17:10:18.203114 IP 68.183.205.32.ssh > cpe00fc8d483dd3-cm00fc8d483dd0.cpe.net.cable.rogers.com.54786: Flags [P.], seq 15339212:15339472, ack 9037, win 501, options [nop,nop,TS val 3770219032 ecr 827868799], length 260
17:10:18.203180 IP 68.183.205.32.ssh > cpe00fc8d483dd3-cm00fc8d483dd0.cpe.net.cable.rogers.com.54786: Flags [P.], seq 15339472:15339732, ack 9037, win 501, options [nop,nop,TS val 3770219032 ecr 827868799], length 260
17:10:18.203255 IP 68.183.205.32.ssh > cpe00fc8d483dd3-cm00fc8d483dd0.cpe.net.cable.rogers.com.54786: Flags [P.], seq 15339732:15339992, ack 9037, win 501, options [nop,nop,TS val 3770219032 ecr 827868799], length 260
17:10:18.203322 IP 68.183.205.32.ssh > cpe00fc8d483dd3-cm00fc8d483dd0.cpe.net.cable.rogers.com.54786: Flags [P.], seq 15339992:15340252, ack 9037, win 501, options [nop,nop,TS val 3770219032 ecr 827868799], length 260
17:10:18.203390 IP 68.183.205.32.ssh > cpe00fc8d483dd3-cm00fc8d483dd0.cpe.net.cable.rogers.com.54786: Flags [P.], seq 15340252:15340512, ack 9037, win 501, options [nop,nop,TS val 3770219032 ecr 827868799], length 260
17:10:18.203461 IP 68.183.205.32.ssh > cpe00fc8d483dd3-cm00fc8d483dd0.cpe.net.cable.rogers.com.54786: Flags [P.], seq 15340512:15340772, ack 9037, win 501, options [nop,nop,TS val 3770219032 ecr 827868799], length 260
17:10:18.203527 IP 68.183.205.32.ssh > cpe00fc8d483dd3-cm00fc8d483dd0.cpe.net.cable.rogers.com.54786: Flags [P.], seq 15340772:15341032, ack 9037, win 501, options [nop,nop,TS val 3770219032 ecr 827868799], length 260
17:10:18.203595 IP 68.183.205.32.ssh > cpe00fc8d483dd3-cm00fc8d483dd0.cpe.net.cable.rogers.com.54786: Flags [P.], seq 15341032:15341292, ack 9037, win 501, options [nop,nop,TS val 3770219033 ecr 827868799], length 260
17:10:18.203662 IP 68.183.205.32.ssh > cpe00fc8d483dd3-cm00fc8d483dd0.cpe.net.cable.rogers.com.54786: Flags [P.], seq 15341292:15341552, ack 9037, win 501, options [nop,nop,TS val 3770219033 ecr 827868799], length 260
17:10:18.203741 IP 68.183.205.32.ssh > cpe00fc8d483dd3-cm00fc8d483dd0.cpe.net.cable.rogers.com.54786: Flags [P.], seq 15341552:15341812, ack 9037, win 501, options [nop,nop,TS val 3770219033 ecr 827868799], length 260
17:10:18.203806 IP 68.183.205.32.ssh > cpe00fc8d483dd3-cm00fc8d483dd0.cpe.net.cable.rogers.com.54786: Flags [P.], seq 15341812:15342072, ack 9037, win 501, options [nop,nop,TS val 3770219033 ecr 827868799], length 260
17:10:18.203871 IP 68.183.205.32.ssh > cpe00fc8d483dd3-cm00fc8d483dd0.cpe.net.cable.rogers.com.54786: Flags [P.], seq 15342072:15342332, ack 9037, win 501, options [nop,nop,TS val 3770219033 ecr 827868799], length 260
17:10:18.203941 IP 68.183.205.32.ssh > cpe00fc8d483dd3-cm00fc8d483dd0.cpe.net.cable.rogers.com.54786: Flags [P.], seq 15342332:15342592, ack 9037, win 501, options [nop,nop,TS val 3770219033 ecr 827868799], length 260
17:10:18.204270 IP 68.183.205.32.ssh > cpe00fc8d483dd3-cm00fc8d483dd0.cpe.net.cable.rogers.com.54786: Flags [.], ack 9109, win 501, options [nop,nop,TS val 3770219033 ecr 827868799], length 0
^C
60228 packets captured
60228 packets received by filter
0 packets dropped by kernel