tcpdump -c 5 -i eth0
tcpdump: verbose output suppressed, use -v or -vv for full protocol decode
listening on eth0, link-type EN10MB (Ethernet), capture size 262144 bytes
16:59:18.342903 IP 68.183.205.32.ssh > cpe00fc8d483dd3-cm00fc8d483dd0.cpe.net.cable.rogers.com.54786: Flags [P.], seq 2039001641:2039001749, ack 718293911, win 501, options [nop,nop,TS val 3769559172 ecr 827221816], length 108
16:59:18.342974 IP 68.183.205.32.ssh > cpe00fc8d483dd3-cm00fc8d483dd0.cpe.net.cable.rogers.com.54786: Flags [P.], seq 108:144, ack 1, win 501, options [nop,nop,TS val 3769559172 ecr 827221816], length 36
16:59:18.343018 IP 68.183.205.32.ssh > cpe00fc8d483dd3-cm00fc8d483dd0.cpe.net.cable.rogers.com.54786: Flags [P.], seq 144:252, ack 1, win 501, options [nop,nop,TS val 3769559172 ecr 827221816], length 108
16:59:18.343067 IP 68.183.205.32.ssh > cpe00fc8d483dd3-cm00fc8d483dd0.cpe.net.cable.rogers.com.54786: Flags [P.], seq 252:288, ack 1, win 501, options [nop,nop,TS val 3769559172 ecr 827221816], length 36
16:59:18.343491 IP 68.183.205.32.46730 > dns.google.domain: 58133+ PTR? 4.36.230.99.in-addr.arpa. (42)
5 packets captured
22 packets received by filter
0 packets dropped by kernel