tcpdump -i eth0 port 22
17:08:51.845273 IP 68.183.205.32.ssh > cpe00fc8d483dd3-cm00fc8d483dd0.cpe.net.cable.rogers.com.54786: Flags [P.], seq 7951612:7951864, ack 4753, win 501, options [nop,nop,TS val 3770132674 ecr 827784051], length 252
17:08:51.845316 IP 68.183.205.32.ssh > cpe00fc8d483dd3-cm00fc8d483dd0.cpe.net.cable.rogers.com.54786: Flags [P.], seq 7951864:7952116, ack 4753, win 501, options [nop,nop,TS val 3770132674 ecr 827784051], length 252
17:08:51.845359 IP 68.183.205.32.ssh > cpe00fc8d483dd3-cm00fc8d483dd0.cpe.net.cable.rogers.com.54786: Flags [P.], seq 7952116:7952368, ack 4753, win 501, options [nop,nop,TS val 3770132674 ecr 827784051], length 252
17:08:51.845429 IP 68.183.205.32.ssh > cpe00fc8d483dd3-cm00fc8d483dd0.cpe.net.cable.rogers.com.54786: Flags [P.], seq 7952368:7952620, ack 4753, win 501, options [nop,nop,TS val 3770132674 ecr 827784051], length 252
17:08:51.845501 IP 68.183.205.32.ssh > cpe00fc8d483dd3-cm00fc8d483dd0.cpe.net.cable.rogers.com.54786: Flags [P.], seq 7952620:7952872, ack 4753, win 501, options [nop,nop,TS val 3770132674 ecr 827784051], length 252
17:08:51.845580 IP 68.183.205.32.ssh > cpe00fc8d483dd3-cm00fc8d483dd0.cpe.net.cable.rogers.com.54786: Flags [P.], seq 7952872:7953124, ack 4753, win 501, options [nop,nop,TS val 3770132675 ecr 827784051], length 252
17:08:51.845647 IP 68.183.205.32.ssh > cpe00fc8d483dd3-cm00fc8d483dd0.cpe.net.cable.rogers.com.54786: Flags [P.], seq 7953124:7953376, ack 4753, win 501, options [nop,nop,TS val 3770132675 ecr 827784051], length 252
17:08:51.845697 IP 68.183.205.32.ssh > cpe00fc8d483dd3-cm00fc8d483dd0.cpe.net.cable.rogers.com.54786: Flags [P.], seq 7953376:7953628, ack 4753, win 501, options [nop,nop,TS val 3770132675 ecr 827784051], length 252
17:08:51.845744 IP 68.183.205.32.ssh > cpe00fc8d483dd3-cm00fc8d483dd0.cpe.net.cable.rogers.com.54786: Flags [P.], seq 7953628:7953880, ack 4753, win 501, options [nop,nop,TS val 3770132675 ecr 827784051], length 252
17:08:51.845789 IP 68.183.205.32.ssh > cpe00fc8d483dd3-cm00fc8d483dd0.cpe.net.cable.rogers.com.54786: Flags [P.], seq 7953880:7954132, ack 4753, win 501, options [nop,nop,TS val 3770132675 ecr 827784051], length 252
17:08:51.845835 IP 68.183.205.32.ssh > cpe00fc8d483dd3-cm00fc8d483dd0.cpe.net.cable.rogers.com.54786: Flags [P.], seq 7954132:7954384, ack 4753, win 501, options [nop,nop,TS val 3770132675 ecr 827784051], length 252
17:08:51.845879 IP 68.183.205.32.ssh > cpe00fc8d483dd3-cm00fc8d483dd0.cpe.net.cable.rogers.com.54786: Flags [P.], seq 7954384:7954636, ack 4753, win 501, options [nop,nop,TS val 3770132675 ecr 827784051], length 252
17:08:51.845925 IP 68.183.205.32.ssh > cpe00fc8d483dd3-cm00fc8d483dd0.cpe.net.cable.rogers.com.54786: Flags [P.], seq 7954636:7954888, ack 4753, win 501, options [nop,nop,TS val 3770132675 ecr 827784051], length 252
17:08:51.845968 IP 68.183.205.32.ssh > cpe00fc8d483dd3-cm00fc8d483dd0.cpe.net.cable.rogers.com.54786: Flags [P.], seq 7954888:7955140, ack 4753, win 501, options [nop,nop,TS val 3770132675 ecr 827784051], length 252
17:08:51.846052 IP 68.183.205.32.ssh > cpe00fc8d483dd3-cm00fc8d483dd0.cpe.net.cable.rogers.com.54786: Flags [P.], seq 7955140:7955392, ack 4753, win 501, options [nop,nop,TS val 3770132675 ecr 827784051], length 252
17:08:51.846098 IP 68.183.205.32.ssh > cpe00fc8d483dd3-cm00fc8d483dd0.cpe.net.cable.rogers.com.54786: Flags [P.], seq 7955392:7955644, ack 4753, win 501, options [nop,nop,TS val 3770132675 ecr 827784051], length 252
17:08:51.846154 IP 68.183.205.32.ssh > cpe00fc8d483dd3-cm00fc8d483dd0.cpe.net.cable.rogers.com.54786: Flags [P.], seq 7955644:7955896, ack 4753, win 501, options [nop,nop,TS val 3770132675 ecr 827784051], length 252
17:08:51.846206 IP 68.183.205.32.ssh > cpe00fc8d483dd3-cm00fc8d483dd0.cpe.net.cable.rogers.com.54786: Flags [P.], seq 7955896:7956148, ack 4753, win 501, options [nop,nop,TS val 3770132675 ecr 827784051], length 252
17:08:51.846250 IP 68.183.205.32.ssh > cpe00fc8d483dd3-cm00fc8d483dd0.cpe.net.cable.rogers.com.54786: Flags [P.], seq 7956148:7956400, ack 4753, win 501, options [nop,nop,TS val 3770132675 ecr 827784051], length 252
17:08:51.846299 IP 68.183.205.32.ssh > cpe00fc8d483dd3-cm00fc8d483dd0.cpe.net.cable.rogers.com.54786: Flags [P.], seq 7956400:7956652, ack 4753, win 501, options [nop,nop,TS val 3770132675 ecr 827784051], length 252
17:08:51.846346 IP 68.183.205.32.ssh > cpe00fc8d483dd3-cm00fc8d483dd0.cpe.net.cable.rogers.com.54786: Flags [P.], seq 7956652:7956904, ack 4753, win 501, options [nop,nop,TS val 3770132675 ecr 827784051], length 252
17:08:51.846389 IP 68.183.205.32.ssh > cpe00fc8d483dd3-cm00fc8d483dd0.cpe.net.cable.rogers.com.54786: Flags [P.], seq 7956904:7957156, ack 4753, win 501, options [nop,nop,TS val 3770132675 ecr 827784051], length 252
17:08:51.846435 IP 68.183.205.32.ssh > cpe00fc8d483dd3-cm00fc8d483dd0.cpe.net.cable.rogers.com.54786: Flags [P.], seq 7957156:7957408, ack 4753, win 501, options [nop,nop,TS val 3770132675 ecr 827784051], length 252
17:08:51.846559 IP 68.183.205.32.ssh > cpe00fc8d483dd3-cm00fc8d483dd0.cpe.net.cable.rogers.com.54786: Flags [P.], seq 7957408:7957660, ack 4753, win 501, options [nop,nop,TS val 3770132675 ecr 827784051], length 252
17:08:51.846631 IP 68.183.205.32.ssh > cpe00fc8d483dd3-cm00fc8d483dd0.cpe.net.cable.rogers.com.54786: Flags [P.], seq 7957660:7957912, ack 4753, win 501, options [nop,nop,TS val 3770132676 ecr 827784051], length 252
17:08:51.846699 IP 68.183.205.32.ssh > cpe00fc8d483dd3-cm00fc8d483dd0.cpe.net.cable.rogers.com.54786: Flags [P.], seq 7957912:7958164, ack 4753, win 501, options [nop,nop,TS val 3770132676 ecr 827784051], length 252
17:08:51.846776 IP 68.183.205.32.ssh > cpe00fc8d483dd3-cm00fc8d483dd0.cpe.net.cable.rogers.com.54786: Flags [P.], seq 7958164:7958416, ack 4753, win 501, options [nop,nop,TS val 3770132676 ecr 827784051], length 252
17:08:51.846844 IP 68.183.205.32.ssh > cpe00fc8d483dd3-cm00fc8d483dd0.cpe.net.cable.rogers.com.54786: Flags [P.], seq 7958416:7958668, ack 4753, win 501, options [nop,nop,TS val 3770132676 ecr 827784051], length 252
17:08:51.846891 IP 68.183.205.32.ssh > cpe00fc8d483dd3-cm00fc8d483dd0.cpe.net.cable.rogers.com.54786: Flags [P.], seq 7958668:7958920, ack 4753, win 501, options [nop,nop,TS val 3770132676 ecr 827784051], length 252
17:08:51.846942 IP 68.183.205.32.ssh > cpe00fc8d483dd3-cm00fc8d483dd0.cpe.net.cable.rogers.com.54786: Flags [P.], seq 7958920:7959172, ack 4753, win 501, options [nop,nop,TS val 3770132676 ecr 827784051], length 252
17:08:51.847019 IP 68.183.205.32.ssh > cpe00fc8d483dd3-cm00fc8d483dd0.cpe.net.cable.rogers.com.54786: Flags [P.], seq 7959172:7959424, ack 4753, win 501, options [nop,nop,TS val 3770132676 ecr 827784051], length 252
17:08:51.847094 IP 68.183.205.32.ssh > cpe00fc8d483dd3-cm00fc8d483dd0.cpe.net.cable.rogers.com.54786: Flags [P.], seq 7959424:7959676, ack 4753, win 501, options [nop,nop,TS val 3770132676 ecr 827784051], length 252
17:08:51.847164 IP 68.183.205.32.ssh > cpe00fc8d483dd3-cm00fc8d483dd0.cpe.net.cable.rogers.com.54786: Flags [P.], seq 7959676:7959928, ack 4753, win 501, options [nop,nop,TS val 3770132676 ecr 827784051], length 252
17:08:51.847234 IP 68.183.205.32.ssh > cpe00fc8d483dd3-cm00fc8d483dd0.cpe.net.cable.rogers.com.54786: Flags [P.], seq 7959928:7960180, ack 4753, win 501, options [nop,nop,TS val 3770132676 ecr 827784051], length 252
17:08:51.847311 IP 68.183.205.32.ssh > cpe00fc8d483dd3-cm00fc8d483dd0.cpe.net.cable.rogers.com.54786: Flags [P.], seq 7960180:7960432, ack 4753, win 501, options [nop,nop,TS val 3770132676 ecr 827784051], length 252
17:08:51.847390 IP 68.183.205.32.ssh > cpe00fc8d483dd3-cm00fc8d483dd0.cpe.net.cable.rogers.com.54786: Flags [P.], seq 7960432:7960684, ack 4753, win 501, options [nop,nop,TS val 3770132676 ecr 827784051], length 252
17:08:51.847461 IP 68.183.205.32.ssh > cpe00fc8d483dd3-cm00fc8d483dd0.cpe.net.cable.rogers.com.54786: Flags [P.], seq 7960684:7960936, ack 4753, win 501, options [nop,nop,TS val 3770132676 ecr 827784051], length 252
17:08:51.847553 IP 68.183.205.32.ssh > cpe00fc8d483dd3-cm00fc8d483dd0.cpe.net.cable.rogers.com.54786: Flags [P.], seq 7960936:7961188, ack 4753, win 501, options [nop,nop,TS val 3770132676 ecr 827784051], length 252
17:08:51.847608 IP 68.183.205.32.ssh > cpe00fc8d483dd3-cm00fc8d483dd0.cpe.net.cable.rogers.com.54786: Flags [P.], seq 7961188:7961440, ack 4753, win 501, options [nop,nop,TS val 3770132677 ecr 827784051], length 252
17:08:51.847661 IP 68.183.205.32.ssh > cpe00fc8d483dd3-cm00fc8d483dd0.cpe.net.cable.rogers.com.54786: Flags [P.], seq 7961440:7961692, ack 4753, win 501, options [nop,nop,TS val 3770132677 ecr 827784051], length 252
17:08:51.847727 IP 68.183.205.32.ssh > cpe00fc8d483dd3-cm00fc8d483dd0.cpe.net.cable.rogers.com.54786: Flags [P.], seq 7961692:7961944, ack 4753, win 501, options [nop,nop,TS val 3770132677 ecr 827784051], length 252
17:08:51.847780 IP 68.183.205.32.ssh > cpe00fc8d483dd3-cm00fc8d483dd0.cpe.net.cable.rogers.com.54786: Flags [P.], seq 7961944:7962196, ack 4753, win 501, options [nop,nop,TS val 3770132677 ecr 827784051], length 252
17:08:51.847828 IP 68.183.205.32.ssh > cpe00fc8d483dd3-cm00fc8d483dd0.cpe.net.cable.rogers.com.54786: Flags [P.], seq 7962196:7962448, ack 4753, win 501, options [nop,nop,TS val 3770132677 ecr 827784051], length 252
17:08:51.847904 IP 68.183.205.32.ssh > cpe00fc8d483dd3-cm00fc8d483dd0.cpe.net.cable.rogers.com.54786: Flags [P.], seq 7962448:7962700, ack 4753, win 501, options [nop,nop,TS val 3770132677 ecr 827784051], length 252
17:08:51.847975 IP 68.183.205.32.ssh > cpe00fc8d483dd3-cm00fc8d483dd0.cpe.net.cable.rogers.com.54786: Flags [P.], seq 7962700:7962952, ack 4753, win 501, options [nop,nop,TS val 3770132677 ecr 827784051], length 252
17:08:51.848049 IP 68.183.205.32.ssh > cpe00fc8d483dd3-cm00fc8d483dd0.cpe.net.cable.rogers.com.54786: Flags [P.], seq 7962952:7963204, ack 4753, win 501, options [nop,nop,TS val 3770132677 ecr 827784051], length 252
17:08:51.848126 IP 68.183.205.32.ssh > cpe00fc8d483dd3-cm00fc8d483dd0.cpe.net.cable.rogers.com.54786: Flags [P.], seq 7963204:7963456, ack 4753, win 501, options [nop,nop,TS val 3770132677 ecr 827784051], length 252
17:08:51.848176 IP 68.183.205.32.ssh > cpe00fc8d483dd3-cm00fc8d483dd0.cpe.net.cable.rogers.com.54786: Flags [P.], seq 7963456:7963708, ack 4753, win 501, options [nop,nop,TS val 3770132677 ecr 827784051], length 252
17:08:51.848222 IP 68.183.205.32.ssh > cpe00fc8d483dd3-cm00fc8d483dd0.cpe.net.cable.rogers.com.54786: Flags [P.], seq 7963708:7963960, ack 4753, win 501, options [nop,nop,TS val 3770132677 ecr 827784051], length 252
17:08:51.848266 IP 68.183.205.32.ssh > cpe00fc8d483dd3-cm00fc8d483dd0.cpe.net.cable.rogers.com.54786: Flags [P.], seq 7963960:7964212, ack 4753, win 501, options [nop,nop,TS val 3770132677 ecr 827784051], length 252
17:08:51.848335 IP 68.183.205.32.ssh > cpe00fc8d483dd3-cm00fc8d483dd0.cpe.net.cable.rogers.com.54786: Flags [P.], seq 7964212:7964464, ack 4753, win 501, options [nop,nop,TS val 3770132677 ecr 827784051], length 252
17:08:51.848379 IP 68.183.205.32.ssh > cpe00fc8d483dd3-cm00fc8d483dd0.cpe.net.cable.rogers.com.54786: Flags [P.], seq 7964464:7964716, ack 4753, win 501, options [nop,nop,TS val 3770132677 ecr 827784051], length 252
17:08:51.848422 IP 68.183.205.32.ssh > cpe00fc8d483dd3-cm00fc8d483dd0.cpe.net.cable.rogers.com.54786: Flags [P.], seq 7964716:7964968, ack 4753, win 501, options [nop,nop,TS val 3770132677 ecr 827784051], length 252
17:08:51.848473 IP 68.183.205.32.ssh > cpe00fc8d483dd3-cm00fc8d483dd0.cpe.net.cable.rogers.com.54786: Flags [P.], seq 7964968:7965220, ack 4753, win 501, options [nop,nop,TS val 3770132677 ecr 827784051], length 252
17:08:51.848520 IP 68.183.205.32.ssh > cpe00fc8d483dd3-cm00fc8d483dd0.cpe.net.cable.rogers.com.54786: Flags [P.], seq 7965220:7965472, ack 4753, win 501, options [nop,nop,TS val 3770132677 ecr 827784051], length 252
17:08:51.848568 IP 68.183.205.32.ssh > cpe00fc8d483dd3-cm00fc8d483dd0.cpe.net.cable.rogers.com.54786: Flags [P.], seq 7965472:7965724, ack 4753, win 501, options [nop,nop,TS val 3770132677 ecr 827784051], length 252
17:08:51.848611 IP 68.183.205.32.ssh > cpe00fc8d483dd3-cm00fc8d483dd0.cpe.net.cable.rogers.com.54786: Flags [P.], seq 7965724:7965976, ack 4753, win 501, options [nop,nop,TS val 3770132678 ecr 827784051], length 252
17:08:51.848655 IP 68.183.205.32.ssh > cpe00fc8d483dd3-cm00fc8d483dd0.cpe.net.cable.rogers.com.54786: Flags [P.], seq 7965976:7966228, ack 4753, win 501, options [nop,nop,TS val 3770132678 ecr 827784051], length 252
17:08:51.848701 IP 68.183.205.32.ssh > cpe00fc8d483dd3-cm00fc8d483dd0.cpe.net.cable.rogers.com.54786: Flags [P.], seq 7966228:7966480, ack 4753, win 501, options [nop,nop,TS val 3770132678 ecr 827784051], length 252
17:08:51.848745 IP 68.183.205.32.ssh > cpe00fc8d483dd3-cm00fc8d483dd0.cpe.net.cable.rogers.com.54786: Flags [P.], seq 7966480:7966732, ack 4753, win 501, options [nop,nop,TS val 3770132678 ecr 827784051], length 252
17:08:51.848791 IP 68.183.205.32.ssh > cpe00fc8d483dd3-cm00fc8d483dd0.cpe.net.cable.rogers.com.54786: Flags [P.], seq 7966732:7966984, ack 4753, win 501, options [nop,nop,TS val 3770132678 ecr 827784051], length 252
17:08:51.848834 IP 68.183.205.32.ssh > cpe00fc8d483dd3-cm00fc8d483dd0.cpe.net.cable.rogers.com.54786: Flags [P.], seq 7966984:7967236, ack 4753, win 501, options [nop,nop,TS val 3770132678 ecr 827784051], length 252
17:08:51.848881 IP 68.183.205.32.ssh > cpe00fc8d483dd3-cm00fc8d483dd0.cpe.net.cable.rogers.com.54786: Flags [P.], seq 7967236:7967488, ack 4753, win 501, options [nop,nop,TS val 3770132678 ecr 827784051], length 252
17:08:51.848926 IP 68.183.205.32.ssh > cpe00fc8d483dd3-cm00fc8d483dd0.cpe.net.cable.rogers.com.54786: Flags [P.], seq 7967488:7967740, ack 4753, win 501, options [nop,nop,TS val 3770132678 ecr 827784051], length 252
17:08:51.848969 IP 68.183.205.32.ssh > cpe00fc8d483dd3-cm00fc8d483dd0.cpe.net.cable.rogers.com.54786: Flags [P.], seq 7967740:7967992, ack 4753, win 501, options [nop,nop,TS val 3770132678 ecr 827784051], length 252
17:08:51.849015 IP 68.183.205.32.ssh > cpe00fc8d483dd3-cm00fc8d483dd0.cpe.net.cable.rogers.com.54786: Flags [P.], seq 7967992:7968244, ack 4753, win 501, options [nop,nop,TS val 3770132678 ecr 827784051], length 252
17:08:51.849059 IP 68.183.205.32.ssh > cpe00fc8d483dd3-cm00fc8d483dd0.cpe.net.cable.rogers.com.54786: Flags [P.], seq 7968244:7968496, ack 4753, win 501, options [nop,nop,TS val 3770132678 ecr 827784051], length 252
17:08:51.849119 IP 68.183.205.32.ssh > cpe00fc8d483dd3-cm00fc8d483dd0.cpe.net.cable.rogers.com.54786: Flags [P.], seq 7968496:7968748, ack 4753, win 501, options [nop,nop,TS val 3770132678 ecr 827784051], length 252
17:08:51.849179 IP 68.183.205.32.ssh > cpe00fc8d483dd3-cm00fc8d483dd0.cpe.net.cable.rogers.com.54786: Flags [P.], seq 7968748:7969000, ack 4753, win 501, options [nop,nop,TS val 3770132678 ecr 827784051], length 252
17:08:51.849241 IP 68.183.205.32.ssh > cpe00fc8d483dd3-cm00fc8d483dd0.cpe.net.cable.rogers.com.54786: Flags [P.], seq 7969000:7969252, ack 4753, win 501, options [nop,nop,TS val 3770132678 ecr 827784051], length 252
17:08:51.849291 IP 68.183.205.32.ssh > cpe00fc8d483dd3-cm00fc8d483dd0.cpe.net.cable.rogers.com.54786: Flags [P.], seq 7969252:7969504, ack 4753, win 501, options [nop,nop,TS val 3770132678 ecr 827784051], length 252
17:08:51.849336 IP 68.183.205.32.ssh > cpe00fc8d483dd3-cm00fc8d483dd0.cpe.net.cable.rogers.com.54786: Flags [P.], seq 7969504:7969756, ack 4753, win 501, options [nop,nop,TS val 3770132678 ecr 827784051], length 252
17:08:51.849386 IP 68.183.205.32.ssh > cpe00fc8d483dd3-cm00fc8d483dd0.cpe.net.cable.rogers.com.54786: Flags [P.], seq 7969756:7970008, ack 4753, win 501, options [nop,nop,TS val 3770132678 ecr 827784051], length 252
17:08:51.849431 IP 68.183.205.32.ssh > cpe00fc8d483dd3-cm00fc8d483dd0.cpe.net.cable.rogers.com.54786: Flags [P.], seq 7970008:7970260, ack 4753, win 501, options [nop,nop,TS val 3770132678 ecr 827784051], length 252
17:08:51.849476 IP 68.183.205.32.ssh > cpe00fc8d483dd3-cm00fc8d483dd0.cpe.net.cable.rogers.com.54786: Flags [P.], seq 7970260:7970512, ack 4753, win 501, options [nop,nop,TS val 3770132678 ecr 827784051], length 252
17:08:51.849519 IP 68.183.205.32.ssh > cpe00fc8d483dd3-cm00fc8d483dd0.cpe.net.cable.rogers.com.54786: Flags [P.], seq 7970512:7970764, ack 4753, win 501, options [nop,nop,TS val 3770132678 ecr 827784051], length 252
17:08:51.849564 IP 68.183.205.32.ssh > cpe00fc8d483dd3-cm00fc8d483dd0.cpe.net.cable.rogers.com.54786: Flags [P.], seq 7970764:7971016, ack 4753, win 501, options [nop,nop,TS val 3770132678 ecr 827784051], length 252
17:08:51.849608 IP 68.183.205.32.ssh > cpe00fc8d483dd3-cm00fc8d483dd0.cpe.net.cable.rogers.com.54786: Flags [P.], seq 7971016:7971268, ack 4753, win 501, options [nop,nop,TS val 3770132679 ecr 827784051], length 252
17:08:51.849655 IP 68.183.205.32.ssh > cpe00fc8d483dd3-cm00fc8d483dd0.cpe.net.cable.rogers.com.54786: Flags [P.], seq 7971268:7971520, ack 4753, win 501, options [nop,nop,TS val 3770132679 ecr 827784051], length 252
17:08:51.849700 IP 68.183.205.32.ssh > cpe00fc8d483dd3-cm00fc8d483dd0.cpe.net.cable.rogers.com.54786: Flags [P.], seq 7971520:7971772, ack 4753, win 501, options [nop,nop,TS val 3770132679 ecr 827784051], length 252
17:08:51.849778 IP 68.183.205.32.ssh > cpe00fc8d483dd3-cm00fc8d483dd0.cpe.net.cable.rogers.com.54786: Flags [P.], seq 7971772:7972024, ack 4753, win 501, options [nop,nop,TS val 3770132679 ecr 827784051], length 252
17:08:51.849826 IP 68.183.205.32.ssh > cpe00fc8d483dd3-cm00fc8d483dd0.cpe.net.cable.rogers.com.54786: Flags [P.], seq 7972024:7972276, ack 4753, win 501, options [nop,nop,TS val 3770132679 ecr 827784051], length 252
17:08:51.849871 IP 68.183.205.32.ssh > cpe00fc8d483dd3-cm00fc8d483dd0.cpe.net.cable.rogers.com.54786: Flags [P.], seq 7972276:7972528, ack 4753, win 501, options [nop,nop,TS val 3770132679 ecr 827784051], length 252
17:08:51.849917 IP 68.183.205.32.ssh > cpe00fc8d483dd3-cm00fc8d483dd0.cpe.net.cable.rogers.com.54786: Flags [P.], seq 7972528:7972780, ack 4753, win 501, options [nop,nop,TS val 3770132679 ecr 827784051], length 252
17:08:51.849960 IP 68.183.205.32.ssh > cpe00fc8d483dd3-cm00fc8d483dd0.cpe.net.cable.rogers.com.54786: Flags [P.], seq 7972780:7973032, ack 4753, win 501, options [nop,nop,TS val 3770132679 ecr 827784051], length 252
17:08:51.850005 IP 68.183.205.32.ssh > cpe00fc8d483dd3-cm00fc8d483dd0.cpe.net.cable.rogers.com.54786: Flags [P.], seq 7973032:7973284, ack 4753, win 501, options [nop,nop,TS val 3770132679 ecr 827784051], length 252
17:08:51.850061 IP 68.183.205.32.ssh > cpe00fc8d483dd3-cm00fc8d483dd0.cpe.net.cable.rogers.com.54786: Flags [P.], seq 7973284:7973536, ack 4753, win 501, options [nop,nop,TS val 3770132679 ecr 827784051], length 252
17:08:51.850116 IP 68.183.205.32.ssh > cpe00fc8d483dd3-cm00fc8d483dd0.cpe.net.cable.rogers.com.54786: Flags [P.], seq 7973536:7973788, ack 4753, win 501, options [nop,nop,TS val 3770132679 ecr 827784051], length 252
17:08:51.850163 IP 68.183.205.32.ssh > cpe00fc8d483dd3-cm00fc8d483dd0.cpe.net.cable.rogers.com.54786: Flags [P.], seq 7973788:7974040, ack 4753, win 501, options [nop,nop,TS val 3770132679 ecr 827784051], length 252
17:08:51.850207 IP 68.183.205.32.ssh > cpe00fc8d483dd3-cm00fc8d483dd0.cpe.net.cable.rogers.com.54786: Flags [P.], seq 7974040:7974292, ack 4753, win 501, options [nop,nop,TS val 3770132679 ecr 827784051], length 252
17:08:51.850252 IP 68.183.205.32.ssh > cpe00fc8d483dd3-cm00fc8d483dd0.cpe.net.cable.rogers.com.54786: Flags [P.], seq 7974292:7974544, ack 4753, win 501, options [nop,nop,TS val 3770132679 ecr 827784051], length 252
17:08:51.850299 IP 68.183.205.32.ssh > cpe00fc8d483dd3-cm00fc8d483dd0.cpe.net.cable.rogers.com.54786: Flags [P.], seq 7974544:7974796, ack 4753, win 501, options [nop,nop,TS val 3770132679 ecr 827784051], length 252
17:08:51.850343 IP 68.183.205.32.ssh > cpe00fc8d483dd3-cm00fc8d483dd0.cpe.net.cable.rogers.com.54786: Flags [P.], seq 7974796:7975048, ack 4753, win 501, options [nop,nop,TS val 3770132679 ecr 827784051], length 252
17:08:51.850386 IP 68.183.205.32.ssh > cpe00fc8d483dd3-cm00fc8d483dd0.cpe.net.cable.rogers.com.54786: Flags [P.], seq 7975048:7975300, ack 4753, win 501, options [nop,nop,TS val 3770132679 ecr 827784051], length 252
17:08:51.850432 IP 68.183.205.32.ssh > cpe00fc8d483dd3-cm00fc8d483dd0.cpe.net.cable.rogers.com.54786: Flags [P.], seq 7975300:7975552, ack 4753, win 501, options [nop,nop,TS val 3770132679 ecr 827784051], length 252
17:08:51.850480 IP 68.183.205.32.ssh > cpe00fc8d483dd3-cm00fc8d483dd0.cpe.net.cable.rogers.com.54786: Flags [P.], seq 7975552:7975804, ack 4753, win 501, options [nop,nop,TS val 3770132679 ecr 827784051], length 252
17:08:51.850523 IP 68.183.205.32.ssh > cpe00fc8d483dd3-cm00fc8d483dd0.cpe.net.cable.rogers.com.54786: Flags [P.], seq 7975804:7976056, ack 4753, win 501, options [nop,nop,TS val 3770132679 ecr 827784051], length 252
17:08:51.850568 IP 68.183.205.32.ssh > cpe00fc8d483dd3-cm00fc8d483dd0.cpe.net.cable.rogers.com.54786: Flags [P.], seq 7976056:7976308, ack 4753, win 501, options [nop,nop,TS val 3770132680 ecr 827784051], length 252
17:08:51.850612 IP 68.183.205.32.ssh > cpe00fc8d483dd3-cm00fc8d483dd0.cpe.net.cable.rogers.com.54786: Flags [P.], seq 7976308:7976560, ack 4753, win 501, options [nop,nop,TS val 3770132680 ecr 827784051], length 252
17:08:51.850658 IP 68.183.205.32.ssh > cpe00fc8d483dd3-cm00fc8d483dd0.cpe.net.cable.rogers.com.54786: Flags [P.], seq 7976560:7976812, ack 4753, win 501, options [nop,nop,TS val 3770132680 ecr 827784051], length 252
17:08:51.850702 IP 68.183.205.32.ssh > cpe00fc8d483dd3-cm00fc8d483dd0.cpe.net.cable.rogers.com.54786: Flags [P.], seq 7976812:7977064, ack 4753, win 501, options [nop,nop,TS val 3770132680 ecr 827784051], length 252
17:08:51.850746 IP 68.183.205.32.ssh > cpe00fc8d483dd3-cm00fc8d483dd0.cpe.net.cable.rogers.com.54786: Flags [P.], seq 7977064:7977316, ack 4753, win 501, options [nop,nop,TS val 3770132680 ecr 827784051], length 252
17:08:51.850794 IP 68.183.205.32.ssh > cpe00fc8d483dd3-cm00fc8d483dd0.cpe.net.cable.rogers.com.54786: Flags [P.], seq 7977316:7977568, ack 4753, win 501, options [nop,nop,TS val 3770132680 ecr 827784051], length 252
17:08:51.850839 IP 68.183.205.32.ssh > cpe00fc8d483dd3-cm00fc8d483dd0.cpe.net.cable.rogers.com.54786: Flags [P.], seq 7977568:7977820, ack 4753, win 501, options [nop,nop,TS val 3770132680 ecr 827784051], length 252
17:08:51.850885 IP 68.183.205.32.ssh > cpe00fc8d483dd3-cm00fc8d483dd0.cpe.net.cable.rogers.com.54786: Flags [P.], seq 7977820:7978072, ack 4753, win 501, options [nop,nop,TS val 3770132680 ecr 827784051], length 252
17:08:51.850928 IP 68.183.205.32.ssh > cpe00fc8d483dd3-cm00fc8d483dd0.cpe.net.cable.rogers.com.54786: Flags [P.], seq 7978072:7978324, ack 4753, win 501, options [nop,nop,TS val 3770132680 ecr 827784051], length 252
17:08:51.850971 IP 68.183.205.32.ssh > cpe00fc8d483dd3-cm00fc8d483dd0.cpe.net.cable.rogers.com.54786: Flags [P.], seq 7978324:7978576, ack 4753, win 501, options [nop,nop,TS val 3770132680 ecr 827784051], length 252
17:08:51.851017 IP 68.183.205.32.ssh > cpe00fc8d483dd3-cm00fc8d483dd0.cpe.net.cable.rogers.com.54786: Flags [P.], seq 7978576:7978828, ack 4753, win 501, options [nop,nop,TS val 3770132680 ecr 827784051], length 252
17:08:51.851072 IP 68.183.205.32.ssh > cpe00fc8d483dd3-cm00fc8d483dd0.cpe.net.cable.rogers.com.54786: Flags [P.], seq 7978828:7979080, ack 4753, win 501, options [nop,nop,TS val 3770132680 ecr 827784051], length 252
17:08:51.851121 IP 68.183.205.32.ssh > cpe00fc8d483dd3-cm00fc8d483dd0.cpe.net.cable.rogers.com.54786: Flags [P.], seq 7979080:7979332, ack 4753, win 501, options [nop,nop,TS val 3770132680 ecr 827784051], length 252
17:08:51.851168 IP 68.183.205.32.ssh > cpe00fc8d483dd3-cm00fc8d483dd0.cpe.net.cable.rogers.com.54786: Flags [P.], seq 7979332:7979584, ack 4753, win 501, options [nop,nop,TS val 3770132680 ecr 827784051], length 252
17:08:51.851214 IP 68.183.205.32.ssh > cpe00fc8d483dd3-cm00fc8d483dd0.cpe.net.cable.rogers.com.54786: Flags [P.], seq 7979584:7979836, ack 4753, win 501, options [nop,nop,TS val 3770132680 ecr 827784051], length 252
17:08:51.851258 IP 68.183.205.32.ssh > cpe00fc8d483dd3-cm00fc8d483dd0.cpe.net.cable.rogers.com.54786: Flags [P.], seq 7979836:7980088, ack 4753, win 501, options [nop,nop,TS val 3770132680 ecr 827784051], length 252
17:08:51.851304 IP 68.183.205.32.ssh > cpe00fc8d483dd3-cm00fc8d483dd0.cpe.net.cable.rogers.com.54786: Flags [P.], seq 7980088:7980340, ack 4753, win 501, options [nop,nop,TS val 3770132680 ecr 827784051], length 252
17:08:51.851347 IP 68.183.205.32.ssh > cpe00fc8d483dd3-cm00fc8d483dd0.cpe.net.cable.rogers.com.54786: Flags [P.], seq 7980340:7980592, ack 4753, win 501, options [nop,nop,TS val 3770132680 ecr 827784051], length 252
17:08:51.851397 IP 68.183.205.32.ssh > cpe00fc8d483dd3-cm00fc8d483dd0.cpe.net.cable.rogers.com.54786: Flags [P.], seq 7980592:7980844, ack 4753, win 501, options [nop,nop,TS val 3770132680 ecr 827784051], length 252
17:08:51.851440 IP 68.183.205.32.ssh > cpe00fc8d483dd3-cm00fc8d483dd0.cpe.net.cable.rogers.com.54786: Flags [P.], seq 7980844:7981096, ack 4753, win 501, options [nop,nop,TS val 3770132680 ecr 827784051], length 252
17:08:51.851485 IP 68.183.205.32.ssh > cpe00fc8d483dd3-cm00fc8d483dd0.cpe.net.cable.rogers.com.54786: Flags [P.], seq 7981096:7981348, ack 4753, win 501, options [nop,nop,TS val 3770132680 ecr 827784051], length 252
17:08:51.851532 IP 68.183.205.32.ssh > cpe00fc8d483dd3-cm00fc8d483dd0.cpe.net.cable.rogers.com.54786: Flags [P.], seq 7981348:7981600, ack 4753, win 501, options [nop,nop,TS val 3770132680 ecr 827784051], length 252
17:08:51.851590 IP 68.183.205.32.ssh > cpe00fc8d483dd3-cm00fc8d483dd0.cpe.net.cable.rogers.com.54786: Flags [P.], seq 7981600:7981852, ack 4753, win 501, options [nop,nop,TS val 3770132681 ecr 827784051], length 252
17:08:51.851634 IP 68.183.205.32.ssh > cpe00fc8d483dd3-cm00fc8d483dd0.cpe.net.cable.rogers.com.54786: Flags [P.], seq 7981852:7982104, ack 4753, win 501, options [nop,nop,TS val 3770132681 ecr 827784051], length 252
17:08:51.851695 IP 68.183.205.32.ssh > cpe00fc8d483dd3-cm00fc8d483dd0.cpe.net.cable.rogers.com.54786: Flags [P.], seq 7982104:7982356, ack 4753, win 501, options [nop,nop,TS val 3770132681 ecr 827784051], length 252
17:08:51.851755 IP 68.183.205.32.ssh > cpe00fc8d483dd3-cm00fc8d483dd0.cpe.net.cable.rogers.com.54786: Flags [P.], seq 7982356:7982608, ack 4753, win 501, options [nop,nop,TS val 3770132681 ecr 827784051], length 252
17:08:51.851801 IP 68.183.205.32.ssh > cpe00fc8d483dd3-cm00fc8d483dd0.cpe.net.cable.rogers.com.54786: Flags [P.], seq 7982608:7982860, ack 4753, win 501, options [nop,nop,TS val 3770132681 ecr 827784051], length 252
17:08:51.851845 IP 68.183.205.32.ssh > cpe00fc8d483dd3-cm00fc8d483dd0.cpe.net.cable.rogers.com.54786: Flags [P.], seq 7982860:7983112, ack 4753, win 501, options [nop,nop,TS val 3770132681 ecr 827784051], length 252
17:08:51.851892 IP 68.183.205.32.ssh > cpe00fc8d483dd3-cm00fc8d483dd0.cpe.net.cable.rogers.com.54786: Flags [P.], seq 7983112:7983364, ack 4753, win 501, options [nop,nop,TS val 3770132681 ecr 827784051], length 252
17:08:51.851937 IP 68.183.205.32.ssh > cpe00fc8d483dd3-cm00fc8d483dd0.cpe.net.cable.rogers.com.54786: Flags [P.], seq 7983364:7983616, ack 4753, win 501, options [nop,nop,TS val 3770132681 ecr 827784051], length 252
17:08:51.851982 IP 68.183.205.32.ssh > cpe00fc8d483dd3-cm00fc8d483dd0.cpe.net.cable.rogers.com.54786: Flags [P.], seq 7983616:7983868, ack 4753, win 501, options [nop,nop,TS val 3770132681 ecr 827784051], length 252
17:08:51.852032 IP 68.183.205.32.ssh > cpe00fc8d483dd3-cm00fc8d483dd0.cpe.net.cable.rogers.com.54786: Flags [P.], seq 7983868:7984120, ack 4753, win 501, options [nop,nop,TS val 3770132681 ecr 827784051], length 252
17:08:51.852100 IP 68.183.205.32.ssh > cpe00fc8d483dd3-cm00fc8d483dd0.cpe.net.cable.rogers.com.54786: Flags [P.], seq 7984120:7984372, ack 4753, win 501, options [nop,nop,TS val 3770132681 ecr 827784051], length 252
17:08:51.852150 IP 68.183.205.32.ssh > cpe00fc8d483dd3-cm00fc8d483dd0.cpe.net.cable.rogers.com.54786: Flags [P.], seq 7984372:7984624, ack 4753, win 501, options [nop,nop,TS val 3770132681 ecr 827784051], length 252
17:08:51.852196 IP 68.183.205.32.ssh > cpe00fc8d483dd3-cm00fc8d483dd0.cpe.net.cable.rogers.com.54786: Flags [P.], seq 7984624:7984876, ack 4753, win 501, options [nop,nop,TS val 3770132681 ecr 827784051], length 252
17:08:51.852239 IP 68.183.205.32.ssh > cpe00fc8d483dd3-cm00fc8d483dd0.cpe.net.cable.rogers.com.54786: Flags [P.], seq 7984876:7985128, ack 4753, win 501, options [nop,nop,TS val 3770132681 ecr 827784051], length 252
17:08:51.852285 IP 68.183.205.32.ssh > cpe00fc8d483dd3-cm00fc8d483dd0.cpe.net.cable.rogers.com.54786: Flags [P.], seq 7985128:7985380, ack 4753, win 501, options [nop,nop,TS val 3770132681 ecr 827784051], length 252
17:08:51.852345 IP 68.183.205.32.ssh > cpe00fc8d483dd3-cm00fc8d483dd0.cpe.net.cable.rogers.com.54786: Flags [P.], seq 7985380:7985632, ack 4753, win 501, options [nop,nop,TS val 3770132681 ecr 827784051], length 252
17:08:51.852391 IP 68.183.205.32.ssh > cpe00fc8d483dd3-cm00fc8d483dd0.cpe.net.cable.rogers.com.54786: Flags [P.], seq 7985632:7985884, ack 4753, win 501, options [nop,nop,TS val 3770132681 ecr 827784051], length 252
17:08:51.852437 IP 68.183.205.32.ssh > cpe00fc8d483dd3-cm00fc8d483dd0.cpe.net.cable.rogers.com.54786: Flags [P.], seq 7985884:7986136, ack 4753, win 501, options [nop,nop,TS val 3770132681 ecr 827784051], length 252
17:08:51.852481 IP 68.183.205.32.ssh > cpe00fc8d483dd3-cm00fc8d483dd0.cpe.net.cable.rogers.com.54786: Flags [P.], seq 7986136:7986388, ack 4753, win 501, options [nop,nop,TS val 3770132681 ecr 827784051], length 252
17:08:51.852528 IP 68.183.205.32.ssh > cpe00fc8d483dd3-cm00fc8d483dd0.cpe.net.cable.rogers.com.54786: Flags [P.], seq 7986388:7986640, ack 4753, win 501, options [nop,nop,TS val 3770132681 ecr 827784051], length 252
17:08:51.852571 IP 68.183.205.32.ssh > cpe00fc8d483dd3-cm00fc8d483dd0.cpe.net.cable.rogers.com.54786: Flags [P.], seq 7986640:7986892, ack 4753, win 501, options [nop,nop,TS val 3770132682 ecr 827784051], length 252
17:08:51.852617 IP 68.183.205.32.ssh > cpe00fc8d483dd3-cm00fc8d483dd0.cpe.net.cable.rogers.com.54786: Flags [P.], seq 7986892:7987144, ack 4753, win 501, options [nop,nop,TS val 3770132682 ecr 827784051], length 252
17:08:51.852685 IP 68.183.205.32.ssh > cpe00fc8d483dd3-cm00fc8d483dd0.cpe.net.cable.rogers.com.54786: Flags [P.], seq 7987144:7987396, ack 4753, win 501, options [nop,nop,TS val 3770132682 ecr 827784051], length 252
17:08:51.852746 IP 68.183.205.32.ssh > cpe00fc8d483dd3-cm00fc8d483dd0.cpe.net.cable.rogers.com.54786: Flags [P.], seq 7987396:7987648, ack 4753, win 501, options [nop,nop,TS val 3770132682 ecr 827784051], length 252
17:08:51.852802 IP 68.183.205.32.ssh > cpe00fc8d483dd3-cm00fc8d483dd0.cpe.net.cable.rogers.com.54786: Flags [P.], seq 7987648:7987900, ack 4753, win 501, options [nop,nop,TS val 3770132682 ecr 827784051], length 252
17:08:51.852853 IP 68.183.205.32.ssh > cpe00fc8d483dd3-cm00fc8d483dd0.cpe.net.cable.rogers.com.54786: Flags [P.], seq 7987900:7988152, ack 4753, win 501, options [nop,nop,TS val 3770132682 ecr 827784051], length 252
17:08:51.852906 IP 68.183.205.32.ssh > cpe00fc8d483dd3-cm00fc8d483dd0.cpe.net.cable.rogers.com.54786: Flags [P.], seq 7988152:7988404, ack 4753, win 501, options [nop,nop,TS val 3770132682 ecr 827784051], length 252
17:08:51.852959 IP 68.183.205.32.ssh > cpe00fc8d483dd3-cm00fc8d483dd0.cpe.net.cable.rogers.com.54786: Flags [P.], seq 7988404:7988656, ack 4753, win 501, options [nop,nop,TS val 3770132682 ecr 827784051], length 252
17:08:51.853012 IP 68.183.205.32.ssh > cpe00fc8d483dd3-cm00fc8d483dd0.cpe.net.cable.rogers.com.54786: Flags [P.], seq 7988656:7988908, ack 4753, win 501, options [nop,nop,TS val 3770132682 ecr 827784051], length 252
17:08:51.853083 IP 68.183.205.32.ssh > cpe00fc8d483dd3-cm00fc8d483dd0.cpe.net.cable.rogers.com.54786: Flags [P.], seq 7988908:7989160, ack 4753, win 501, options [nop,nop,TS val 3770132682 ecr 827784051], length 252
17:08:51.853150 IP 68.183.205.32.ssh > cpe00fc8d483dd3-cm00fc8d483dd0.cpe.net.cable.rogers.com.54786: Flags [P.], seq 7989160:7989412, ack 4753, win 501, options [nop,nop,TS val 3770132682 ecr 827784051], length 252
17:08:51.853206 IP 68.183.205.32.ssh > cpe00fc8d483dd3-cm00fc8d483dd0.cpe.net.cable.rogers.com.54786: Flags [P.], seq 7989412:7989664, ack 4753, win 501, options [nop,nop,TS val 3770132682 ecr 827784051], length 252
17:08:51.853262 IP 68.183.205.32.ssh > cpe00fc8d483dd3-cm00fc8d483dd0.cpe.net.cable.rogers.com.54786: Flags [P.], seq 7989664:7989916, ack 4753, win 501, options [nop,nop,TS val 3770132682 ecr 827784051], length 252
17:08:51.853314 IP 68.183.205.32.ssh > cpe00fc8d483dd3-cm00fc8d483dd0.cpe.net.cable.rogers.com.54786: Flags [P.], seq 7989916:7990168, ack 4753, win 501, options [nop,nop,TS val 3770132682 ecr 827784051], length 252
17:08:51.853369 IP 68.183.205.32.ssh > cpe00fc8d483dd3-cm00fc8d483dd0.cpe.net.cable.rogers.com.54786: Flags [P.], seq 7990168:7990420, ack 4753, win 501, options [nop,nop,TS val 3770132682 ecr 827784051], length 252
17:08:51.853419 IP 68.183.205.32.ssh > cpe00fc8d483dd3-cm00fc8d483dd0.cpe.net.cable.rogers.com.54786: Flags [P.], seq 7990420:7990672, ack 4753, win 501, options [nop,nop,TS val 3770132682 ecr 827784051], length 252
17:08:51.853472 IP 68.183.205.32.ssh > cpe00fc8d483dd3-cm00fc8d483dd0.cpe.net.cable.rogers.com.54786: Flags [P.], seq 7990672:7990924, ack 4753, win 501, options [nop,nop,TS val 3770132682 ecr 827784051], length 252
17:08:51.853522 IP 68.183.205.32.ssh > cpe00fc8d483dd3-cm00fc8d483dd0.cpe.net.cable.rogers.com.54786: Flags [P.], seq 7990924:7991176, ack 4753, win 501, options [nop,nop,TS val 3770132682 ecr 827784051], length 252
17:08:51.853574 IP 68.183.205.32.ssh > cpe00fc8d483dd3-cm00fc8d483dd0.cpe.net.cable.rogers.com.54786: Flags [P.], seq 7991176:7991428, ack 4753, win 501, options [nop,nop,TS val 3770132683 ecr 827784051], length 252
17:08:51.853628 IP 68.183.205.32.ssh > cpe00fc8d483dd3-cm00fc8d483dd0.cpe.net.cable.rogers.com.54786: Flags [P.], seq 7991428:7991680, ack 4753, win 501, options [nop,nop,TS val 3770132683 ecr 827784051], length 252
17:08:51.853686 IP 68.183.205.32.ssh > cpe00fc8d483dd3-cm00fc8d483dd0.cpe.net.cable.rogers.com.54786: Flags [P.], seq 7991680:7991932, ack 4753, win 501, options [nop,nop,TS val 3770132683 ecr 827784051], length 252
17:08:51.853738 IP 68.183.205.32.ssh > cpe00fc8d483dd3-cm00fc8d483dd0.cpe.net.cable.rogers.com.54786: Flags [P.], seq 7991932:7992184, ack 4753, win 501, options [nop,nop,TS val 3770132683 ecr 827784051], length 252
17:08:51.853792 IP 68.183.205.32.ssh > cpe00fc8d483dd3-cm00fc8d483dd0.cpe.net.cable.rogers.com.54786: Flags [P.], seq 7992184:7992436, ack 4753, win 501, options [nop,nop,TS val 3770132683 ecr 827784051], length 252
17:08:51.853842 IP 68.183.205.32.ssh > cpe00fc8d483dd3-cm00fc8d483dd0.cpe.net.cable.rogers.com.54786: Flags [P.], seq 7992436:7992688, ack 4753, win 501, options [nop,nop,TS val 3770132683 ecr 827784051], length 252
17:08:51.853894 IP 68.183.205.32.ssh > cpe00fc8d483dd3-cm00fc8d483dd0.cpe.net.cable.rogers.com.54786: Flags [P.], seq 7992688:7992940, ack 4753, win 501, options [nop,nop,TS val 3770132683 ecr 827784051], length 252
17:08:51.853945 IP 68.183.205.32.ssh > cpe00fc8d483dd3-cm00fc8d483dd0.cpe.net.cable.rogers.com.54786: Flags [P.], seq 7992940:7993192, ack 4753, win 501, options [nop,nop,TS val 3770132683 ecr 827784051], length 252
17:08:51.853997 IP 68.183.205.32.ssh > cpe00fc8d483dd3-cm00fc8d483dd0.cpe.net.cable.rogers.com.54786: Flags [P.], seq 7993192:7993444, ack 4753, win 501, options [nop,nop,TS val 3770132683 ecr 827784051], length 252
17:08:51.854061 IP 68.183.205.32.ssh > cpe00fc8d483dd3-cm00fc8d483dd0.cpe.net.cable.rogers.com.54786: Flags [P.], seq 7993444:7993696, ack 4753, win 501, options [nop,nop,TS val 3770132683 ecr 827784051], length 252
17:08:51.854130 IP 68.183.205.32.ssh > cpe00fc8d483dd3-cm00fc8d483dd0.cpe.net.cable.rogers.com.54786: Flags [P.], seq 7993696:7993948, ack 4753, win 501, options [nop,nop,TS val 3770132683 ecr 827784051], length 252
17:08:51.854191 IP 68.183.205.32.ssh > cpe00fc8d483dd3-cm00fc8d483dd0.cpe.net.cable.rogers.com.54786: Flags [P.], seq 7993948:7994200, ack 4753, win 501, options [nop,nop,TS val 3770132683 ecr 827784051], length 252
17:08:51.854274 IP 68.183.205.32.ssh > cpe00fc8d483dd3-cm00fc8d483dd0.cpe.net.cable.rogers.com.54786: Flags [P.], seq 7994200:7994452, ack 4753, win 501, options [nop,nop,TS val 3770132683 ecr 827784051], length 252
17:08:51.854332 IP 68.183.205.32.ssh > cpe00fc8d483dd3-cm00fc8d483dd0.cpe.net.cable.rogers.com.54786: Flags [P.], seq 7994452:7994704, ack 4753, win 501, options [nop,nop,TS val 3770132683 ecr 827784051], length 252
17:08:51.854380 IP 68.183.205.32.ssh > cpe00fc8d483dd3-cm00fc8d483dd0.cpe.net.cable.rogers.com.54786: Flags [P.], seq 7994704:7994956, ack 4753, win 501, options [nop,nop,TS val 3770132683 ecr 827784051], length 252
17:08:51.854424 IP 68.183.205.32.ssh > cpe00fc8d483dd3-cm00fc8d483dd0.cpe.net.cable.rogers.com.54786: Flags [P.], seq 7994956:7995208, ack 4753, win 501, options [nop,nop,TS val 3770132683 ecr 827784051], length 252
17:08:51.854484 IP 68.183.205.32.ssh > cpe00fc8d483dd3-cm00fc8d483dd0.cpe.net.cable.rogers.com.54786: Flags [P.], seq 7995208:7995460, ack 4753, win 501, options [nop,nop,TS val 3770132683 ecr 827784051], length 252
17:08:51.854529 IP 68.183.205.32.ssh > cpe00fc8d483dd3-cm00fc8d483dd0.cpe.net.cable.rogers.com.54786: Flags [P.], seq 7995460:7995712, ack 4753, win 501, options [nop,nop,TS val 3770132683 ecr 827784051], length 252
17:08:51.854575 IP 68.183.205.32.ssh > cpe00fc8d483dd3-cm00fc8d483dd0.cpe.net.cable.rogers.com.54786: Flags [P.], seq 7995712:7995964, ack 4753, win 501, options [nop,nop,TS val 3770132684 ecr 827784051], length 252
17:08:51.854620 IP 68.183.205.32.ssh > cpe00fc8d483dd3-cm00fc8d483dd0.cpe.net.cable.rogers.com.54786: Flags [P.], seq 7995964:7996216, ack 4753, win 501, options [nop,nop,TS val 3770132684 ecr 827784051], length 252
17:08:51.854666 IP 68.183.205.32.ssh > cpe00fc8d483dd3-cm00fc8d483dd0.cpe.net.cable.rogers.com.54786: Flags [P.], seq 7996216:7996468, ack 4753, win 501, options [nop,nop,TS val 3770132684 ecr 827784051], length 252
17:08:51.854709 IP 68.183.205.32.ssh > cpe00fc8d483dd3-cm00fc8d483dd0.cpe.net.cable.rogers.com.54786: Flags [P.], seq 7996468:7996720, ack 4753, win 501, options [nop,nop,TS val 3770132684 ecr 827784051], length 252
17:08:51.854753 IP 68.183.205.32.ssh > cpe00fc8d483dd3-cm00fc8d483dd0.cpe.net.cable.rogers.com.54786: Flags [P.], seq 7996720:7996972, ack 4753, win 501, options [nop,nop,TS val 3770132684 ecr 827784051], length 252
17:08:51.854799 IP 68.183.205.32.ssh > cpe00fc8d483dd3-cm00fc8d483dd0.cpe.net.cable.rogers.com.54786: Flags [P.], seq 7996972:7997224, ack 4753, win 501, options [nop,nop,TS val 3770132684 ecr 827784051], length 252
17:08:51.854842 IP 68.183.205.32.ssh > cpe00fc8d483dd3-cm00fc8d483dd0.cpe.net.cable.rogers.com.54786: Flags [P.], seq 7997224:7997476, ack 4753, win 501, options [nop,nop,TS val 3770132684 ecr 827784051], length 252
17:08:51.854892 IP 68.183.205.32.ssh > cpe00fc8d483dd3-cm00fc8d483dd0.cpe.net.cable.rogers.com.54786: Flags [P.], seq 7997476:7997728, ack 4753, win 501, options [nop,nop,TS val 3770132684 ecr 827784051], length 252
17:08:51.854937 IP 68.183.205.32.ssh > cpe00fc8d483dd3-cm00fc8d483dd0.cpe.net.cable.rogers.com.54786: Flags [P.], seq 7997728:7997980, ack 4753, win 501, options [nop,nop,TS val 3770132684 ecr 827784051], length 252
17:08:51.854981 IP 68.183.205.32.ssh > cpe00fc8d483dd3-cm00fc8d483dd0.cpe.net.cable.rogers.com.54786: Flags [P.], seq 7997980:7998232, ack 4753, win 501, options [nop,nop,TS val 3770132684 ecr 827784051], length 252
17:08:51.855026 IP 68.183.205.32.ssh > cpe00fc8d483dd3-cm00fc8d483dd0.cpe.net.cable.rogers.com.54786: Flags [P.], seq 7998232:7998484, ack 4753, win 501, options [nop,nop,TS val 3770132684 ecr 827784051], length 252
17:08:51.855093 IP 68.183.205.32.ssh > cpe00fc8d483dd3-cm00fc8d483dd0.cpe.net.cable.rogers.com.54786: Flags [P.], seq 7998484:7998736, ack 4753, win 501, options [nop,nop,TS val 3770132684 ecr 827784051], length 252
17:08:51.855142 IP 68.183.205.32.ssh > cpe00fc8d483dd3-cm00fc8d483dd0.cpe.net.cable.rogers.com.54786: Flags [P.], seq 7998736:7998988, ack 4753, win 501, options [nop,nop,TS val 3770132684 ecr 827784051], length 252
17:08:51.855189 IP 68.183.205.32.ssh > cpe00fc8d483dd3-cm00fc8d483dd0.cpe.net.cable.rogers.com.54786: Flags [P.], seq 7998988:7999240, ack 4753, win 501, options [nop,nop,TS val 3770132684 ecr 827784051], length 252
17:08:51.855233 IP 68.183.205.32.ssh > cpe00fc8d483dd3-cm00fc8d483dd0.cpe.net.cable.rogers.com.54786: Flags [P.], seq 7999240:7999492, ack 4753, win 501, options [nop,nop,TS val 3770132684 ecr 827784051], length 252
17:08:51.855283 IP 68.183.205.32.ssh > cpe00fc8d483dd3-cm00fc8d483dd0.cpe.net.cable.rogers.com.54786: Flags [P.], seq 7999492:7999744, ack 4753, win 501, options [nop,nop,TS val 3770132684 ecr 827784051], length 252
17:08:51.855335 IP 68.183.205.32.ssh > cpe00fc8d483dd3-cm00fc8d483dd0.cpe.net.cable.rogers.com.54786: Flags [P.], seq 7999744:7999996, ack 4753, win 501, options [nop,nop,TS val 3770132684 ecr 827784051], length 252
17:08:51.855381 IP 68.183.205.32.ssh > cpe00fc8d483dd3-cm00fc8d483dd0.cpe.net.cable.rogers.com.54786: Flags [P.], seq 7999996:8000248, ack 4753, win 501, options [nop,nop,TS val 3770132684 ecr 827784051], length 252
17:08:51.855427 IP 68.183.205.32.ssh > cpe00fc8d483dd3-cm00fc8d483dd0.cpe.net.cable.rogers.com.54786: Flags [P.], seq 8000248:8000500, ack 4753, win 501, options [nop,nop,TS val 3770132684 ecr 827784051], length 252
17:08:51.855471 IP 68.183.205.32.ssh > cpe00fc8d483dd3-cm00fc8d483dd0.cpe.net.cable.rogers.com.54786: Flags [P.], seq 8000500:8000752, ack 4753, win 501, options [nop,nop,TS val 3770132684 ecr 827784051], length 252
17:08:51.855518 IP 68.183.205.32.ssh > cpe00fc8d483dd3-cm00fc8d483dd0.cpe.net.cable.rogers.com.54786: Flags [P.], seq 8000752:8001004, ack 4753, win 501, options [nop,nop,TS val 3770132684 ecr 827784051], length 252
17:08:51.855573 IP 68.183.205.32.ssh > cpe00fc8d483dd3-cm00fc8d483dd0.cpe.net.cable.rogers.com.54786: Flags [P.], seq 8001004:8001256, ack 4753, win 501, options [nop,nop,TS val 3770132685 ecr 827784051], length 252
17:08:51.855618 IP 68.183.205.32.ssh > cpe00fc8d483dd3-cm00fc8d483dd0.cpe.net.cable.rogers.com.54786: Flags [P.], seq 8001256:8001508, ack 4753, win 501, options [nop,nop,TS val 3770132685 ecr 827784051], length 252
17:08:51.855664 IP 68.183.205.32.ssh > cpe00fc8d483dd3-cm00fc8d483dd0.cpe.net.cable.rogers.com.54786: Flags [P.], seq 8001508:8001760, ack 4753, win 501, options [nop,nop,TS val 3770132685 ecr 827784051], length 252
17:08:51.855712 IP 68.183.205.32.ssh > cpe00fc8d483dd3-cm00fc8d483dd0.cpe.net.cable.rogers.com.54786: Flags [P.], seq 8001760:8002012, ack 4753, win 501, options [nop,nop,TS val 3770132685 ecr 827784051], length 252
17:08:51.855755 IP 68.183.205.32.ssh > cpe00fc8d483dd3-cm00fc8d483dd0.cpe.net.cable.rogers.com.54786: Flags [P.], seq 8002012:8002264, ack 4753, win 501, options [nop,nop,TS val 3770132685 ecr 827784051], length 252
17:08:51.855801 IP 68.183.205.32.ssh > cpe00fc8d483dd3-cm00fc8d483dd0.cpe.net.cable.rogers.com.54786: Flags [P.], seq 8002264:8002516, ack 4753, win 501, options [nop,nop,TS val 3770132685 ecr 827784051], length 252
17:08:51.855844 IP 68.183.205.32.ssh > cpe00fc8d483dd3-cm00fc8d483dd0.cpe.net.cable.rogers.com.54786: Flags [P.], seq 8002516:8002768, ack 4753, win 501, options [nop,nop,TS val 3770132685 ecr 827784051], length 252
17:08:51.855890 IP 68.183.205.32.ssh > cpe00fc8d483dd3-cm00fc8d483dd0.cpe.net.cable.rogers.com.54786: Flags [P.], seq 8002768:8003020, ack 4753, win 501, options [nop,nop,TS val 3770132685 ecr 827784051], length 252
17:08:51.855932 IP 68.183.205.32.ssh > cpe00fc8d483dd3-cm00fc8d483dd0.cpe.net.cable.rogers.com.54786: Flags [P.], seq 8003020:8003272, ack 4753, win 501, options [nop,nop,TS val 3770132685 ecr 827784051], length 252
17:08:51.855975 IP 68.183.205.32.ssh > cpe00fc8d483dd3-cm00fc8d483dd0.cpe.net.cable.rogers.com.54786: Flags [P.], seq 8003272:8003524, ack 4753, win 501, options [nop,nop,TS val 3770132685 ecr 827784051], length 252
17:08:51.856023 IP 68.183.205.32.ssh > cpe00fc8d483dd3-cm00fc8d483dd0.cpe.net.cable.rogers.com.54786: Flags [P.], seq 8003524:8003776, ack 4753, win 501, options [nop,nop,TS val 3770132685 ecr 827784051], length 252
17:08:51.856080 IP 68.183.205.32.ssh > cpe00fc8d483dd3-cm00fc8d483dd0.cpe.net.cable.rogers.com.54786: Flags [P.], seq 8003776:8004028, ack 4753, win 501, options [nop,nop,TS val 3770132685 ecr 827784051], length 252
17:08:51.856128 IP 68.183.205.32.ssh > cpe00fc8d483dd3-cm00fc8d483dd0.cpe.net.cable.rogers.com.54786: Flags [P.], seq 8004028:8004280, ack 4753, win 501, options [nop,nop,TS val 3770132685 ecr 827784051], length 252
17:08:51.856172 IP 68.183.205.32.ssh > cpe00fc8d483dd3-cm00fc8d483dd0.cpe.net.cable.rogers.com.54786: Flags [P.], seq 8004280:8004532, ack 4753, win 501, options [nop,nop,TS val 3770132685 ecr 827784051], length 252
17:08:51.856217 IP 68.183.205.32.ssh > cpe00fc8d483dd3-cm00fc8d483dd0.cpe.net.cable.rogers.com.54786: Flags [P.], seq 8004532:8004784, ack 4753, win 501, options [nop,nop,TS val 3770132685 ecr 827784051], length 252
17:08:51.856261 IP 68.183.205.32.ssh > cpe00fc8d483dd3-cm00fc8d483dd0.cpe.net.cable.rogers.com.54786: Flags [P.], seq 8004784:8005036, ack 4753, win 501, options [nop,nop,TS val 3770132685 ecr 827784051], length 252
17:08:51.856306 IP 68.183.205.32.ssh > cpe00fc8d483dd3-cm00fc8d483dd0.cpe.net.cable.rogers.com.54786: Flags [P.], seq 8005036:8005288, ack 4753, win 501, options [nop,nop,TS val 3770132685 ecr 827784051], length 252
17:08:51.856366 IP 68.183.205.32.ssh > cpe00fc8d483dd3-cm00fc8d483dd0.cpe.net.cable.rogers.com.54786: Flags [P.], seq 8005288:8005540, ack 4753, win 501, options [nop,nop,TS val 3770132685 ecr 827784051], length 252
17:08:51.856412 IP 68.183.205.32.ssh > cpe00fc8d483dd3-cm00fc8d483dd0.cpe.net.cable.rogers.com.54786: Flags [P.], seq 8005540:8005792, ack 4753, win 501, options [nop,nop,TS val 3770132685 ecr 827784051], length 252
17:08:51.856458 IP 68.183.205.32.ssh > cpe00fc8d483dd3-cm00fc8d483dd0.cpe.net.cable.rogers.com.54786: Flags [P.], seq 8005792:8006044, ack 4753, win 501, options [nop,nop,TS val 3770132685 ecr 827784051], length 252
17:08:51.856501 IP 68.183.205.32.ssh > cpe00fc8d483dd3-cm00fc8d483dd0.cpe.net.cable.rogers.com.54786: Flags [P.], seq 8006044:8006296, ack 4753, win 501, options [nop,nop,TS val 3770132685 ecr 827784051], length 252
17:08:51.856547 IP 68.183.205.32.ssh > cpe00fc8d483dd3-cm00fc8d483dd0.cpe.net.cable.rogers.com.54786: Flags [P.], seq 8006296:8006548, ack 4753, win 501, options [nop,nop,TS val 3770132685 ecr 827784051], length 252
17:08:51.856595 IP 68.183.205.32.ssh > cpe00fc8d483dd3-cm00fc8d483dd0.cpe.net.cable.rogers.com.54786: Flags [P.], seq 8006548:8006800, ack 4753, win 501, options [nop,nop,TS val 3770132686 ecr 827784051], length 252
17:08:51.856638 IP 68.183.205.32.ssh > cpe00fc8d483dd3-cm00fc8d483dd0.cpe.net.cable.rogers.com.54786: Flags [P.], seq 8006800:8007052, ack 4753, win 501, options [nop,nop,TS val 3770132686 ecr 827784051], length 252
17:08:51.856681 IP 68.183.205.32.ssh > cpe00fc8d483dd3-cm00fc8d483dd0.cpe.net.cable.rogers.com.54786: Flags [P.], seq 8007052:8007304, ack 4753, win 501, options [nop,nop,TS val 3770132686 ecr 827784051], length 252
17:08:51.856727 IP 68.183.205.32.ssh > cpe00fc8d483dd3-cm00fc8d483dd0.cpe.net.cable.rogers.com.54786: Flags [P.], seq 8007304:8007556, ack 4753, win 501, options [nop,nop,TS val 3770132686 ecr 827784051], length 252
17:08:51.856772 IP 68.183.205.32.ssh > cpe00fc8d483dd3-cm00fc8d483dd0.cpe.net.cable.rogers.com.54786: Flags [P.], seq 8007556:8007808, ack 4753, win 501, options [nop,nop,TS val 3770132686 ecr 827784051], length 252
17:08:51.856819 IP 68.183.205.32.ssh > cpe00fc8d483dd3-cm00fc8d483dd0.cpe.net.cable.rogers.com.54786: Flags [P.], seq 8007808:8008060, ack 4753, win 501, options [nop,nop,TS val 3770132686 ecr 827784051], length 252
17:08:51.856862 IP 68.183.205.32.ssh > cpe00fc8d483dd3-cm00fc8d483dd0.cpe.net.cable.rogers.com.54786: Flags [P.], seq 8008060:8008312, ack 4753, win 501, options [nop,nop,TS val 3770132686 ecr 827784051], length 252
17:08:51.856906 IP 68.183.205.32.ssh > cpe00fc8d483dd3-cm00fc8d483dd0.cpe.net.cable.rogers.com.54786: Flags [P.], seq 8008312:8008564, ack 4753, win 501, options [nop,nop,TS val 3770132686 ecr 827784051], length 252
17:08:51.856952 IP 68.183.205.32.ssh > cpe00fc8d483dd3-cm00fc8d483dd0.cpe.net.cable.rogers.com.54786: Flags [P.], seq 8008564:8008816, ack 4753, win 501, options [nop,nop,TS val 3770132686 ecr 827784051], length 252
17:08:51.856995 IP 68.183.205.32.ssh > cpe00fc8d483dd3-cm00fc8d483dd0.cpe.net.cable.rogers.com.54786: Flags [P.], seq 8008816:8009068, ack 4753, win 501, options [nop,nop,TS val 3770132686 ecr 827784051], length 252
17:08:51.857052 IP 68.183.205.32.ssh > cpe00fc8d483dd3-cm00fc8d483dd0.cpe.net.cable.rogers.com.54786: Flags [P.], seq 8009068:8009320, ack 4753, win 501, options [nop,nop,TS val 3770132686 ecr 827784051], length 252
17:08:51.857104 IP 68.183.205.32.ssh > cpe00fc8d483dd3-cm00fc8d483dd0.cpe.net.cable.rogers.com.54786: Flags [P.], seq 8009320:8009572, ack 4753, win 501, options [nop,nop,TS val 3770132686 ecr 827784051], length 252
17:08:51.857151 IP 68.183.205.32.ssh > cpe00fc8d483dd3-cm00fc8d483dd0.cpe.net.cable.rogers.com.54786: Flags [P.], seq 8009572:8009824, ack 4753, win 501, options [nop,nop,TS val 3770132686 ecr 827784051], length 252
17:08:51.857196 IP 68.183.205.32.ssh > cpe00fc8d483dd3-cm00fc8d483dd0.cpe.net.cable.rogers.com.54786: Flags [P.], seq 8009824:8010076, ack 4753, win 501, options [nop,nop,TS val 3770132686 ecr 827784051], length 252
17:08:51.857240 IP 68.183.205.32.ssh > cpe00fc8d483dd3-cm00fc8d483dd0.cpe.net.cable.rogers.com.54786: Flags [P.], seq 8010076:8010328, ack 4753, win 501, options [nop,nop,TS val 3770132686 ecr 827784051], length 252
17:08:51.857288 IP 68.183.205.32.ssh > cpe00fc8d483dd3-cm00fc8d483dd0.cpe.net.cable.rogers.com.54786: Flags [P.], seq 8010328:8010580, ack 4753, win 501, options [nop,nop,TS val 3770132686 ecr 827784051], length 252
17:08:51.857333 IP 68.183.205.32.ssh > cpe00fc8d483dd3-cm00fc8d483dd0.cpe.net.cable.rogers.com.54786: Flags [P.], seq 8010580:8010832, ack 4753, win 501, options [nop,nop,TS val 3770132686 ecr 827784051], length 252
17:08:51.857376 IP 68.183.205.32.ssh > cpe00fc8d483dd3-cm00fc8d483dd0.cpe.net.cable.rogers.com.54786: Flags [P.], seq 8010832:8011084, ack 4753, win 501, options [nop,nop,TS val 3770132686 ecr 827784051], length 252
17:08:51.857418 IP 68.183.205.32.ssh > cpe00fc8d483dd3-cm00fc8d483dd0.cpe.net.cable.rogers.com.54786: Flags [P.], seq 8011084:8011336, ack 4753, win 501, options [nop,nop,TS val 3770132686 ecr 827784051], length 252
17:08:51.857464 IP 68.183.205.32.ssh > cpe00fc8d483dd3-cm00fc8d483dd0.cpe.net.cable.rogers.com.54786: Flags [P.], seq 8011336:8011588, ack 4753, win 501, options [nop,nop,TS val 3770132686 ecr 827784051], length 252
17:08:51.857510 IP 68.183.205.32.ssh > cpe00fc8d483dd3-cm00fc8d483dd0.cpe.net.cable.rogers.com.54786: Flags [P.], seq 8011588:8011840, ack 4753, win 501, options [nop,nop,TS val 3770132686 ecr 827784051], length 252
17:08:51.857558 IP 68.183.205.32.ssh > cpe00fc8d483dd3-cm00fc8d483dd0.cpe.net.cable.rogers.com.54786: Flags [P.], seq 8011840:8012092, ack 4753, win 501, options [nop,nop,TS val 3770132686 ecr 827784051], length 252
17:08:51.857603 IP 68.183.205.32.ssh > cpe00fc8d483dd3-cm00fc8d483dd0.cpe.net.cable.rogers.com.54786: Flags [P.], seq 8012092:8012344, ack 4753, win 501, options [nop,nop,TS val 3770132687 ecr 827784051], length 252
17:08:51.857663 IP 68.183.205.32.ssh > cpe00fc8d483dd3-cm00fc8d483dd0.cpe.net.cable.rogers.com.54786: Flags [P.], seq 8012344:8012596, ack 4753, win 501, options [nop,nop,TS val 3770132687 ecr 827784051], length 252
17:08:51.857716 IP 68.183.205.32.ssh > cpe00fc8d483dd3-cm00fc8d483dd0.cpe.net.cable.rogers.com.54786: Flags [P.], seq 8012596:8012848, ack 4753, win 501, options [nop,nop,TS val 3770132687 ecr 827784051], length 252
17:08:51.857761 IP 68.183.205.32.ssh > cpe00fc8d483dd3-cm00fc8d483dd0.cpe.net.cable.rogers.com.54786: Flags [P.], seq 8012848:8013100, ack 4753, win 501, options [nop,nop,TS val 3770132687 ecr 827784051], length 252
17:08:51.857779 IP cpe00fc8d483dd3-cm00fc8d483dd0.cpe.net.cable.rogers.com.54786 > 68.183.205.32.ssh: Flags [.], ack 7909164, win 37094, options [nop,nop,TS val 827784063 ecr 3770132664], length 0
17:08:51.857789 IP cpe00fc8d483dd3-cm00fc8d483dd0.cpe.net.cable.rogers.com.54786 > 68.183.205.32.ssh: Flags [P.], seq 4753:4789, ack 7909164, win 37094, options [nop,nop,TS val 827784063 ecr 3770132664], length 36
17:08:51.857793 IP cpe00fc8d483dd3-cm00fc8d483dd0.cpe.net.cable.rogers.com.54786 > 68.183.205.32.ssh: Flags [.], ack 7961692, win 37094, options [nop,nop,TS val 827784071 ecr 3770132673], length 0
17:08:51.857992 IP 68.183.205.32.ssh > cpe00fc8d483dd3-cm00fc8d483dd0.cpe.net.cable.rogers.com.54786: Flags [P.], seq 8013100:8013968, ack 4789, win 501, options [nop,nop,TS val 3770132687 ecr 827784063], length 868
17:08:51.858073 IP 68.183.205.32.ssh > cpe00fc8d483dd3-cm00fc8d483dd0.cpe.net.cable.rogers.com.54786: Flags [P.], seq 8013968:8014220, ack 4789, win 501, options [nop,nop,TS val 3770132687 ecr 827784063], length 252
17:08:51.858123 IP 68.183.205.32.ssh > cpe00fc8d483dd3-cm00fc8d483dd0.cpe.net.cable.rogers.com.54786: Flags [P.], seq 8014220:8014472, ack 4789, win 501, options [nop,nop,TS val 3770132687 ecr 827784063], length 252
17:08:51.858167 IP 68.183.205.32.ssh > cpe00fc8d483dd3-cm00fc8d483dd0.cpe.net.cable.rogers.com.54786: Flags [P.], seq 8014472:8014724, ack 4789, win 501, options [nop,nop,TS val 3770132687 ecr 827784063], length 252
17:08:51.858211 IP 68.183.205.32.ssh > cpe00fc8d483dd3-cm00fc8d483dd0.cpe.net.cable.rogers.com.54786: Flags [P.], seq 8014724:8014976, ack 4789, win 501, options [nop,nop,TS val 3770132687 ecr 827784063], length 252
17:08:51.858256 IP 68.183.205.32.ssh > cpe00fc8d483dd3-cm00fc8d483dd0.cpe.net.cable.rogers.com.54786: Flags [P.], seq 8014976:8015228, ack 4789, win 501, options [nop,nop,TS val 3770132687 ecr 827784063], length 252
17:08:51.858298 IP 68.183.205.32.ssh > cpe00fc8d483dd3-cm00fc8d483dd0.cpe.net.cable.rogers.com.54786: Flags [P.], seq 8015228:8015480, ack 4789, win 501, options [nop,nop,TS val 3770132687 ecr 827784063], length 252
17:08:51.858342 IP 68.183.205.32.ssh > cpe00fc8d483dd3-cm00fc8d483dd0.cpe.net.cable.rogers.com.54786: Flags [P.], seq 8015480:8015732, ack 4789, win 501, options [nop,nop,TS val 3770132687 ecr 827784063], length 252
17:08:51.858390 IP 68.183.205.32.ssh > cpe00fc8d483dd3-cm00fc8d483dd0.cpe.net.cable.rogers.com.54786: Flags [P.], seq 8015732:8015984, ack 4789, win 501, options [nop,nop,TS val 3770132687 ecr 827784063], length 252
17:08:51.858456 IP 68.183.205.32.ssh > cpe00fc8d483dd3-cm00fc8d483dd0.cpe.net.cable.rogers.com.54786: Flags [P.], seq 8015984:8016236, ack 4789, win 501, options [nop,nop,TS val 3770132687 ecr 827784063], length 252
17:08:51.858512 IP 68.183.205.32.ssh > cpe00fc8d483dd3-cm00fc8d483dd0.cpe.net.cable.rogers.com.54786: Flags [P.], seq 8016236:8016488, ack 4789, win 501, options [nop,nop,TS val 3770132687 ecr 827784063], length 252
17:08:51.858570 IP 68.183.205.32.ssh > cpe00fc8d483dd3-cm00fc8d483dd0.cpe.net.cable.rogers.com.54786: Flags [P.], seq 8016488:8016740, ack 4789, win 501, options [nop,nop,TS val 3770132688 ecr 827784063], length 252
17:08:51.858633 IP 68.183.205.32.ssh > cpe00fc8d483dd3-cm00fc8d483dd0.cpe.net.cable.rogers.com.54786: Flags [P.], seq 8016740:8016992, ack 4789, win 501, options [nop,nop,TS val 3770132688 ecr 827784063], length 252
17:08:51.858679 IP 68.183.205.32.ssh > cpe00fc8d483dd3-cm00fc8d483dd0.cpe.net.cable.rogers.com.54786: Flags [P.], seq 8016992:8017244, ack 4789, win 501, options [nop,nop,TS val 3770132688 ecr 827784063], length 252
17:08:51.858744 IP 68.183.205.32.ssh > cpe00fc8d483dd3-cm00fc8d483dd0.cpe.net.cable.rogers.com.54786: Flags [P.], seq 8017244:8017496, ack 4789, win 501, options [nop,nop,TS val 3770132688 ecr 827784063], length 252
17:08:51.858803 IP 68.183.205.32.ssh > cpe00fc8d483dd3-cm00fc8d483dd0.cpe.net.cable.rogers.com.54786: Flags [P.], seq 8017496:8017748, ack 4789, win 501, options [nop,nop,TS val 3770132688 ecr 827784063], length 252
17:08:51.858858 IP 68.183.205.32.ssh > cpe00fc8d483dd3-cm00fc8d483dd0.cpe.net.cable.rogers.com.54786: Flags [P.], seq 8017748:8018000, ack 4789, win 501, options [nop,nop,TS val 3770132688 ecr 827784063], length 252
17:08:51.858901 IP 68.183.205.32.ssh > cpe00fc8d483dd3-cm00fc8d483dd0.cpe.net.cable.rogers.com.54786: Flags [P.], seq 8018000:8018252, ack 4789, win 501, options [nop,nop,TS val 3770132688 ecr 827784063], length 252
17:08:51.858944 IP 68.183.205.32.ssh > cpe00fc8d483dd3-cm00fc8d483dd0.cpe.net.cable.rogers.com.54786: Flags [P.], seq 8018252:8018504, ack 4789, win 501, options [nop,nop,TS val 3770132688 ecr 827784063], length 252
17:08:51.858991 IP 68.183.205.32.ssh > cpe00fc8d483dd3-cm00fc8d483dd0.cpe.net.cable.rogers.com.54786: Flags [P.], seq 8018504:8018756, ack 4789, win 501, options [nop,nop,TS val 3770132688 ecr 827784063], length 252
17:08:51.859039 IP 68.183.205.32.ssh > cpe00fc8d483dd3-cm00fc8d483dd0.cpe.net.cable.rogers.com.54786: Flags [P.], seq 8018756:8019008, ack 4789, win 501, options [nop,nop,TS val 3770132688 ecr 827784063], length 252
17:08:51.859105 IP 68.183.205.32.ssh > cpe00fc8d483dd3-cm00fc8d483dd0.cpe.net.cable.rogers.com.54786: Flags [P.], seq 8019008:8019260, ack 4789, win 501, options [nop,nop,TS val 3770132688 ecr 827784063], length 252
17:08:51.859157 IP 68.183.205.32.ssh > cpe00fc8d483dd3-cm00fc8d483dd0.cpe.net.cable.rogers.com.54786: Flags [P.], seq 8019260:8019512, ack 4789, win 501, options [nop,nop,TS val 3770132688 ecr 827784063], length 252
17:08:51.859211 IP 68.183.205.32.ssh > cpe00fc8d483dd3-cm00fc8d483dd0.cpe.net.cable.rogers.com.54786: Flags [P.], seq 8019512:8019764, ack 4789, win 501, options [nop,nop,TS val 3770132688 ecr 827784063], length 252
17:08:51.859263 IP 68.183.205.32.ssh > cpe00fc8d483dd3-cm00fc8d483dd0.cpe.net.cable.rogers.com.54786: Flags [P.], seq 8019764:8020016, ack 4789, win 501, options [nop,nop,TS val 3770132688 ecr 827784063], length 252
17:08:51.859311 IP 68.183.205.32.ssh > cpe00fc8d483dd3-cm00fc8d483dd0.cpe.net.cable.rogers.com.54786: Flags [P.], seq 8020016:8020268, ack 4789, win 501, options [nop,nop,TS val 3770132688 ecr 827784063], length 252
17:08:51.859360 IP 68.183.205.32.ssh > cpe00fc8d483dd3-cm00fc8d483dd0.cpe.net.cable.rogers.com.54786: Flags [P.], seq 8020268:8020520, ack 4789, win 501, options [nop,nop,TS val 3770132688 ecr 827784063], length 252
17:08:51.859409 IP 68.183.205.32.ssh > cpe00fc8d483dd3-cm00fc8d483dd0.cpe.net.cable.rogers.com.54786: Flags [P.], seq 8020520:8020772, ack 4789, win 501, options [nop,nop,TS val 3770132688 ecr 827784063], length 252
17:08:51.859463 IP 68.183.205.32.ssh > cpe00fc8d483dd3-cm00fc8d483dd0.cpe.net.cable.rogers.com.54786: Flags [P.], seq 8020772:8021024, ack 4789, win 501, options [nop,nop,TS val 3770132688 ecr 827784063], length 252
17:08:51.859517 IP 68.183.205.32.ssh > cpe00fc8d483dd3-cm00fc8d483dd0.cpe.net.cable.rogers.com.54786: Flags [P.], seq 8021024:8021276, ack 4789, win 501, options [nop,nop,TS val 3770132688 ecr 827784063], length 252
17:08:51.859575 IP 68.183.205.32.ssh > cpe00fc8d483dd3-cm00fc8d483dd0.cpe.net.cable.rogers.com.54786: Flags [P.], seq 8021276:8021528, ack 4789, win 501, options [nop,nop,TS val 3770132689 ecr 827784063], length 252
17:08:51.859622 IP 68.183.205.32.ssh > cpe00fc8d483dd3-cm00fc8d483dd0.cpe.net.cable.rogers.com.54786: Flags [P.], seq 8021528:8021780, ack 4789, win 501, options [nop,nop,TS val 3770132689 ecr 827784063], length 252
17:08:51.859673 IP 68.183.205.32.ssh > cpe00fc8d483dd3-cm00fc8d483dd0.cpe.net.cable.rogers.com.54786: Flags [P.], seq 8021780:8022032, ack 4789, win 501, options [nop,nop,TS val 3770132689 ecr 827784063], length 252
17:08:51.859726 IP 68.183.205.32.ssh > cpe00fc8d483dd3-cm00fc8d483dd0.cpe.net.cable.rogers.com.54786: Flags [P.], seq 8022032:8022284, ack 4789, win 501, options [nop,nop,TS val 3770132689 ecr 827784063], length 252
17:08:51.859782 IP 68.183.205.32.ssh > cpe00fc8d483dd3-cm00fc8d483dd0.cpe.net.cable.rogers.com.54786: Flags [P.], seq 8022284:8022536, ack 4789, win 501, options [nop,nop,TS val 3770132689 ecr 827784063], length 252
17:08:51.859834 IP 68.183.205.32.ssh > cpe00fc8d483dd3-cm00fc8d483dd0.cpe.net.cable.rogers.com.54786: Flags [P.], seq 8022536:8022788, ack 4789, win 501, options [nop,nop,TS val 3770132689 ecr 827784063], length 252
17:08:51.859907 IP 68.183.205.32.ssh > cpe00fc8d483dd3-cm00fc8d483dd0.cpe.net.cable.rogers.com.54786: Flags [P.], seq 8022788:8023040, ack 4789, win 501, options [nop,nop,TS val 3770132689 ecr 827784063], length 252
17:08:51.859955 IP 68.183.205.32.ssh > cpe00fc8d483dd3-cm00fc8d483dd0.cpe.net.cable.rogers.com.54786: Flags [P.], seq 8023040:8023292, ack 4789, win 501, options [nop,nop,TS val 3770132689 ecr 827784063], length 252
17:08:51.860029 IP 68.183.205.32.ssh > cpe00fc8d483dd3-cm00fc8d483dd0.cpe.net.cable.rogers.com.54786: Flags [P.], seq 8023292:8023544, ack 4789, win 501, options [nop,nop,TS val 3770132689 ecr 827784063], length 252
17:08:51.860100 IP 68.183.205.32.ssh > cpe00fc8d483dd3-cm00fc8d483dd0.cpe.net.cable.rogers.com.54786: Flags [P.], seq 8023544:8023796, ack 4789, win 501, options [nop,nop,TS val 3770132689 ecr 827784063], length 252
17:08:51.860194 IP 68.183.205.32.ssh > cpe00fc8d483dd3-cm00fc8d483dd0.cpe.net.cable.rogers.com.54786: Flags [P.], seq 8023796:8024048, ack 4789, win 501, options [nop,nop,TS val 3770132689 ecr 827784063], length 252
17:08:51.860272 IP 68.183.205.32.ssh > cpe00fc8d483dd3-cm00fc8d483dd0.cpe.net.cable.rogers.com.54786: Flags [P.], seq 8024048:8024300, ack 4789, win 501, options [nop,nop,TS val 3770132689 ecr 827784063], length 252
17:08:51.860368 IP 68.183.205.32.ssh > cpe00fc8d483dd3-cm00fc8d483dd0.cpe.net.cable.rogers.com.54786: Flags [P.], seq 8024300:8024552, ack 4789, win 501, options [nop,nop,TS val 3770132689 ecr 827784063], length 252
17:08:51.860442 IP 68.183.205.32.ssh > cpe00fc8d483dd3-cm00fc8d483dd0.cpe.net.cable.rogers.com.54786: Flags [P.], seq 8024552:8024804, ack 4789, win 501, options [nop,nop,TS val 3770132689 ecr 827784063], length 252
17:08:51.860519 IP 68.183.205.32.ssh > cpe00fc8d483dd3-cm00fc8d483dd0.cpe.net.cable.rogers.com.54786: Flags [P.], seq 8024804:8025056, ack 4789, win 501, options [nop,nop,TS val 3770132689 ecr 827784063], length 252
17:08:51.860583 IP 68.183.205.32.ssh > cpe00fc8d483dd3-cm00fc8d483dd0.cpe.net.cable.rogers.com.54786: Flags [P.], seq 8025056:8025308, ack 4789, win 501, options [nop,nop,TS val 3770132690 ecr 827784063], length 252
17:08:51.860631 IP 68.183.205.32.ssh > cpe00fc8d483dd3-cm00fc8d483dd0.cpe.net.cable.rogers.com.54786: Flags [P.], seq 8025308:8025560, ack 4789, win 501, options [nop,nop,TS val 3770132690 ecr 827784063], length 252
17:08:51.860676 IP 68.183.205.32.ssh > cpe00fc8d483dd3-cm00fc8d483dd0.cpe.net.cable.rogers.com.54786: Flags [P.], seq 8025560:8025812, ack 4789, win 501, options [nop,nop,TS val 3770132690 ecr 827784063], length 252
17:08:51.860724 IP 68.183.205.32.ssh > cpe00fc8d483dd3-cm00fc8d483dd0.cpe.net.cable.rogers.com.54786: Flags [P.], seq 8025812:8026064, ack 4789, win 501, options [nop,nop,TS val 3770132690 ecr 827784063], length 252
17:08:51.860768 IP 68.183.205.32.ssh > cpe00fc8d483dd3-cm00fc8d483dd0.cpe.net.cable.rogers.com.54786: Flags [P.], seq 8026064:8026316, ack 4789, win 501, options [nop,nop,TS val 3770132690 ecr 827784063], length 252
17:08:51.860812 IP 68.183.205.32.ssh > cpe00fc8d483dd3-cm00fc8d483dd0.cpe.net.cable.rogers.com.54786: Flags [P.], seq 8026316:8026568, ack 4789, win 501, options [nop,nop,TS val 3770132690 ecr 827784063], length 252
17:08:51.860857 IP 68.183.205.32.ssh > cpe00fc8d483dd3-cm00fc8d483dd0.cpe.net.cable.rogers.com.54786: Flags [P.], seq 8026568:8026820, ack 4789, win 501, options [nop,nop,TS val 3770132690 ecr 827784063], length 252
17:08:51.860905 IP 68.183.205.32.ssh > cpe00fc8d483dd3-cm00fc8d483dd0.cpe.net.cable.rogers.com.54786: Flags [P.], seq 8026820:8027072, ack 4789, win 501, options [nop,nop,TS val 3770132690 ecr 827784063], length 252
17:08:51.860981 IP 68.183.205.32.ssh > cpe00fc8d483dd3-cm00fc8d483dd0.cpe.net.cable.rogers.com.54786: Flags [P.], seq 8027072:8027324, ack 4789, win 501, options [nop,nop,TS val 3770132690 ecr 827784063], length 252
17:08:51.861050 IP 68.183.205.32.ssh > cpe00fc8d483dd3-cm00fc8d483dd0.cpe.net.cable.rogers.com.54786: Flags [P.], seq 8027324:8027576, ack 4789, win 501, options [nop,nop,TS val 3770132690 ecr 827784063], length 252
17:08:51.861121 IP 68.183.205.32.ssh > cpe00fc8d483dd3-cm00fc8d483dd0.cpe.net.cable.rogers.com.54786: Flags [P.], seq 8027576:8027828, ack 4789, win 501, options [nop,nop,TS val 3770132690 ecr 827784063], length 252
17:08:51.861186 IP 68.183.205.32.ssh > cpe00fc8d483dd3-cm00fc8d483dd0.cpe.net.cable.rogers.com.54786: Flags [P.], seq 8027828:8028080, ack 4789, win 501, options [nop,nop,TS val 3770132690 ecr 827784063], length 252
17:08:51.861264 IP 68.183.205.32.ssh > cpe00fc8d483dd3-cm00fc8d483dd0.cpe.net.cable.rogers.com.54786: Flags [P.], seq 8028080:8028332, ack 4789, win 501, options [nop,nop,TS val 3770132690 ecr 827784063], length 252
17:08:51.861333 IP 68.183.205.32.ssh > cpe00fc8d483dd3-cm00fc8d483dd0.cpe.net.cable.rogers.com.54786: Flags [P.], seq 8028332:8028584, ack 4789, win 501, options [nop,nop,TS val 3770132690 ecr 827784063], length 252
17:08:51.861395 IP 68.183.205.32.ssh > cpe00fc8d483dd3-cm00fc8d483dd0.cpe.net.cable.rogers.com.54786: Flags [P.], seq 8028584:8028836, ack 4789, win 501, options [nop,nop,TS val 3770132690 ecr 827784063], length 252
17:08:51.861467 IP 68.183.205.32.ssh > cpe00fc8d483dd3-cm00fc8d483dd0.cpe.net.cable.rogers.com.54786: Flags [P.], seq 8028836:8029088, ack 4789, win 501, options [nop,nop,TS val 3770132690 ecr 827784063], length 252
17:08:51.861540 IP 68.183.205.32.ssh > cpe00fc8d483dd3-cm00fc8d483dd0.cpe.net.cable.rogers.com.54786: Flags [P.], seq 8029088:8029340, ack 4789, win 501, options [nop,nop,TS val 3770132690 ecr 827784063], length 252
17:08:51.861617 IP 68.183.205.32.ssh > cpe00fc8d483dd3-cm00fc8d483dd0.cpe.net.cable.rogers.com.54786: Flags [P.], seq 8029340:8029592, ack 4789, win 501, options [nop,nop,TS val 3770132691 ecr 827784063], length 252
17:08:51.861690 IP 68.183.205.32.ssh > cpe00fc8d483dd3-cm00fc8d483dd0.cpe.net.cable.rogers.com.54786: Flags [P.], seq 8029592:8029844, ack 4789, win 501, options [nop,nop,TS val 3770132691 ecr 827784063], length 252
17:08:51.861763 IP 68.183.205.32.ssh > cpe00fc8d483dd3-cm00fc8d483dd0.cpe.net.cable.rogers.com.54786: Flags [P.], seq 8029844:8030096, ack 4789, win 501, options [nop,nop,TS val 3770132691 ecr 827784063], length 252
17:08:51.861832 IP 68.183.205.32.ssh > cpe00fc8d483dd3-cm00fc8d483dd0.cpe.net.cable.rogers.com.54786: Flags [P.], seq 8030096:8030348, ack 4789, win 501, options [nop,nop,TS val 3770132691 ecr 827784063], length 252
17:08:51.861908 IP 68.183.205.32.ssh > cpe00fc8d483dd3-cm00fc8d483dd0.cpe.net.cable.rogers.com.54786: Flags [P.], seq 8030348:8030600, ack 4789, win 501, options [nop,nop,TS val 3770132691 ecr 827784063], length 252
17:08:51.861972 IP 68.183.205.32.ssh > cpe00fc8d483dd3-cm00fc8d483dd0.cpe.net.cable.rogers.com.54786: Flags [P.], seq 8030600:8030852, ack 4789, win 501, options [nop,nop,TS val 3770132691 ecr 827784063], length 252
17:08:51.862037 IP 68.183.205.32.ssh > cpe00fc8d483dd3-cm00fc8d483dd0.cpe.net.cable.rogers.com.54786: Flags [P.], seq 8030852:8031104, ack 4789, win 501, options [nop,nop,TS val 3770132691 ecr 827784063], length 252
17:08:51.862107 IP 68.183.205.32.ssh > cpe00fc8d483dd3-cm00fc8d483dd0.cpe.net.cable.rogers.com.54786: Flags [P.], seq 8031104:8031356, ack 4789, win 501, options [nop,nop,TS val 3770132691 ecr 827784063], length 252
17:08:51.862171 IP 68.183.205.32.ssh > cpe00fc8d483dd3-cm00fc8d483dd0.cpe.net.cable.rogers.com.54786: Flags [P.], seq 8031356:8031608, ack 4789, win 501, options [nop,nop,TS val 3770132691 ecr 827784063], length 252
17:08:51.862238 IP 68.183.205.32.ssh > cpe00fc8d483dd3-cm00fc8d483dd0.cpe.net.cable.rogers.com.54786: Flags [P.], seq 8031608:8031860, ack 4789, win 501, options [nop,nop,TS val 3770132691 ecr 827784063], length 252
17:08:51.862305 IP 68.183.205.32.ssh > cpe00fc8d483dd3-cm00fc8d483dd0.cpe.net.cable.rogers.com.54786: Flags [P.], seq 8031860:8032112, ack 4789, win 501, options [nop,nop,TS val 3770132691 ecr 827784063], length 252
17:08:51.862375 IP 68.183.205.32.ssh > cpe00fc8d483dd3-cm00fc8d483dd0.cpe.net.cable.rogers.com.54786: Flags [P.], seq 8032112:8032364, ack 4789, win 501, options [nop,nop,TS val 3770132691 ecr 827784063], length 252
17:08:51.862449 IP 68.183.205.32.ssh > cpe00fc8d483dd3-cm00fc8d483dd0.cpe.net.cable.rogers.com.54786: Flags [P.], seq 8032364:8032616, ack 4789, win 501, options [nop,nop,TS val 3770132691 ecr 827784063], length 252
17:08:51.862516 IP 68.183.205.32.ssh > cpe00fc8d483dd3-cm00fc8d483dd0.cpe.net.cable.rogers.com.54786: Flags [P.], seq 8032616:8032868, ack 4789, win 501, options [nop,nop,TS val 3770132691 ecr 827784063], length 252
17:08:51.862585 IP 68.183.205.32.ssh > cpe00fc8d483dd3-cm00fc8d483dd0.cpe.net.cable.rogers.com.54786: Flags [P.], seq 8032868:8033120, ack 4789, win 501, options [nop,nop,TS val 3770132692 ecr 827784063], length 252
17:08:51.862633 IP 68.183.205.32.ssh > cpe00fc8d483dd3-cm00fc8d483dd0.cpe.net.cable.rogers.com.54786: Flags [P.], seq 8033120:8033372, ack 4789, win 501, options [nop,nop,TS val 3770132692 ecr 827784063], length 252
17:08:51.862688 IP 68.183.205.32.ssh > cpe00fc8d483dd3-cm00fc8d483dd0.cpe.net.cable.rogers.com.54786: Flags [P.], seq 8033372:8033624, ack 4789, win 501, options [nop,nop,TS val 3770132692 ecr 827784063], length 252
17:08:51.862745 IP 68.183.205.32.ssh > cpe00fc8d483dd3-cm00fc8d483dd0.cpe.net.cable.rogers.com.54786: Flags [P.], seq 8033624:8033876, ack 4789, win 501, options [nop,nop,TS val 3770132692 ecr 827784063], length 252
17:08:51.862801 IP 68.183.205.32.ssh > cpe00fc8d483dd3-cm00fc8d483dd0.cpe.net.cable.rogers.com.54786: Flags [P.], seq 8033876:8034128, ack 4789, win 501, options [nop,nop,TS val 3770132692 ecr 827784063], length 252
17:08:51.862850 IP 68.183.205.32.ssh > cpe00fc8d483dd3-cm00fc8d483dd0.cpe.net.cable.rogers.com.54786: Flags [P.], seq 8034128:8034380, ack 4789, win 501, options [nop,nop,TS val 3770132692 ecr 827784063], length 252
17:08:51.862906 IP 68.183.205.32.ssh > cpe00fc8d483dd3-cm00fc8d483dd0.cpe.net.cable.rogers.com.54786: Flags [P.], seq 8034380:8034632, ack 4789, win 501, options [nop,nop,TS val 3770132692 ecr 827784063], length 252
17:08:51.863010 IP 68.183.205.32.ssh > cpe00fc8d483dd3-cm00fc8d483dd0.cpe.net.cable.rogers.com.54786: Flags [P.], seq 8034632:8034884, ack 4789, win 501, options [nop,nop,TS val 3770132692 ecr 827784063], length 252
17:08:51.863082 IP 68.183.205.32.ssh > cpe00fc8d483dd3-cm00fc8d483dd0.cpe.net.cable.rogers.com.54786: Flags [P.], seq 8034884:8035136, ack 4789, win 501, options [nop,nop,TS val 3770132692 ecr 827784063], length 252
17:08:51.863626 IP 68.183.205.32.ssh > cpe00fc8d483dd3-cm00fc8d483dd0.cpe.net.cable.rogers.com.54786: Flags [P.], seq 8035136:8035388, ack 4789, win 501, options [nop,nop,TS val 3770132693 ecr 827784063], length 252
17:08:51.863723 IP 68.183.205.32.ssh > cpe00fc8d483dd3-cm00fc8d483dd0.cpe.net.cable.rogers.com.54786: Flags [P.], seq 8035388:8035640, ack 4789, win 501, options [nop,nop,TS val 3770132693 ecr 827784063], length 252
17:08:51.863792 IP 68.183.205.32.ssh > cpe00fc8d483dd3-cm00fc8d483dd0.cpe.net.cable.rogers.com.54786: Flags [P.], seq 8035640:8035892, ack 4789, win 501, options [nop,nop,TS val 3770132693 ecr 827784063], length 252
17:08:51.863862 IP 68.183.205.32.ssh > cpe00fc8d483dd3-cm00fc8d483dd0.cpe.net.cable.rogers.com.54786: Flags [P.], seq 8035892:8036144, ack 4789, win 501, options [nop,nop,TS val 3770132693 ecr 827784063], length 252
17:08:51.863911 IP 68.183.205.32.ssh > cpe00fc8d483dd3-cm00fc8d483dd0.cpe.net.cable.rogers.com.54786: Flags [P.], seq 8036144:8036396, ack 4789, win 501, options [nop,nop,TS val 3770132693 ecr 827784063], length 252
17:08:51.863962 IP 68.183.205.32.ssh > cpe00fc8d483dd3-cm00fc8d483dd0.cpe.net.cable.rogers.com.54786: Flags [P.], seq 8036396:8036648, ack 4789, win 501, options [nop,nop,TS val 3770132693 ecr 827784063], length 252
17:08:51.864007 IP 68.183.205.32.ssh > cpe00fc8d483dd3-cm00fc8d483dd0.cpe.net.cable.rogers.com.54786: Flags [P.], seq 8036648:8036900, ack 4789, win 501, options [nop,nop,TS val 3770132693 ecr 827784063], length 252
17:08:51.864254 IP 68.183.205.32.ssh > cpe00fc8d483dd3-cm00fc8d483dd0.cpe.net.cable.rogers.com.54786: Flags [P.], seq 8036900:8037152, ack 4789, win 501, options [nop,nop,TS val 3770132693 ecr 827784063], length 252
^C
31972 packets captured
31987 packets received by filter
9 packets dropped by kernel