tcpdump -i eth0 tcp
17:07:54.221861 IP 68.183.205.32.ssh > cpe00fc8d483dd3-cm00fc8d483dd0.cpe.net.cable.rogers.com.54786: Flags [P.], seq 13227928:13228188, ack 7777, win 501, options [nop,nop,TS val 3770075051 ecr 827727336], length 260
17:07:54.221900 IP 68.183.205.32.ssh > cpe00fc8d483dd3-cm00fc8d483dd0.cpe.net.cable.rogers.com.54786: Flags [P.], seq 13228188:13228448, ack 7777, win 501, options [nop,nop,TS val 3770075051 ecr 827727336], length 260
17:07:54.221940 IP 68.183.205.32.ssh > cpe00fc8d483dd3-cm00fc8d483dd0.cpe.net.cable.rogers.com.54786: Flags [P.], seq 13228448:13228708, ack 7777, win 501, options [nop,nop,TS val 3770075051 ecr 827727336], length 260
17:07:54.221978 IP 68.183.205.32.ssh > cpe00fc8d483dd3-cm00fc8d483dd0.cpe.net.cable.rogers.com.54786: Flags [P.], seq 13228708:13228968, ack 7777, win 501, options [nop,nop,TS val 3770075051 ecr 827727336], length 260
17:07:54.222016 IP 68.183.205.32.ssh > cpe00fc8d483dd3-cm00fc8d483dd0.cpe.net.cable.rogers.com.54786: Flags [P.], seq 13228968:13229228, ack 7777, win 501, options [nop,nop,TS val 3770075051 ecr 827727336], length 260
17:07:54.222059 IP 68.183.205.32.ssh > cpe00fc8d483dd3-cm00fc8d483dd0.cpe.net.cable.rogers.com.54786: Flags [P.], seq 13229228:13229488, ack 7777, win 501, options [nop,nop,TS val 3770075051 ecr 827727336], length 260
17:07:54.222097 IP 68.183.205.32.ssh > cpe00fc8d483dd3-cm00fc8d483dd0.cpe.net.cable.rogers.com.54786: Flags [P.], seq 13229488:13229748, ack 7777, win 501, options [nop,nop,TS val 3770075051 ecr 827727336], length 260
17:07:54.222141 IP 68.183.205.32.ssh > cpe00fc8d483dd3-cm00fc8d483dd0.cpe.net.cable.rogers.com.54786: Flags [P.], seq 13229748:13230008, ack 7777, win 501, options [nop,nop,TS val 3770075051 ecr 827727336], length 260
17:07:54.222180 IP 68.183.205.32.ssh > cpe00fc8d483dd3-cm00fc8d483dd0.cpe.net.cable.rogers.com.54786: Flags [P.], seq 13230008:13230268, ack 7777, win 501, options [nop,nop,TS val 3770075051 ecr 827727336], length 260
17:07:54.222219 IP 68.183.205.32.ssh > cpe00fc8d483dd3-cm00fc8d483dd0.cpe.net.cable.rogers.com.54786: Flags [P.], seq 13230268:13230528, ack 7777, win 501, options [nop,nop,TS val 3770075051 ecr 827727336], length 260
17:07:54.222258 IP 68.183.205.32.ssh > cpe00fc8d483dd3-cm00fc8d483dd0.cpe.net.cable.rogers.com.54786: Flags [P.], seq 13230528:13230788, ack 7777, win 501, options [nop,nop,TS val 3770075051 ecr 827727336], length 260
17:07:54.222296 IP 68.183.205.32.ssh > cpe00fc8d483dd3-cm00fc8d483dd0.cpe.net.cable.rogers.com.54786: Flags [P.], seq 13230788:13231048, ack 7777, win 501, options [nop,nop,TS val 3770075051 ecr 827727336], length 260
17:07:54.222337 IP 68.183.205.32.ssh > cpe00fc8d483dd3-cm00fc8d483dd0.cpe.net.cable.rogers.com.54786: Flags [P.], seq 13231048:13231308, ack 7777, win 501, options [nop,nop,TS val 3770075051 ecr 827727336], length 260
17:07:54.222375 IP 68.183.205.32.ssh > cpe00fc8d483dd3-cm00fc8d483dd0.cpe.net.cable.rogers.com.54786: Flags [P.], seq 13231308:13231568, ack 7777, win 501, options [nop,nop,TS val 3770075051 ecr 827727336], length 260
17:07:54.222415 IP 68.183.205.32.ssh > cpe00fc8d483dd3-cm00fc8d483dd0.cpe.net.cable.rogers.com.54786: Flags [P.], seq 13231568:13231828, ack 7777, win 501, options [nop,nop,TS val 3770075051 ecr 827727336], length 260
17:07:54.222457 IP 68.183.205.32.ssh > cpe00fc8d483dd3-cm00fc8d483dd0.cpe.net.cable.rogers.com.54786: Flags [P.], seq 13231828:13232088, ack 7777, win 501, options [nop,nop,TS val 3770075051 ecr 827727336], length 260
17:07:54.222496 IP 68.183.205.32.ssh > cpe00fc8d483dd3-cm00fc8d483dd0.cpe.net.cable.rogers.com.54786: Flags [P.], seq 13232088:13232348, ack 7777, win 501, options [nop,nop,TS val 3770075051 ecr 827727336], length 260
17:07:54.222537 IP 68.183.205.32.ssh > cpe00fc8d483dd3-cm00fc8d483dd0.cpe.net.cable.rogers.com.54786: Flags [P.], seq 13232348:13232608, ack 7777, win 501, options [nop,nop,TS val 3770075051 ecr 827727336], length 260
17:07:54.222576 IP 68.183.205.32.ssh > cpe00fc8d483dd3-cm00fc8d483dd0.cpe.net.cable.rogers.com.54786: Flags [P.], seq 13232608:13232868, ack 7777, win 501, options [nop,nop,TS val 3770075052 ecr 827727336], length 260
17:07:54.222606 IP cpe00fc8d483dd3-cm00fc8d483dd0.cpe.net.cable.rogers.com.54786 > 68.183.205.32.ssh: Flags [P.], seq 7777:7813, ack 13141936, win 36662, options [nop,nop,TS val 827727345 ecr 3770075026], length 36
17:07:54.222766 IP 68.183.205.32.ssh > cpe00fc8d483dd3-cm00fc8d483dd0.cpe.net.cable.rogers.com.54786: Flags [P.], seq 13232868:13233344, ack 7813, win 501, options [nop,nop,TS val 3770075052 ecr 827727345], length 476
17:07:54.222809 IP 68.183.205.32.ssh > cpe00fc8d483dd3-cm00fc8d483dd0.cpe.net.cable.rogers.com.54786: Flags [P.], seq 13233344:13233604, ack 7813, win 501, options [nop,nop,TS val 3770075052 ecr 827727345], length 260
17:07:54.222849 IP 68.183.205.32.ssh > cpe00fc8d483dd3-cm00fc8d483dd0.cpe.net.cable.rogers.com.54786: Flags [P.], seq 13233604:13233864, ack 7813, win 501, options [nop,nop,TS val 3770075052 ecr 827727345], length 260
17:07:54.222887 IP 68.183.205.32.ssh > cpe00fc8d483dd3-cm00fc8d483dd0.cpe.net.cable.rogers.com.54786: Flags [P.], seq 13233864:13234124, ack 7813, win 501, options [nop,nop,TS val 3770075052 ecr 827727345], length 260
17:07:54.222927 IP 68.183.205.32.ssh > cpe00fc8d483dd3-cm00fc8d483dd0.cpe.net.cable.rogers.com.54786: Flags [P.], seq 13234124:13234384, ack 7813, win 501, options [nop,nop,TS val 3770075052 ecr 827727345], length 260
17:07:54.222966 IP 68.183.205.32.ssh > cpe00fc8d483dd3-cm00fc8d483dd0.cpe.net.cable.rogers.com.54786: Flags [P.], seq 13234384:13234644, ack 7813, win 501, options [nop,nop,TS val 3770075052 ecr 827727345], length 260
17:07:54.223006 IP 68.183.205.32.ssh > cpe00fc8d483dd3-cm00fc8d483dd0.cpe.net.cable.rogers.com.54786: Flags [P.], seq 13234644:13234904, ack 7813, win 501, options [nop,nop,TS val 3770075052 ecr 827727345], length 260
17:07:54.223044 IP 68.183.205.32.ssh > cpe00fc8d483dd3-cm00fc8d483dd0.cpe.net.cable.rogers.com.54786: Flags [P.], seq 13234904:13235164, ack 7813, win 501, options [nop,nop,TS val 3770075052 ecr 827727345], length 260
17:07:54.223082 IP 68.183.205.32.ssh > cpe00fc8d483dd3-cm00fc8d483dd0.cpe.net.cable.rogers.com.54786: Flags [P.], seq 13235164:13235424, ack 7813, win 501, options [nop,nop,TS val 3770075052 ecr 827727345], length 260
17:07:54.223125 IP 68.183.205.32.ssh > cpe00fc8d483dd3-cm00fc8d483dd0.cpe.net.cable.rogers.com.54786: Flags [P.], seq 13235424:13235684, ack 7813, win 501, options [nop,nop,TS val 3770075052 ecr 827727345], length 260
17:07:54.223163 IP 68.183.205.32.ssh > cpe00fc8d483dd3-cm00fc8d483dd0.cpe.net.cable.rogers.com.54786: Flags [P.], seq 13235684:13235944, ack 7813, win 501, options [nop,nop,TS val 3770075052 ecr 827727345], length 260
17:07:54.223201 IP 68.183.205.32.ssh > cpe00fc8d483dd3-cm00fc8d483dd0.cpe.net.cable.rogers.com.54786: Flags [P.], seq 13235944:13236204, ack 7813, win 501, options [nop,nop,TS val 3770075052 ecr 827727345], length 260
17:07:54.223239 IP 68.183.205.32.ssh > cpe00fc8d483dd3-cm00fc8d483dd0.cpe.net.cable.rogers.com.54786: Flags [P.], seq 13236204:13236464, ack 7813, win 501, options [nop,nop,TS val 3770075052 ecr 827727345], length 260
17:07:54.223279 IP 68.183.205.32.ssh > cpe00fc8d483dd3-cm00fc8d483dd0.cpe.net.cable.rogers.com.54786: Flags [P.], seq 13236464:13236724, ack 7813, win 501, options [nop,nop,TS val 3770075052 ecr 827727345], length 260
17:07:54.223317 IP 68.183.205.32.ssh > cpe00fc8d483dd3-cm00fc8d483dd0.cpe.net.cable.rogers.com.54786: Flags [P.], seq 13236724:13236984, ack 7813, win 501, options [nop,nop,TS val 3770075052 ecr 827727345], length 260
17:07:54.223357 IP 68.183.205.32.ssh > cpe00fc8d483dd3-cm00fc8d483dd0.cpe.net.cable.rogers.com.54786: Flags [P.], seq 13236984:13237244, ack 7813, win 501, options [nop,nop,TS val 3770075052 ecr 827727345], length 260
17:07:54.223480 IP 68.183.205.32.ssh > cpe00fc8d483dd3-cm00fc8d483dd0.cpe.net.cable.rogers.com.54786: Flags [P.], seq 13237244:13237504, ack 7813, win 501, options [nop,nop,TS val 3770075052 ecr 827727345], length 260
17:07:54.223523 IP 68.183.205.32.ssh > cpe00fc8d483dd3-cm00fc8d483dd0.cpe.net.cable.rogers.com.54786: Flags [P.], seq 13237504:13237764, ack 7813, win 501, options [nop,nop,TS val 3770075052 ecr 827727345], length 260
17:07:54.223572 IP 68.183.205.32.ssh > cpe00fc8d483dd3-cm00fc8d483dd0.cpe.net.cable.rogers.com.54786: Flags [P.], seq 13237764:13238024, ack 7813, win 501, options [nop,nop,TS val 3770075053 ecr 827727345], length 260
17:07:54.223610 IP 68.183.205.32.ssh > cpe00fc8d483dd3-cm00fc8d483dd0.cpe.net.cable.rogers.com.54786: Flags [P.], seq 13238024:13238284, ack 7813, win 501, options [nop,nop,TS val 3770075053 ecr 827727345], length 260
17:07:54.223649 IP 68.183.205.32.ssh > cpe00fc8d483dd3-cm00fc8d483dd0.cpe.net.cable.rogers.com.54786: Flags [P.], seq 13238284:13238544, ack 7813, win 501, options [nop,nop,TS val 3770075053 ecr 827727345], length 260
17:07:54.223687 IP 68.183.205.32.ssh > cpe00fc8d483dd3-cm00fc8d483dd0.cpe.net.cable.rogers.com.54786: Flags [P.], seq 13238544:13238804, ack 7813, win 501, options [nop,nop,TS val 3770075053 ecr 827727345], length 260
17:07:54.223726 IP 68.183.205.32.ssh > cpe00fc8d483dd3-cm00fc8d483dd0.cpe.net.cable.rogers.com.54786: Flags [P.], seq 13238804:13239064, ack 7813, win 501, options [nop,nop,TS val 3770075053 ecr 827727345], length 260
17:07:54.223764 IP 68.183.205.32.ssh > cpe00fc8d483dd3-cm00fc8d483dd0.cpe.net.cable.rogers.com.54786: Flags [P.], seq 13239064:13239324, ack 7813, win 501, options [nop,nop,TS val 3770075053 ecr 827727345], length 260
17:07:54.223801 IP 68.183.205.32.ssh > cpe00fc8d483dd3-cm00fc8d483dd0.cpe.net.cable.rogers.com.54786: Flags [P.], seq 13239324:13239584, ack 7813, win 501, options [nop,nop,TS val 3770075053 ecr 827727345], length 260
17:07:54.223840 IP 68.183.205.32.ssh > cpe00fc8d483dd3-cm00fc8d483dd0.cpe.net.cable.rogers.com.54786: Flags [P.], seq 13239584:13239844, ack 7813, win 501, options [nop,nop,TS val 3770075053 ecr 827727345], length 260
17:07:54.223879 IP 68.183.205.32.ssh > cpe00fc8d483dd3-cm00fc8d483dd0.cpe.net.cable.rogers.com.54786: Flags [P.], seq 13239844:13240104, ack 7813, win 501, options [nop,nop,TS val 3770075053 ecr 827727345], length 260
17:07:54.223917 IP 68.183.205.32.ssh > cpe00fc8d483dd3-cm00fc8d483dd0.cpe.net.cable.rogers.com.54786: Flags [P.], seq 13240104:13240364, ack 7813, win 501, options [nop,nop,TS val 3770075053 ecr 827727345], length 260
17:07:54.223957 IP 68.183.205.32.ssh > cpe00fc8d483dd3-cm00fc8d483dd0.cpe.net.cable.rogers.com.54786: Flags [P.], seq 13240364:13240624, ack 7813, win 501, options [nop,nop,TS val 3770075053 ecr 827727345], length 260
17:07:54.223996 IP 68.183.205.32.ssh > cpe00fc8d483dd3-cm00fc8d483dd0.cpe.net.cable.rogers.com.54786: Flags [P.], seq 13240624:13240884, ack 7813, win 501, options [nop,nop,TS val 3770075053 ecr 827727345], length 260
17:07:54.224035 IP 68.183.205.32.ssh > cpe00fc8d483dd3-cm00fc8d483dd0.cpe.net.cable.rogers.com.54786: Flags [P.], seq 13240884:13241144, ack 7813, win 501, options [nop,nop,TS val 3770075053 ecr 827727345], length 260
17:07:54.224075 IP 68.183.205.32.ssh > cpe00fc8d483dd3-cm00fc8d483dd0.cpe.net.cable.rogers.com.54786: Flags [P.], seq 13241144:13241404, ack 7813, win 501, options [nop,nop,TS val 3770075053 ecr 827727345], length 260
17:07:54.224113 IP 68.183.205.32.ssh > cpe00fc8d483dd3-cm00fc8d483dd0.cpe.net.cable.rogers.com.54786: Flags [P.], seq 13241404:13241664, ack 7813, win 501, options [nop,nop,TS val 3770075053 ecr 827727345], length 260
17:07:54.224153 IP 68.183.205.32.ssh > cpe00fc8d483dd3-cm00fc8d483dd0.cpe.net.cable.rogers.com.54786: Flags [P.], seq 13241664:13241924, ack 7813, win 501, options [nop,nop,TS val 3770075053 ecr 827727345], length 260
17:07:54.224191 IP 68.183.205.32.ssh > cpe00fc8d483dd3-cm00fc8d483dd0.cpe.net.cable.rogers.com.54786: Flags [P.], seq 13241924:13242184, ack 7813, win 501, options [nop,nop,TS val 3770075053 ecr 827727345], length 260
17:07:54.224231 IP 68.183.205.32.ssh > cpe00fc8d483dd3-cm00fc8d483dd0.cpe.net.cable.rogers.com.54786: Flags [P.], seq 13242184:13242444, ack 7813, win 501, options [nop,nop,TS val 3770075053 ecr 827727345], length 260
17:07:54.224268 IP 68.183.205.32.ssh > cpe00fc8d483dd3-cm00fc8d483dd0.cpe.net.cable.rogers.com.54786: Flags [P.], seq 13242444:13242704, ack 7813, win 501, options [nop,nop,TS val 3770075053 ecr 827727345], length 260
17:07:54.224319 IP 68.183.205.32.ssh > cpe00fc8d483dd3-cm00fc8d483dd0.cpe.net.cable.rogers.com.54786: Flags [P.], seq 13242704:13242964, ack 7813, win 501, options [nop,nop,TS val 3770075053 ecr 827727345], length 260
17:07:54.224357 IP 68.183.205.32.ssh > cpe00fc8d483dd3-cm00fc8d483dd0.cpe.net.cable.rogers.com.54786: Flags [P.], seq 13242964:13243224, ack 7813, win 501, options [nop,nop,TS val 3770075053 ecr 827727345], length 260
17:07:54.224396 IP 68.183.205.32.ssh > cpe00fc8d483dd3-cm00fc8d483dd0.cpe.net.cable.rogers.com.54786: Flags [P.], seq 13243224:13243484, ack 7813, win 501, options [nop,nop,TS val 3770075053 ecr 827727345], length 260
17:07:54.224434 IP 68.183.205.32.ssh > cpe00fc8d483dd3-cm00fc8d483dd0.cpe.net.cable.rogers.com.54786: Flags [P.], seq 13243484:13243744, ack 7813, win 501, options [nop,nop,TS val 3770075053 ecr 827727345], length 260
17:07:54.224472 IP 68.183.205.32.ssh > cpe00fc8d483dd3-cm00fc8d483dd0.cpe.net.cable.rogers.com.54786: Flags [P.], seq 13243744:13244004, ack 7813, win 501, options [nop,nop,TS val 3770075053 ecr 827727345], length 260
17:07:54.224512 IP 68.183.205.32.ssh > cpe00fc8d483dd3-cm00fc8d483dd0.cpe.net.cable.rogers.com.54786: Flags [P.], seq 13244004:13244264, ack 7813, win 501, options [nop,nop,TS val 3770075053 ecr 827727345], length 260
17:07:54.224550 IP 68.183.205.32.ssh > cpe00fc8d483dd3-cm00fc8d483dd0.cpe.net.cable.rogers.com.54786: Flags [P.], seq 13244264:13244524, ack 7813, win 501, options [nop,nop,TS val 3770075053 ecr 827727345], length 260
17:07:54.224589 IP 68.183.205.32.ssh > cpe00fc8d483dd3-cm00fc8d483dd0.cpe.net.cable.rogers.com.54786: Flags [P.], seq 13244524:13244784, ack 7813, win 501, options [nop,nop,TS val 3770075054 ecr 827727345], length 260
17:07:54.224627 IP 68.183.205.32.ssh > cpe00fc8d483dd3-cm00fc8d483dd0.cpe.net.cable.rogers.com.54786: Flags [P.], seq 13244784:13245044, ack 7813, win 501, options [nop,nop,TS val 3770075054 ecr 827727345], length 260
17:07:54.224669 IP 68.183.205.32.ssh > cpe00fc8d483dd3-cm00fc8d483dd0.cpe.net.cable.rogers.com.54786: Flags [P.], seq 13245044:13245304, ack 7813, win 501, options [nop,nop,TS val 3770075054 ecr 827727345], length 260
17:07:54.224706 IP 68.183.205.32.ssh > cpe00fc8d483dd3-cm00fc8d483dd0.cpe.net.cable.rogers.com.54786: Flags [P.], seq 13245304:13245564, ack 7813, win 501, options [nop,nop,TS val 3770075054 ecr 827727345], length 260
17:07:54.224743 IP 68.183.205.32.ssh > cpe00fc8d483dd3-cm00fc8d483dd0.cpe.net.cable.rogers.com.54786: Flags [P.], seq 13245564:13245824, ack 7813, win 501, options [nop,nop,TS val 3770075054 ecr 827727345], length 260
17:07:54.224781 IP 68.183.205.32.ssh > cpe00fc8d483dd3-cm00fc8d483dd0.cpe.net.cable.rogers.com.54786: Flags [P.], seq 13245824:13246084, ack 7813, win 501, options [nop,nop,TS val 3770075054 ecr 827727345], length 260
17:07:54.224819 IP 68.183.205.32.ssh > cpe00fc8d483dd3-cm00fc8d483dd0.cpe.net.cable.rogers.com.54786: Flags [P.], seq 13246084:13246344, ack 7813, win 501, options [nop,nop,TS val 3770075054 ecr 827727345], length 260
17:07:54.224859 IP 68.183.205.32.ssh > cpe00fc8d483dd3-cm00fc8d483dd0.cpe.net.cable.rogers.com.54786: Flags [P.], seq 13246344:13246604, ack 7813, win 501, options [nop,nop,TS val 3770075054 ecr 827727345], length 260
17:07:54.224897 IP 68.183.205.32.ssh > cpe00fc8d483dd3-cm00fc8d483dd0.cpe.net.cable.rogers.com.54786: Flags [P.], seq 13246604:13246864, ack 7813, win 501, options [nop,nop,TS val 3770075054 ecr 827727345], length 260
17:07:54.224963 IP 68.183.205.32.ssh > cpe00fc8d483dd3-cm00fc8d483dd0.cpe.net.cable.rogers.com.54786: Flags [P.], seq 13246864:13247124, ack 7813, win 501, options [nop,nop,TS val 3770075054 ecr 827727345], length 260
17:07:54.225012 IP 68.183.205.32.ssh > cpe00fc8d483dd3-cm00fc8d483dd0.cpe.net.cable.rogers.com.54786: Flags [P.], seq 13247124:13247384, ack 7813, win 501, options [nop,nop,TS val 3770075054 ecr 827727345], length 260
17:07:54.225051 IP 68.183.205.32.ssh > cpe00fc8d483dd3-cm00fc8d483dd0.cpe.net.cable.rogers.com.54786: Flags [P.], seq 13247384:13247644, ack 7813, win 501, options [nop,nop,TS val 3770075054 ecr 827727345], length 260
17:07:54.225091 IP 68.183.205.32.ssh > cpe00fc8d483dd3-cm00fc8d483dd0.cpe.net.cable.rogers.com.54786: Flags [P.], seq 13247644:13247904, ack 7813, win 501, options [nop,nop,TS val 3770075054 ecr 827727345], length 260
17:07:54.225130 IP 68.183.205.32.ssh > cpe00fc8d483dd3-cm00fc8d483dd0.cpe.net.cable.rogers.com.54786: Flags [P.], seq 13247904:13248164, ack 7813, win 501, options [nop,nop,TS val 3770075054 ecr 827727345], length 260
17:07:54.225171 IP 68.183.205.32.ssh > cpe00fc8d483dd3-cm00fc8d483dd0.cpe.net.cable.rogers.com.54786: Flags [P.], seq 13248164:13248424, ack 7813, win 501, options [nop,nop,TS val 3770075054 ecr 827727345], length 260
17:07:54.225209 IP 68.183.205.32.ssh > cpe00fc8d483dd3-cm00fc8d483dd0.cpe.net.cable.rogers.com.54786: Flags [P.], seq 13248424:13248684, ack 7813, win 501, options [nop,nop,TS val 3770075054 ecr 827727345], length 260
17:07:54.225251 IP 68.183.205.32.ssh > cpe00fc8d483dd3-cm00fc8d483dd0.cpe.net.cable.rogers.com.54786: Flags [P.], seq 13248684:13248944, ack 7813, win 501, options [nop,nop,TS val 3770075054 ecr 827727345], length 260
17:07:54.225290 IP 68.183.205.32.ssh > cpe00fc8d483dd3-cm00fc8d483dd0.cpe.net.cable.rogers.com.54786: Flags [P.], seq 13248944:13249204, ack 7813, win 501, options [nop,nop,TS val 3770075054 ecr 827727345], length 260
17:07:54.225332 IP 68.183.205.32.ssh > cpe00fc8d483dd3-cm00fc8d483dd0.cpe.net.cable.rogers.com.54786: Flags [P.], seq 13249204:13249464, ack 7813, win 501, options [nop,nop,TS val 3770075054 ecr 827727345], length 260
17:07:54.225370 IP 68.183.205.32.ssh > cpe00fc8d483dd3-cm00fc8d483dd0.cpe.net.cable.rogers.com.54786: Flags [P.], seq 13249464:13249724, ack 7813, win 501, options [nop,nop,TS val 3770075054 ecr 827727345], length 260
17:07:54.225408 IP 68.183.205.32.ssh > cpe00fc8d483dd3-cm00fc8d483dd0.cpe.net.cable.rogers.com.54786: Flags [P.], seq 13249724:13249984, ack 7813, win 501, options [nop,nop,TS val 3770075054 ecr 827727345], length 260
17:07:54.225448 IP 68.183.205.32.ssh > cpe00fc8d483dd3-cm00fc8d483dd0.cpe.net.cable.rogers.com.54786: Flags [P.], seq 13249984:13250244, ack 7813, win 501, options [nop,nop,TS val 3770075054 ecr 827727345], length 260
17:07:54.225486 IP 68.183.205.32.ssh > cpe00fc8d483dd3-cm00fc8d483dd0.cpe.net.cable.rogers.com.54786: Flags [P.], seq 13250244:13250504, ack 7813, win 501, options [nop,nop,TS val 3770075054 ecr 827727345], length 260
17:07:54.225527 IP 68.183.205.32.ssh > cpe00fc8d483dd3-cm00fc8d483dd0.cpe.net.cable.rogers.com.54786: Flags [P.], seq 13250504:13250764, ack 7813, win 501, options [nop,nop,TS val 3770075054 ecr 827727345], length 260
17:07:54.225567 IP 68.183.205.32.ssh > cpe00fc8d483dd3-cm00fc8d483dd0.cpe.net.cable.rogers.com.54786: Flags [P.], seq 13250764:13251024, ack 7813, win 501, options [nop,nop,TS val 3770075054 ecr 827727345], length 260
17:07:54.225607 IP 68.183.205.32.ssh > cpe00fc8d483dd3-cm00fc8d483dd0.cpe.net.cable.rogers.com.54786: Flags [P.], seq 13251024:13251284, ack 7813, win 501, options [nop,nop,TS val 3770075055 ecr 827727345], length 260
17:07:54.225645 IP 68.183.205.32.ssh > cpe00fc8d483dd3-cm00fc8d483dd0.cpe.net.cable.rogers.com.54786: Flags [P.], seq 13251284:13251544, ack 7813, win 501, options [nop,nop,TS val 3770075055 ecr 827727345], length 260
17:07:54.225685 IP 68.183.205.32.ssh > cpe00fc8d483dd3-cm00fc8d483dd0.cpe.net.cable.rogers.com.54786: Flags [P.], seq 13251544:13251804, ack 7813, win 501, options [nop,nop,TS val 3770075055 ecr 827727345], length 260
17:07:54.225722 IP 68.183.205.32.ssh > cpe00fc8d483dd3-cm00fc8d483dd0.cpe.net.cable.rogers.com.54786: Flags [P.], seq 13251804:13252064, ack 7813, win 501, options [nop,nop,TS val 3770075055 ecr 827727345], length 260
17:07:54.225761 IP 68.183.205.32.ssh > cpe00fc8d483dd3-cm00fc8d483dd0.cpe.net.cable.rogers.com.54786: Flags [P.], seq 13252064:13252324, ack 7813, win 501, options [nop,nop,TS val 3770075055 ecr 827727345], length 260
17:07:54.225802 IP 68.183.205.32.ssh > cpe00fc8d483dd3-cm00fc8d483dd0.cpe.net.cable.rogers.com.54786: Flags [P.], seq 13252324:13252584, ack 7813, win 501, options [nop,nop,TS val 3770075055 ecr 827727345], length 260
17:07:54.225839 IP 68.183.205.32.ssh > cpe00fc8d483dd3-cm00fc8d483dd0.cpe.net.cable.rogers.com.54786: Flags [P.], seq 13252584:13252844, ack 7813, win 501, options [nop,nop,TS val 3770075055 ecr 827727345], length 260
17:07:54.225880 IP 68.183.205.32.ssh > cpe00fc8d483dd3-cm00fc8d483dd0.cpe.net.cable.rogers.com.54786: Flags [P.], seq 13252844:13253104, ack 7813, win 501, options [nop,nop,TS val 3770075055 ecr 827727345], length 260
17:07:54.225918 IP 68.183.205.32.ssh > cpe00fc8d483dd3-cm00fc8d483dd0.cpe.net.cable.rogers.com.54786: Flags [P.], seq 13253104:13253364, ack 7813, win 501, options [nop,nop,TS val 3770075055 ecr 827727345], length 260
17:07:54.225956 IP 68.183.205.32.ssh > cpe00fc8d483dd3-cm00fc8d483dd0.cpe.net.cable.rogers.com.54786: Flags [P.], seq 13253364:13253624, ack 7813, win 501, options [nop,nop,TS val 3770075055 ecr 827727345], length 260
17:07:54.225994 IP 68.183.205.32.ssh > cpe00fc8d483dd3-cm00fc8d483dd0.cpe.net.cable.rogers.com.54786: Flags [P.], seq 13253624:13253884, ack 7813, win 501, options [nop,nop,TS val 3770075055 ecr 827727345], length 260
17:07:54.226034 IP 68.183.205.32.ssh > cpe00fc8d483dd3-cm00fc8d483dd0.cpe.net.cable.rogers.com.54786: Flags [P.], seq 13253884:13254144, ack 7813, win 501, options [nop,nop,TS val 3770075055 ecr 827727345], length 260
17:07:54.226073 IP 68.183.205.32.ssh > cpe00fc8d483dd3-cm00fc8d483dd0.cpe.net.cable.rogers.com.54786: Flags [P.], seq 13254144:13254404, ack 7813, win 501, options [nop,nop,TS val 3770075055 ecr 827727345], length 260
17:07:54.226113 IP 68.183.205.32.ssh > cpe00fc8d483dd3-cm00fc8d483dd0.cpe.net.cable.rogers.com.54786: Flags [P.], seq 13254404:13254664, ack 7813, win 501, options [nop,nop,TS val 3770075055 ecr 827727345], length 260
17:07:54.226151 IP 68.183.205.32.ssh > cpe00fc8d483dd3-cm00fc8d483dd0.cpe.net.cable.rogers.com.54786: Flags [P.], seq 13254664:13254924, ack 7813, win 501, options [nop,nop,TS val 3770075055 ecr 827727345], length 260
17:07:54.226189 IP 68.183.205.32.ssh > cpe00fc8d483dd3-cm00fc8d483dd0.cpe.net.cable.rogers.com.54786: Flags [P.], seq 13254924:13255184, ack 7813, win 501, options [nop,nop,TS val 3770075055 ecr 827727345], length 260
17:07:54.226229 IP 68.183.205.32.ssh > cpe00fc8d483dd3-cm00fc8d483dd0.cpe.net.cable.rogers.com.54786: Flags [P.], seq 13255184:13255444, ack 7813, win 501, options [nop,nop,TS val 3770075055 ecr 827727345], length 260
17:07:54.226293 IP 68.183.205.32.ssh > cpe00fc8d483dd3-cm00fc8d483dd0.cpe.net.cable.rogers.com.54786: Flags [P.], seq 13255444:13255704, ack 7813, win 501, options [nop,nop,TS val 3770075055 ecr 827727345], length 260
17:07:54.226333 IP 68.183.205.32.ssh > cpe00fc8d483dd3-cm00fc8d483dd0.cpe.net.cable.rogers.com.54786: Flags [P.], seq 13255704:13255964, ack 7813, win 501, options [nop,nop,TS val 3770075055 ecr 827727345], length 260
17:07:54.226371 IP 68.183.205.32.ssh > cpe00fc8d483dd3-cm00fc8d483dd0.cpe.net.cable.rogers.com.54786: Flags [P.], seq 13255964:13256224, ack 7813, win 501, options [nop,nop,TS val 3770075055 ecr 827727345], length 260
17:07:54.226409 IP 68.183.205.32.ssh > cpe00fc8d483dd3-cm00fc8d483dd0.cpe.net.cable.rogers.com.54786: Flags [P.], seq 13256224:13256484, ack 7813, win 501, options [nop,nop,TS val 3770075055 ecr 827727345], length 260
17:07:54.226447 IP 68.183.205.32.ssh > cpe00fc8d483dd3-cm00fc8d483dd0.cpe.net.cable.rogers.com.54786: Flags [P.], seq 13256484:13256744, ack 7813, win 501, options [nop,nop,TS val 3770075055 ecr 827727345], length 260
17:07:54.226486 IP 68.183.205.32.ssh > cpe00fc8d483dd3-cm00fc8d483dd0.cpe.net.cable.rogers.com.54786: Flags [P.], seq 13256744:13257004, ack 7813, win 501, options [nop,nop,TS val 3770075055 ecr 827727345], length 260
17:07:54.226525 IP 68.183.205.32.ssh > cpe00fc8d483dd3-cm00fc8d483dd0.cpe.net.cable.rogers.com.54786: Flags [P.], seq 13257004:13257264, ack 7813, win 501, options [nop,nop,TS val 3770075055 ecr 827727345], length 260
17:07:54.226563 IP 68.183.205.32.ssh > cpe00fc8d483dd3-cm00fc8d483dd0.cpe.net.cable.rogers.com.54786: Flags [P.], seq 13257264:13257524, ack 7813, win 501, options [nop,nop,TS val 3770075055 ecr 827727345], length 260
17:07:54.226602 IP 68.183.205.32.ssh > cpe00fc8d483dd3-cm00fc8d483dd0.cpe.net.cable.rogers.com.54786: Flags [P.], seq 13257524:13257784, ack 7813, win 501, options [nop,nop,TS val 3770075056 ecr 827727345], length 260
17:07:54.226640 IP 68.183.205.32.ssh > cpe00fc8d483dd3-cm00fc8d483dd0.cpe.net.cable.rogers.com.54786: Flags [P.], seq 13257784:13258044, ack 7813, win 501, options [nop,nop,TS val 3770075056 ecr 827727345], length 260
17:07:54.226678 IP 68.183.205.32.ssh > cpe00fc8d483dd3-cm00fc8d483dd0.cpe.net.cable.rogers.com.54786: Flags [P.], seq 13258044:13258304, ack 7813, win 501, options [nop,nop,TS val 3770075056 ecr 827727345], length 260
17:07:54.226731 IP 68.183.205.32.ssh > cpe00fc8d483dd3-cm00fc8d483dd0.cpe.net.cable.rogers.com.54786: Flags [P.], seq 13258304:13258564, ack 7813, win 501, options [nop,nop,TS val 3770075056 ecr 827727345], length 260
17:07:54.226792 IP 68.183.205.32.ssh > cpe00fc8d483dd3-cm00fc8d483dd0.cpe.net.cable.rogers.com.54786: Flags [P.], seq 13258564:13258824, ack 7813, win 501, options [nop,nop,TS val 3770075056 ecr 827727345], length 260
17:07:54.226855 IP 68.183.205.32.ssh > cpe00fc8d483dd3-cm00fc8d483dd0.cpe.net.cable.rogers.com.54786: Flags [P.], seq 13258824:13259084, ack 7813, win 501, options [nop,nop,TS val 3770075056 ecr 827727345], length 260
17:07:54.226907 IP 68.183.205.32.ssh > cpe00fc8d483dd3-cm00fc8d483dd0.cpe.net.cable.rogers.com.54786: Flags [P.], seq 13259084:13259344, ack 7813, win 501, options [nop,nop,TS val 3770075056 ecr 827727345], length 260
17:07:54.226949 IP 68.183.205.32.ssh > cpe00fc8d483dd3-cm00fc8d483dd0.cpe.net.cable.rogers.com.54786: Flags [P.], seq 13259344:13259604, ack 7813, win 501, options [nop,nop,TS val 3770075056 ecr 827727345], length 260
17:07:54.226987 IP 68.183.205.32.ssh > cpe00fc8d483dd3-cm00fc8d483dd0.cpe.net.cable.rogers.com.54786: Flags [P.], seq 13259604:13259864, ack 7813, win 501, options [nop,nop,TS val 3770075056 ecr 827727345], length 260
17:07:54.227026 IP 68.183.205.32.ssh > cpe00fc8d483dd3-cm00fc8d483dd0.cpe.net.cable.rogers.com.54786: Flags [P.], seq 13259864:13260124, ack 7813, win 501, options [nop,nop,TS val 3770075056 ecr 827727345], length 260
17:07:54.227067 IP 68.183.205.32.ssh > cpe00fc8d483dd3-cm00fc8d483dd0.cpe.net.cable.rogers.com.54786: Flags [P.], seq 13260124:13260384, ack 7813, win 501, options [nop,nop,TS val 3770075056 ecr 827727345], length 260
17:07:54.227106 IP 68.183.205.32.ssh > cpe00fc8d483dd3-cm00fc8d483dd0.cpe.net.cable.rogers.com.54786: Flags [P.], seq 13260384:13260644, ack 7813, win 501, options [nop,nop,TS val 3770075056 ecr 827727345], length 260
17:07:54.227147 IP 68.183.205.32.ssh > cpe00fc8d483dd3-cm00fc8d483dd0.cpe.net.cable.rogers.com.54786: Flags [P.], seq 13260644:13260904, ack 7813, win 501, options [nop,nop,TS val 3770075056 ecr 827727345], length 260
17:07:54.227186 IP 68.183.205.32.ssh > cpe00fc8d483dd3-cm00fc8d483dd0.cpe.net.cable.rogers.com.54786: Flags [P.], seq 13260904:13261164, ack 7813, win 501, options [nop,nop,TS val 3770075056 ecr 827727345], length 260
17:07:54.227224 IP 68.183.205.32.ssh > cpe00fc8d483dd3-cm00fc8d483dd0.cpe.net.cable.rogers.com.54786: Flags [P.], seq 13261164:13261424, ack 7813, win 501, options [nop,nop,TS val 3770075056 ecr 827727345], length 260
17:07:54.227275 IP 68.183.205.32.ssh > cpe00fc8d483dd3-cm00fc8d483dd0.cpe.net.cable.rogers.com.54786: Flags [P.], seq 13261424:13261684, ack 7813, win 501, options [nop,nop,TS val 3770075056 ecr 827727345], length 260
17:07:54.227314 IP 68.183.205.32.ssh > cpe00fc8d483dd3-cm00fc8d483dd0.cpe.net.cable.rogers.com.54786: Flags [P.], seq 13261684:13261944, ack 7813, win 501, options [nop,nop,TS val 3770075056 ecr 827727345], length 260
17:07:54.227357 IP 68.183.205.32.ssh > cpe00fc8d483dd3-cm00fc8d483dd0.cpe.net.cable.rogers.com.54786: Flags [P.], seq 13261944:13262204, ack 7813, win 501, options [nop,nop,TS val 3770075056 ecr 827727345], length 260
17:07:54.227440 IP 68.183.205.32.ssh > cpe00fc8d483dd3-cm00fc8d483dd0.cpe.net.cable.rogers.com.54786: Flags [P.], seq 13262204:13262464, ack 7813, win 501, options [nop,nop,TS val 3770075056 ecr 827727345], length 260
17:07:54.227494 IP 68.183.205.32.ssh > cpe00fc8d483dd3-cm00fc8d483dd0.cpe.net.cable.rogers.com.54786: Flags [P.], seq 13262464:13262724, ack 7813, win 501, options [nop,nop,TS val 3770075056 ecr 827727345], length 260
17:07:54.227540 IP 68.183.205.32.ssh > cpe00fc8d483dd3-cm00fc8d483dd0.cpe.net.cable.rogers.com.54786: Flags [P.], seq 13262724:13262984, ack 7813, win 501, options [nop,nop,TS val 3770075056 ecr 827727345], length 260
17:07:54.227607 IP 68.183.205.32.ssh > cpe00fc8d483dd3-cm00fc8d483dd0.cpe.net.cable.rogers.com.54786: Flags [P.], seq 13262984:13263244, ack 7813, win 501, options [nop,nop,TS val 3770075057 ecr 827727345], length 260
17:07:54.227649 IP 68.183.205.32.ssh > cpe00fc8d483dd3-cm00fc8d483dd0.cpe.net.cable.rogers.com.54786: Flags [P.], seq 13263244:13263504, ack 7813, win 501, options [nop,nop,TS val 3770075057 ecr 827727345], length 260
17:07:54.227688 IP 68.183.205.32.ssh > cpe00fc8d483dd3-cm00fc8d483dd0.cpe.net.cable.rogers.com.54786: Flags [P.], seq 13263504:13263764, ack 7813, win 501, options [nop,nop,TS val 3770075057 ecr 827727345], length 260
17:07:54.227727 IP 68.183.205.32.ssh > cpe00fc8d483dd3-cm00fc8d483dd0.cpe.net.cable.rogers.com.54786: Flags [P.], seq 13263764:13264024, ack 7813, win 501, options [nop,nop,TS val 3770075057 ecr 827727345], length 260
17:07:54.227765 IP 68.183.205.32.ssh > cpe00fc8d483dd3-cm00fc8d483dd0.cpe.net.cable.rogers.com.54786: Flags [P.], seq 13264024:13264284, ack 7813, win 501, options [nop,nop,TS val 3770075057 ecr 827727345], length 260
17:07:54.227806 IP 68.183.205.32.ssh > cpe00fc8d483dd3-cm00fc8d483dd0.cpe.net.cable.rogers.com.54786: Flags [P.], seq 13264284:13264544, ack 7813, win 501, options [nop,nop,TS val 3770075057 ecr 827727345], length 260
17:07:54.227850 IP 68.183.205.32.ssh > cpe00fc8d483dd3-cm00fc8d483dd0.cpe.net.cable.rogers.com.54786: Flags [P.], seq 13264544:13264804, ack 7813, win 501, options [nop,nop,TS val 3770075057 ecr 827727345], length 260
17:07:54.227888 IP 68.183.205.32.ssh > cpe00fc8d483dd3-cm00fc8d483dd0.cpe.net.cable.rogers.com.54786: Flags [P.], seq 13264804:13265064, ack 7813, win 501, options [nop,nop,TS val 3770075057 ecr 827727345], length 260
17:07:54.227928 IP 68.183.205.32.ssh > cpe00fc8d483dd3-cm00fc8d483dd0.cpe.net.cable.rogers.com.54786: Flags [P.], seq 13265064:13265324, ack 7813, win 501, options [nop,nop,TS val 3770075057 ecr 827727345], length 260
17:07:54.227966 IP 68.183.205.32.ssh > cpe00fc8d483dd3-cm00fc8d483dd0.cpe.net.cable.rogers.com.54786: Flags [P.], seq 13265324:13265584, ack 7813, win 501, options [nop,nop,TS val 3770075057 ecr 827727345], length 260
17:07:54.228004 IP 68.183.205.32.ssh > cpe00fc8d483dd3-cm00fc8d483dd0.cpe.net.cable.rogers.com.54786: Flags [P.], seq 13265584:13265844, ack 7813, win 501, options [nop,nop,TS val 3770075057 ecr 827727345], length 260
17:07:54.228044 IP 68.183.205.32.ssh > cpe00fc8d483dd3-cm00fc8d483dd0.cpe.net.cable.rogers.com.54786: Flags [P.], seq 13265844:13266104, ack 7813, win 501, options [nop,nop,TS val 3770075057 ecr 827727345], length 260
17:07:54.228082 IP 68.183.205.32.ssh > cpe00fc8d483dd3-cm00fc8d483dd0.cpe.net.cable.rogers.com.54786: Flags [P.], seq 13266104:13266364, ack 7813, win 501, options [nop,nop,TS val 3770075057 ecr 827727345], length 260
17:07:54.228122 IP 68.183.205.32.ssh > cpe00fc8d483dd3-cm00fc8d483dd0.cpe.net.cable.rogers.com.54786: Flags [P.], seq 13266364:13266624, ack 7813, win 501, options [nop,nop,TS val 3770075057 ecr 827727345], length 260
17:07:54.228162 IP 68.183.205.32.ssh > cpe00fc8d483dd3-cm00fc8d483dd0.cpe.net.cable.rogers.com.54786: Flags [P.], seq 13266624:13266884, ack 7813, win 501, options [nop,nop,TS val 3770075057 ecr 827727345], length 260
17:07:54.228202 IP 68.183.205.32.ssh > cpe00fc8d483dd3-cm00fc8d483dd0.cpe.net.cable.rogers.com.54786: Flags [P.], seq 13266884:13267144, ack 7813, win 501, options [nop,nop,TS val 3770075057 ecr 827727345], length 260
17:07:54.228244 IP 68.183.205.32.ssh > cpe00fc8d483dd3-cm00fc8d483dd0.cpe.net.cable.rogers.com.54786: Flags [P.], seq 13267144:13267404, ack 7813, win 501, options [nop,nop,TS val 3770075057 ecr 827727345], length 260
17:07:54.228286 IP 68.183.205.32.ssh > cpe00fc8d483dd3-cm00fc8d483dd0.cpe.net.cable.rogers.com.54786: Flags [P.], seq 13267404:13267664, ack 7813, win 501, options [nop,nop,TS val 3770075057 ecr 827727345], length 260
17:07:54.228337 IP 68.183.205.32.ssh > cpe00fc8d483dd3-cm00fc8d483dd0.cpe.net.cable.rogers.com.54786: Flags [P.], seq 13267664:13267924, ack 7813, win 501, options [nop,nop,TS val 3770075057 ecr 827727345], length 260
17:07:54.228378 IP 68.183.205.32.ssh > cpe00fc8d483dd3-cm00fc8d483dd0.cpe.net.cable.rogers.com.54786: Flags [P.], seq 13267924:13268184, ack 7813, win 501, options [nop,nop,TS val 3770075057 ecr 827727345], length 260
17:07:54.228416 IP 68.183.205.32.ssh > cpe00fc8d483dd3-cm00fc8d483dd0.cpe.net.cable.rogers.com.54786: Flags [P.], seq 13268184:13268444, ack 7813, win 501, options [nop,nop,TS val 3770075057 ecr 827727345], length 260
17:07:54.228456 IP 68.183.205.32.ssh > cpe00fc8d483dd3-cm00fc8d483dd0.cpe.net.cable.rogers.com.54786: Flags [P.], seq 13268444:13268704, ack 7813, win 501, options [nop,nop,TS val 3770075057 ecr 827727345], length 260
17:07:54.228496 IP 68.183.205.32.ssh > cpe00fc8d483dd3-cm00fc8d483dd0.cpe.net.cable.rogers.com.54786: Flags [P.], seq 13268704:13268964, ack 7813, win 501, options [nop,nop,TS val 3770075057 ecr 827727345], length 260
17:07:54.228542 IP 68.183.205.32.ssh > cpe00fc8d483dd3-cm00fc8d483dd0.cpe.net.cable.rogers.com.54786: Flags [P.], seq 13268964:13269224, ack 7813, win 501, options [nop,nop,TS val 3770075057 ecr 827727345], length 260
17:07:54.228581 IP 68.183.205.32.ssh > cpe00fc8d483dd3-cm00fc8d483dd0.cpe.net.cable.rogers.com.54786: Flags [P.], seq 13269224:13269484, ack 7813, win 501, options [nop,nop,TS val 3770075058 ecr 827727345], length 260
17:07:54.228619 IP 68.183.205.32.ssh > cpe00fc8d483dd3-cm00fc8d483dd0.cpe.net.cable.rogers.com.54786: Flags [P.], seq 13269484:13269744, ack 7813, win 501, options [nop,nop,TS val 3770075058 ecr 827727345], length 260
17:07:54.228657 IP 68.183.205.32.ssh > cpe00fc8d483dd3-cm00fc8d483dd0.cpe.net.cable.rogers.com.54786: Flags [P.], seq 13269744:13270004, ack 7813, win 501, options [nop,nop,TS val 3770075058 ecr 827727345], length 260
17:07:54.228698 IP 68.183.205.32.ssh > cpe00fc8d483dd3-cm00fc8d483dd0.cpe.net.cable.rogers.com.54786: Flags [P.], seq 13270004:13270264, ack 7813, win 501, options [nop,nop,TS val 3770075058 ecr 827727345], length 260
17:07:54.228736 IP 68.183.205.32.ssh > cpe00fc8d483dd3-cm00fc8d483dd0.cpe.net.cable.rogers.com.54786: Flags [P.], seq 13270264:13270524, ack 7813, win 501, options [nop,nop,TS val 3770075058 ecr 827727345], length 260
17:07:54.228786 IP 68.183.205.32.ssh > cpe00fc8d483dd3-cm00fc8d483dd0.cpe.net.cable.rogers.com.54786: Flags [P.], seq 13270524:13270784, ack 7813, win 501, options [nop,nop,TS val 3770075058 ecr 827727345], length 260
17:07:54.228826 IP 68.183.205.32.ssh > cpe00fc8d483dd3-cm00fc8d483dd0.cpe.net.cable.rogers.com.54786: Flags [P.], seq 13270784:13271044, ack 7813, win 501, options [nop,nop,TS val 3770075058 ecr 827727345], length 260
17:07:54.228864 IP 68.183.205.32.ssh > cpe00fc8d483dd3-cm00fc8d483dd0.cpe.net.cable.rogers.com.54786: Flags [P.], seq 13271044:13271304, ack 7813, win 501, options [nop,nop,TS val 3770075058 ecr 827727345], length 260
17:07:54.228902 IP 68.183.205.32.ssh > cpe00fc8d483dd3-cm00fc8d483dd0.cpe.net.cable.rogers.com.54786: Flags [P.], seq 13271304:13271564, ack 7813, win 501, options [nop,nop,TS val 3770075058 ecr 827727345], length 260
17:07:54.228976 IP 68.183.205.32.ssh > cpe00fc8d483dd3-cm00fc8d483dd0.cpe.net.cable.rogers.com.54786: Flags [P.], seq 13271564:13271824, ack 7813, win 501, options [nop,nop,TS val 3770075058 ecr 827727345], length 260
17:07:54.229040 IP 68.183.205.32.ssh > cpe00fc8d483dd3-cm00fc8d483dd0.cpe.net.cable.rogers.com.54786: Flags [P.], seq 13271824:13272084, ack 7813, win 501, options [nop,nop,TS val 3770075058 ecr 827727345], length 260
17:07:54.229104 IP 68.183.205.32.ssh > cpe00fc8d483dd3-cm00fc8d483dd0.cpe.net.cable.rogers.com.54786: Flags [P.], seq 13272084:13272344, ack 7813, win 501, options [nop,nop,TS val 3770075058 ecr 827727345], length 260
17:07:54.229155 IP 68.183.205.32.ssh > cpe00fc8d483dd3-cm00fc8d483dd0.cpe.net.cable.rogers.com.54786: Flags [P.], seq 13272344:13272604, ack 7813, win 501, options [nop,nop,TS val 3770075058 ecr 827727345], length 260
17:07:54.229198 IP 68.183.205.32.ssh > cpe00fc8d483dd3-cm00fc8d483dd0.cpe.net.cable.rogers.com.54786: Flags [P.], seq 13272604:13272864, ack 7813, win 501, options [nop,nop,TS val 3770075058 ecr 827727345], length 260
17:07:54.229238 IP 68.183.205.32.ssh > cpe00fc8d483dd3-cm00fc8d483dd0.cpe.net.cable.rogers.com.54786: Flags [P.], seq 13272864:13273124, ack 7813, win 501, options [nop,nop,TS val 3770075058 ecr 827727345], length 260
17:07:54.229277 IP 68.183.205.32.ssh > cpe00fc8d483dd3-cm00fc8d483dd0.cpe.net.cable.rogers.com.54786: Flags [P.], seq 13273124:13273384, ack 7813, win 501, options [nop,nop,TS val 3770075058 ecr 827727345], length 260
17:07:54.229316 IP 68.183.205.32.ssh > cpe00fc8d483dd3-cm00fc8d483dd0.cpe.net.cable.rogers.com.54786: Flags [P.], seq 13273384:13273644, ack 7813, win 501, options [nop,nop,TS val 3770075058 ecr 827727345], length 260
17:07:54.229353 IP 68.183.205.32.ssh > cpe00fc8d483dd3-cm00fc8d483dd0.cpe.net.cable.rogers.com.54786: Flags [P.], seq 13273644:13273904, ack 7813, win 501, options [nop,nop,TS val 3770075058 ecr 827727345], length 260
17:07:54.229393 IP 68.183.205.32.ssh > cpe00fc8d483dd3-cm00fc8d483dd0.cpe.net.cable.rogers.com.54786: Flags [P.], seq 13273904:13274164, ack 7813, win 501, options [nop,nop,TS val 3770075058 ecr 827727345], length 260
17:07:54.229431 IP 68.183.205.32.ssh > cpe00fc8d483dd3-cm00fc8d483dd0.cpe.net.cable.rogers.com.54786: Flags [P.], seq 13274164:13274424, ack 7813, win 501, options [nop,nop,TS val 3770075058 ecr 827727345], length 260
17:07:54.229472 IP 68.183.205.32.ssh > cpe00fc8d483dd3-cm00fc8d483dd0.cpe.net.cable.rogers.com.54786: Flags [P.], seq 13274424:13274684, ack 7813, win 501, options [nop,nop,TS val 3770075058 ecr 827727345], length 260
17:07:54.229512 IP 68.183.205.32.ssh > cpe00fc8d483dd3-cm00fc8d483dd0.cpe.net.cable.rogers.com.54786: Flags [P.], seq 13274684:13274944, ack 7813, win 501, options [nop,nop,TS val 3770075058 ecr 827727345], length 260
17:07:54.229554 IP 68.183.205.32.ssh > cpe00fc8d483dd3-cm00fc8d483dd0.cpe.net.cable.rogers.com.54786: Flags [P.], seq 13274944:13275204, ack 7813, win 501, options [nop,nop,TS val 3770075058 ecr 827727345], length 260
17:07:54.229592 IP 68.183.205.32.ssh > cpe00fc8d483dd3-cm00fc8d483dd0.cpe.net.cable.rogers.com.54786: Flags [P.], seq 13275204:13275464, ack 7813, win 501, options [nop,nop,TS val 3770075059 ecr 827727345], length 260
17:07:54.229633 IP 68.183.205.32.ssh > cpe00fc8d483dd3-cm00fc8d483dd0.cpe.net.cable.rogers.com.54786: Flags [P.], seq 13275464:13275724, ack 7813, win 501, options [nop,nop,TS val 3770075059 ecr 827727345], length 260
17:07:54.229671 IP 68.183.205.32.ssh > cpe00fc8d483dd3-cm00fc8d483dd0.cpe.net.cable.rogers.com.54786: Flags [P.], seq 13275724:13275984, ack 7813, win 501, options [nop,nop,TS val 3770075059 ecr 827727345], length 260
17:07:54.229712 IP 68.183.205.32.ssh > cpe00fc8d483dd3-cm00fc8d483dd0.cpe.net.cable.rogers.com.54786: Flags [P.], seq 13275984:13276244, ack 7813, win 501, options [nop,nop,TS val 3770075059 ecr 827727345], length 260
17:07:54.229750 IP 68.183.205.32.ssh > cpe00fc8d483dd3-cm00fc8d483dd0.cpe.net.cable.rogers.com.54786: Flags [P.], seq 13276244:13276504, ack 7813, win 501, options [nop,nop,TS val 3770075059 ecr 827727345], length 260
17:07:54.229791 IP 68.183.205.32.ssh > cpe00fc8d483dd3-cm00fc8d483dd0.cpe.net.cable.rogers.com.54786: Flags [P.], seq 13276504:13276764, ack 7813, win 501, options [nop,nop,TS val 3770075059 ecr 827727345], length 260
17:07:54.229831 IP 68.183.205.32.ssh > cpe00fc8d483dd3-cm00fc8d483dd0.cpe.net.cable.rogers.com.54786: Flags [P.], seq 13276764:13277024, ack 7813, win 501, options [nop,nop,TS val 3770075059 ecr 827727345], length 260
17:07:54.229874 IP 68.183.205.32.ssh > cpe00fc8d483dd3-cm00fc8d483dd0.cpe.net.cable.rogers.com.54786: Flags [P.], seq 13277024:13277284, ack 7813, win 501, options [nop,nop,TS val 3770075059 ecr 827727345], length 260
17:07:54.229929 IP 68.183.205.32.ssh > cpe00fc8d483dd3-cm00fc8d483dd0.cpe.net.cable.rogers.com.54786: Flags [P.], seq 13277284:13277544, ack 7813, win 501, options [nop,nop,TS val 3770075059 ecr 827727345], length 260
17:07:54.229991 IP 68.183.205.32.ssh > cpe00fc8d483dd3-cm00fc8d483dd0.cpe.net.cable.rogers.com.54786: Flags [P.], seq 13277544:13277804, ack 7813, win 501, options [nop,nop,TS val 3770075059 ecr 827727345], length 260
17:07:54.230032 IP 68.183.205.32.ssh > cpe00fc8d483dd3-cm00fc8d483dd0.cpe.net.cable.rogers.com.54786: Flags [P.], seq 13277804:13278064, ack 7813, win 501, options [nop,nop,TS val 3770075059 ecr 827727345], length 260
17:07:54.230074 IP 68.183.205.32.ssh > cpe00fc8d483dd3-cm00fc8d483dd0.cpe.net.cable.rogers.com.54786: Flags [P.], seq 13278064:13278324, ack 7813, win 501, options [nop,nop,TS val 3770075059 ecr 827727345], length 260
17:07:54.230122 IP cpe00fc8d483dd3-cm00fc8d483dd0.cpe.net.cable.rogers.com.54786 > 68.183.205.32.ssh: Flags [.], ack 13156168, win 37094, options [nop,nop,TS val 827727347 ecr 3770075038], length 0
17:07:54.230160 IP cpe00fc8d483dd3-cm00fc8d483dd0.cpe.net.cable.rogers.com.54786 > 68.183.205.32.ssh: Flags [P.], seq 7813:7849, ack 13156168, win 37094, options [nop,nop,TS val 827727347 ecr 3770075038], length 36
17:07:54.230163 IP cpe00fc8d483dd3-cm00fc8d483dd0.cpe.net.cable.rogers.com.54786 > 68.183.205.32.ssh: Flags [.], ack 13168648, win 37094, options [nop,nop,TS val 827727348 ecr 3770075039], length 0
17:07:54.230219 IP 68.183.205.32.ssh > cpe00fc8d483dd3-cm00fc8d483dd0.cpe.net.cable.rogers.com.54786: Flags [P.], seq 13278324:13278584, ack 7849, win 501, options [nop,nop,TS val 3770075059 ecr 827727347], length 260
17:07:54.230239 IP cpe00fc8d483dd3-cm00fc8d483dd0.cpe.net.cable.rogers.com.54786 > 68.183.205.32.ssh: Flags [.], ack 13182428, win 37094, options [nop,nop,TS val 827727350 ecr 3770075042], length 0
17:07:54.230284 IP 68.183.205.32.ssh > cpe00fc8d483dd3-cm00fc8d483dd0.cpe.net.cable.rogers.com.54786: Flags [P.], seq 13278584:13279236, ack 7849, win 501, options [nop,nop,TS val 3770075059 ecr 827727350], length 652
17:07:54.230345 IP 68.183.205.32.ssh > cpe00fc8d483dd3-cm00fc8d483dd0.cpe.net.cable.rogers.com.54786: Flags [P.], seq 13279236:13279912, ack 7849, win 501, options [nop,nop,TS val 3770075059 ecr 827727350], length 676
17:07:54.230386 IP 68.183.205.32.ssh > cpe00fc8d483dd3-cm00fc8d483dd0.cpe.net.cable.rogers.com.54786: Flags [P.], seq 13279912:13280172, ack 7849, win 501, options [nop,nop,TS val 3770075059 ecr 827727350], length 260
17:07:54.230426 IP 68.183.205.32.ssh > cpe00fc8d483dd3-cm00fc8d483dd0.cpe.net.cable.rogers.com.54786: Flags [P.], seq 13280172:13280432, ack 7849, win 501, options [nop,nop,TS val 3770075059 ecr 827727350], length 260
17:07:54.230465 IP 68.183.205.32.ssh > cpe00fc8d483dd3-cm00fc8d483dd0.cpe.net.cable.rogers.com.54786: Flags [P.], seq 13280432:13280692, ack 7849, win 501, options [nop,nop,TS val 3770075059 ecr 827727350], length 260
17:07:54.230506 IP 68.183.205.32.ssh > cpe00fc8d483dd3-cm00fc8d483dd0.cpe.net.cable.rogers.com.54786: Flags [P.], seq 13280692:13280952, ack 7849, win 501, options [nop,nop,TS val 3770075059 ecr 827727350], length 260
17:07:54.230543 IP 68.183.205.32.ssh > cpe00fc8d483dd3-cm00fc8d483dd0.cpe.net.cable.rogers.com.54786: Flags [P.], seq 13280952:13281212, ack 7849, win 501, options [nop,nop,TS val 3770075059 ecr 827727350], length 260
17:07:54.230584 IP 68.183.205.32.ssh > cpe00fc8d483dd3-cm00fc8d483dd0.cpe.net.cable.rogers.com.54786: Flags [P.], seq 13281212:13281472, ack 7849, win 501, options [nop,nop,TS val 3770075060 ecr 827727350], length 260
17:07:54.230622 IP 68.183.205.32.ssh > cpe00fc8d483dd3-cm00fc8d483dd0.cpe.net.cable.rogers.com.54786: Flags [P.], seq 13281472:13281732, ack 7849, win 501, options [nop,nop,TS val 3770075060 ecr 827727350], length 260
17:07:54.230661 IP 68.183.205.32.ssh > cpe00fc8d483dd3-cm00fc8d483dd0.cpe.net.cable.rogers.com.54786: Flags [P.], seq 13281732:13281992, ack 7849, win 501, options [nop,nop,TS val 3770075060 ecr 827727350], length 260
17:07:54.230700 IP 68.183.205.32.ssh > cpe00fc8d483dd3-cm00fc8d483dd0.cpe.net.cable.rogers.com.54786: Flags [P.], seq 13281992:13282252, ack 7849, win 501, options [nop,nop,TS val 3770075060 ecr 827727350], length 260
17:07:54.230738 IP 68.183.205.32.ssh > cpe00fc8d483dd3-cm00fc8d483dd0.cpe.net.cable.rogers.com.54786: Flags [P.], seq 13282252:13282512, ack 7849, win 501, options [nop,nop,TS val 3770075060 ecr 827727350], length 260
17:07:54.230776 IP 68.183.205.32.ssh > cpe00fc8d483dd3-cm00fc8d483dd0.cpe.net.cable.rogers.com.54786: Flags [P.], seq 13282512:13282772, ack 7849, win 501, options [nop,nop,TS val 3770075060 ecr 827727350], length 260
17:07:54.230816 IP 68.183.205.32.ssh > cpe00fc8d483dd3-cm00fc8d483dd0.cpe.net.cable.rogers.com.54786: Flags [P.], seq 13282772:13283032, ack 7849, win 501, options [nop,nop,TS val 3770075060 ecr 827727350], length 260
17:07:54.230855 IP 68.183.205.32.ssh > cpe00fc8d483dd3-cm00fc8d483dd0.cpe.net.cable.rogers.com.54786: Flags [P.], seq 13283032:13283292, ack 7849, win 501, options [nop,nop,TS val 3770075060 ecr 827727350], length 260
17:07:54.230895 IP 68.183.205.32.ssh > cpe00fc8d483dd3-cm00fc8d483dd0.cpe.net.cable.rogers.com.54786: Flags [P.], seq 13283292:13283552, ack 7849, win 501, options [nop,nop,TS val 3770075060 ecr 827727350], length 260
17:07:54.230935 IP 68.183.205.32.ssh > cpe00fc8d483dd3-cm00fc8d483dd0.cpe.net.cable.rogers.com.54786: Flags [P.], seq 13283552:13283812, ack 7849, win 501, options [nop,nop,TS val 3770075060 ecr 827727350], length 260
17:07:54.230976 IP 68.183.205.32.ssh > cpe00fc8d483dd3-cm00fc8d483dd0.cpe.net.cable.rogers.com.54786: Flags [P.], seq 13283812:13284072, ack 7849, win 501, options [nop,nop,TS val 3770075060 ecr 827727350], length 260
17:07:54.231016 IP 68.183.205.32.ssh > cpe00fc8d483dd3-cm00fc8d483dd0.cpe.net.cable.rogers.com.54786: Flags [P.], seq 13284072:13284332, ack 7849, win 501, options [nop,nop,TS val 3770075060 ecr 827727350], length 260
17:07:54.231056 IP 68.183.205.32.ssh > cpe00fc8d483dd3-cm00fc8d483dd0.cpe.net.cable.rogers.com.54786: Flags [P.], seq 13284332:13284592, ack 7849, win 501, options [nop,nop,TS val 3770075060 ecr 827727350], length 260
17:07:54.231096 IP 68.183.205.32.ssh > cpe00fc8d483dd3-cm00fc8d483dd0.cpe.net.cable.rogers.com.54786: Flags [P.], seq 13284592:13284852, ack 7849, win 501, options [nop,nop,TS val 3770075060 ecr 827727350], length 260
17:07:54.231135 IP 68.183.205.32.ssh > cpe00fc8d483dd3-cm00fc8d483dd0.cpe.net.cable.rogers.com.54786: Flags [P.], seq 13284852:13285112, ack 7849, win 501, options [nop,nop,TS val 3770075060 ecr 827727350], length 260
17:07:54.231176 IP 68.183.205.32.ssh > cpe00fc8d483dd3-cm00fc8d483dd0.cpe.net.cable.rogers.com.54786: Flags [P.], seq 13285112:13285372, ack 7849, win 501, options [nop,nop,TS val 3770075060 ecr 827727350], length 260
17:07:54.231215 IP 68.183.205.32.ssh > cpe00fc8d483dd3-cm00fc8d483dd0.cpe.net.cable.rogers.com.54786: Flags [P.], seq 13285372:13285632, ack 7849, win 501, options [nop,nop,TS val 3770075060 ecr 827727350], length 260
17:07:54.231254 IP 68.183.205.32.ssh > cpe00fc8d483dd3-cm00fc8d483dd0.cpe.net.cable.rogers.com.54786: Flags [P.], seq 13285632:13285892, ack 7849, win 501, options [nop,nop,TS val 3770075060 ecr 827727350], length 260
17:07:54.231292 IP 68.183.205.32.ssh > cpe00fc8d483dd3-cm00fc8d483dd0.cpe.net.cable.rogers.com.54786: Flags [P.], seq 13285892:13286152, ack 7849, win 501, options [nop,nop,TS val 3770075060 ecr 827727350], length 260
17:07:54.231332 IP 68.183.205.32.ssh > cpe00fc8d483dd3-cm00fc8d483dd0.cpe.net.cable.rogers.com.54786: Flags [P.], seq 13286152:13286412, ack 7849, win 501, options [nop,nop,TS val 3770075060 ecr 827727350], length 260
17:07:54.231379 IP 68.183.205.32.ssh > cpe00fc8d483dd3-cm00fc8d483dd0.cpe.net.cable.rogers.com.54786: Flags [P.], seq 13286412:13286672, ack 7849, win 501, options [nop,nop,TS val 3770075060 ecr 827727350], length 260
17:07:54.231450 IP 68.183.205.32.ssh > cpe00fc8d483dd3-cm00fc8d483dd0.cpe.net.cable.rogers.com.54786: Flags [P.], seq 13286672:13286932, ack 7849, win 501, options [nop,nop,TS val 3770075060 ecr 827727350], length 260
17:07:54.231514 IP 68.183.205.32.ssh > cpe00fc8d483dd3-cm00fc8d483dd0.cpe.net.cable.rogers.com.54786: Flags [P.], seq 13286932:13287192, ack 7849, win 501, options [nop,nop,TS val 3770075060 ecr 827727350], length 260
17:07:54.231569 IP 68.183.205.32.ssh > cpe00fc8d483dd3-cm00fc8d483dd0.cpe.net.cable.rogers.com.54786: Flags [P.], seq 13287192:13287452, ack 7849, win 501, options [nop,nop,TS val 3770075061 ecr 827727350], length 260
17:07:54.231610 IP 68.183.205.32.ssh > cpe00fc8d483dd3-cm00fc8d483dd0.cpe.net.cable.rogers.com.54786: Flags [P.], seq 13287452:13287712, ack 7849, win 501, options [nop,nop,TS val 3770075061 ecr 827727350], length 260
17:07:54.231651 IP 68.183.205.32.ssh > cpe00fc8d483dd3-cm00fc8d483dd0.cpe.net.cable.rogers.com.54786: Flags [P.], seq 13287712:13287972, ack 7849, win 501, options [nop,nop,TS val 3770075061 ecr 827727350], length 260
17:07:54.231692 IP 68.183.205.32.ssh > cpe00fc8d483dd3-cm00fc8d483dd0.cpe.net.cable.rogers.com.54786: Flags [P.], seq 13287972:13288232, ack 7849, win 501, options [nop,nop,TS val 3770075061 ecr 827727350], length 260
17:07:54.231730 IP 68.183.205.32.ssh > cpe00fc8d483dd3-cm00fc8d483dd0.cpe.net.cable.rogers.com.54786: Flags [P.], seq 13288232:13288492, ack 7849, win 501, options [nop,nop,TS val 3770075061 ecr 827727350], length 260
17:07:54.231770 IP 68.183.205.32.ssh > cpe00fc8d483dd3-cm00fc8d483dd0.cpe.net.cable.rogers.com.54786: Flags [P.], seq 13288492:13288752, ack 7849, win 501, options [nop,nop,TS val 3770075061 ecr 827727350], length 260
17:07:54.231809 IP 68.183.205.32.ssh > cpe00fc8d483dd3-cm00fc8d483dd0.cpe.net.cable.rogers.com.54786: Flags [P.], seq 13288752:13289012, ack 7849, win 501, options [nop,nop,TS val 3770075061 ecr 827727350], length 260
17:07:54.231849 IP 68.183.205.32.ssh > cpe00fc8d483dd3-cm00fc8d483dd0.cpe.net.cable.rogers.com.54786: Flags [P.], seq 13289012:13289272, ack 7849, win 501, options [nop,nop,TS val 3770075061 ecr 827727350], length 260
17:07:54.231887 IP 68.183.205.32.ssh > cpe00fc8d483dd3-cm00fc8d483dd0.cpe.net.cable.rogers.com.54786: Flags [P.], seq 13289272:13289532, ack 7849, win 501, options [nop,nop,TS val 3770075061 ecr 827727350], length 260
17:07:54.231925 IP 68.183.205.32.ssh > cpe00fc8d483dd3-cm00fc8d483dd0.cpe.net.cable.rogers.com.54786: Flags [P.], seq 13289532:13289792, ack 7849, win 501, options [nop,nop,TS val 3770075061 ecr 827727350], length 260
17:07:54.231966 IP 68.183.205.32.ssh > cpe00fc8d483dd3-cm00fc8d483dd0.cpe.net.cable.rogers.com.54786: Flags [P.], seq 13289792:13290052, ack 7849, win 501, options [nop,nop,TS val 3770075061 ecr 827727350], length 260
17:07:54.232003 IP 68.183.205.32.ssh > cpe00fc8d483dd3-cm00fc8d483dd0.cpe.net.cable.rogers.com.54786: Flags [P.], seq 13290052:13290312, ack 7849, win 501, options [nop,nop,TS val 3770075061 ecr 827727350], length 260
17:07:54.232045 IP 68.183.205.32.ssh > cpe00fc8d483dd3-cm00fc8d483dd0.cpe.net.cable.rogers.com.54786: Flags [P.], seq 13290312:13290572, ack 7849, win 501, options [nop,nop,TS val 3770075061 ecr 827727350], length 260
17:07:54.232084 IP 68.183.205.32.ssh > cpe00fc8d483dd3-cm00fc8d483dd0.cpe.net.cable.rogers.com.54786: Flags [P.], seq 13290572:13290832, ack 7849, win 501, options [nop,nop,TS val 3770075061 ecr 827727350], length 260
17:07:54.232124 IP 68.183.205.32.ssh > cpe00fc8d483dd3-cm00fc8d483dd0.cpe.net.cable.rogers.com.54786: Flags [P.], seq 13290832:13291092, ack 7849, win 501, options [nop,nop,TS val 3770075061 ecr 827727350], length 260
17:07:54.232163 IP 68.183.205.32.ssh > cpe00fc8d483dd3-cm00fc8d483dd0.cpe.net.cable.rogers.com.54786: Flags [P.], seq 13291092:13291352, ack 7849, win 501, options [nop,nop,TS val 3770075061 ecr 827727350], length 260
17:07:54.232203 IP 68.183.205.32.ssh > cpe00fc8d483dd3-cm00fc8d483dd0.cpe.net.cable.rogers.com.54786: Flags [P.], seq 13291352:13291612, ack 7849, win 501, options [nop,nop,TS val 3770075061 ecr 827727350], length 260
17:07:54.232241 IP 68.183.205.32.ssh > cpe00fc8d483dd3-cm00fc8d483dd0.cpe.net.cable.rogers.com.54786: Flags [P.], seq 13291612:13291872, ack 7849, win 501, options [nop,nop,TS val 3770075061 ecr 827727350], length 260
17:07:54.232281 IP 68.183.205.32.ssh > cpe00fc8d483dd3-cm00fc8d483dd0.cpe.net.cable.rogers.com.54786: Flags [P.], seq 13291872:13292132, ack 7849, win 501, options [nop,nop,TS val 3770075061 ecr 827727350], length 260
17:07:54.232335 IP 68.183.205.32.ssh > cpe00fc8d483dd3-cm00fc8d483dd0.cpe.net.cable.rogers.com.54786: Flags [P.], seq 13292132:13292392, ack 7849, win 501, options [nop,nop,TS val 3770075061 ecr 827727350], length 260
17:07:54.232372 IP 68.183.205.32.ssh > cpe00fc8d483dd3-cm00fc8d483dd0.cpe.net.cable.rogers.com.54786: Flags [P.], seq 13292392:13292652, ack 7849, win 501, options [nop,nop,TS val 3770075061 ecr 827727350], length 260
17:07:54.232411 IP 68.183.205.32.ssh > cpe00fc8d483dd3-cm00fc8d483dd0.cpe.net.cable.rogers.com.54786: Flags [P.], seq 13292652:13292912, ack 7849, win 501, options [nop,nop,TS val 3770075061 ecr 827727350], length 260
17:07:54.232450 IP 68.183.205.32.ssh > cpe00fc8d483dd3-cm00fc8d483dd0.cpe.net.cable.rogers.com.54786: Flags [P.], seq 13292912:13293172, ack 7849, win 501, options [nop,nop,TS val 3770075061 ecr 827727350], length 260
17:07:54.232491 IP 68.183.205.32.ssh > cpe00fc8d483dd3-cm00fc8d483dd0.cpe.net.cable.rogers.com.54786: Flags [P.], seq 13293172:13293432, ack 7849, win 501, options [nop,nop,TS val 3770075061 ecr 827727350], length 260
17:07:54.232530 IP 68.183.205.32.ssh > cpe00fc8d483dd3-cm00fc8d483dd0.cpe.net.cable.rogers.com.54786: Flags [P.], seq 13293432:13293692, ack 7849, win 501, options [nop,nop,TS val 3770075061 ecr 827727350], length 260
17:07:54.232570 IP 68.183.205.32.ssh > cpe00fc8d483dd3-cm00fc8d483dd0.cpe.net.cable.rogers.com.54786: Flags [P.], seq 13293692:13293952, ack 7849, win 501, options [nop,nop,TS val 3770075062 ecr 827727350], length 260
17:07:54.232608 IP 68.183.205.32.ssh > cpe00fc8d483dd3-cm00fc8d483dd0.cpe.net.cable.rogers.com.54786: Flags [P.], seq 13293952:13294212, ack 7849, win 501, options [nop,nop,TS val 3770075062 ecr 827727350], length 260
17:07:54.232648 IP 68.183.205.32.ssh > cpe00fc8d483dd3-cm00fc8d483dd0.cpe.net.cable.rogers.com.54786: Flags [P.], seq 13294212:13294472, ack 7849, win 501, options [nop,nop,TS val 3770075062 ecr 827727350], length 260
17:07:54.232687 IP 68.183.205.32.ssh > cpe00fc8d483dd3-cm00fc8d483dd0.cpe.net.cable.rogers.com.54786: Flags [P.], seq 13294472:13294732, ack 7849, win 501, options [nop,nop,TS val 3770075062 ecr 827727350], length 260
17:07:54.232728 IP 68.183.205.32.ssh > cpe00fc8d483dd3-cm00fc8d483dd0.cpe.net.cable.rogers.com.54786: Flags [P.], seq 13294732:13294992, ack 7849, win 501, options [nop,nop,TS val 3770075062 ecr 827727350], length 260
17:07:54.232767 IP 68.183.205.32.ssh > cpe00fc8d483dd3-cm00fc8d483dd0.cpe.net.cable.rogers.com.54786: Flags [P.], seq 13294992:13295252, ack 7849, win 501, options [nop,nop,TS val 3770075062 ecr 827727350], length 260
17:07:54.232806 IP 68.183.205.32.ssh > cpe00fc8d483dd3-cm00fc8d483dd0.cpe.net.cable.rogers.com.54786: Flags [P.], seq 13295252:13295512, ack 7849, win 501, options [nop,nop,TS val 3770075062 ecr 827727350], length 260
17:07:54.232846 IP 68.183.205.32.ssh > cpe00fc8d483dd3-cm00fc8d483dd0.cpe.net.cable.rogers.com.54786: Flags [P.], seq 13295512:13295772, ack 7849, win 501, options [nop,nop,TS val 3770075062 ecr 827727350], length 260
17:07:54.232885 IP 68.183.205.32.ssh > cpe00fc8d483dd3-cm00fc8d483dd0.cpe.net.cable.rogers.com.54786: Flags [P.], seq 13295772:13296032, ack 7849, win 501, options [nop,nop,TS val 3770075062 ecr 827727350], length 260
17:07:54.232922 IP 68.183.205.32.ssh > cpe00fc8d483dd3-cm00fc8d483dd0.cpe.net.cable.rogers.com.54786: Flags [P.], seq 13296032:13296292, ack 7849, win 501, options [nop,nop,TS val 3770075062 ecr 827727350], length 260
17:07:54.232960 IP 68.183.205.32.ssh > cpe00fc8d483dd3-cm00fc8d483dd0.cpe.net.cable.rogers.com.54786: Flags [P.], seq 13296292:13296552, ack 7849, win 501, options [nop,nop,TS val 3770075062 ecr 827727350], length 260
17:07:54.233000 IP 68.183.205.32.ssh > cpe00fc8d483dd3-cm00fc8d483dd0.cpe.net.cable.rogers.com.54786: Flags [P.], seq 13296552:13296812, ack 7849, win 501, options [nop,nop,TS val 3770075062 ecr 827727350], length 260
17:07:54.233040 IP 68.183.205.32.ssh > cpe00fc8d483dd3-cm00fc8d483dd0.cpe.net.cable.rogers.com.54786: Flags [P.], seq 13296812:13297072, ack 7849, win 501, options [nop,nop,TS val 3770075062 ecr 827727350], length 260
17:07:54.233080 IP 68.183.205.32.ssh > cpe00fc8d483dd3-cm00fc8d483dd0.cpe.net.cable.rogers.com.54786: Flags [P.], seq 13297072:13297332, ack 7849, win 501, options [nop,nop,TS val 3770075062 ecr 827727350], length 260
17:07:54.233118 IP 68.183.205.32.ssh > cpe00fc8d483dd3-cm00fc8d483dd0.cpe.net.cable.rogers.com.54786: Flags [P.], seq 13297332:13297592, ack 7849, win 501, options [nop,nop,TS val 3770075062 ecr 827727350], length 260
17:07:54.233158 IP 68.183.205.32.ssh > cpe00fc8d483dd3-cm00fc8d483dd0.cpe.net.cable.rogers.com.54786: Flags [P.], seq 13297592:13297852, ack 7849, win 501, options [nop,nop,TS val 3770075062 ecr 827727350], length 260
17:07:54.233197 IP 68.183.205.32.ssh > cpe00fc8d483dd3-cm00fc8d483dd0.cpe.net.cable.rogers.com.54786: Flags [P.], seq 13297852:13298112, ack 7849, win 501, options [nop,nop,TS val 3770075062 ecr 827727350], length 260
17:07:54.233238 IP 68.183.205.32.ssh > cpe00fc8d483dd3-cm00fc8d483dd0.cpe.net.cable.rogers.com.54786: Flags [P.], seq 13298112:13298372, ack 7849, win 501, options [nop,nop,TS val 3770075062 ecr 827727350], length 260
17:07:54.233291 IP 68.183.205.32.ssh > cpe00fc8d483dd3-cm00fc8d483dd0.cpe.net.cable.rogers.com.54786: Flags [P.], seq 13298372:13298632, ack 7849, win 501, options [nop,nop,TS val 3770075062 ecr 827727350], length 260
17:07:54.233352 IP 68.183.205.32.ssh > cpe00fc8d483dd3-cm00fc8d483dd0.cpe.net.cable.rogers.com.54786: Flags [P.], seq 13298632:13298892, ack 7849, win 501, options [nop,nop,TS val 3770075062 ecr 827727350], length 260
17:07:54.233407 IP 68.183.205.32.ssh > cpe00fc8d483dd3-cm00fc8d483dd0.cpe.net.cable.rogers.com.54786: Flags [P.], seq 13298892:13299152, ack 7849, win 501, options [nop,nop,TS val 3770075062 ecr 827727350], length 260
17:07:54.233448 IP 68.183.205.32.ssh > cpe00fc8d483dd3-cm00fc8d483dd0.cpe.net.cable.rogers.com.54786: Flags [P.], seq 13299152:13299412, ack 7849, win 501, options [nop,nop,TS val 3770075062 ecr 827727350], length 260
17:07:54.233491 IP 68.183.205.32.ssh > cpe00fc8d483dd3-cm00fc8d483dd0.cpe.net.cable.rogers.com.54786: Flags [P.], seq 13299412:13299672, ack 7849, win 501, options [nop,nop,TS val 3770075062 ecr 827727350], length 260
17:07:54.233529 IP 68.183.205.32.ssh > cpe00fc8d483dd3-cm00fc8d483dd0.cpe.net.cable.rogers.com.54786: Flags [P.], seq 13299672:13299932, ack 7849, win 501, options [nop,nop,TS val 3770075062 ecr 827727350], length 260
17:07:54.233569 IP 68.183.205.32.ssh > cpe00fc8d483dd3-cm00fc8d483dd0.cpe.net.cable.rogers.com.54786: Flags [P.], seq 13299932:13300192, ack 7849, win 501, options [nop,nop,TS val 3770075063 ecr 827727350], length 260
17:07:54.233608 IP 68.183.205.32.ssh > cpe00fc8d483dd3-cm00fc8d483dd0.cpe.net.cable.rogers.com.54786: Flags [P.], seq 13300192:13300452, ack 7849, win 501, options [nop,nop,TS val 3770075063 ecr 827727350], length 260
17:07:54.233649 IP 68.183.205.32.ssh > cpe00fc8d483dd3-cm00fc8d483dd0.cpe.net.cable.rogers.com.54786: Flags [P.], seq 13300452:13300712, ack 7849, win 501, options [nop,nop,TS val 3770075063 ecr 827727350], length 260
17:07:54.233687 IP 68.183.205.32.ssh > cpe00fc8d483dd3-cm00fc8d483dd0.cpe.net.cable.rogers.com.54786: Flags [P.], seq 13300712:13300972, ack 7849, win 501, options [nop,nop,TS val 3770075063 ecr 827727350], length 260
17:07:54.233730 IP 68.183.205.32.ssh > cpe00fc8d483dd3-cm00fc8d483dd0.cpe.net.cable.rogers.com.54786: Flags [P.], seq 13300972:13301232, ack 7849, win 501, options [nop,nop,TS val 3770075063 ecr 827727350], length 260
17:07:54.233769 IP 68.183.205.32.ssh > cpe00fc8d483dd3-cm00fc8d483dd0.cpe.net.cable.rogers.com.54786: Flags [P.], seq 13301232:13301492, ack 7849, win 501, options [nop,nop,TS val 3770075063 ecr 827727350], length 260
17:07:54.233809 IP 68.183.205.32.ssh > cpe00fc8d483dd3-cm00fc8d483dd0.cpe.net.cable.rogers.com.54786: Flags [P.], seq 13301492:13301752, ack 7849, win 501, options [nop,nop,TS val 3770075063 ecr 827727350], length 260
17:07:54.233847 IP 68.183.205.32.ssh > cpe00fc8d483dd3-cm00fc8d483dd0.cpe.net.cable.rogers.com.54786: Flags [P.], seq 13301752:13302012, ack 7849, win 501, options [nop,nop,TS val 3770075063 ecr 827727350], length 260
17:07:54.233885 IP 68.183.205.32.ssh > cpe00fc8d483dd3-cm00fc8d483dd0.cpe.net.cable.rogers.com.54786: Flags [P.], seq 13302012:13302272, ack 7849, win 501, options [nop,nop,TS val 3770075063 ecr 827727350], length 260
17:07:54.233926 IP 68.183.205.32.ssh > cpe00fc8d483dd3-cm00fc8d483dd0.cpe.net.cable.rogers.com.54786: Flags [P.], seq 13302272:13302532, ack 7849, win 501, options [nop,nop,TS val 3770075063 ecr 827727350], length 260
17:07:54.233966 IP 68.183.205.32.ssh > cpe00fc8d483dd3-cm00fc8d483dd0.cpe.net.cable.rogers.com.54786: Flags [P.], seq 13302532:13302792, ack 7849, win 501, options [nop,nop,TS val 3770075063 ecr 827727350], length 260
17:07:54.234009 IP 68.183.205.32.ssh > cpe00fc8d483dd3-cm00fc8d483dd0.cpe.net.cable.rogers.com.54786: Flags [P.], seq 13302792:13303052, ack 7849, win 501, options [nop,nop,TS val 3770075063 ecr 827727350], length 260
17:07:54.234048 IP 68.183.205.32.ssh > cpe00fc8d483dd3-cm00fc8d483dd0.cpe.net.cable.rogers.com.54786: Flags [P.], seq 13303052:13303312, ack 7849, win 501, options [nop,nop,TS val 3770075063 ecr 827727350], length 260
17:07:54.234098 IP 68.183.205.32.ssh > cpe00fc8d483dd3-cm00fc8d483dd0.cpe.net.cable.rogers.com.54786: Flags [P.], seq 13303312:13303572, ack 7849, win 501, options [nop,nop,TS val 3770075063 ecr 827727350], length 260
17:07:54.234136 IP 68.183.205.32.ssh > cpe00fc8d483dd3-cm00fc8d483dd0.cpe.net.cable.rogers.com.54786: Flags [P.], seq 13303572:13303832, ack 7849, win 501, options [nop,nop,TS val 3770075063 ecr 827727350], length 260
17:07:54.234175 IP 68.183.205.32.ssh > cpe00fc8d483dd3-cm00fc8d483dd0.cpe.net.cable.rogers.com.54786: Flags [P.], seq 13303832:13304092, ack 7849, win 501, options [nop,nop,TS val 3770075063 ecr 827727350], length 260
17:07:54.234213 IP 68.183.205.32.ssh > cpe00fc8d483dd3-cm00fc8d483dd0.cpe.net.cable.rogers.com.54786: Flags [P.], seq 13304092:13304352, ack 7849, win 501, options [nop,nop,TS val 3770075063 ecr 827727350], length 260
17:07:54.234254 IP 68.183.205.32.ssh > cpe00fc8d483dd3-cm00fc8d483dd0.cpe.net.cable.rogers.com.54786: Flags [P.], seq 13304352:13304612, ack 7849, win 501, options [nop,nop,TS val 3770075063 ecr 827727350], length 260
17:07:54.234292 IP 68.183.205.32.ssh > cpe00fc8d483dd3-cm00fc8d483dd0.cpe.net.cable.rogers.com.54786: Flags [P.], seq 13304612:13304872, ack 7849, win 501, options [nop,nop,TS val 3770075063 ecr 827727350], length 260
17:07:54.234332 IP 68.183.205.32.ssh > cpe00fc8d483dd3-cm00fc8d483dd0.cpe.net.cable.rogers.com.54786: Flags [P.], seq 13304872:13305132, ack 7849, win 501, options [nop,nop,TS val 3770075063 ecr 827727350], length 260
17:07:54.234370 IP 68.183.205.32.ssh > cpe00fc8d483dd3-cm00fc8d483dd0.cpe.net.cable.rogers.com.54786: Flags [P.], seq 13305132:13305392, ack 7849, win 501, options [nop,nop,TS val 3770075063 ecr 827727350], length 260
17:07:54.234410 IP 68.183.205.32.ssh > cpe00fc8d483dd3-cm00fc8d483dd0.cpe.net.cable.rogers.com.54786: Flags [P.], seq 13305392:13305652, ack 7849, win 501, options [nop,nop,TS val 3770075063 ecr 827727350], length 260
17:07:54.234450 IP 68.183.205.32.ssh > cpe00fc8d483dd3-cm00fc8d483dd0.cpe.net.cable.rogers.com.54786: Flags [P.], seq 13305652:13305912, ack 7849, win 501, options [nop,nop,TS val 3770075063 ecr 827727350], length 260
17:07:54.234546 IP 68.183.205.32.ssh > cpe00fc8d483dd3-cm00fc8d483dd0.cpe.net.cable.rogers.com.54786: Flags [P.], seq 13305912:13306172, ack 7849, win 501, options [nop,nop,TS val 3770075063 ecr 827727350], length 260
17:07:54.234595 IP 68.183.205.32.ssh > cpe00fc8d483dd3-cm00fc8d483dd0.cpe.net.cable.rogers.com.54786: Flags [P.], seq 13306172:13306432, ack 7849, win 501, options [nop,nop,TS val 3770075064 ecr 827727350], length 260
17:07:54.234634 IP 68.183.205.32.ssh > cpe00fc8d483dd3-cm00fc8d483dd0.cpe.net.cable.rogers.com.54786: Flags [P.], seq 13306432:13306692, ack 7849, win 501, options [nop,nop,TS val 3770075064 ecr 827727350], length 260
17:07:54.234672 IP 68.183.205.32.ssh > cpe00fc8d483dd3-cm00fc8d483dd0.cpe.net.cable.rogers.com.54786: Flags [P.], seq 13306692:13306952, ack 7849, win 501, options [nop,nop,TS val 3770075064 ecr 827727350], length 260
17:07:54.234714 IP 68.183.205.32.ssh > cpe00fc8d483dd3-cm00fc8d483dd0.cpe.net.cable.rogers.com.54786: Flags [P.], seq 13306952:13307212, ack 7849, win 501, options [nop,nop,TS val 3770075064 ecr 827727350], length 260
17:07:54.234752 IP 68.183.205.32.ssh > cpe00fc8d483dd3-cm00fc8d483dd0.cpe.net.cable.rogers.com.54786: Flags [P.], seq 13307212:13307472, ack 7849, win 501, options [nop,nop,TS val 3770075064 ecr 827727350], length 260
17:07:54.234793 IP 68.183.205.32.ssh > cpe00fc8d483dd3-cm00fc8d483dd0.cpe.net.cable.rogers.com.54786: Flags [P.], seq 13307472:13307732, ack 7849, win 501, options [nop,nop,TS val 3770075064 ecr 827727350], length 260
17:07:54.234834 IP 68.183.205.32.ssh > cpe00fc8d483dd3-cm00fc8d483dd0.cpe.net.cable.rogers.com.54786: Flags [P.], seq 13307732:13307992, ack 7849, win 501, options [nop,nop,TS val 3770075064 ecr 827727350], length 260
17:07:54.234873 IP 68.183.205.32.ssh > cpe00fc8d483dd3-cm00fc8d483dd0.cpe.net.cable.rogers.com.54786: Flags [P.], seq 13307992:13308252, ack 7849, win 501, options [nop,nop,TS val 3770075064 ecr 827727350], length 260
17:07:54.234911 IP 68.183.205.32.ssh > cpe00fc8d483dd3-cm00fc8d483dd0.cpe.net.cable.rogers.com.54786: Flags [P.], seq 13308252:13308512, ack 7849, win 501, options [nop,nop,TS val 3770075064 ecr 827727350], length 260
17:07:54.234951 IP 68.183.205.32.ssh > cpe00fc8d483dd3-cm00fc8d483dd0.cpe.net.cable.rogers.com.54786: Flags [P.], seq 13308512:13308772, ack 7849, win 501, options [nop,nop,TS val 3770075064 ecr 827727350], length 260
17:07:54.234989 IP 68.183.205.32.ssh > cpe00fc8d483dd3-cm00fc8d483dd0.cpe.net.cable.rogers.com.54786: Flags [P.], seq 13308772:13309032, ack 7849, win 501, options [nop,nop,TS val 3770075064 ecr 827727350], length 260
17:07:54.235029 IP 68.183.205.32.ssh > cpe00fc8d483dd3-cm00fc8d483dd0.cpe.net.cable.rogers.com.54786: Flags [P.], seq 13309032:13309292, ack 7849, win 501, options [nop,nop,TS val 3770075064 ecr 827727350], length 260
17:07:54.235067 IP 68.183.205.32.ssh > cpe00fc8d483dd3-cm00fc8d483dd0.cpe.net.cable.rogers.com.54786: Flags [P.], seq 13309292:13309552, ack 7849, win 501, options [nop,nop,TS val 3770075064 ecr 827727350], length 260
17:07:54.235111 IP 68.183.205.32.ssh > cpe00fc8d483dd3-cm00fc8d483dd0.cpe.net.cable.rogers.com.54786: Flags [P.], seq 13309552:13309812, ack 7849, win 501, options [nop,nop,TS val 3770075064 ecr 827727350], length 260
17:07:54.235150 IP 68.183.205.32.ssh > cpe00fc8d483dd3-cm00fc8d483dd0.cpe.net.cable.rogers.com.54786: Flags [P.], seq 13309812:13310072, ack 7849, win 501, options [nop,nop,TS val 3770075064 ecr 827727350], length 260
17:07:54.235188 IP 68.183.205.32.ssh > cpe00fc8d483dd3-cm00fc8d483dd0.cpe.net.cable.rogers.com.54786: Flags [P.], seq 13310072:13310332, ack 7849, win 501, options [nop,nop,TS val 3770075064 ecr 827727350], length 260
17:07:54.235226 IP 68.183.205.32.ssh > cpe00fc8d483dd3-cm00fc8d483dd0.cpe.net.cable.rogers.com.54786: Flags [P.], seq 13310332:13310592, ack 7849, win 501, options [nop,nop,TS val 3770075064 ecr 827727350], length 260
17:07:54.235266 IP 68.183.205.32.ssh > cpe00fc8d483dd3-cm00fc8d483dd0.cpe.net.cable.rogers.com.54786: Flags [P.], seq 13310592:13310852, ack 7849, win 501, options [nop,nop,TS val 3770075064 ecr 827727350], length 260
17:07:54.235304 IP 68.183.205.32.ssh > cpe00fc8d483dd3-cm00fc8d483dd0.cpe.net.cable.rogers.com.54786: Flags [P.], seq 13310852:13311112, ack 7849, win 501, options [nop,nop,TS val 3770075064 ecr 827727350], length 260
17:07:54.235342 IP 68.183.205.32.ssh > cpe00fc8d483dd3-cm00fc8d483dd0.cpe.net.cable.rogers.com.54786: Flags [P.], seq 13311112:13311372, ack 7849, win 501, options [nop,nop,TS val 3770075064 ecr 827727350], length 260
17:07:54.235383 IP 68.183.205.32.ssh > cpe00fc8d483dd3-cm00fc8d483dd0.cpe.net.cable.rogers.com.54786: Flags [P.], seq 13311372:13311632, ack 7849, win 501, options [nop,nop,TS val 3770075064 ecr 827727350], length 260
17:07:54.235433 IP 68.183.205.32.ssh > cpe00fc8d483dd3-cm00fc8d483dd0.cpe.net.cable.rogers.com.54786: Flags [P.], seq 13311632:13311892, ack 7849, win 501, options [nop,nop,TS val 3770075064 ecr 827727350], length 260
17:07:54.235472 IP 68.183.205.32.ssh > cpe00fc8d483dd3-cm00fc8d483dd0.cpe.net.cable.rogers.com.54786: Flags [P.], seq 13311892:13312152, ack 7849, win 501, options [nop,nop,TS val 3770075064 ecr 827727350], length 260
17:07:54.235513 IP 68.183.205.32.ssh > cpe00fc8d483dd3-cm00fc8d483dd0.cpe.net.cable.rogers.com.54786: Flags [P.], seq 13312152:13312412, ack 7849, win 501, options [nop,nop,TS val 3770075064 ecr 827727350], length 260
17:07:54.235550 IP 68.183.205.32.ssh > cpe00fc8d483dd3-cm00fc8d483dd0.cpe.net.cable.rogers.com.54786: Flags [P.], seq 13312412:13312672, ack 7849, win 501, options [nop,nop,TS val 3770075064 ecr 827727350], length 260
17:07:54.235592 IP 68.183.205.32.ssh > cpe00fc8d483dd3-cm00fc8d483dd0.cpe.net.cable.rogers.com.54786: Flags [P.], seq 13312672:13312932, ack 7849, win 501, options [nop,nop,TS val 3770075065 ecr 827727350], length 260
17:07:54.235629 IP 68.183.205.32.ssh > cpe00fc8d483dd3-cm00fc8d483dd0.cpe.net.cable.rogers.com.54786: Flags [P.], seq 13312932:13313192, ack 7849, win 501, options [nop,nop,TS val 3770075065 ecr 827727350], length 260
17:07:54.235667 IP 68.183.205.32.ssh > cpe00fc8d483dd3-cm00fc8d483dd0.cpe.net.cable.rogers.com.54786: Flags [P.], seq 13313192:13313452, ack 7849, win 501, options [nop,nop,TS val 3770075065 ecr 827727350], length 260
17:07:54.235707 IP 68.183.205.32.ssh > cpe00fc8d483dd3-cm00fc8d483dd0.cpe.net.cable.rogers.com.54786: Flags [P.], seq 13313452:13313712, ack 7849, win 501, options [nop,nop,TS val 3770075065 ecr 827727350], length 260
17:07:54.235749 IP 68.183.205.32.ssh > cpe00fc8d483dd3-cm00fc8d483dd0.cpe.net.cable.rogers.com.54786: Flags [P.], seq 13313712:13313972, ack 7849, win 501, options [nop,nop,TS val 3770075065 ecr 827727350], length 260
17:07:54.235788 IP 68.183.205.32.ssh > cpe00fc8d483dd3-cm00fc8d483dd0.cpe.net.cable.rogers.com.54786: Flags [P.], seq 13313972:13314232, ack 7849, win 501, options [nop,nop,TS val 3770075065 ecr 827727350], length 260
17:07:54.235826 IP 68.183.205.32.ssh > cpe00fc8d483dd3-cm00fc8d483dd0.cpe.net.cable.rogers.com.54786: Flags [P.], seq 13314232:13314492, ack 7849, win 501, options [nop,nop,TS val 3770075065 ecr 827727350], length 260
17:07:54.235866 IP 68.183.205.32.ssh > cpe00fc8d483dd3-cm00fc8d483dd0.cpe.net.cable.rogers.com.54786: Flags [P.], seq 13314492:13314752, ack 7849, win 501, options [nop,nop,TS val 3770075065 ecr 827727350], length 260
17:07:54.235903 IP 68.183.205.32.ssh > cpe00fc8d483dd3-cm00fc8d483dd0.cpe.net.cable.rogers.com.54786: Flags [P.], seq 13314752:13315012, ack 7849, win 501, options [nop,nop,TS val 3770075065 ecr 827727350], length 260
17:07:54.235960 IP 68.183.205.32.ssh > cpe00fc8d483dd3-cm00fc8d483dd0.cpe.net.cable.rogers.com.54786: Flags [P.], seq 13315012:13315272, ack 7849, win 501, options [nop,nop,TS val 3770075065 ecr 827727350], length 260
17:07:54.236006 IP cpe00fc8d483dd3-cm00fc8d483dd0.cpe.net.cable.rogers.com.54786 > 68.183.205.32.ssh: Flags [P.], seq 7849:7885, ack 13182428, win 37094, options [nop,nop,TS val 827727350 ecr 3770075042], length 36
17:07:54.236022 IP cpe00fc8d483dd3-cm00fc8d483dd0.cpe.net.cable.rogers.com.54786 > 68.183.205.32.ssh: Flags [.], ack 13223508, win 37094, options [nop,nop,TS val 827727355 ecr 3770075049], length 0
17:07:54.236107 IP cpe00fc8d483dd3-cm00fc8d483dd0.cpe.net.cable.rogers.com.54786 > 68.183.205.32.ssh: Flags [P.], seq 7885:7921, ack 13223508, win 37094, options [nop,nop,TS val 827727355 ecr 3770075049], length 36
^C
52574 packets captured
52587 packets received by filter
11 packets dropped by kernel