tcpdump -i eth0 dst 68.183.205.32
17:14:31.195788 IP 68.183.205.32.ssh > cpe00fc8d483dd3-cm00fc8d483dd0.cpe.net.cable.rogers.com.54786: Flags [P.], seq 9530180:9530432, ack 5689, win 501, options [nop,nop,TS val 3770472025 ecr 828119004], length 252
17:14:31.195847 IP 68.183.205.32.ssh > cpe00fc8d483dd3-cm00fc8d483dd0.cpe.net.cable.rogers.com.54786: Flags [P.], seq 9530432:9530684, ack 5689, win 501, options [nop,nop,TS val 3770472025 ecr 828119004], length 252
17:14:31.195903 IP 68.183.205.32.ssh > cpe00fc8d483dd3-cm00fc8d483dd0.cpe.net.cable.rogers.com.54786: Flags [P.], seq 9530684:9530936, ack 5689, win 501, options [nop,nop,TS val 3770472025 ecr 828119004], length 252
17:14:31.195956 IP 68.183.205.32.ssh > cpe00fc8d483dd3-cm00fc8d483dd0.cpe.net.cable.rogers.com.54786: Flags [P.], seq 9530936:9531188, ack 5689, win 501, options [nop,nop,TS val 3770472025 ecr 828119004], length 252
17:14:31.196013 IP 68.183.205.32.ssh > cpe00fc8d483dd3-cm00fc8d483dd0.cpe.net.cable.rogers.com.54786: Flags [P.], seq 9531188:9531440, ack 5689, win 501, options [nop,nop,TS val 3770472025 ecr 828119004], length 252
17:14:31.196068 IP 68.183.205.32.ssh > cpe00fc8d483dd3-cm00fc8d483dd0.cpe.net.cable.rogers.com.54786: Flags [P.], seq 9531440:9531692, ack 5689, win 501, options [nop,nop,TS val 3770472025 ecr 828119004], length 252
17:14:31.196136 IP 68.183.205.32.ssh > cpe00fc8d483dd3-cm00fc8d483dd0.cpe.net.cable.rogers.com.54786: Flags [P.], seq 9531692:9531944, ack 5689, win 501, options [nop,nop,TS val 3770472025 ecr 828119004], length 252
17:14:31.196194 IP 68.183.205.32.ssh > cpe00fc8d483dd3-cm00fc8d483dd0.cpe.net.cable.rogers.com.54786: Flags [P.], seq 9531944:9532196, ack 5689, win 501, options [nop,nop,TS val 3770472025 ecr 828119004], length 252
17:14:31.196254 IP 68.183.205.32.ssh > cpe00fc8d483dd3-cm00fc8d483dd0.cpe.net.cable.rogers.com.54786: Flags [P.], seq 9532196:9532448, ack 5689, win 501, options [nop,nop,TS val 3770472025 ecr 828119004], length 252
17:14:31.196353 IP 68.183.205.32.ssh > cpe00fc8d483dd3-cm00fc8d483dd0.cpe.net.cable.rogers.com.54786: Flags [P.], seq 9532448:9532700, ack 5689, win 501, options [nop,nop,TS val 3770472025 ecr 828119004], length 252
17:14:31.196415 IP 68.183.205.32.ssh > cpe00fc8d483dd3-cm00fc8d483dd0.cpe.net.cable.rogers.com.54786: Flags [P.], seq 9532700:9532952, ack 5689, win 501, options [nop,nop,TS val 3770472025 ecr 828119004], length 252
17:14:31.196483 IP 68.183.205.32.ssh > cpe00fc8d483dd3-cm00fc8d483dd0.cpe.net.cable.rogers.com.54786: Flags [P.], seq 9532952:9533204, ack 5689, win 501, options [nop,nop,TS val 3770472025 ecr 828119004], length 252
17:14:31.196549 IP 68.183.205.32.ssh > cpe00fc8d483dd3-cm00fc8d483dd0.cpe.net.cable.rogers.com.54786: Flags [P.], seq 9533204:9533456, ack 5689, win 501, options [nop,nop,TS val 3770472025 ecr 828119004], length 252
17:14:31.196618 IP 68.183.205.32.ssh > cpe00fc8d483dd3-cm00fc8d483dd0.cpe.net.cable.rogers.com.54786: Flags [P.], seq 9533456:9533708, ack 5689, win 501, options [nop,nop,TS val 3770472026 ecr 828119004], length 252
17:14:31.196686 IP 68.183.205.32.ssh > cpe00fc8d483dd3-cm00fc8d483dd0.cpe.net.cable.rogers.com.54786: Flags [P.], seq 9533708:9533960, ack 5689, win 501, options [nop,nop,TS val 3770472026 ecr 828119004], length 252
17:14:31.196746 IP 68.183.205.32.ssh > cpe00fc8d483dd3-cm00fc8d483dd0.cpe.net.cable.rogers.com.54786: Flags [P.], seq 9533960:9534212, ack 5689, win 501, options [nop,nop,TS val 3770472026 ecr 828119004], length 252
17:14:31.196811 IP 68.183.205.32.ssh > cpe00fc8d483dd3-cm00fc8d483dd0.cpe.net.cable.rogers.com.54786: Flags [P.], seq 9534212:9534464, ack 5689, win 501, options [nop,nop,TS val 3770472026 ecr 828119004], length 252
17:14:31.196868 IP 68.183.205.32.ssh > cpe00fc8d483dd3-cm00fc8d483dd0.cpe.net.cable.rogers.com.54786: Flags [P.], seq 9534464:9534716, ack 5689, win 501, options [nop,nop,TS val 3770472026 ecr 828119004], length 252
17:14:31.196926 IP 68.183.205.32.ssh > cpe00fc8d483dd3-cm00fc8d483dd0.cpe.net.cable.rogers.com.54786: Flags [P.], seq 9534716:9534968, ack 5689, win 501, options [nop,nop,TS val 3770472026 ecr 828119004], length 252
17:14:31.196981 IP 68.183.205.32.ssh > cpe00fc8d483dd3-cm00fc8d483dd0.cpe.net.cable.rogers.com.54786: Flags [P.], seq 9534968:9535220, ack 5689, win 501, options [nop,nop,TS val 3770472026 ecr 828119004], length 252
17:14:31.197049 IP 68.183.205.32.ssh > cpe00fc8d483dd3-cm00fc8d483dd0.cpe.net.cable.rogers.com.54786: Flags [P.], seq 9535220:9535472, ack 5689, win 501, options [nop,nop,TS val 3770472026 ecr 828119004], length 252
17:14:31.197105 IP 68.183.205.32.ssh > cpe00fc8d483dd3-cm00fc8d483dd0.cpe.net.cable.rogers.com.54786: Flags [P.], seq 9535472:9535724, ack 5689, win 501, options [nop,nop,TS val 3770472026 ecr 828119004], length 252
17:14:31.197162 IP 68.183.205.32.ssh > cpe00fc8d483dd3-cm00fc8d483dd0.cpe.net.cable.rogers.com.54786: Flags [P.], seq 9535724:9535976, ack 5689, win 501, options [nop,nop,TS val 3770472026 ecr 828119004], length 252
17:14:31.197224 IP 68.183.205.32.ssh > cpe00fc8d483dd3-cm00fc8d483dd0.cpe.net.cable.rogers.com.54786: Flags [P.], seq 9535976:9536228, ack 5689, win 501, options [nop,nop,TS val 3770472026 ecr 828119004], length 252
17:14:31.197290 IP 68.183.205.32.ssh > cpe00fc8d483dd3-cm00fc8d483dd0.cpe.net.cable.rogers.com.54786: Flags [P.], seq 9536228:9536480, ack 5689, win 501, options [nop,nop,TS val 3770472026 ecr 828119004], length 252
17:14:31.197348 IP 68.183.205.32.ssh > cpe00fc8d483dd3-cm00fc8d483dd0.cpe.net.cable.rogers.com.54786: Flags [P.], seq 9536480:9536732, ack 5689, win 501, options [nop,nop,TS val 3770472026 ecr 828119004], length 252
17:14:31.197417 IP 68.183.205.32.ssh > cpe00fc8d483dd3-cm00fc8d483dd0.cpe.net.cable.rogers.com.54786: Flags [P.], seq 9536732:9536984, ack 5689, win 501, options [nop,nop,TS val 3770472026 ecr 828119004], length 252
17:14:31.197495 IP 68.183.205.32.ssh > cpe00fc8d483dd3-cm00fc8d483dd0.cpe.net.cable.rogers.com.54786: Flags [P.], seq 9536984:9537236, ack 5689, win 501, options [nop,nop,TS val 3770472026 ecr 828119004], length 252
17:14:31.197544 IP 68.183.205.32.ssh > cpe00fc8d483dd3-cm00fc8d483dd0.cpe.net.cable.rogers.com.54786: Flags [P.], seq 9537236:9537488, ack 5689, win 501, options [nop,nop,TS val 3770472026 ecr 828119004], length 252
17:14:31.197604 IP 68.183.205.32.ssh > cpe00fc8d483dd3-cm00fc8d483dd0.cpe.net.cable.rogers.com.54786: Flags [P.], seq 9537488:9537740, ack 5689, win 501, options [nop,nop,TS val 3770472027 ecr 828119004], length 252
17:14:31.197669 IP 68.183.205.32.ssh > cpe00fc8d483dd3-cm00fc8d483dd0.cpe.net.cable.rogers.com.54786: Flags [P.], seq 9537740:9537992, ack 5689, win 501, options [nop,nop,TS val 3770472027 ecr 828119004], length 252
17:14:31.197725 IP 68.183.205.32.ssh > cpe00fc8d483dd3-cm00fc8d483dd0.cpe.net.cable.rogers.com.54786: Flags [P.], seq 9537992:9538244, ack 5689, win 501, options [nop,nop,TS val 3770472027 ecr 828119004], length 252
17:14:31.197783 IP 68.183.205.32.ssh > cpe00fc8d483dd3-cm00fc8d483dd0.cpe.net.cable.rogers.com.54786: Flags [P.], seq 9538244:9538496, ack 5689, win 501, options [nop,nop,TS val 3770472027 ecr 828119004], length 252
17:14:31.197842 IP 68.183.205.32.ssh > cpe00fc8d483dd3-cm00fc8d483dd0.cpe.net.cable.rogers.com.54786: Flags [P.], seq 9538496:9538748, ack 5689, win 501, options [nop,nop,TS val 3770472027 ecr 828119004], length 252
17:14:31.197897 IP 68.183.205.32.ssh > cpe00fc8d483dd3-cm00fc8d483dd0.cpe.net.cable.rogers.com.54786: Flags [P.], seq 9538748:9539000, ack 5689, win 501, options [nop,nop,TS val 3770472027 ecr 828119004], length 252
17:14:31.197958 IP 68.183.205.32.ssh > cpe00fc8d483dd3-cm00fc8d483dd0.cpe.net.cable.rogers.com.54786: Flags [P.], seq 9539000:9539252, ack 5689, win 501, options [nop,nop,TS val 3770472027 ecr 828119004], length 252
17:14:31.198014 IP 68.183.205.32.ssh > cpe00fc8d483dd3-cm00fc8d483dd0.cpe.net.cable.rogers.com.54786: Flags [P.], seq 9539252:9539504, ack 5689, win 501, options [nop,nop,TS val 3770472027 ecr 828119004], length 252
17:14:31.198070 IP 68.183.205.32.ssh > cpe00fc8d483dd3-cm00fc8d483dd0.cpe.net.cable.rogers.com.54786: Flags [P.], seq 9539504:9539756, ack 5689, win 501, options [nop,nop,TS val 3770472027 ecr 828119004], length 252
17:14:31.198132 IP 68.183.205.32.ssh > cpe00fc8d483dd3-cm00fc8d483dd0.cpe.net.cable.rogers.com.54786: Flags [P.], seq 9539756:9540008, ack 5689, win 501, options [nop,nop,TS val 3770472027 ecr 828119004], length 252
17:14:31.198188 IP 68.183.205.32.ssh > cpe00fc8d483dd3-cm00fc8d483dd0.cpe.net.cable.rogers.com.54786: Flags [P.], seq 9540008:9540260, ack 5689, win 501, options [nop,nop,TS val 3770472027 ecr 828119004], length 252
17:14:31.198246 IP 68.183.205.32.ssh > cpe00fc8d483dd3-cm00fc8d483dd0.cpe.net.cable.rogers.com.54786: Flags [P.], seq 9540260:9540512, ack 5689, win 501, options [nop,nop,TS val 3770472027 ecr 828119004], length 252
17:14:31.198326 IP 68.183.205.32.ssh > cpe00fc8d483dd3-cm00fc8d483dd0.cpe.net.cable.rogers.com.54786: Flags [P.], seq 9540512:9540764, ack 5689, win 501, options [nop,nop,TS val 3770472027 ecr 828119004], length 252
17:14:31.198388 IP 68.183.205.32.ssh > cpe00fc8d483dd3-cm00fc8d483dd0.cpe.net.cable.rogers.com.54786: Flags [P.], seq 9540764:9541016, ack 5689, win 501, options [nop,nop,TS val 3770472027 ecr 828119004], length 252
17:14:31.198447 IP 68.183.205.32.ssh > cpe00fc8d483dd3-cm00fc8d483dd0.cpe.net.cable.rogers.com.54786: Flags [P.], seq 9541016:9541268, ack 5689, win 501, options [nop,nop,TS val 3770472027 ecr 828119004], length 252
17:14:31.198507 IP 68.183.205.32.ssh > cpe00fc8d483dd3-cm00fc8d483dd0.cpe.net.cable.rogers.com.54786: Flags [P.], seq 9541268:9541520, ack 5689, win 501, options [nop,nop,TS val 3770472027 ecr 828119004], length 252
17:14:31.198563 IP 68.183.205.32.ssh > cpe00fc8d483dd3-cm00fc8d483dd0.cpe.net.cable.rogers.com.54786: Flags [P.], seq 9541520:9541772, ack 5689, win 501, options [nop,nop,TS val 3770472027 ecr 828119004], length 252
17:14:31.198638 IP 68.183.205.32.ssh > cpe00fc8d483dd3-cm00fc8d483dd0.cpe.net.cable.rogers.com.54786: Flags [P.], seq 9541772:9542024, ack 5689, win 501, options [nop,nop,TS val 3770472028 ecr 828119004], length 252
17:14:31.198706 IP 68.183.205.32.ssh > cpe00fc8d483dd3-cm00fc8d483dd0.cpe.net.cable.rogers.com.54786: Flags [P.], seq 9542024:9542276, ack 5689, win 501, options [nop,nop,TS val 3770472028 ecr 828119004], length 252
17:14:31.198765 IP 68.183.205.32.ssh > cpe00fc8d483dd3-cm00fc8d483dd0.cpe.net.cable.rogers.com.54786: Flags [P.], seq 9542276:9542528, ack 5689, win 501, options [nop,nop,TS val 3770472028 ecr 828119004], length 252
17:14:31.198820 IP 68.183.205.32.ssh > cpe00fc8d483dd3-cm00fc8d483dd0.cpe.net.cable.rogers.com.54786: Flags [P.], seq 9542528:9542780, ack 5689, win 501, options [nop,nop,TS val 3770472028 ecr 828119004], length 252
17:14:31.198878 IP 68.183.205.32.ssh > cpe00fc8d483dd3-cm00fc8d483dd0.cpe.net.cable.rogers.com.54786: Flags [P.], seq 9542780:9543032, ack 5689, win 501, options [nop,nop,TS val 3770472028 ecr 828119004], length 252
17:14:31.198935 IP 68.183.205.32.ssh > cpe00fc8d483dd3-cm00fc8d483dd0.cpe.net.cable.rogers.com.54786: Flags [P.], seq 9543032:9543284, ack 5689, win 501, options [nop,nop,TS val 3770472028 ecr 828119004], length 252
17:14:31.198996 IP 68.183.205.32.ssh > cpe00fc8d483dd3-cm00fc8d483dd0.cpe.net.cable.rogers.com.54786: Flags [P.], seq 9543284:9543536, ack 5689, win 501, options [nop,nop,TS val 3770472028 ecr 828119004], length 252
17:14:31.199053 IP 68.183.205.32.ssh > cpe00fc8d483dd3-cm00fc8d483dd0.cpe.net.cable.rogers.com.54786: Flags [P.], seq 9543536:9543788, ack 5689, win 501, options [nop,nop,TS val 3770472028 ecr 828119004], length 252
17:14:31.199111 IP 68.183.205.32.ssh > cpe00fc8d483dd3-cm00fc8d483dd0.cpe.net.cable.rogers.com.54786: Flags [P.], seq 9543788:9544040, ack 5689, win 501, options [nop,nop,TS val 3770472028 ecr 828119004], length 252
17:14:31.199168 IP 68.183.205.32.ssh > cpe00fc8d483dd3-cm00fc8d483dd0.cpe.net.cable.rogers.com.54786: Flags [P.], seq 9544040:9544292, ack 5689, win 501, options [nop,nop,TS val 3770472028 ecr 828119004], length 252
17:14:31.199231 IP 68.183.205.32.ssh > cpe00fc8d483dd3-cm00fc8d483dd0.cpe.net.cable.rogers.com.54786: Flags [P.], seq 9544292:9544544, ack 5689, win 501, options [nop,nop,TS val 3770472028 ecr 828119004], length 252
17:14:31.199287 IP 68.183.205.32.ssh > cpe00fc8d483dd3-cm00fc8d483dd0.cpe.net.cable.rogers.com.54786: Flags [P.], seq 9544544:9544796, ack 5689, win 501, options [nop,nop,TS val 3770472028 ecr 828119004], length 252
17:14:31.199353 IP 68.183.205.32.ssh > cpe00fc8d483dd3-cm00fc8d483dd0.cpe.net.cable.rogers.com.54786: Flags [P.], seq 9544796:9545048, ack 5689, win 501, options [nop,nop,TS val 3770472028 ecr 828119004], length 252
17:14:31.199409 IP 68.183.205.32.ssh > cpe00fc8d483dd3-cm00fc8d483dd0.cpe.net.cable.rogers.com.54786: Flags [P.], seq 9545048:9545300, ack 5689, win 501, options [nop,nop,TS val 3770472028 ecr 828119004], length 252
17:14:31.199468 IP 68.183.205.32.ssh > cpe00fc8d483dd3-cm00fc8d483dd0.cpe.net.cable.rogers.com.54786: Flags [P.], seq 9545300:9545552, ack 5689, win 501, options [nop,nop,TS val 3770472028 ecr 828119004], length 252
17:14:31.199523 IP 68.183.205.32.ssh > cpe00fc8d483dd3-cm00fc8d483dd0.cpe.net.cable.rogers.com.54786: Flags [P.], seq 9545552:9545804, ack 5689, win 501, options [nop,nop,TS val 3770472028 ecr 828119004], length 252
17:14:31.199583 IP 68.183.205.32.ssh > cpe00fc8d483dd3-cm00fc8d483dd0.cpe.net.cable.rogers.com.54786: Flags [P.], seq 9545804:9546056, ack 5689, win 501, options [nop,nop,TS val 3770472029 ecr 828119004], length 252
17:14:31.199639 IP 68.183.205.32.ssh > cpe00fc8d483dd3-cm00fc8d483dd0.cpe.net.cable.rogers.com.54786: Flags [P.], seq 9546056:9546308, ack 5689, win 501, options [nop,nop,TS val 3770472029 ecr 828119004], length 252
17:14:31.199706 IP 68.183.205.32.ssh > cpe00fc8d483dd3-cm00fc8d483dd0.cpe.net.cable.rogers.com.54786: Flags [P.], seq 9546308:9546560, ack 5689, win 501, options [nop,nop,TS val 3770472029 ecr 828119004], length 252
17:14:31.199772 IP 68.183.205.32.ssh > cpe00fc8d483dd3-cm00fc8d483dd0.cpe.net.cable.rogers.com.54786: Flags [P.], seq 9546560:9546812, ack 5689, win 501, options [nop,nop,TS val 3770472029 ecr 828119004], length 252
17:14:31.199837 IP 68.183.205.32.ssh > cpe00fc8d483dd3-cm00fc8d483dd0.cpe.net.cable.rogers.com.54786: Flags [P.], seq 9546812:9547064, ack 5689, win 501, options [nop,nop,TS val 3770472029 ecr 828119004], length 252
17:14:31.199907 IP 68.183.205.32.ssh > cpe00fc8d483dd3-cm00fc8d483dd0.cpe.net.cable.rogers.com.54786: Flags [P.], seq 9547064:9547316, ack 5689, win 501, options [nop,nop,TS val 3770472029 ecr 828119004], length 252
17:14:31.199971 IP 68.183.205.32.ssh > cpe00fc8d483dd3-cm00fc8d483dd0.cpe.net.cable.rogers.com.54786: Flags [P.], seq 9547316:9547568, ack 5689, win 501, options [nop,nop,TS val 3770472029 ecr 828119004], length 252
17:14:31.200035 IP 68.183.205.32.ssh > cpe00fc8d483dd3-cm00fc8d483dd0.cpe.net.cable.rogers.com.54786: Flags [P.], seq 9547568:9547820, ack 5689, win 501, options [nop,nop,TS val 3770472029 ecr 828119004], length 252
17:14:31.200120 IP 68.183.205.32.ssh > cpe00fc8d483dd3-cm00fc8d483dd0.cpe.net.cable.rogers.com.54786: Flags [P.], seq 9547820:9548072, ack 5689, win 501, options [nop,nop,TS val 3770472029 ecr 828119004], length 252
17:14:31.200183 IP 68.183.205.32.ssh > cpe00fc8d483dd3-cm00fc8d483dd0.cpe.net.cable.rogers.com.54786: Flags [P.], seq 9548072:9548324, ack 5689, win 501, options [nop,nop,TS val 3770472029 ecr 828119004], length 252
17:14:31.200252 IP 68.183.205.32.ssh > cpe00fc8d483dd3-cm00fc8d483dd0.cpe.net.cable.rogers.com.54786: Flags [P.], seq 9548324:9548576, ack 5689, win 501, options [nop,nop,TS val 3770472029 ecr 828119004], length 252
17:14:31.200337 IP 68.183.205.32.ssh > cpe00fc8d483dd3-cm00fc8d483dd0.cpe.net.cable.rogers.com.54786: Flags [P.], seq 9548576:9548828, ack 5689, win 501, options [nop,nop,TS val 3770472029 ecr 828119004], length 252
17:14:31.200387 IP 68.183.205.32.ssh > cpe00fc8d483dd3-cm00fc8d483dd0.cpe.net.cable.rogers.com.54786: Flags [P.], seq 9548828:9549080, ack 5689, win 501, options [nop,nop,TS val 3770472029 ecr 828119004], length 252
17:14:31.200438 IP 68.183.205.32.ssh > cpe00fc8d483dd3-cm00fc8d483dd0.cpe.net.cable.rogers.com.54786: Flags [P.], seq 9549080:9549332, ack 5689, win 501, options [nop,nop,TS val 3770472029 ecr 828119004], length 252
17:14:31.200482 IP 68.183.205.32.ssh > cpe00fc8d483dd3-cm00fc8d483dd0.cpe.net.cable.rogers.com.54786: Flags [P.], seq 9549332:9549584, ack 5689, win 501, options [nop,nop,TS val 3770472029 ecr 828119004], length 252
17:14:31.200529 IP 68.183.205.32.ssh > cpe00fc8d483dd3-cm00fc8d483dd0.cpe.net.cable.rogers.com.54786: Flags [P.], seq 9549584:9549836, ack 5689, win 501, options [nop,nop,TS val 3770472029 ecr 828119004], length 252
17:14:31.200571 IP 68.183.205.32.ssh > cpe00fc8d483dd3-cm00fc8d483dd0.cpe.net.cable.rogers.com.54786: Flags [P.], seq 9549836:9550088, ack 5689, win 501, options [nop,nop,TS val 3770472030 ecr 828119004], length 252
17:14:31.200614 IP 68.183.205.32.ssh > cpe00fc8d483dd3-cm00fc8d483dd0.cpe.net.cable.rogers.com.54786: Flags [P.], seq 9550088:9550340, ack 5689, win 501, options [nop,nop,TS val 3770472030 ecr 828119004], length 252
17:14:31.200660 IP 68.183.205.32.ssh > cpe00fc8d483dd3-cm00fc8d483dd0.cpe.net.cable.rogers.com.54786: Flags [P.], seq 9550340:9550592, ack 5689, win 501, options [nop,nop,TS val 3770472030 ecr 828119004], length 252
17:14:31.200718 IP 68.183.205.32.ssh > cpe00fc8d483dd3-cm00fc8d483dd0.cpe.net.cable.rogers.com.54786: Flags [P.], seq 9550592:9550844, ack 5689, win 501, options [nop,nop,TS val 3770472030 ecr 828119004], length 252
17:14:31.200765 IP 68.183.205.32.ssh > cpe00fc8d483dd3-cm00fc8d483dd0.cpe.net.cable.rogers.com.54786: Flags [P.], seq 9550844:9551096, ack 5689, win 501, options [nop,nop,TS val 3770472030 ecr 828119004], length 252
17:14:31.200814 IP 68.183.205.32.ssh > cpe00fc8d483dd3-cm00fc8d483dd0.cpe.net.cable.rogers.com.54786: Flags [P.], seq 9551096:9551348, ack 5689, win 501, options [nop,nop,TS val 3770472030 ecr 828119004], length 252
17:14:31.200869 IP 68.183.205.32.ssh > cpe00fc8d483dd3-cm00fc8d483dd0.cpe.net.cable.rogers.com.54786: Flags [P.], seq 9551348:9551600, ack 5689, win 501, options [nop,nop,TS val 3770472030 ecr 828119004], length 252
17:14:31.200936 IP 68.183.205.32.ssh > cpe00fc8d483dd3-cm00fc8d483dd0.cpe.net.cable.rogers.com.54786: Flags [P.], seq 9551600:9551852, ack 5689, win 501, options [nop,nop,TS val 3770472030 ecr 828119004], length 252
17:14:31.200998 IP 68.183.205.32.ssh > cpe00fc8d483dd3-cm00fc8d483dd0.cpe.net.cable.rogers.com.54786: Flags [P.], seq 9551852:9552104, ack 5689, win 501, options [nop,nop,TS val 3770472030 ecr 828119004], length 252
17:14:31.201060 IP 68.183.205.32.ssh > cpe00fc8d483dd3-cm00fc8d483dd0.cpe.net.cable.rogers.com.54786: Flags [P.], seq 9552104:9552356, ack 5689, win 501, options [nop,nop,TS val 3770472030 ecr 828119004], length 252
17:14:31.201124 IP 68.183.205.32.ssh > cpe00fc8d483dd3-cm00fc8d483dd0.cpe.net.cable.rogers.com.54786: Flags [P.], seq 9552356:9552608, ack 5689, win 501, options [nop,nop,TS val 3770472030 ecr 828119004], length 252
17:14:31.201174 IP 68.183.205.32.ssh > cpe00fc8d483dd3-cm00fc8d483dd0.cpe.net.cable.rogers.com.54786: Flags [P.], seq 9552608:9552860, ack 5689, win 501, options [nop,nop,TS val 3770472030 ecr 828119004], length 252
17:14:31.201224 IP cpe00fc8d483dd3-cm00fc8d483dd0.cpe.net.cable.rogers.com.54786 > 68.183.205.32.ssh: Flags [.], ack 9483048, win 37094, options [nop,nop,TS val 828119010 ecr 3770472013], length 0
17:14:31.201303 IP cpe00fc8d483dd3-cm00fc8d483dd0.cpe.net.cable.rogers.com.54786 > 68.183.205.32.ssh: Flags [P.], seq 5689:5725, ack 9483048, win 37094, options [nop,nop,TS val 828119010 ecr 3770472013], length 36
17:14:31.201312 IP cpe00fc8d483dd3-cm00fc8d483dd0.cpe.net.cable.rogers.com.54786 > 68.183.205.32.ssh: Flags [.], ack 9491364, win 37094, options [nop,nop,TS val 828119012 ecr 3770472015], length 0
17:14:31.201438 IP 68.183.205.32.ssh > cpe00fc8d483dd3-cm00fc8d483dd0.cpe.net.cable.rogers.com.54786: Flags [P.], seq 9552860:9553728, ack 5725, win 501, options [nop,nop,TS val 3770472030 ecr 828119010], length 868
17:14:31.201510 IP 68.183.205.32.ssh > cpe00fc8d483dd3-cm00fc8d483dd0.cpe.net.cable.rogers.com.54786: Flags [P.], seq 9553728:9553980, ack 5725, win 501, options [nop,nop,TS val 3770472030 ecr 828119010], length 252
17:14:31.201578 IP 68.183.205.32.ssh > cpe00fc8d483dd3-cm00fc8d483dd0.cpe.net.cable.rogers.com.54786: Flags [P.], seq 9553980:9554232, ack 5725, win 501, options [nop,nop,TS val 3770472031 ecr 828119010], length 252
17:14:31.201646 IP 68.183.205.32.ssh > cpe00fc8d483dd3-cm00fc8d483dd0.cpe.net.cable.rogers.com.54786: Flags [P.], seq 9554232:9554484, ack 5725, win 501, options [nop,nop,TS val 3770472031 ecr 828119010], length 252
17:14:31.201703 IP 68.183.205.32.ssh > cpe00fc8d483dd3-cm00fc8d483dd0.cpe.net.cable.rogers.com.54786: Flags [P.], seq 9554484:9554736, ack 5725, win 501, options [nop,nop,TS val 3770472031 ecr 828119010], length 252
17:14:31.201764 IP 68.183.205.32.ssh > cpe00fc8d483dd3-cm00fc8d483dd0.cpe.net.cable.rogers.com.54786: Flags [P.], seq 9554736:9554988, ack 5725, win 501, options [nop,nop,TS val 3770472031 ecr 828119010], length 252
17:14:31.201810 IP 68.183.205.32.ssh > cpe00fc8d483dd3-cm00fc8d483dd0.cpe.net.cable.rogers.com.54786: Flags [P.], seq 9554988:9555240, ack 5725, win 501, options [nop,nop,TS val 3770472031 ecr 828119010], length 252
17:14:31.201857 IP 68.183.205.32.ssh > cpe00fc8d483dd3-cm00fc8d483dd0.cpe.net.cable.rogers.com.54786: Flags [P.], seq 9555240:9555492, ack 5725, win 501, options [nop,nop,TS val 3770472031 ecr 828119010], length 252
17:14:31.201901 IP 68.183.205.32.ssh > cpe00fc8d483dd3-cm00fc8d483dd0.cpe.net.cable.rogers.com.54786: Flags [P.], seq 9555492:9555744, ack 5725, win 501, options [nop,nop,TS val 3770472031 ecr 828119010], length 252
17:14:31.201948 IP 68.183.205.32.ssh > cpe00fc8d483dd3-cm00fc8d483dd0.cpe.net.cable.rogers.com.54786: Flags [P.], seq 9555744:9555996, ack 5725, win 501, options [nop,nop,TS val 3770472031 ecr 828119010], length 252
17:14:31.201992 IP 68.183.205.32.ssh > cpe00fc8d483dd3-cm00fc8d483dd0.cpe.net.cable.rogers.com.54786: Flags [P.], seq 9555996:9556248, ack 5725, win 501, options [nop,nop,TS val 3770472031 ecr 828119010], length 252
17:14:31.202037 IP 68.183.205.32.ssh > cpe00fc8d483dd3-cm00fc8d483dd0.cpe.net.cable.rogers.com.54786: Flags [P.], seq 9556248:9556500, ack 5725, win 501, options [nop,nop,TS val 3770472031 ecr 828119010], length 252
17:14:31.202081 IP 68.183.205.32.ssh > cpe00fc8d483dd3-cm00fc8d483dd0.cpe.net.cable.rogers.com.54786: Flags [P.], seq 9556500:9556752, ack 5725, win 501, options [nop,nop,TS val 3770472031 ecr 828119010], length 252
17:14:31.202127 IP 68.183.205.32.ssh > cpe00fc8d483dd3-cm00fc8d483dd0.cpe.net.cable.rogers.com.54786: Flags [P.], seq 9556752:9557004, ack 5725, win 501, options [nop,nop,TS val 3770472031 ecr 828119010], length 252
17:14:31.202172 IP 68.183.205.32.ssh > cpe00fc8d483dd3-cm00fc8d483dd0.cpe.net.cable.rogers.com.54786: Flags [P.], seq 9557004:9557256, ack 5725, win 501, options [nop,nop,TS val 3770472031 ecr 828119010], length 252
17:14:31.202216 IP 68.183.205.32.ssh > cpe00fc8d483dd3-cm00fc8d483dd0.cpe.net.cable.rogers.com.54786: Flags [P.], seq 9557256:9557508, ack 5725, win 501, options [nop,nop,TS val 3770472031 ecr 828119010], length 252
17:14:31.202263 IP 68.183.205.32.ssh > cpe00fc8d483dd3-cm00fc8d483dd0.cpe.net.cable.rogers.com.54786: Flags [P.], seq 9557508:9557760, ack 5725, win 501, options [nop,nop,TS val 3770472031 ecr 828119010], length 252
17:14:31.202333 IP 68.183.205.32.ssh > cpe00fc8d483dd3-cm00fc8d483dd0.cpe.net.cable.rogers.com.54786: Flags [P.], seq 9557760:9558012, ack 5725, win 501, options [nop,nop,TS val 3770472031 ecr 828119010], length 252
17:14:31.202380 IP 68.183.205.32.ssh > cpe00fc8d483dd3-cm00fc8d483dd0.cpe.net.cable.rogers.com.54786: Flags [P.], seq 9558012:9558264, ack 5725, win 501, options [nop,nop,TS val 3770472031 ecr 828119010], length 252
17:14:31.202425 IP 68.183.205.32.ssh > cpe00fc8d483dd3-cm00fc8d483dd0.cpe.net.cable.rogers.com.54786: Flags [P.], seq 9558264:9558516, ack 5725, win 501, options [nop,nop,TS val 3770472031 ecr 828119010], length 252
17:14:31.202471 IP 68.183.205.32.ssh > cpe00fc8d483dd3-cm00fc8d483dd0.cpe.net.cable.rogers.com.54786: Flags [P.], seq 9558516:9558768, ack 5725, win 501, options [nop,nop,TS val 3770472031 ecr 828119010], length 252
17:14:31.202514 IP 68.183.205.32.ssh > cpe00fc8d483dd3-cm00fc8d483dd0.cpe.net.cable.rogers.com.54786: Flags [P.], seq 9558768:9559020, ack 5725, win 501, options [nop,nop,TS val 3770472031 ecr 828119010], length 252
17:14:31.202560 IP 68.183.205.32.ssh > cpe00fc8d483dd3-cm00fc8d483dd0.cpe.net.cable.rogers.com.54786: Flags [P.], seq 9559020:9559272, ack 5725, win 501, options [nop,nop,TS val 3770472031 ecr 828119010], length 252
17:14:31.202603 IP 68.183.205.32.ssh > cpe00fc8d483dd3-cm00fc8d483dd0.cpe.net.cable.rogers.com.54786: Flags [P.], seq 9559272:9559524, ack 5725, win 501, options [nop,nop,TS val 3770472032 ecr 828119010], length 252
17:14:31.202650 IP 68.183.205.32.ssh > cpe00fc8d483dd3-cm00fc8d483dd0.cpe.net.cable.rogers.com.54786: Flags [P.], seq 9559524:9559776, ack 5725, win 501, options [nop,nop,TS val 3770472032 ecr 828119010], length 252
17:14:31.202692 IP 68.183.205.32.ssh > cpe00fc8d483dd3-cm00fc8d483dd0.cpe.net.cable.rogers.com.54786: Flags [P.], seq 9559776:9560028, ack 5725, win 501, options [nop,nop,TS val 3770472032 ecr 828119010], length 252
17:14:31.202737 IP 68.183.205.32.ssh > cpe00fc8d483dd3-cm00fc8d483dd0.cpe.net.cable.rogers.com.54786: Flags [P.], seq 9560028:9560280, ack 5725, win 501, options [nop,nop,TS val 3770472032 ecr 828119010], length 252
17:14:31.202780 IP 68.183.205.32.ssh > cpe00fc8d483dd3-cm00fc8d483dd0.cpe.net.cable.rogers.com.54786: Flags [P.], seq 9560280:9560532, ack 5725, win 501, options [nop,nop,TS val 3770472032 ecr 828119010], length 252
17:14:31.202822 IP 68.183.205.32.ssh > cpe00fc8d483dd3-cm00fc8d483dd0.cpe.net.cable.rogers.com.54786: Flags [P.], seq 9560532:9560784, ack 5725, win 501, options [nop,nop,TS val 3770472032 ecr 828119010], length 252
17:14:31.202867 IP 68.183.205.32.ssh > cpe00fc8d483dd3-cm00fc8d483dd0.cpe.net.cable.rogers.com.54786: Flags [P.], seq 9560784:9561036, ack 5725, win 501, options [nop,nop,TS val 3770472032 ecr 828119010], length 252
17:14:31.202910 IP 68.183.205.32.ssh > cpe00fc8d483dd3-cm00fc8d483dd0.cpe.net.cable.rogers.com.54786: Flags [P.], seq 9561036:9561288, ack 5725, win 501, options [nop,nop,TS val 3770472032 ecr 828119010], length 252
17:14:31.202954 IP 68.183.205.32.ssh > cpe00fc8d483dd3-cm00fc8d483dd0.cpe.net.cable.rogers.com.54786: Flags [P.], seq 9561288:9561540, ack 5725, win 501, options [nop,nop,TS val 3770472032 ecr 828119010], length 252
17:14:31.202997 IP 68.183.205.32.ssh > cpe00fc8d483dd3-cm00fc8d483dd0.cpe.net.cable.rogers.com.54786: Flags [P.], seq 9561540:9561792, ack 5725, win 501, options [nop,nop,TS val 3770472032 ecr 828119010], length 252
17:14:31.203043 IP 68.183.205.32.ssh > cpe00fc8d483dd3-cm00fc8d483dd0.cpe.net.cable.rogers.com.54786: Flags [P.], seq 9561792:9562044, ack 5725, win 501, options [nop,nop,TS val 3770472032 ecr 828119010], length 252
17:14:31.203086 IP 68.183.205.32.ssh > cpe00fc8d483dd3-cm00fc8d483dd0.cpe.net.cable.rogers.com.54786: Flags [P.], seq 9562044:9562296, ack 5725, win 501, options [nop,nop,TS val 3770472032 ecr 828119010], length 252
17:14:31.203130 IP 68.183.205.32.ssh > cpe00fc8d483dd3-cm00fc8d483dd0.cpe.net.cable.rogers.com.54786: Flags [P.], seq 9562296:9562548, ack 5725, win 501, options [nop,nop,TS val 3770472032 ecr 828119010], length 252
17:14:31.203173 IP 68.183.205.32.ssh > cpe00fc8d483dd3-cm00fc8d483dd0.cpe.net.cable.rogers.com.54786: Flags [P.], seq 9562548:9562800, ack 5725, win 501, options [nop,nop,TS val 3770472032 ecr 828119010], length 252
17:14:31.203219 IP 68.183.205.32.ssh > cpe00fc8d483dd3-cm00fc8d483dd0.cpe.net.cable.rogers.com.54786: Flags [P.], seq 9562800:9563052, ack 5725, win 501, options [nop,nop,TS val 3770472032 ecr 828119010], length 252
17:14:31.203262 IP 68.183.205.32.ssh > cpe00fc8d483dd3-cm00fc8d483dd0.cpe.net.cable.rogers.com.54786: Flags [P.], seq 9563052:9563304, ack 5725, win 501, options [nop,nop,TS val 3770472032 ecr 828119010], length 252
17:14:31.203308 IP 68.183.205.32.ssh > cpe00fc8d483dd3-cm00fc8d483dd0.cpe.net.cable.rogers.com.54786: Flags [P.], seq 9563304:9563556, ack 5725, win 501, options [nop,nop,TS val 3770472032 ecr 828119010], length 252
17:14:31.203351 IP 68.183.205.32.ssh > cpe00fc8d483dd3-cm00fc8d483dd0.cpe.net.cable.rogers.com.54786: Flags [P.], seq 9563556:9563808, ack 5725, win 501, options [nop,nop,TS val 3770472032 ecr 828119010], length 252
17:14:31.203395 IP 68.183.205.32.ssh > cpe00fc8d483dd3-cm00fc8d483dd0.cpe.net.cable.rogers.com.54786: Flags [P.], seq 9563808:9564060, ack 5725, win 501, options [nop,nop,TS val 3770472032 ecr 828119010], length 252
17:14:31.203440 IP 68.183.205.32.ssh > cpe00fc8d483dd3-cm00fc8d483dd0.cpe.net.cable.rogers.com.54786: Flags [P.], seq 9564060:9564312, ack 5725, win 501, options [nop,nop,TS val 3770472032 ecr 828119010], length 252
17:14:31.203483 IP 68.183.205.32.ssh > cpe00fc8d483dd3-cm00fc8d483dd0.cpe.net.cable.rogers.com.54786: Flags [P.], seq 9564312:9564564, ack 5725, win 501, options [nop,nop,TS val 3770472032 ecr 828119010], length 252
17:14:31.203526 IP 68.183.205.32.ssh > cpe00fc8d483dd3-cm00fc8d483dd0.cpe.net.cable.rogers.com.54786: Flags [P.], seq 9564564:9564816, ack 5725, win 501, options [nop,nop,TS val 3770472032 ecr 828119010], length 252
17:14:31.203573 IP 68.183.205.32.ssh > cpe00fc8d483dd3-cm00fc8d483dd0.cpe.net.cable.rogers.com.54786: Flags [P.], seq 9564816:9565068, ack 5725, win 501, options [nop,nop,TS val 3770472033 ecr 828119010], length 252
17:14:31.203616 IP 68.183.205.32.ssh > cpe00fc8d483dd3-cm00fc8d483dd0.cpe.net.cable.rogers.com.54786: Flags [P.], seq 9565068:9565320, ack 5725, win 501, options [nop,nop,TS val 3770472033 ecr 828119010], length 252
17:14:31.203664 IP 68.183.205.32.ssh > cpe00fc8d483dd3-cm00fc8d483dd0.cpe.net.cable.rogers.com.54786: Flags [P.], seq 9565320:9565572, ack 5725, win 501, options [nop,nop,TS val 3770472033 ecr 828119010], length 252
17:14:31.203727 IP 68.183.205.32.ssh > cpe00fc8d483dd3-cm00fc8d483dd0.cpe.net.cable.rogers.com.54786: Flags [P.], seq 9565572:9565824, ack 5725, win 501, options [nop,nop,TS val 3770472033 ecr 828119010], length 252
17:14:31.203771 IP 68.183.205.32.ssh > cpe00fc8d483dd3-cm00fc8d483dd0.cpe.net.cable.rogers.com.54786: Flags [P.], seq 9565824:9566076, ack 5725, win 501, options [nop,nop,TS val 3770472033 ecr 828119010], length 252
17:14:31.203814 IP 68.183.205.32.ssh > cpe00fc8d483dd3-cm00fc8d483dd0.cpe.net.cable.rogers.com.54786: Flags [P.], seq 9566076:9566328, ack 5725, win 501, options [nop,nop,TS val 3770472033 ecr 828119010], length 252
17:14:31.203858 IP 68.183.205.32.ssh > cpe00fc8d483dd3-cm00fc8d483dd0.cpe.net.cable.rogers.com.54786: Flags [P.], seq 9566328:9566580, ack 5725, win 501, options [nop,nop,TS val 3770472033 ecr 828119010], length 252
17:14:31.203901 IP 68.183.205.32.ssh > cpe00fc8d483dd3-cm00fc8d483dd0.cpe.net.cable.rogers.com.54786: Flags [P.], seq 9566580:9566832, ack 5725, win 501, options [nop,nop,TS val 3770472033 ecr 828119010], length 252
17:14:31.203944 IP 68.183.205.32.ssh > cpe00fc8d483dd3-cm00fc8d483dd0.cpe.net.cable.rogers.com.54786: Flags [P.], seq 9566832:9567084, ack 5725, win 501, options [nop,nop,TS val 3770472033 ecr 828119010], length 252
17:14:31.203989 IP 68.183.205.32.ssh > cpe00fc8d483dd3-cm00fc8d483dd0.cpe.net.cable.rogers.com.54786: Flags [P.], seq 9567084:9567336, ack 5725, win 501, options [nop,nop,TS val 3770472033 ecr 828119010], length 252
17:14:31.204033 IP 68.183.205.32.ssh > cpe00fc8d483dd3-cm00fc8d483dd0.cpe.net.cable.rogers.com.54786: Flags [P.], seq 9567336:9567588, ack 5725, win 501, options [nop,nop,TS val 3770472033 ecr 828119010], length 252
17:14:31.204090 IP 68.183.205.32.ssh > cpe00fc8d483dd3-cm00fc8d483dd0.cpe.net.cable.rogers.com.54786: Flags [P.], seq 9567588:9567840, ack 5725, win 501, options [nop,nop,TS val 3770472033 ecr 828119010], length 252
17:14:31.204141 IP 68.183.205.32.ssh > cpe00fc8d483dd3-cm00fc8d483dd0.cpe.net.cable.rogers.com.54786: Flags [P.], seq 9567840:9568092, ack 5725, win 501, options [nop,nop,TS val 3770472033 ecr 828119010], length 252
17:14:31.204185 IP 68.183.205.32.ssh > cpe00fc8d483dd3-cm00fc8d483dd0.cpe.net.cable.rogers.com.54786: Flags [P.], seq 9568092:9568344, ack 5725, win 501, options [nop,nop,TS val 3770472033 ecr 828119010], length 252
17:14:31.204228 IP 68.183.205.32.ssh > cpe00fc8d483dd3-cm00fc8d483dd0.cpe.net.cable.rogers.com.54786: Flags [P.], seq 9568344:9568596, ack 5725, win 501, options [nop,nop,TS val 3770472033 ecr 828119010], length 252
17:14:31.204270 IP 68.183.205.32.ssh > cpe00fc8d483dd3-cm00fc8d483dd0.cpe.net.cable.rogers.com.54786: Flags [P.], seq 9568596:9568848, ack 5725, win 501, options [nop,nop,TS val 3770472033 ecr 828119010], length 252
17:14:31.204330 IP 68.183.205.32.ssh > cpe00fc8d483dd3-cm00fc8d483dd0.cpe.net.cable.rogers.com.54786: Flags [P.], seq 9568848:9569100, ack 5725, win 501, options [nop,nop,TS val 3770472033 ecr 828119010], length 252
17:14:31.204377 IP 68.183.205.32.ssh > cpe00fc8d483dd3-cm00fc8d483dd0.cpe.net.cable.rogers.com.54786: Flags [P.], seq 9569100:9569352, ack 5725, win 501, options [nop,nop,TS val 3770472033 ecr 828119010], length 252
17:14:31.204425 IP 68.183.205.32.ssh > cpe00fc8d483dd3-cm00fc8d483dd0.cpe.net.cable.rogers.com.54786: Flags [P.], seq 9569352:9569604, ack 5725, win 501, options [nop,nop,TS val 3770472033 ecr 828119010], length 252
17:14:31.204469 IP 68.183.205.32.ssh > cpe00fc8d483dd3-cm00fc8d483dd0.cpe.net.cable.rogers.com.54786: Flags [P.], seq 9569604:9569856, ack 5725, win 501, options [nop,nop,TS val 3770472033 ecr 828119010], length 252
17:14:31.204511 IP 68.183.205.32.ssh > cpe00fc8d483dd3-cm00fc8d483dd0.cpe.net.cable.rogers.com.54786: Flags [P.], seq 9569856:9570108, ack 5725, win 501, options [nop,nop,TS val 3770472033 ecr 828119010], length 252
17:14:31.204558 IP 68.183.205.32.ssh > cpe00fc8d483dd3-cm00fc8d483dd0.cpe.net.cable.rogers.com.54786: Flags [P.], seq 9570108:9570360, ack 5725, win 501, options [nop,nop,TS val 3770472033 ecr 828119010], length 252
17:14:31.204600 IP 68.183.205.32.ssh > cpe00fc8d483dd3-cm00fc8d483dd0.cpe.net.cable.rogers.com.54786: Flags [P.], seq 9570360:9570612, ack 5725, win 501, options [nop,nop,TS val 3770472034 ecr 828119010], length 252
17:14:31.204680 IP 68.183.205.32.ssh > cpe00fc8d483dd3-cm00fc8d483dd0.cpe.net.cable.rogers.com.54786: Flags [P.], seq 9570612:9570864, ack 5725, win 501, options [nop,nop,TS val 3770472034 ecr 828119010], length 252
17:14:31.204749 IP 68.183.205.32.ssh > cpe00fc8d483dd3-cm00fc8d483dd0.cpe.net.cable.rogers.com.54786: Flags [P.], seq 9570864:9571116, ack 5725, win 501, options [nop,nop,TS val 3770472034 ecr 828119010], length 252
17:14:31.204796 IP 68.183.205.32.ssh > cpe00fc8d483dd3-cm00fc8d483dd0.cpe.net.cable.rogers.com.54786: Flags [P.], seq 9571116:9571368, ack 5725, win 501, options [nop,nop,TS val 3770472034 ecr 828119010], length 252
17:14:31.204839 IP 68.183.205.32.ssh > cpe00fc8d483dd3-cm00fc8d483dd0.cpe.net.cable.rogers.com.54786: Flags [P.], seq 9571368:9571620, ack 5725, win 501, options [nop,nop,TS val 3770472034 ecr 828119010], length 252
17:14:31.204882 IP 68.183.205.32.ssh > cpe00fc8d483dd3-cm00fc8d483dd0.cpe.net.cable.rogers.com.54786: Flags [P.], seq 9571620:9571872, ack 5725, win 501, options [nop,nop,TS val 3770472034 ecr 828119010], length 252
17:14:31.204925 IP 68.183.205.32.ssh > cpe00fc8d483dd3-cm00fc8d483dd0.cpe.net.cable.rogers.com.54786: Flags [P.], seq 9571872:9572124, ack 5725, win 501, options [nop,nop,TS val 3770472034 ecr 828119010], length 252
17:14:31.204971 IP 68.183.205.32.ssh > cpe00fc8d483dd3-cm00fc8d483dd0.cpe.net.cable.rogers.com.54786: Flags [P.], seq 9572124:9572376, ack 5725, win 501, options [nop,nop,TS val 3770472034 ecr 828119010], length 252
17:14:31.205032 IP 68.183.205.32.ssh > cpe00fc8d483dd3-cm00fc8d483dd0.cpe.net.cable.rogers.com.54786: Flags [P.], seq 9572376:9572628, ack 5725, win 501, options [nop,nop,TS val 3770472034 ecr 828119010], length 252
17:14:31.205097 IP 68.183.205.32.ssh > cpe00fc8d483dd3-cm00fc8d483dd0.cpe.net.cable.rogers.com.54786: Flags [P.], seq 9572628:9572880, ack 5725, win 501, options [nop,nop,TS val 3770472034 ecr 828119010], length 252
17:14:31.205157 IP 68.183.205.32.ssh > cpe00fc8d483dd3-cm00fc8d483dd0.cpe.net.cable.rogers.com.54786: Flags [P.], seq 9572880:9573132, ack 5725, win 501, options [nop,nop,TS val 3770472034 ecr 828119010], length 252
17:14:31.205216 IP 68.183.205.32.ssh > cpe00fc8d483dd3-cm00fc8d483dd0.cpe.net.cable.rogers.com.54786: Flags [P.], seq 9573132:9573384, ack 5725, win 501, options [nop,nop,TS val 3770472034 ecr 828119010], length 252
17:14:31.205284 IP 68.183.205.32.ssh > cpe00fc8d483dd3-cm00fc8d483dd0.cpe.net.cable.rogers.com.54786: Flags [P.], seq 9573384:9573636, ack 5725, win 501, options [nop,nop,TS val 3770472034 ecr 828119010], length 252
17:14:31.205345 IP 68.183.205.32.ssh > cpe00fc8d483dd3-cm00fc8d483dd0.cpe.net.cable.rogers.com.54786: Flags [P.], seq 9573636:9573888, ack 5725, win 501, options [nop,nop,TS val 3770472034 ecr 828119010], length 252
17:14:31.205413 IP 68.183.205.32.ssh > cpe00fc8d483dd3-cm00fc8d483dd0.cpe.net.cable.rogers.com.54786: Flags [P.], seq 9573888:9574140, ack 5725, win 501, options [nop,nop,TS val 3770472034 ecr 828119010], length 252
17:14:31.205477 IP 68.183.205.32.ssh > cpe00fc8d483dd3-cm00fc8d483dd0.cpe.net.cable.rogers.com.54786: Flags [P.], seq 9574140:9574392, ack 5725, win 501, options [nop,nop,TS val 3770472034 ecr 828119010], length 252
17:14:31.205539 IP 68.183.205.32.ssh > cpe00fc8d483dd3-cm00fc8d483dd0.cpe.net.cable.rogers.com.54786: Flags [P.], seq 9574392:9574644, ack 5725, win 501, options [nop,nop,TS val 3770472034 ecr 828119010], length 252
17:14:31.205603 IP 68.183.205.32.ssh > cpe00fc8d483dd3-cm00fc8d483dd0.cpe.net.cable.rogers.com.54786: Flags [P.], seq 9574644:9574896, ack 5725, win 501, options [nop,nop,TS val 3770472035 ecr 828119010], length 252
17:14:31.205664 IP 68.183.205.32.ssh > cpe00fc8d483dd3-cm00fc8d483dd0.cpe.net.cable.rogers.com.54786: Flags [P.], seq 9574896:9575148, ack 5725, win 501, options [nop,nop,TS val 3770472035 ecr 828119010], length 252
17:14:31.205733 IP 68.183.205.32.ssh > cpe00fc8d483dd3-cm00fc8d483dd0.cpe.net.cable.rogers.com.54786: Flags [P.], seq 9575148:9575400, ack 5725, win 501, options [nop,nop,TS val 3770472035 ecr 828119010], length 252
17:14:31.205797 IP 68.183.205.32.ssh > cpe00fc8d483dd3-cm00fc8d483dd0.cpe.net.cable.rogers.com.54786: Flags [P.], seq 9575400:9575652, ack 5725, win 501, options [nop,nop,TS val 3770472035 ecr 828119010], length 252
17:14:31.205858 IP 68.183.205.32.ssh > cpe00fc8d483dd3-cm00fc8d483dd0.cpe.net.cable.rogers.com.54786: Flags [P.], seq 9575652:9575904, ack 5725, win 501, options [nop,nop,TS val 3770472035 ecr 828119010], length 252
17:14:31.205917 IP 68.183.205.32.ssh > cpe00fc8d483dd3-cm00fc8d483dd0.cpe.net.cable.rogers.com.54786: Flags [P.], seq 9575904:9576156, ack 5725, win 501, options [nop,nop,TS val 3770472035 ecr 828119010], length 252
17:14:31.205980 IP 68.183.205.32.ssh > cpe00fc8d483dd3-cm00fc8d483dd0.cpe.net.cable.rogers.com.54786: Flags [P.], seq 9576156:9576408, ack 5725, win 501, options [nop,nop,TS val 3770472035 ecr 828119010], length 252
17:14:31.206039 IP 68.183.205.32.ssh > cpe00fc8d483dd3-cm00fc8d483dd0.cpe.net.cable.rogers.com.54786: Flags [P.], seq 9576408:9576660, ack 5725, win 501, options [nop,nop,TS val 3770472035 ecr 828119010], length 252
17:14:31.206100 IP 68.183.205.32.ssh > cpe00fc8d483dd3-cm00fc8d483dd0.cpe.net.cable.rogers.com.54786: Flags [P.], seq 9576660:9576912, ack 5725, win 501, options [nop,nop,TS val 3770472035 ecr 828119010], length 252
17:14:31.206162 IP 68.183.205.32.ssh > cpe00fc8d483dd3-cm00fc8d483dd0.cpe.net.cable.rogers.com.54786: Flags [P.], seq 9576912:9577164, ack 5725, win 501, options [nop,nop,TS val 3770472035 ecr 828119010], length 252
17:14:31.206248 IP 68.183.205.32.ssh > cpe00fc8d483dd3-cm00fc8d483dd0.cpe.net.cable.rogers.com.54786: Flags [P.], seq 9577164:9577416, ack 5725, win 501, options [nop,nop,TS val 3770472035 ecr 828119010], length 252
17:14:31.206318 IP 68.183.205.32.ssh > cpe00fc8d483dd3-cm00fc8d483dd0.cpe.net.cable.rogers.com.54786: Flags [P.], seq 9577416:9577668, ack 5725, win 501, options [nop,nop,TS val 3770472035 ecr 828119010], length 252
17:14:31.206381 IP 68.183.205.32.ssh > cpe00fc8d483dd3-cm00fc8d483dd0.cpe.net.cable.rogers.com.54786: Flags [P.], seq 9577668:9577920, ack 5725, win 501, options [nop,nop,TS val 3770472035 ecr 828119010], length 252
17:14:31.206440 IP 68.183.205.32.ssh > cpe00fc8d483dd3-cm00fc8d483dd0.cpe.net.cable.rogers.com.54786: Flags [P.], seq 9577920:9578172, ack 5725, win 501, options [nop,nop,TS val 3770472035 ecr 828119010], length 252
17:14:31.206499 IP 68.183.205.32.ssh > cpe00fc8d483dd3-cm00fc8d483dd0.cpe.net.cable.rogers.com.54786: Flags [P.], seq 9578172:9578424, ack 5725, win 501, options [nop,nop,TS val 3770472035 ecr 828119010], length 252
17:14:31.206567 IP 68.183.205.32.ssh > cpe00fc8d483dd3-cm00fc8d483dd0.cpe.net.cable.rogers.com.54786: Flags [P.], seq 9578424:9578676, ack 5725, win 501, options [nop,nop,TS val 3770472035 ecr 828119010], length 252
17:14:31.206636 IP 68.183.205.32.ssh > cpe00fc8d483dd3-cm00fc8d483dd0.cpe.net.cable.rogers.com.54786: Flags [P.], seq 9578676:9578928, ack 5725, win 501, options [nop,nop,TS val 3770472036 ecr 828119010], length 252
17:14:31.206700 IP 68.183.205.32.ssh > cpe00fc8d483dd3-cm00fc8d483dd0.cpe.net.cable.rogers.com.54786: Flags [P.], seq 9578928:9579180, ack 5725, win 501, options [nop,nop,TS val 3770472036 ecr 828119010], length 252
17:14:31.206760 IP 68.183.205.32.ssh > cpe00fc8d483dd3-cm00fc8d483dd0.cpe.net.cable.rogers.com.54786: Flags [P.], seq 9579180:9579432, ack 5725, win 501, options [nop,nop,TS val 3770472036 ecr 828119010], length 252
17:14:31.206832 IP 68.183.205.32.ssh > cpe00fc8d483dd3-cm00fc8d483dd0.cpe.net.cable.rogers.com.54786: Flags [P.], seq 9579432:9579684, ack 5725, win 501, options [nop,nop,TS val 3770472036 ecr 828119010], length 252
17:14:31.206886 IP 68.183.205.32.ssh > cpe00fc8d483dd3-cm00fc8d483dd0.cpe.net.cable.rogers.com.54786: Flags [P.], seq 9579684:9579936, ack 5725, win 501, options [nop,nop,TS val 3770472036 ecr 828119010], length 252
17:14:31.206940 IP 68.183.205.32.ssh > cpe00fc8d483dd3-cm00fc8d483dd0.cpe.net.cable.rogers.com.54786: Flags [P.], seq 9579936:9580188, ack 5725, win 501, options [nop,nop,TS val 3770472036 ecr 828119010], length 252
17:14:31.206991 IP 68.183.205.32.ssh > cpe00fc8d483dd3-cm00fc8d483dd0.cpe.net.cable.rogers.com.54786: Flags [P.], seq 9580188:9580440, ack 5725, win 501, options [nop,nop,TS val 3770472036 ecr 828119010], length 252
17:14:31.207043 IP 68.183.205.32.ssh > cpe00fc8d483dd3-cm00fc8d483dd0.cpe.net.cable.rogers.com.54786: Flags [P.], seq 9580440:9580692, ack 5725, win 501, options [nop,nop,TS val 3770472036 ecr 828119010], length 252
17:14:31.207102 IP cpe00fc8d483dd3-cm00fc8d483dd0.cpe.net.cable.rogers.com.54786 > 68.183.205.32.ssh: Flags [P.], seq 5725:5761, ack 9491364, win 37094, options [nop,nop,TS val 828119012 ecr 3770472015], length 36
17:14:31.207119 IP cpe00fc8d483dd3-cm00fc8d483dd0.cpe.net.cable.rogers.com.54786 > 68.183.205.32.ssh: Flags [.], ack 9506544, win 37094, options [nop,nop,TS val 828119014 ecr 3770472019], length 0
17:14:31.207158 IP cpe00fc8d483dd3-cm00fc8d483dd0.cpe.net.cable.rogers.com.54786 > 68.183.205.32.ssh: Flags [.], ack 9531692, win 37094, options [nop,nop,TS val 828119019 ecr 3770472025], length 0
^C
38115 packets captured
38125 packets received by filter
8 packets dropped by kernel
root@lamp-ubuntu-s-1vcpu-1gb-tor1-01:~# tcpdump -i eth0 dst 68.183.205.32
tcpdump: verbose output suppressed, use -v or -vv for full protocol decode
listening on eth0, link-type EN10MB (Ethernet), capture size 262144 bytes
17:14:51.784649 IP cpe00fc8d483dd3-cm00fc8d483dd0.cpe.net.cable.rogers.com.54786 > 68.183.205.32.ssh: Flags [.], ack 2166704605, win 37093, options [nop,nop,TS val 828139334 ecr 3770492602], length 0
17:14:51.792245 IP cpe00fc8d483dd3-cm00fc8d483dd0.cpe.net.cable.rogers.com.54786 > 68.183.205.32.ssh: Flags [.], ack 289, win 37089, options [nop,nop,TS val 828139338 ecr 3770492605], length 0
17:14:51.805846 IP dns.google.domain > 68.183.205.32.37535: 14357 NXDomain 0/1/0 (111)
17:14:51.814487 IP dns.google.domain > 68.183.205.32.35912: 21790 1/0/0 PTR cpe00fc8d483dd3-cm00fc8d483dd0.cpe.net.cable.rogers.com. (111)
17:14:51.815977 IP dns.google.domain > 68.183.205.32.55417: 37991 1/0/0 PTR dns.google. (62)
17:14:51.831527 IP cpe00fc8d483dd3-cm00fc8d483dd0.cpe.net.cable.rogers.com.54786 > 68.183.205.32.ssh: Flags [.], ack 1193, win 37093, options [nop,nop,TS val 828139376 ecr 3770492645], length 0
17:14:51.831589 IP cpe00fc8d483dd3-cm00fc8d483dd0.cpe.net.cable.rogers.com.54786 > 68.183.205.32.ssh: Flags [.], ack 1361, win 37091, options [nop,nop,TS val 828139377 ecr 3770492645], length 0
17:14:51.845885 IP cpe00fc8d483dd3-cm00fc8d483dd0.cpe.net.cable.rogers.com.54786 > 68.183.205.32.ssh: Flags [.], ack 1889, win 37085, options [nop,nop,TS val 828139392 ecr 3770492661], length 0
17:14:51.860036 IP cpe00fc8d483dd3-cm00fc8d483dd0.cpe.net.cable.rogers.com.54786 > 68.183.205.32.ssh: Flags [.], ack 2153, win 37090, options [nop,nop,TS val 828139406 ecr 3770492675], length 0
17:14:51.872543 IP cpe00fc8d483dd3-cm00fc8d483dd0.cpe.net.cable.rogers.com.54786 > 68.183.205.32.ssh: Flags [.], ack 2417, win 37090, options [nop,nop,TS val 828139420 ecr 3770492689], length 0
17:14:51.886756 IP cpe00fc8d483dd3-cm00fc8d483dd0.cpe.net.cable.rogers.com.54786 > 68.183.205.32.ssh: Flags [.], ack 2681, win 37090, options [nop,nop,TS val 828139432 ecr 3770492702], length 0
17:14:51.901053 IP cpe00fc8d483dd3-cm00fc8d483dd0.cpe.net.cable.rogers.com.54786 > 68.183.205.32.ssh: Flags [.], ack 2945, win 37090, options [nop,nop,TS val 828139445 ecr 3770492716], length 0
17:14:51.918395 IP cpe00fc8d483dd3-cm00fc8d483dd0.cpe.net.cable.rogers.com.54786 > 68.183.205.32.ssh: Flags [.], ack 3209, win 37090, options [nop,nop,TS val 828139459 ecr 3770492730], length 0
17:14:51.938160 IP cpe00fc8d483dd3-cm00fc8d483dd0.cpe.net.cable.rogers.com.54786 > 68.183.205.32.ssh: Flags [.], ack 3473, win 37090, options [nop,nop,TS val 828139476 ecr 3770492748], length 0
17:14:51.952744 IP cpe00fc8d483dd3-cm00fc8d483dd0.cpe.net.cable.rogers.com.54786 > 68.183.205.32.ssh: Flags [.], ack 3737, win 37090, options [nop,nop,TS val 828139495 ecr 3770492767], length 0
17:14:51.967870 IP cpe00fc8d483dd3-cm00fc8d483dd0.cpe.net.cable.rogers.com.54786 > 68.183.205.32.ssh: Flags [.], ack 4001, win 37090, options [nop,nop,TS val 828139509 ecr 3770492782], length 0
17:14:51.981787 IP cpe00fc8d483dd3-cm00fc8d483dd0.cpe.net.cable.rogers.com.54786 > 68.183.205.32.ssh: Flags [.], ack 4265, win 37090, options [nop,nop,TS val 828139524 ecr 3770492797], length 0
17:14:51.995137 IP cpe00fc8d483dd3-cm00fc8d483dd0.cpe.net.cable.rogers.com.54786 > 68.183.205.32.ssh: Flags [.], ack 4529, win 37094, options [nop,nop,TS val 828139536 ecr 3770492811], length 0
17:14:52.009207 IP cpe00fc8d483dd3-cm00fc8d483dd0.cpe.net.cable.rogers.com.54786 > 68.183.205.32.ssh: Flags [.], ack 4793, win 37094, options [nop,nop,TS val 828139549 ecr 3770492824], length 0
17:14:52.022930 IP cpe00fc8d483dd3-cm00fc8d483dd0.cpe.net.cable.rogers.com.54786 > 68.183.205.32.ssh: Flags [.], ack 5057, win 37094, options [nop,nop,TS val 828139561 ecr 3770492838], length 0
17:14:52.038846 IP cpe00fc8d483dd3-cm00fc8d483dd0.cpe.net.cable.rogers.com.54786 > 68.183.205.32.ssh: Flags [.], ack 5321, win 37094, options [nop,nop,TS val 828139574 ecr 3770492852], length 0
17:14:52.052802 IP cpe00fc8d483dd3-cm00fc8d483dd0.cpe.net.cable.rogers.com.54786 > 68.183.205.32.ssh: Flags [.], ack 5585, win 37094, options [nop,nop,TS val 828139589 ecr 3770492868], length 0
17:14:52.069511 IP cpe00fc8d483dd3-cm00fc8d483dd0.cpe.net.cable.rogers.com.54786 > 68.183.205.32.ssh: Flags [.], ack 5849, win 37094, options [nop,nop,TS val 828139603 ecr 3770492882], length 0
17:14:52.084157 IP cpe00fc8d483dd3-cm00fc8d483dd0.cpe.net.cable.rogers.com.54786 > 68.183.205.32.ssh: Flags [.], ack 6113, win 37094, options [nop,nop,TS val 828139619 ecr 3770492899], length 0
17:14:52.100031 IP cpe00fc8d483dd3-cm00fc8d483dd0.cpe.net.cable.rogers.com.54786 > 68.183.205.32.ssh: Flags [.], ack 6377, win 37094, options [nop,nop,TS val 828139633 ecr 3770492913], length 0
17:14:52.114770 IP cpe00fc8d483dd3-cm00fc8d483dd0.cpe.net.cable.rogers.com.54786 > 68.183.205.32.ssh: Flags [.], ack 6641, win 37094, options [nop,nop,TS val 828139647 ecr 3770492929], length 0
17:14:52.129488 IP cpe00fc8d483dd3-cm00fc8d483dd0.cpe.net.cable.rogers.com.54786 > 68.183.205.32.ssh: Flags [.], ack 6905, win 37094, options [nop,nop,TS val 828139661 ecr 3770492944], length 0
17:14:52.143458 IP cpe00fc8d483dd3-cm00fc8d483dd0.cpe.net.cable.rogers.com.54786 > 68.183.205.32.ssh: Flags [.], ack 7169, win 37094, options [nop,nop,TS val 828139675 ecr 3770492959], length 0
17:14:52.163520 IP cpe00fc8d483dd3-cm00fc8d483dd0.cpe.net.cable.rogers.com.54786 > 68.183.205.32.ssh: Flags [.], ack 7433, win 37094, options [nop,nop,TS val 828139689 ecr 3770492973], length 0
17:14:52.177915 IP cpe00fc8d483dd3-cm00fc8d483dd0.cpe.net.cable.rogers.com.54786 > 68.183.205.32.ssh: Flags [.], ack 7697, win 37094, options [nop,nop,TS val 828139708 ecr 3770492993], length 0
17:14:52.194355 IP cpe00fc8d483dd3-cm00fc8d483dd0.cpe.net.cable.rogers.com.54786 > 68.183.205.32.ssh: Flags [.], ack 7961, win 37094, options [nop,nop,TS val 828139720 ecr 3770493007], length 0
17:14:52.209945 IP cpe00fc8d483dd3-cm00fc8d483dd0.cpe.net.cable.rogers.com.54786 > 68.183.205.32.ssh: Flags [.], ack 8225, win 37094, options [nop,nop,TS val 828139737 ecr 3770493024], length 0
17:14:52.225832 IP cpe00fc8d483dd3-cm00fc8d483dd0.cpe.net.cable.rogers.com.54786 > 68.183.205.32.ssh: Flags [.], ack 8489, win 37094, options [nop,nop,TS val 828139752 ecr 3770493039], length 0
17:14:52.241491 IP cpe00fc8d483dd3-cm00fc8d483dd0.cpe.net.cable.rogers.com.54786 > 68.183.205.32.ssh: Flags [.], ack 8753, win 37094, options [nop,nop,TS val 828139767 ecr 3770493055], length 0
17:14:52.256777 IP cpe00fc8d483dd3-cm00fc8d483dd0.cpe.net.cable.rogers.com.54786 > 68.183.205.32.ssh: Flags [.], ack 9017, win 37094, options [nop,nop,TS val 828139782 ecr 3770493071], length 0
17:14:52.274423 IP cpe00fc8d483dd3-cm00fc8d483dd0.cpe.net.cable.rogers.com.54786 > 68.183.205.32.ssh: Flags [.], ack 9281, win 37094, options [nop,nop,TS val 828139798 ecr 3770493086], length 0
17:14:52.290441 IP cpe00fc8d483dd3-cm00fc8d483dd0.cpe.net.cable.rogers.com.54786 > 68.183.205.32.ssh: Flags [.], ack 9545, win 37094, options [nop,nop,TS val 828139814 ecr 3770493104], length 0
17:14:52.312476 IP cpe00fc8d483dd3-cm00fc8d483dd0.cpe.net.cable.rogers.com.54786 > 68.183.205.32.ssh: Flags [.], ack 9809, win 37094, options [nop,nop,TS val 828139829 ecr 3770493120], length 0
17:14:52.328932 IP cpe00fc8d483dd3-cm00fc8d483dd0.cpe.net.cable.rogers.com.54786 > 68.183.205.32.ssh: Flags [.], ack 10073, win 37094, options [nop,nop,TS val 828139851 ecr 3770493142], length 0
17:14:52.344559 IP cpe00fc8d483dd3-cm00fc8d483dd0.cpe.net.cable.rogers.com.54786 > 68.183.205.32.ssh: Flags [.], ack 10337, win 37094, options [nop,nop,TS val 828139867 ecr 3770493158], length 0
17:14:52.360524 IP cpe00fc8d483dd3-cm00fc8d483dd0.cpe.net.cable.rogers.com.54786 > 68.183.205.32.ssh: Flags [.], ack 10601, win 37094, options [nop,nop,TS val 828139881 ecr 3770493174], length 0
17:14:52.374681 IP cpe00fc8d483dd3-cm00fc8d483dd0.cpe.net.cable.rogers.com.54786 > 68.183.205.32.ssh: Flags [.], ack 10865, win 37094, options [nop,nop,TS val 828139896 ecr 3770493190], length 0
17:14:52.387247 IP cpe00fc8d483dd3-cm00fc8d483dd0.cpe.net.cable.rogers.com.54786 > 68.183.205.32.ssh: Flags [.], ack 11129, win 37094, options [nop,nop,TS val 828139910 ecr 3770493204], length 0
17:14:52.405058 IP cpe00fc8d483dd3-cm00fc8d483dd0.cpe.net.cable.rogers.com.54786 > 68.183.205.32.ssh: Flags [.], ack 11393, win 37094, options [nop,nop,TS val 828139921 ecr 3770493216], length 0
17:14:52.419603 IP cpe00fc8d483dd3-cm00fc8d483dd0.cpe.net.cable.rogers.com.54786 > 68.183.205.32.ssh: Flags [.], ack 11657, win 37094, options [nop,nop,TS val 828139938 ecr 3770493234], length 0
17:14:52.433340 IP cpe00fc8d483dd3-cm00fc8d483dd0.cpe.net.cable.rogers.com.54786 > 68.183.205.32.ssh: Flags [.], ack 11921, win 37094, options [nop,nop,TS val 828139953 ecr 3770493249], length 0
17:14:52.448462 IP cpe00fc8d483dd3-cm00fc8d483dd0.cpe.net.cable.rogers.com.54786 > 68.183.205.32.ssh: Flags [.], ack 12185, win 37094, options [nop,nop,TS val 828139965 ecr 3770493263], length 0
17:14:52.463597 IP cpe00fc8d483dd3-cm00fc8d483dd0.cpe.net.cable.rogers.com.54786 > 68.183.205.32.ssh: Flags [.], ack 12449, win 37094, options [nop,nop,TS val 828139980 ecr 3770493278], length 0
17:14:52.476257 IP cpe00fc8d483dd3-cm00fc8d483dd0.cpe.net.cable.rogers.com.54786 > 68.183.205.32.ssh: Flags [.], ack 12713, win 37094, options [nop,nop,TS val 828139994 ecr 3770493293], length 0
17:14:52.499513 IP cpe00fc8d483dd3-cm00fc8d483dd0.cpe.net.cable.rogers.com.54786 > 68.183.205.32.ssh: Flags [.], ack 12977, win 37094, options [nop,nop,TS val 828140006 ecr 3770493305], length 0
17:14:52.518658 IP cpe00fc8d483dd3-cm00fc8d483dd0.cpe.net.cable.rogers.com.54786 > 68.183.205.32.ssh: Flags [.], ack 13241, win 37094, options [nop,nop,TS val 828140028 ecr 3770493329], length 0
17:14:52.534379 IP cpe00fc8d483dd3-cm00fc8d483dd0.cpe.net.cable.rogers.com.54786 > 68.183.205.32.ssh: Flags [.], ack 13505, win 37094, options [nop,nop,TS val 828140047 ecr 3770493348], length 0
17:14:52.554924 IP cpe00fc8d483dd3-cm00fc8d483dd0.cpe.net.cable.rogers.com.54786 > 68.183.205.32.ssh: Flags [.], ack 13769, win 37094, options [nop,nop,TS val 828140062 ecr 3770493364], length 0
17:14:52.567876 IP cpe00fc8d483dd3-cm00fc8d483dd0.cpe.net.cable.rogers.com.54786 > 68.183.205.32.ssh: Flags [.], ack 14033, win 37094, options [nop,nop,TS val 828140083 ecr 3770493384], length 0
17:14:52.592017 IP cpe00fc8d483dd3-cm00fc8d483dd0.cpe.net.cable.rogers.com.54786 > 68.183.205.32.ssh: Flags [.], ack 14297, win 37094, options [nop,nop,TS val 828140095 ecr 3770493397], length 0
17:14:52.606035 IP cpe00fc8d483dd3-cm00fc8d483dd0.cpe.net.cable.rogers.com.54786 > 68.183.205.32.ssh: Flags [.], ack 14561, win 37094, options [nop,nop,TS val 828140118 ecr 3770493421], length 0
17:14:52.627024 IP cpe00fc8d483dd3-cm00fc8d483dd0.cpe.net.cable.rogers.com.54786 > 68.183.205.32.ssh: Flags [.], ack 14825, win 37094, options [nop,nop,TS val 828140130 ecr 3770493435], length 0
17:14:52.646321 IP cpe00fc8d483dd3-cm00fc8d483dd0.cpe.net.cable.rogers.com.54786 > 68.183.205.32.ssh: Flags [.], ack 15089, win 37094, options [nop,nop,TS val 828140151 ecr 3770493456], length 0
17:14:52.661068 IP cpe00fc8d483dd3-cm00fc8d483dd0.cpe.net.cable.rogers.com.54786 > 68.183.205.32.ssh: Flags [.], ack 15353, win 37094, options [nop,nop,TS val 828140170 ecr 3770493475], length 0
17:14:52.675575 IP cpe00fc8d483dd3-cm00fc8d483dd0.cpe.net.cable.rogers.com.54786 > 68.183.205.32.ssh: Flags [.], ack 15617, win 37094, options [nop,nop,TS val 828140184 ecr 3770493490], length 0
17:14:52.697325 IP cpe00fc8d483dd3-cm00fc8d483dd0.cpe.net.cable.rogers.com.54786 > 68.183.205.32.ssh: Flags [.], ack 15881, win 37094, options [nop,nop,TS val 828140198 ecr 3770493505], length 0
17:14:52.710314 IP cpe00fc8d483dd3-cm00fc8d483dd0.cpe.net.cable.rogers.com.54786 > 68.183.205.32.ssh: Flags [.], ack 16145, win 37094, options [nop,nop,TS val 828140219 ecr 3770493526], length 0
17:14:52.724660 IP cpe00fc8d483dd3-cm00fc8d483dd0.cpe.net.cable.rogers.com.54786 > 68.183.205.32.ssh: Flags [.], ack 16409, win 37094, options [nop,nop,TS val 828140231 ecr 3770493539], length 0
17:14:52.749974 IP cpe00fc8d483dd3-cm00fc8d483dd0.cpe.net.cable.rogers.com.54786 > 68.183.205.32.ssh: Flags [.], ack 16673, win 37094, options [nop,nop,TS val 828140245 ecr 3770493554], length 0
17:14:52.765572 IP cpe00fc8d483dd3-cm00fc8d483dd0.cpe.net.cable.rogers.com.54786 > 68.183.205.32.ssh: Flags [.], ack 16937, win 37094, options [nop,nop,TS val 828140270 ecr 3770493579], length 0
17:14:52.780826 IP cpe00fc8d483dd3-cm00fc8d483dd0.cpe.net.cable.rogers.com.54786 > 68.183.205.32.ssh: Flags [.], ack 17201, win 37094, options [nop,nop,TS val 828140286 ecr 3770493595], length 0
17:14:52.797621 IP cpe00fc8d483dd3-cm00fc8d483dd0.cpe.net.cable.rogers.com.54786 > 68.183.205.32.ssh: Flags [.], ack 17465, win 37094, options [nop,nop,TS val 828140300 ecr 3770493610], length 0
17:14:52.813303 IP cpe00fc8d483dd3-cm00fc8d483dd0.cpe.net.cable.rogers.com.54786 > 68.183.205.32.ssh: Flags [.], ack 17729, win 37094, options [nop,nop,TS val 828140316 ecr 3770493627], length 0
17:14:52.827919 IP cpe00fc8d483dd3-cm00fc8d483dd0.cpe.net.cable.rogers.com.54786 > 68.183.205.32.ssh: Flags [.], ack 17993, win 37094, options [nop,nop,TS val 828140331 ecr 3770493642], length 0
17:14:52.840493 IP cpe00fc8d483dd3-cm00fc8d483dd0.cpe.net.cable.rogers.com.54786 > 68.183.205.32.ssh: Flags [.], ack 18221, win 37094, options [nop,nop,TS val 828140345 ecr 3770493657], length 0
17:14:52.846830 IP cpe00fc8d483dd3-cm00fc8d483dd0.cpe.net.cable.rogers.com.54786 > 68.183.205.32.ssh: Flags [.], ack 18257, win 37094, options [nop,nop,TS val 828140346 ecr 3770493657], length 0
17:14:52.854698 IP cpe00fc8d483dd3-cm00fc8d483dd0.cpe.net.cable.rogers.com.54786 > 68.183.205.32.ssh: Flags [.], ack 18521, win 37094, options [nop,nop,TS val 828140357 ecr 3770493670], length 0
17:14:52.862274 IP cpe00fc8d483dd3-cm00fc8d483dd0.cpe.net.cable.rogers.com.54786 > 68.183.205.32.ssh: Flags [.], ack 18785, win 37094, options [nop,nop,TS val 828140362 ecr 3770493676], length 0
17:14:52.870409 IP cpe00fc8d483dd3-cm00fc8d483dd0.cpe.net.cable.rogers.com.54786 > 68.183.205.32.ssh: Flags [.], ack 19049, win 37094, options [nop,nop,TS val 828140369 ecr 3770493684], length 0
17:14:52.878092 IP cpe00fc8d483dd3-cm00fc8d483dd0.cpe.net.cable.rogers.com.54786 > 68.183.205.32.ssh: Flags [.], ack 19313, win 37094, options [nop,nop,TS val 828140376 ecr 3770493691], length 0
17:14:52.885559 IP cpe00fc8d483dd3-cm00fc8d483dd0.cpe.net.cable.rogers.com.54786 > 68.183.205.32.ssh: Flags [.], ack 19577, win 37094, options [nop,nop,TS val 828140383 ecr 3770493700], length 0
17:14:52.892595 IP cpe00fc8d483dd3-cm00fc8d483dd0.cpe.net.cable.rogers.com.54786 > 68.183.205.32.ssh: Flags [.], ack 19841, win 37094, options [nop,nop,TS val 828140391 ecr 3770493707], length 0
17:14:52.892648 IP cpe00fc8d483dd3-cm00fc8d483dd0.cpe.net.cable.rogers.com.54786 > 68.183.205.32.ssh: Flags [P.], seq 0:36, ack 19841, win 37094, options [nop,nop,TS val 828140391 ecr 3770493707], length 36
17:14:52.895455 IP ip-175-158-38-124.cbn.net.id.50823 > 68.183.205.32.ssh: Flags [S], seq 3876824659, win 64240, options [mss 1452,sackOK,TS val 1377547346 ecr 0,nop,wscale 7], length 0
17:14:52.903730 IP dns.google.domain > 68.183.205.32.45665: 15301 1/0/0 PTR ip-175-158-38-124.cbn.net.id. (87)
17:14:52.908177 IP cpe00fc8d483dd3-cm00fc8d483dd0.cpe.net.cable.rogers.com.54786 > 68.183.205.32.ssh: Flags [.], ack 20105, win 37094, options [nop,nop,TS val 828140397 ecr 3770493715], length 0
17:14:52.914963 IP cpe00fc8d483dd3-cm00fc8d483dd0.cpe.net.cable.rogers.com.54786 > 68.183.205.32.ssh: Flags [.], ack 20649, win 37085, options [nop,nop,TS val 828140404 ecr 3770493722], length 0
17:14:52.923882 IP cpe00fc8d483dd3-cm00fc8d483dd0.cpe.net.cable.rogers.com.54786 > 68.183.205.32.ssh: Flags [.], ack 21353, win 37090, options [nop,nop,TS val 828140418 ecr 3770493737], length 0
17:14:52.928316 IP cpe00fc8d483dd3-cm00fc8d483dd0.cpe.net.cable.rogers.com.54786 > 68.183.205.32.ssh: Flags [.], ack 21617, win 37094, options [nop,nop,TS val 828140424 ecr 3770493744], length 0
17:14:52.931403 IP cpe00fc8d483dd3-cm00fc8d483dd0.cpe.net.cable.rogers.com.54786 > 68.183.205.32.ssh: Flags [.], ack 21881, win 37094, options [nop,nop,TS val 828140432 ecr 3770493753], length 0
17:14:52.938124 IP cpe00fc8d483dd3-cm00fc8d483dd0.cpe.net.cable.rogers.com.54786 > 68.183.205.32.ssh: Flags [.], ack 22145, win 37094, options [nop,nop,TS val 828140436 ecr 3770493757], length 0
17:14:52.942563 IP cpe00fc8d483dd3-cm00fc8d483dd0.cpe.net.cable.rogers.com.54786 > 68.183.205.32.ssh: Flags [.], ack 22409, win 37094, options [nop,nop,TS val 828140438 ecr 3770493761], length 0
17:14:52.951652 IP cpe00fc8d483dd3-cm00fc8d483dd0.cpe.net.cable.rogers.com.54786 > 68.183.205.32.ssh: Flags [.], ack 22673, win 37094, options [nop,nop,TS val 828140444 ecr 3770493767], length 0
17:14:52.958257 IP cpe00fc8d483dd3-cm00fc8d483dd0.cpe.net.cable.rogers.com.54786 > 68.183.205.32.ssh: Flags [.], ack 22937, win 37094, options [nop,nop,TS val 828140449 ecr 3770493772], length 0
17:14:52.967022 IP cpe00fc8d483dd3-cm00fc8d483dd0.cpe.net.cable.rogers.com.54786 > 68.183.205.32.ssh: Flags [.], ack 23201, win 37094, options [nop,nop,TS val 828140457 ecr 3770493781], length 0
17:14:52.974408 IP cpe00fc8d483dd3-cm00fc8d483dd0.cpe.net.cable.rogers.com.54786 > 68.183.205.32.ssh: Flags [.], ack 23465, win 37094, options [nop,nop,TS val 828140463 ecr 3770493787], length 0
17:14:52.981876 IP cpe00fc8d483dd3-cm00fc8d483dd0.cpe.net.cable.rogers.com.54786 > 68.183.205.32.ssh: Flags [.], ack 23729, win 37094, options [nop,nop,TS val 828140471 ecr 3770493796], length 0
17:14:52.989941 IP cpe00fc8d483dd3-cm00fc8d483dd0.cpe.net.cable.rogers.com.54786 > 68.183.205.32.ssh: Flags [.], ack 23993, win 37094, options [nop,nop,TS val 828140478 ecr 3770493804], length 0
17:14:52.998077 IP cpe00fc8d483dd3-cm00fc8d483dd0.cpe.net.cable.rogers.com.54786 > 68.183.205.32.ssh: Flags [.], ack 24257, win 37094, options [nop,nop,TS val 828140484 ecr 3770493811], length 0
17:14:53.004639 IP cpe00fc8d483dd3-cm00fc8d483dd0.cpe.net.cable.rogers.com.54786 > 68.183.205.32.ssh: Flags [.], ack 24521, win 37094, options [nop,nop,TS val 828140492 ecr 3770493819], length 0
17:14:53.012814 IP cpe00fc8d483dd3-cm00fc8d483dd0.cpe.net.cable.rogers.com.54786 > 68.183.205.32.ssh: Flags [.], ack 24785, win 37094, options [nop,nop,TS val 828140500 ecr 3770493827], length 0
17:14:53.020902 IP cpe00fc8d483dd3-cm00fc8d483dd0.cpe.net.cable.rogers.com.54786 > 68.183.205.32.ssh: Flags [.], ack 25049, win 37094, options [nop,nop,TS val 828140506 ecr 3770493834], length 0
17:14:53.028284 IP cpe00fc8d483dd3-cm00fc8d483dd0.cpe.net.cable.rogers.com.54786 > 68.183.205.32.ssh: Flags [.], ack 25313, win 37094, options [nop,nop,TS val 828140514 ecr 3770493842], length 0
17:14:53.035292 IP cpe00fc8d483dd3-cm00fc8d483dd0.cpe.net.cable.rogers.com.54786 > 68.183.205.32.ssh: Flags [.], ack 25577, win 37094, options [nop,nop,TS val 828140521 ecr 3770493850], length 0
17:14:53.043533 IP cpe00fc8d483dd3-cm00fc8d483dd0.cpe.net.cable.rogers.com.54786 > 68.183.205.32.ssh: Flags [.], ack 25841, win 37094, options [nop,nop,TS val 828140528 ecr 3770493858], length 0
17:14:53.051361 IP cpe00fc8d483dd3-cm00fc8d483dd0.cpe.net.cable.rogers.com.54786 > 68.183.205.32.ssh: Flags [.], ack 26105, win 37094, options [nop,nop,TS val 828140535 ecr 3770493864], length 0
17:14:53.059067 IP cpe00fc8d483dd3-cm00fc8d483dd0.cpe.net.cable.rogers.com.54786 > 68.183.205.32.ssh: Flags [.], ack 26369, win 37094, options [nop,nop,TS val 828140543 ecr 3770493873], length 0
17:14:53.066956 IP cpe00fc8d483dd3-cm00fc8d483dd0.cpe.net.cable.rogers.com.54786 > 68.183.205.32.ssh: Flags [.], ack 26633, win 37094, options [nop,nop,TS val 828140550 ecr 3770493881], length 0
17:14:53.074982 IP cpe00fc8d483dd3-cm00fc8d483dd0.cpe.net.cable.rogers.com.54786 > 68.183.205.32.ssh: Flags [.], ack 26897, win 37094, options [nop,nop,TS val 828140557 ecr 3770493888], length 0
17:14:53.083910 IP cpe00fc8d483dd3-cm00fc8d483dd0.cpe.net.cable.rogers.com.54786 > 68.183.205.32.ssh: Flags [.], ack 27161, win 37094, options [nop,nop,TS val 828140564 ecr 3770493896], length 0
17:14:53.092215 IP cpe00fc8d483dd3-cm00fc8d483dd0.cpe.net.cable.rogers.com.54786 > 68.183.205.32.ssh: Flags [.], ack 27425, win 37094, options [nop,nop,TS val 828140572 ecr 3770493904], length 0
17:14:53.100026 IP cpe00fc8d483dd3-cm00fc8d483dd0.cpe.net.cable.rogers.com.54786 > 68.183.205.32.ssh: Flags [.], ack 27689, win 37094, options [nop,nop,TS val 828140580 ecr 3770493913], length 0
17:14:53.108188 IP cpe00fc8d483dd3-cm00fc8d483dd0.cpe.net.cable.rogers.com.54786 > 68.183.205.32.ssh: Flags [.], ack 27953, win 37094, options [nop,nop,TS val 828140588 ecr 3770493921], length 0
17:14:53.109895 IP cpe00fc8d483dd3-cm00fc8d483dd0.cpe.net.cable.rogers.com.54786 > 68.183.205.32.ssh: Flags [.], ack 28217, win 37094, options [nop,nop,TS val 828140595 ecr 3770493929], length 0
17:14:53.124518 IP cpe00fc8d483dd3-cm00fc8d483dd0.cpe.net.cable.rogers.com.54786 > 68.183.205.32.ssh: Flags [.], ack 28481, win 37094, options [nop,nop,TS val 828140602 ecr 3770493937], length 0
17:14:53.132801 IP cpe00fc8d483dd3-cm00fc8d483dd0.cpe.net.cable.rogers.com.54786 > 68.183.205.32.ssh: Flags [.], ack 28745, win 37094, options [nop,nop,TS val 828140603 ecr 3770493939], length 0
17:14:53.139052 IP cpe00fc8d483dd3-cm00fc8d483dd0.cpe.net.cable.rogers.com.54786 > 68.183.205.32.ssh: Flags [.], ack 29009, win 37094, options [nop,nop,TS val 828140617 ecr 3770493954], length 0
17:14:53.149854 IP cpe00fc8d483dd3-cm00fc8d483dd0.cpe.net.cable.rogers.com.54786 > 68.183.205.32.ssh: Flags [.], ack 29273, win 37094, options [nop,nop,TS val 828140625 ecr 3770493962], length 0
17:14:53.158336 IP cpe00fc8d483dd3-cm00fc8d483dd0.cpe.net.cable.rogers.com.54786 > 68.183.205.32.ssh: Flags [.], ack 29537, win 37094, options [nop,nop,TS val 828140630 ecr 3770493968], length 0
17:14:53.164788 IP cpe00fc8d483dd3-cm00fc8d483dd0.cpe.net.cable.rogers.com.54786 > 68.183.205.32.ssh: Flags [.], ack 29801, win 37094, options [nop,nop,TS val 828140640 ecr 3770493979], length 0
17:14:53.174477 IP cpe00fc8d483dd3-cm00fc8d483dd0.cpe.net.cable.rogers.com.54786 > 68.183.205.32.ssh: Flags [.], ack 30065, win 37094, options [nop,nop,TS val 828140649 ecr 3770493988], length 0
17:14:53.176922 IP ip-175-158-38-124.cbn.net.id.50823 > 68.183.205.32.ssh: Flags [.], ack 3470140856, win 502, options [nop,nop,TS val 1377547628 ecr 2642015504], length 0
17:14:53.180461 IP cpe00fc8d483dd3-cm00fc8d483dd0.cpe.net.cable.rogers.com.54786 > 68.183.205.32.ssh: Flags [.], ack 30329, win 37094, options [nop,nop,TS val 828140655 ecr 3770493994], length 0
17:14:53.188647 IP cpe00fc8d483dd3-cm00fc8d483dd0.cpe.net.cable.rogers.com.54786 > 68.183.205.32.ssh: Flags [.], ack 30593, win 37094, options [nop,nop,TS val 828140663 ecr 3770494004], length 0
17:14:53.199094 IP cpe00fc8d483dd3-cm00fc8d483dd0.cpe.net.cable.rogers.com.54786 > 68.183.205.32.ssh: Flags [.], ack 31105, win 37094, options [nop,nop,TS val 828140670 ecr 3770494011], length 0
17:14:53.205814 IP cpe00fc8d483dd3-cm00fc8d483dd0.cpe.net.cable.rogers.com.54786 > 68.183.205.32.ssh: Flags [.], ack 31341, win 37094, options [nop,nop,TS val 828140675 ecr 3770494018], length 0
17:14:53.216394 IP cpe00fc8d483dd3-cm00fc8d483dd0.cpe.net.cable.rogers.com.54786 > 68.183.205.32.ssh: Flags [.], ack 31577, win 37094, options [nop,nop,TS val 828140685 ecr 3770494028], length 0
17:14:53.224727 IP cpe00fc8d483dd3-cm00fc8d483dd0.cpe.net.cable.rogers.com.54786 > 68.183.205.32.ssh: Flags [.], ack 31813, win 37094, options [nop,nop,TS val 828140691 ecr 3770494035], length 0
17:14:53.242516 IP cpe00fc8d483dd3-cm00fc8d483dd0.cpe.net.cable.rogers.com.54786 > 68.183.205.32.ssh: Flags [.], ack 32049, win 37094, options [nop,nop,TS val 828140701 ecr 3770494045], length 0
17:14:53.248682 IP cpe00fc8d483dd3-cm00fc8d483dd0.cpe.net.cable.rogers.com.54786 > 68.183.205.32.ssh: Flags [.], ack 32285, win 37094, options [nop,nop,TS val 828140709 ecr 3770494054], length 0
17:14:53.256299 IP cpe00fc8d483dd3-cm00fc8d483dd0.cpe.net.cable.rogers.com.54786 > 68.183.205.32.ssh: Flags [.], ack 32521, win 37094, options [nop,nop,TS val 828140726 ecr 3770494072], length 0
17:14:53.264673 IP cpe00fc8d483dd3-cm00fc8d483dd0.cpe.net.cable.rogers.com.54786 > 68.183.205.32.ssh: Flags [.], ack 32757, win 37094, options [nop,nop,TS val 828140732 ecr 3770494078], length 0
17:14:53.273698 IP cpe00fc8d483dd3-cm00fc8d483dd0.cpe.net.cable.rogers.com.54786 > 68.183.205.32.ssh: Flags [.], ack 32993, win 37094, options [nop,nop,TS val 828140739 ecr 3770494085], length 0
17:14:53.282192 IP cpe00fc8d483dd3-cm00fc8d483dd0.cpe.net.cable.rogers.com.54786 > 68.183.205.32.ssh: Flags [.], ack 33229, win 37094, options [nop,nop,TS val 828140747 ecr 3770494094], length 0
17:14:53.288795 IP cpe00fc8d483dd3-cm00fc8d483dd0.cpe.net.cable.rogers.com.54786 > 68.183.205.32.ssh: Flags [.], ack 33465, win 37094, options [nop,nop,TS val 828140756 ecr 3770494103], length 0
17:14:53.300378 IP cpe00fc8d483dd3-cm00fc8d483dd0.cpe.net.cable.rogers.com.54786 > 68.183.205.32.ssh: Flags [.], ack 33729, win 37094, options [nop,nop,TS val 828140764 ecr 3770494111], length 0
17:14:53.311697 IP cpe00fc8d483dd3-cm00fc8d483dd0.cpe.net.cable.rogers.com.54786 > 68.183.205.32.ssh: Flags [.], ack 33993, win 37094, options [nop,nop,TS val 828140770 ecr 3770494118], length 0
17:14:53.314726 IP cpe00fc8d483dd3-cm00fc8d483dd0.cpe.net.cable.rogers.com.54786 > 68.183.205.32.ssh: Flags [.], ack 34257, win 37094, options [nop,nop,TS val 828140779 ecr 3770494129], length 0
17:14:53.327056 IP cpe00fc8d483dd3-cm00fc8d483dd0.cpe.net.cable.rogers.com.54786 > 68.183.205.32.ssh: Flags [.], ack 34521, win 37094, options [nop,nop,TS val 828140791 ecr 3770494141], length 0
17:14:53.334690 IP cpe00fc8d483dd3-cm00fc8d483dd0.cpe.net.cable.rogers.com.54786 > 68.183.205.32.ssh: Flags [.], ack 34785, win 37094, options [nop,nop,TS val 828140793 ecr 3770494144], length 0
^C
135 packets captured
138 packets received by filter
0 packets dropped by kernel