tcpdump -i eth0
16:57:25.474780 IP 68.183.205.32.ssh > cpe00fc8d483dd3-cm00fc8d483dd0.cpe.net.cable.rogers.com.54786: Flags [P.], seq 16326664:16326924, ack 9685, win 501, options [nop,nop,TS val 3769446304 ecr 827110504], length 260
16:57:25.474819 IP 68.183.205.32.ssh > cpe00fc8d483dd3-cm00fc8d483dd0.cpe.net.cable.rogers.com.54786: Flags [P.], seq 16326924:16327184, ack 9685, win 501, options [nop,nop,TS val 3769446304 ecr 827110504], length 260
16:57:25.474862 IP 68.183.205.32.ssh > cpe00fc8d483dd3-cm00fc8d483dd0.cpe.net.cable.rogers.com.54786: Flags [P.], seq 16327184:16327444, ack 9685, win 501, options [nop,nop,TS val 3769446304 ecr 827110504], length 260
16:57:25.474902 IP 68.183.205.32.ssh > cpe00fc8d483dd3-cm00fc8d483dd0.cpe.net.cable.rogers.com.54786: Flags [P.], seq 16327444:16327704, ack 9685, win 501, options [nop,nop,TS val 3769446304 ecr 827110504], length 260
16:57:25.474940 IP 68.183.205.32.ssh > cpe00fc8d483dd3-cm00fc8d483dd0.cpe.net.cable.rogers.com.54786: Flags [P.], seq 16327704:16327964, ack 9685, win 501, options [nop,nop,TS val 3769446304 ecr 827110504], length 260
16:57:25.474978 IP 68.183.205.32.ssh > cpe00fc8d483dd3-cm00fc8d483dd0.cpe.net.cable.rogers.com.54786: Flags [P.], seq 16327964:16328224, ack 9685, win 501, options [nop,nop,TS val 3769446304 ecr 827110504], length 260
16:57:25.475015 IP 68.183.205.32.ssh > cpe00fc8d483dd3-cm00fc8d483dd0.cpe.net.cable.rogers.com.54786: Flags [P.], seq 16328224:16328484, ack 9685, win 501, options [nop,nop,TS val 3769446304 ecr 827110504], length 260
16:57:25.475063 IP 68.183.205.32.ssh > cpe00fc8d483dd3-cm00fc8d483dd0.cpe.net.cable.rogers.com.54786: Flags [P.], seq 16328484:16328744, ack 9685, win 501, options [nop,nop,TS val 3769446304 ecr 827110504], length 260
16:57:25.475142 IP 68.183.205.32.ssh > cpe00fc8d483dd3-cm00fc8d483dd0.cpe.net.cable.rogers.com.54786: Flags [P.], seq 16328744:16329004, ack 9685, win 501, options [nop,nop,TS val 3769446304 ecr 827110504], length 260
16:57:25.475195 IP 68.183.205.32.ssh > cpe00fc8d483dd3-cm00fc8d483dd0.cpe.net.cable.rogers.com.54786: Flags [P.], seq 16329004:16329264, ack 9685, win 501, options [nop,nop,TS val 3769446304 ecr 827110504], length 260
16:57:25.475237 IP 68.183.205.32.ssh > cpe00fc8d483dd3-cm00fc8d483dd0.cpe.net.cable.rogers.com.54786: Flags [P.], seq 16329264:16329524, ack 9685, win 501, options [nop,nop,TS val 3769446304 ecr 827110504], length 260
16:57:25.475278 IP 68.183.205.32.ssh > cpe00fc8d483dd3-cm00fc8d483dd0.cpe.net.cable.rogers.com.54786: Flags [P.], seq 16329524:16329784, ack 9685, win 501, options [nop,nop,TS val 3769446304 ecr 827110504], length 260
16:57:25.475316 IP 68.183.205.32.ssh > cpe00fc8d483dd3-cm00fc8d483dd0.cpe.net.cable.rogers.com.54786: Flags [P.], seq 16329784:16330044, ack 9685, win 501, options [nop,nop,TS val 3769446304 ecr 827110504], length 260
16:57:25.475357 IP 68.183.205.32.ssh > cpe00fc8d483dd3-cm00fc8d483dd0.cpe.net.cable.rogers.com.54786: Flags [P.], seq 16330044:16330304, ack 9685, win 501, options [nop,nop,TS val 3769446304 ecr 827110504], length 260
16:57:25.475395 IP 68.183.205.32.ssh > cpe00fc8d483dd3-cm00fc8d483dd0.cpe.net.cable.rogers.com.54786: Flags [P.], seq 16330304:16330564, ack 9685, win 501, options [nop,nop,TS val 3769446304 ecr 827110504], length 260
16:57:25.475433 IP 68.183.205.32.ssh > cpe00fc8d483dd3-cm00fc8d483dd0.cpe.net.cable.rogers.com.54786: Flags [P.], seq 16330564:16330824, ack 9685, win 501, options [nop,nop,TS val 3769446304 ecr 827110504], length 260
16:57:25.475473 IP 68.183.205.32.ssh > cpe00fc8d483dd3-cm00fc8d483dd0.cpe.net.cable.rogers.com.54786: Flags [P.], seq 16330824:16331084, ack 9685, win 501, options [nop,nop,TS val 3769446304 ecr 827110504], length 260
16:57:25.475511 IP 68.183.205.32.ssh > cpe00fc8d483dd3-cm00fc8d483dd0.cpe.net.cable.rogers.com.54786: Flags [P.], seq 16331084:16331344, ack 9685, win 501, options [nop,nop,TS val 3769446304 ecr 827110504], length 260
16:57:25.475560 IP 68.183.205.32.ssh > cpe00fc8d483dd3-cm00fc8d483dd0.cpe.net.cable.rogers.com.54786: Flags [P.], seq 16331344:16331604, ack 9685, win 501, options [nop,nop,TS val 3769446304 ecr 827110504], length 260
16:57:25.475606 IP 68.183.205.32.ssh > cpe00fc8d483dd3-cm00fc8d483dd0.cpe.net.cable.rogers.com.54786: Flags [P.], seq 16331604:16331864, ack 9685, win 501, options [nop,nop,TS val 3769446305 ecr 827110504], length 260
16:57:25.475734 IP 68.183.205.32.ssh > cpe00fc8d483dd3-cm00fc8d483dd0.cpe.net.cable.rogers.com.54786: Flags [P.], seq 16331864:16332124, ack 9685, win 501, options [nop,nop,TS val 3769446305 ecr 827110504], length 260
16:57:25.475809 IP 68.183.205.32.ssh > cpe00fc8d483dd3-cm00fc8d483dd0.cpe.net.cable.rogers.com.54786: Flags [P.], seq 16332124:16332384, ack 9685, win 501, options [nop,nop,TS val 3769446305 ecr 827110504], length 260
16:57:25.475862 IP 68.183.205.32.ssh > cpe00fc8d483dd3-cm00fc8d483dd0.cpe.net.cable.rogers.com.54786: Flags [P.], seq 16332384:16332644, ack 9685, win 501, options [nop,nop,TS val 3769446305 ecr 827110504], length 260
16:57:25.475914 IP 68.183.205.32.ssh > cpe00fc8d483dd3-cm00fc8d483dd0.cpe.net.cable.rogers.com.54786: Flags [P.], seq 16332644:16332904, ack 9685, win 501, options [nop,nop,TS val 3769446305 ecr 827110504], length 260
16:57:25.475968 IP 68.183.205.32.ssh > cpe00fc8d483dd3-cm00fc8d483dd0.cpe.net.cable.rogers.com.54786: Flags [P.], seq 16332904:16333164, ack 9685, win 501, options [nop,nop,TS val 3769446305 ecr 827110504], length 260
16:57:25.476021 IP 68.183.205.32.ssh > cpe00fc8d483dd3-cm00fc8d483dd0.cpe.net.cable.rogers.com.54786: Flags [P.], seq 16333164:16333424, ack 9685, win 501, options [nop,nop,TS val 3769446305 ecr 827110504], length 260
16:57:25.476073 IP 68.183.205.32.ssh > cpe00fc8d483dd3-cm00fc8d483dd0.cpe.net.cable.rogers.com.54786: Flags [P.], seq 16333424:16333684, ack 9685, win 501, options [nop,nop,TS val 3769446305 ecr 827110504], length 260
16:57:25.476129 IP 68.183.205.32.ssh > cpe00fc8d483dd3-cm00fc8d483dd0.cpe.net.cable.rogers.com.54786: Flags [P.], seq 16333684:16333944, ack 9685, win 501, options [nop,nop,TS val 3769446305 ecr 827110504], length 260
16:57:25.476189 IP 68.183.205.32.ssh > cpe00fc8d483dd3-cm00fc8d483dd0.cpe.net.cable.rogers.com.54786: Flags [P.], seq 16333944:16334204, ack 9685, win 501, options [nop,nop,TS val 3769446305 ecr 827110504], length 260
16:57:25.476243 IP 68.183.205.32.ssh > cpe00fc8d483dd3-cm00fc8d483dd0.cpe.net.cable.rogers.com.54786: Flags [P.], seq 16334204:16334464, ack 9685, win 501, options [nop,nop,TS val 3769446305 ecr 827110504], length 260
16:57:25.476298 IP 68.183.205.32.ssh > cpe00fc8d483dd3-cm00fc8d483dd0.cpe.net.cable.rogers.com.54786: Flags [P.], seq 16334464:16334724, ack 9685, win 501, options [nop,nop,TS val 3769446305 ecr 827110504], length 260
16:57:25.476376 IP 68.183.205.32.ssh > cpe00fc8d483dd3-cm00fc8d483dd0.cpe.net.cable.rogers.com.54786: Flags [P.], seq 16334724:16334984, ack 9685, win 501, options [nop,nop,TS val 3769446305 ecr 827110504], length 260
16:57:25.476437 IP 68.183.205.32.ssh > cpe00fc8d483dd3-cm00fc8d483dd0.cpe.net.cable.rogers.com.54786: Flags [P.], seq 16334984:16335244, ack 9685, win 501, options [nop,nop,TS val 3769446305 ecr 827110504], length 260
16:57:25.476492 IP 68.183.205.32.ssh > cpe00fc8d483dd3-cm00fc8d483dd0.cpe.net.cable.rogers.com.54786: Flags [P.], seq 16335244:16335504, ack 9685, win 501, options [nop,nop,TS val 3769446305 ecr 827110504], length 260
16:57:25.476547 IP 68.183.205.32.ssh > cpe00fc8d483dd3-cm00fc8d483dd0.cpe.net.cable.rogers.com.54786: Flags [P.], seq 16335504:16335764, ack 9685, win 501, options [nop,nop,TS val 3769446305 ecr 827110504], length 260
16:57:25.476602 IP 68.183.205.32.ssh > cpe00fc8d483dd3-cm00fc8d483dd0.cpe.net.cable.rogers.com.54786: Flags [P.], seq 16335764:16336024, ack 9685, win 501, options [nop,nop,TS val 3769446306 ecr 827110504], length 260
16:57:25.476656 IP 68.183.205.32.ssh > cpe00fc8d483dd3-cm00fc8d483dd0.cpe.net.cable.rogers.com.54786: Flags [P.], seq 16336024:16336284, ack 9685, win 501, options [nop,nop,TS val 3769446306 ecr 827110504], length 260
16:57:25.476716 IP 68.183.205.32.ssh > cpe00fc8d483dd3-cm00fc8d483dd0.cpe.net.cable.rogers.com.54786: Flags [P.], seq 16336284:16336544, ack 9685, win 501, options [nop,nop,TS val 3769446306 ecr 827110504], length 260
16:57:25.476769 IP 68.183.205.32.ssh > cpe00fc8d483dd3-cm00fc8d483dd0.cpe.net.cable.rogers.com.54786: Flags [P.], seq 16336544:16336804, ack 9685, win 501, options [nop,nop,TS val 3769446306 ecr 827110504], length 260
16:57:25.476824 IP 68.183.205.32.ssh > cpe00fc8d483dd3-cm00fc8d483dd0.cpe.net.cable.rogers.com.54786: Flags [P.], seq 16336804:16337064, ack 9685, win 501, options [nop,nop,TS val 3769446306 ecr 827110504], length 260
16:57:25.476878 IP 68.183.205.32.ssh > cpe00fc8d483dd3-cm00fc8d483dd0.cpe.net.cable.rogers.com.54786: Flags [P.], seq 16337064:16337324, ack 9685, win 501, options [nop,nop,TS val 3769446306 ecr 827110504], length 260
16:57:25.476937 IP 68.183.205.32.ssh > cpe00fc8d483dd3-cm00fc8d483dd0.cpe.net.cable.rogers.com.54786: Flags [P.], seq 16337324:16337584, ack 9685, win 501, options [nop,nop,TS val 3769446306 ecr 827110504], length 260
16:57:25.476998 IP 68.183.205.32.ssh > cpe00fc8d483dd3-cm00fc8d483dd0.cpe.net.cable.rogers.com.54786: Flags [P.], seq 16337584:16337844, ack 9685, win 501, options [nop,nop,TS val 3769446306 ecr 827110504], length 260
16:57:25.477052 IP 68.183.205.32.ssh > cpe00fc8d483dd3-cm00fc8d483dd0.cpe.net.cable.rogers.com.54786: Flags [P.], seq 16337844:16338104, ack 9685, win 501, options [nop,nop,TS val 3769446306 ecr 827110504], length 260
16:57:25.477107 IP 68.183.205.32.ssh > cpe00fc8d483dd3-cm00fc8d483dd0.cpe.net.cable.rogers.com.54786: Flags [P.], seq 16338104:16338364, ack 9685, win 501, options [nop,nop,TS val 3769446306 ecr 827110504], length 260
16:57:25.477158 IP 68.183.205.32.ssh > cpe00fc8d483dd3-cm00fc8d483dd0.cpe.net.cable.rogers.com.54786: Flags [P.], seq 16338364:16338624, ack 9685, win 501, options [nop,nop,TS val 3769446306 ecr 827110504], length 260
16:57:25.477218 IP 68.183.205.32.ssh > cpe00fc8d483dd3-cm00fc8d483dd0.cpe.net.cable.rogers.com.54786: Flags [P.], seq 16338624:16338884, ack 9685, win 501, options [nop,nop,TS val 3769446306 ecr 827110504], length 260
16:57:25.477274 IP 68.183.205.32.ssh > cpe00fc8d483dd3-cm00fc8d483dd0.cpe.net.cable.rogers.com.54786: Flags [P.], seq 16338884:16339144, ack 9685, win 501, options [nop,nop,TS val 3769446306 ecr 827110504], length 260
16:57:25.477326 IP 68.183.205.32.ssh > cpe00fc8d483dd3-cm00fc8d483dd0.cpe.net.cable.rogers.com.54786: Flags [P.], seq 16339144:16339404, ack 9685, win 501, options [nop,nop,TS val 3769446306 ecr 827110504], length 260
16:57:25.477368 IP 68.183.205.32.ssh > cpe00fc8d483dd3-cm00fc8d483dd0.cpe.net.cable.rogers.com.54786: Flags [P.], seq 16339404:16339664, ack 9685, win 501, options [nop,nop,TS val 3769446306 ecr 827110504], length 260
16:57:25.477428 IP 68.183.205.32.ssh > cpe00fc8d483dd3-cm00fc8d483dd0.cpe.net.cable.rogers.com.54786: Flags [P.], seq 16339664:16339924, ack 9685, win 501, options [nop,nop,TS val 3769446306 ecr 827110504], length 260
16:57:25.477482 IP 68.183.205.32.ssh > cpe00fc8d483dd3-cm00fc8d483dd0.cpe.net.cable.rogers.com.54786: Flags [P.], seq 16339924:16340184, ack 9685, win 501, options [nop,nop,TS val 3769446306 ecr 827110504], length 260
16:57:25.477525 IP 68.183.205.32.ssh > cpe00fc8d483dd3-cm00fc8d483dd0.cpe.net.cable.rogers.com.54786: Flags [P.], seq 16340184:16340444, ack 9685, win 501, options [nop,nop,TS val 3769446306 ecr 827110504], length 260
16:57:25.477564 IP 68.183.205.32.ssh > cpe00fc8d483dd3-cm00fc8d483dd0.cpe.net.cable.rogers.com.54786: Flags [P.], seq 16340444:16340704, ack 9685, win 501, options [nop,nop,TS val 3769446306 ecr 827110504], length 260
16:57:25.477602 IP 68.183.205.32.ssh > cpe00fc8d483dd3-cm00fc8d483dd0.cpe.net.cable.rogers.com.54786: Flags [P.], seq 16340704:16340964, ack 9685, win 501, options [nop,nop,TS val 3769446307 ecr 827110504], length 260
16:57:25.477642 IP 68.183.205.32.ssh > cpe00fc8d483dd3-cm00fc8d483dd0.cpe.net.cable.rogers.com.54786: Flags [P.], seq 16340964:16341224, ack 9685, win 501, options [nop,nop,TS val 3769446307 ecr 827110504], length 260
16:57:25.477680 IP 68.183.205.32.ssh > cpe00fc8d483dd3-cm00fc8d483dd0.cpe.net.cable.rogers.com.54786: Flags [P.], seq 16341224:16341484, ack 9685, win 501, options [nop,nop,TS val 3769446307 ecr 827110504], length 260
16:57:25.477736 IP 68.183.205.32.ssh > cpe00fc8d483dd3-cm00fc8d483dd0.cpe.net.cable.rogers.com.54786: Flags [P.], seq 16341484:16341744, ack 9685, win 501, options [nop,nop,TS val 3769446307 ecr 827110504], length 260
16:57:25.477791 IP 68.183.205.32.ssh > cpe00fc8d483dd3-cm00fc8d483dd0.cpe.net.cable.rogers.com.54786: Flags [P.], seq 16341744:16342004, ack 9685, win 501, options [nop,nop,TS val 3769446307 ecr 827110504], length 260
16:57:25.477856 IP 68.183.205.32.ssh > cpe00fc8d483dd3-cm00fc8d483dd0.cpe.net.cable.rogers.com.54786: Flags [P.], seq 16342004:16342264, ack 9685, win 501, options [nop,nop,TS val 3769446307 ecr 827110504], length 260
16:57:25.477915 IP 68.183.205.32.ssh > cpe00fc8d483dd3-cm00fc8d483dd0.cpe.net.cable.rogers.com.54786: Flags [P.], seq 16342264:16342524, ack 9685, win 501, options [nop,nop,TS val 3769446307 ecr 827110504], length 260
16:57:25.477974 IP 68.183.205.32.ssh > cpe00fc8d483dd3-cm00fc8d483dd0.cpe.net.cable.rogers.com.54786: Flags [P.], seq 16342524:16342784, ack 9685, win 501, options [nop,nop,TS val 3769446307 ecr 827110504], length 260
16:57:25.478030 IP 68.183.205.32.ssh > cpe00fc8d483dd3-cm00fc8d483dd0.cpe.net.cable.rogers.com.54786: Flags [P.], seq 16342784:16343044, ack 9685, win 501, options [nop,nop,TS val 3769446307 ecr 827110504], length 260
16:57:25.478081 IP 68.183.205.32.ssh > cpe00fc8d483dd3-cm00fc8d483dd0.cpe.net.cable.rogers.com.54786: Flags [P.], seq 16343044:16343304, ack 9685, win 501, options [nop,nop,TS val 3769446307 ecr 827110504], length 260
16:57:25.478123 IP 68.183.205.32.ssh > cpe00fc8d483dd3-cm00fc8d483dd0.cpe.net.cable.rogers.com.54786: Flags [P.], seq 16343304:16343564, ack 9685, win 501, options [nop,nop,TS val 3769446307 ecr 827110504], length 260
16:57:25.478164 IP 68.183.205.32.ssh > cpe00fc8d483dd3-cm00fc8d483dd0.cpe.net.cable.rogers.com.54786: Flags [P.], seq 16343564:16343824, ack 9685, win 501, options [nop,nop,TS val 3769446307 ecr 827110504], length 260
16:57:25.478202 IP 68.183.205.32.ssh > cpe00fc8d483dd3-cm00fc8d483dd0.cpe.net.cable.rogers.com.54786: Flags [P.], seq 16343824:16344084, ack 9685, win 501, options [nop,nop,TS val 3769446307 ecr 827110504], length 260
16:57:25.478244 IP 68.183.205.32.ssh > cpe00fc8d483dd3-cm00fc8d483dd0.cpe.net.cable.rogers.com.54786: Flags [P.], seq 16344084:16344344, ack 9685, win 501, options [nop,nop,TS val 3769446307 ecr 827110504], length 260
16:57:25.478282 IP 68.183.205.32.ssh > cpe00fc8d483dd3-cm00fc8d483dd0.cpe.net.cable.rogers.com.54786: Flags [P.], seq 16344344:16344604, ack 9685, win 501, options [nop,nop,TS val 3769446307 ecr 827110504], length 260
16:57:25.478322 IP 68.183.205.32.ssh > cpe00fc8d483dd3-cm00fc8d483dd0.cpe.net.cable.rogers.com.54786: Flags [P.], seq 16344604:16344864, ack 9685, win 501, options [nop,nop,TS val 3769446307 ecr 827110504], length 260
16:57:25.478360 IP 68.183.205.32.ssh > cpe00fc8d483dd3-cm00fc8d483dd0.cpe.net.cable.rogers.com.54786: Flags [P.], seq 16344864:16345124, ack 9685, win 501, options [nop,nop,TS val 3769446307 ecr 827110504], length 260
16:57:25.478398 IP 68.183.205.32.ssh > cpe00fc8d483dd3-cm00fc8d483dd0.cpe.net.cable.rogers.com.54786: Flags [P.], seq 16345124:16345384, ack 9685, win 501, options [nop,nop,TS val 3769446307 ecr 827110504], length 260
16:57:25.478438 IP 68.183.205.32.ssh > cpe00fc8d483dd3-cm00fc8d483dd0.cpe.net.cable.rogers.com.54786: Flags [P.], seq 16345384:16345644, ack 9685, win 501, options [nop,nop,TS val 3769446307 ecr 827110504], length 260
16:57:25.478476 IP 68.183.205.32.ssh > cpe00fc8d483dd3-cm00fc8d483dd0.cpe.net.cable.rogers.com.54786: Flags [P.], seq 16345644:16345904, ack 9685, win 501, options [nop,nop,TS val 3769446307 ecr 827110504], length 260
16:57:25.478524 IP 68.183.205.32.ssh > cpe00fc8d483dd3-cm00fc8d483dd0.cpe.net.cable.rogers.com.54786: Flags [P.], seq 16345904:16346164, ack 9685, win 501, options [nop,nop,TS val 3769446307 ecr 827110504], length 260
16:57:25.478562 IP 68.183.205.32.ssh > cpe00fc8d483dd3-cm00fc8d483dd0.cpe.net.cable.rogers.com.54786: Flags [P.], seq 16346164:16346424, ack 9685, win 501, options [nop,nop,TS val 3769446307 ecr 827110504], length 260
16:57:25.478599 IP 68.183.205.32.ssh > cpe00fc8d483dd3-cm00fc8d483dd0.cpe.net.cable.rogers.com.54786: Flags [P.], seq 16346424:16346684, ack 9685, win 501, options [nop,nop,TS val 3769446308 ecr 827110504], length 260
16:57:25.478640 IP 68.183.205.32.ssh > cpe00fc8d483dd3-cm00fc8d483dd0.cpe.net.cable.rogers.com.54786: Flags [P.], seq 16346684:16346944, ack 9685, win 501, options [nop,nop,TS val 3769446308 ecr 827110504], length 260
16:57:25.478678 IP 68.183.205.32.ssh > cpe00fc8d483dd3-cm00fc8d483dd0.cpe.net.cable.rogers.com.54786: Flags [P.], seq 16346944:16347204, ack 9685, win 501, options [nop,nop,TS val 3769446308 ecr 827110504], length 260
16:57:25.478724 IP 68.183.205.32.ssh > cpe00fc8d483dd3-cm00fc8d483dd0.cpe.net.cable.rogers.com.54786: Flags [P.], seq 16347204:16347464, ack 9685, win 501, options [nop,nop,TS val 3769446308 ecr 827110504], length 260
16:57:25.478764 IP 68.183.205.32.ssh > cpe00fc8d483dd3-cm00fc8d483dd0.cpe.net.cable.rogers.com.54786: Flags [P.], seq 16347464:16347724, ack 9685, win 501, options [nop,nop,TS val 3769446308 ecr 827110504], length 260
16:57:25.478803 IP 68.183.205.32.ssh > cpe00fc8d483dd3-cm00fc8d483dd0.cpe.net.cable.rogers.com.54786: Flags [P.], seq 16347724:16347984, ack 9685, win 501, options [nop,nop,TS val 3769446308 ecr 827110504], length 260
16:57:25.478841 IP 68.183.205.32.ssh > cpe00fc8d483dd3-cm00fc8d483dd0.cpe.net.cable.rogers.com.54786: Flags [P.], seq 16347984:16348244, ack 9685, win 501, options [nop,nop,TS val 3769446308 ecr 827110504], length 260
16:57:25.479078 IP 68.183.205.32.ssh > cpe00fc8d483dd3-cm00fc8d483dd0.cpe.net.cable.rogers.com.54786: Flags [P.], seq 16348244:16348504, ack 9685, win 501, options [nop,nop,TS val 3769446308 ecr 827110504], length 260
16:57:25.479146 IP 68.183.205.32.ssh > cpe00fc8d483dd3-cm00fc8d483dd0.cpe.net.cable.rogers.com.54786: Flags [P.], seq 16348504:16348764, ack 9685, win 501, options [nop,nop,TS val 3769446308 ecr 827110504], length 260
16:57:25.479199 IP 68.183.205.32.ssh > cpe00fc8d483dd3-cm00fc8d483dd0.cpe.net.cable.rogers.com.54786: Flags [P.], seq 16348764:16349024, ack 9685, win 501, options [nop,nop,TS val 3769446308 ecr 827110504], length 260
16:57:25.479243 IP 68.183.205.32.ssh > cpe00fc8d483dd3-cm00fc8d483dd0.cpe.net.cable.rogers.com.54786: Flags [P.], seq 16349024:16349284, ack 9685, win 501, options [nop,nop,TS val 3769446308 ecr 827110504], length 260
16:57:25.479295 IP 68.183.205.32.ssh > cpe00fc8d483dd3-cm00fc8d483dd0.cpe.net.cable.rogers.com.54786: Flags [P.], seq 16349284:16349544, ack 9685, win 501, options [nop,nop,TS val 3769446308 ecr 827110504], length 260
16:57:25.479346 IP 68.183.205.32.ssh > cpe00fc8d483dd3-cm00fc8d483dd0.cpe.net.cable.rogers.com.54786: Flags [P.], seq 16349544:16349804, ack 9685, win 501, options [nop,nop,TS val 3769446308 ecr 827110504], length 260
16:57:25.479409 IP 68.183.205.32.ssh > cpe00fc8d483dd3-cm00fc8d483dd0.cpe.net.cable.rogers.com.54786: Flags [P.], seq 16349804:16350064, ack 9685, win 501, options [nop,nop,TS val 3769446308 ecr 827110504], length 260
16:57:25.479458 IP 68.183.205.32.ssh > cpe00fc8d483dd3-cm00fc8d483dd0.cpe.net.cable.rogers.com.54786: Flags [P.], seq 16350064:16350324, ack 9685, win 501, options [nop,nop,TS val 3769446308 ecr 827110504], length 260
16:57:25.479518 IP 68.183.205.32.ssh > cpe00fc8d483dd3-cm00fc8d483dd0.cpe.net.cable.rogers.com.54786: Flags [P.], seq 16350324:16350584, ack 9685, win 501, options [nop,nop,TS val 3769446308 ecr 827110504], length 260
16:57:25.479589 IP 68.183.205.32.ssh > cpe00fc8d483dd3-cm00fc8d483dd0.cpe.net.cable.rogers.com.54786: Flags [P.], seq 16350584:16350844, ack 9685, win 501, options [nop,nop,TS val 3769446309 ecr 827110504], length 260
16:57:25.479650 IP 68.183.205.32.ssh > cpe00fc8d483dd3-cm00fc8d483dd0.cpe.net.cable.rogers.com.54786: Flags [P.], seq 16350844:16351104, ack 9685, win 501, options [nop,nop,TS val 3769446309 ecr 827110504], length 260
16:57:25.479700 IP 68.183.205.32.ssh > cpe00fc8d483dd3-cm00fc8d483dd0.cpe.net.cable.rogers.com.54786: Flags [P.], seq 16351104:16351364, ack 9685, win 501, options [nop,nop,TS val 3769446309 ecr 827110504], length 260
16:57:25.479740 IP 68.183.205.32.ssh > cpe00fc8d483dd3-cm00fc8d483dd0.cpe.net.cable.rogers.com.54786: Flags [P.], seq 16351364:16351624, ack 9685, win 501, options [nop,nop,TS val 3769446309 ecr 827110504], length 260
16:57:25.479799 IP 68.183.205.32.ssh > cpe00fc8d483dd3-cm00fc8d483dd0.cpe.net.cable.rogers.com.54786: Flags [P.], seq 16351624:16351884, ack 9685, win 501, options [nop,nop,TS val 3769446309 ecr 827110504], length 260
16:57:25.479856 IP 68.183.205.32.ssh > cpe00fc8d483dd3-cm00fc8d483dd0.cpe.net.cable.rogers.com.54786: Flags [P.], seq 16351884:16352144, ack 9685, win 501, options [nop,nop,TS val 3769446309 ecr 827110504], length 260
16:57:25.479914 IP 68.183.205.32.ssh > cpe00fc8d483dd3-cm00fc8d483dd0.cpe.net.cable.rogers.com.54786: Flags [P.], seq 16352144:16352404, ack 9685, win 501, options [nop,nop,TS val 3769446309 ecr 827110504], length 260
16:57:25.480001 IP 68.183.205.32.ssh > cpe00fc8d483dd3-cm00fc8d483dd0.cpe.net.cable.rogers.com.54786: Flags [P.], seq 16352404:16352664, ack 9685, win 501, options [nop,nop,TS val 3769446309 ecr 827110504], length 260
16:57:25.480063 IP 68.183.205.32.ssh > cpe00fc8d483dd3-cm00fc8d483dd0.cpe.net.cable.rogers.com.54786: Flags [P.], seq 16352664:16352924, ack 9685, win 501, options [nop,nop,TS val 3769446309 ecr 827110504], length 260
16:57:25.480119 IP 68.183.205.32.ssh > cpe00fc8d483dd3-cm00fc8d483dd0.cpe.net.cable.rogers.com.54786: Flags [P.], seq 16352924:16353184, ack 9685, win 501, options [nop,nop,TS val 3769446309 ecr 827110504], length 260
16:57:25.480178 IP 68.183.205.32.ssh > cpe00fc8d483dd3-cm00fc8d483dd0.cpe.net.cable.rogers.com.54786: Flags [P.], seq 16353184:16353444, ack 9685, win 501, options [nop,nop,TS val 3769446309 ecr 827110504], length 260
16:57:25.480229 IP 68.183.205.32.ssh > cpe00fc8d483dd3-cm00fc8d483dd0.cpe.net.cable.rogers.com.54786: Flags [P.], seq 16353444:16353704, ack 9685, win 501, options [nop,nop,TS val 3769446309 ecr 827110504], length 260
16:57:25.480295 IP 68.183.205.32.ssh > cpe00fc8d483dd3-cm00fc8d483dd0.cpe.net.cable.rogers.com.54786: Flags [P.], seq 16353704:16353964, ack 9685, win 501, options [nop,nop,TS val 3769446309 ecr 827110504], length 260
16:57:25.480379 IP 68.183.205.32.ssh > cpe00fc8d483dd3-cm00fc8d483dd0.cpe.net.cable.rogers.com.54786: Flags [P.], seq 16353964:16354224, ack 9685, win 501, options [nop,nop,TS val 3769446309 ecr 827110504], length 260
16:57:25.480434 IP 68.183.205.32.ssh > cpe00fc8d483dd3-cm00fc8d483dd0.cpe.net.cable.rogers.com.54786: Flags [P.], seq 16354224:16354484, ack 9685, win 501, options [nop,nop,TS val 3769446309 ecr 827110504], length 260
16:57:25.480489 IP 68.183.205.32.ssh > cpe00fc8d483dd3-cm00fc8d483dd0.cpe.net.cable.rogers.com.54786: Flags [P.], seq 16354484:16354744, ack 9685, win 501, options [nop,nop,TS val 3769446309 ecr 827110504], length 260
16:57:25.480547 IP 68.183.205.32.ssh > cpe00fc8d483dd3-cm00fc8d483dd0.cpe.net.cable.rogers.com.54786: Flags [P.], seq 16354744:16355004, ack 9685, win 501, options [nop,nop,TS val 3769446309 ecr 827110504], length 260
16:57:25.480606 IP 68.183.205.32.ssh > cpe00fc8d483dd3-cm00fc8d483dd0.cpe.net.cable.rogers.com.54786: Flags [P.], seq 16355004:16355264, ack 9685, win 501, options [nop,nop,TS val 3769446310 ecr 827110504], length 260
16:57:25.480659 IP 68.183.205.32.ssh > cpe00fc8d483dd3-cm00fc8d483dd0.cpe.net.cable.rogers.com.54786: Flags [P.], seq 16355264:16355524, ack 9685, win 501, options [nop,nop,TS val 3769446310 ecr 827110504], length 260
16:57:25.480714 IP 68.183.205.32.ssh > cpe00fc8d483dd3-cm00fc8d483dd0.cpe.net.cable.rogers.com.54786: Flags [P.], seq 16355524:16355784, ack 9685, win 501, options [nop,nop,TS val 3769446310 ecr 827110504], length 260
16:57:25.480772 IP 68.183.205.32.ssh > cpe00fc8d483dd3-cm00fc8d483dd0.cpe.net.cable.rogers.com.54786: Flags [P.], seq 16355784:16356044, ack 9685, win 501, options [nop,nop,TS val 3769446310 ecr 827110504], length 260
16:57:25.480830 IP 68.183.205.32.ssh > cpe00fc8d483dd3-cm00fc8d483dd0.cpe.net.cable.rogers.com.54786: Flags [P.], seq 16356044:16356304, ack 9685, win 501, options [nop,nop,TS val 3769446310 ecr 827110504], length 260
16:57:25.480874 IP 68.183.205.32.ssh > cpe00fc8d483dd3-cm00fc8d483dd0.cpe.net.cable.rogers.com.54786: Flags [P.], seq 16356304:16356564, ack 9685, win 501, options [nop,nop,TS val 3769446310 ecr 827110504], length 260
16:57:25.480924 IP 68.183.205.32.ssh > cpe00fc8d483dd3-cm00fc8d483dd0.cpe.net.cable.rogers.com.54786: Flags [P.], seq 16356564:16356824, ack 9685, win 501, options [nop,nop,TS val 3769446310 ecr 827110504], length 260
16:57:25.480969 IP 68.183.205.32.ssh > cpe00fc8d483dd3-cm00fc8d483dd0.cpe.net.cable.rogers.com.54786: Flags [P.], seq 16356824:16357084, ack 9685, win 501, options [nop,nop,TS val 3769446310 ecr 827110504], length 260
16:57:25.481008 IP 68.183.205.32.ssh > cpe00fc8d483dd3-cm00fc8d483dd0.cpe.net.cable.rogers.com.54786: Flags [P.], seq 16357084:16357344, ack 9685, win 501, options [nop,nop,TS val 3769446310 ecr 827110504], length 260
16:57:25.481065 IP 68.183.205.32.ssh > cpe00fc8d483dd3-cm00fc8d483dd0.cpe.net.cable.rogers.com.54786: Flags [P.], seq 16357344:16357604, ack 9685, win 501, options [nop,nop,TS val 3769446310 ecr 827110504], length 260
16:57:25.481142 IP 68.183.205.32.ssh > cpe00fc8d483dd3-cm00fc8d483dd0.cpe.net.cable.rogers.com.54786: Flags [P.], seq 16357604:16357864, ack 9685, win 501, options [nop,nop,TS val 3769446310 ecr 827110504], length 260
16:57:25.481200 IP 68.183.205.32.ssh > cpe00fc8d483dd3-cm00fc8d483dd0.cpe.net.cable.rogers.com.54786: Flags [P.], seq 16357864:16358124, ack 9685, win 501, options [nop,nop,TS val 3769446310 ecr 827110504], length 260
16:57:25.481262 IP 68.183.205.32.ssh > cpe00fc8d483dd3-cm00fc8d483dd0.cpe.net.cable.rogers.com.54786: Flags [P.], seq 16358124:16358384, ack 9685, win 501, options [nop,nop,TS val 3769446310 ecr 827110504], length 260
16:57:25.481322 IP 68.183.205.32.ssh > cpe00fc8d483dd3-cm00fc8d483dd0.cpe.net.cable.rogers.com.54786: Flags [P.], seq 16358384:16358644, ack 9685, win 501, options [nop,nop,TS val 3769446310 ecr 827110504], length 260
16:57:25.481383 IP 68.183.205.32.ssh > cpe00fc8d483dd3-cm00fc8d483dd0.cpe.net.cable.rogers.com.54786: Flags [P.], seq 16358644:16358904, ack 9685, win 501, options [nop,nop,TS val 3769446310 ecr 827110504], length 260
16:57:25.481415 IP cpe00fc8d483dd3-cm00fc8d483dd0.cpe.net.cable.rogers.com.54786 > 68.183.205.32.ssh: Flags [.], ack 16268076, win 16030, options [nop,nop,TS val 827110504 ecr 3769446291], length 0
16:57:25.481556 IP 68.183.205.32.ssh > cpe00fc8d483dd3-cm00fc8d483dd0.cpe.net.cable.rogers.com.54786: Flags [P.], seq 16358904:16359356, ack 9685, win 501, options [nop,nop,TS val 3769446310 ecr 827110504], length 452
16:57:25.481616 IP 68.183.205.32.ssh > cpe00fc8d483dd3-cm00fc8d483dd0.cpe.net.cable.rogers.com.54786: Flags [P.], seq 16359356:16359616, ack 9685, win 501, options [nop,nop,TS val 3769446311 ecr 827110504], length 260
16:57:25.481672 IP 68.183.205.32.ssh > cpe00fc8d483dd3-cm00fc8d483dd0.cpe.net.cable.rogers.com.54786: Flags [P.], seq 16359616:16359876, ack 9685, win 501, options [nop,nop,TS val 3769446311 ecr 827110504], length 260
16:57:25.481734 IP 68.183.205.32.ssh > cpe00fc8d483dd3-cm00fc8d483dd0.cpe.net.cable.rogers.com.54786: Flags [P.], seq 16359876:16360136, ack 9685, win 501, options [nop,nop,TS val 3769446311 ecr 827110504], length 260
16:57:25.481789 IP 68.183.205.32.ssh > cpe00fc8d483dd3-cm00fc8d483dd0.cpe.net.cable.rogers.com.54786: Flags [P.], seq 16360136:16360396, ack 9685, win 501, options [nop,nop,TS val 3769446311 ecr 827110504], length 260
16:57:25.481846 IP 68.183.205.32.ssh > cpe00fc8d483dd3-cm00fc8d483dd0.cpe.net.cable.rogers.com.54786: Flags [P.], seq 16360396:16360656, ack 9685, win 501, options [nop,nop,TS val 3769446311 ecr 827110504], length 260
16:57:25.481900 IP 68.183.205.32.ssh > cpe00fc8d483dd3-cm00fc8d483dd0.cpe.net.cable.rogers.com.54786: Flags [P.], seq 16360656:16360916, ack 9685, win 501, options [nop,nop,TS val 3769446311 ecr 827110504], length 260
16:57:25.481957 IP 68.183.205.32.ssh > cpe00fc8d483dd3-cm00fc8d483dd0.cpe.net.cable.rogers.com.54786: Flags [P.], seq 16360916:16361176, ack 9685, win 501, options [nop,nop,TS val 3769446311 ecr 827110504], length 260
16:57:25.482014 IP 68.183.205.32.ssh > cpe00fc8d483dd3-cm00fc8d483dd0.cpe.net.cable.rogers.com.54786: Flags [P.], seq 16361176:16361436, ack 9685, win 501, options [nop,nop,TS val 3769446311 ecr 827110504], length 260
16:57:25.482066 IP 68.183.205.32.ssh > cpe00fc8d483dd3-cm00fc8d483dd0.cpe.net.cable.rogers.com.54786: Flags [P.], seq 16361436:16361696, ack 9685, win 501, options [nop,nop,TS val 3769446311 ecr 827110504], length 260
16:57:25.482117 IP 68.183.205.32.ssh > cpe00fc8d483dd3-cm00fc8d483dd0.cpe.net.cable.rogers.com.54786: Flags [P.], seq 16361696:16361956, ack 9685, win 501, options [nop,nop,TS val 3769446311 ecr 827110504], length 260
16:57:25.482170 IP 68.183.205.32.ssh > cpe00fc8d483dd3-cm00fc8d483dd0.cpe.net.cable.rogers.com.54786: Flags [P.], seq 16361956:16362216, ack 9685, win 501, options [nop,nop,TS val 3769446311 ecr 827110504], length 260
16:57:25.482225 IP 68.183.205.32.ssh > cpe00fc8d483dd3-cm00fc8d483dd0.cpe.net.cable.rogers.com.54786: Flags [P.], seq 16362216:16362476, ack 9685, win 501, options [nop,nop,TS val 3769446311 ecr 827110504], length 260
16:57:25.482278 IP 68.183.205.32.ssh > cpe00fc8d483dd3-cm00fc8d483dd0.cpe.net.cable.rogers.com.54786: Flags [P.], seq 16362476:16362736, ack 9685, win 501, options [nop,nop,TS val 3769446311 ecr 827110504], length 260
16:57:25.482336 IP 68.183.205.32.ssh > cpe00fc8d483dd3-cm00fc8d483dd0.cpe.net.cable.rogers.com.54786: Flags [P.], seq 16362736:16362996, ack 9685, win 501, options [nop,nop,TS val 3769446311 ecr 827110504], length 260
16:57:25.482392 IP 68.183.205.32.ssh > cpe00fc8d483dd3-cm00fc8d483dd0.cpe.net.cable.rogers.com.54786: Flags [P.], seq 16362996:16363256, ack 9685, win 501, options [nop,nop,TS val 3769446311 ecr 827110504], length 260
16:57:25.482446 IP 68.183.205.32.ssh > cpe00fc8d483dd3-cm00fc8d483dd0.cpe.net.cable.rogers.com.54786: Flags [P.], seq 16363256:16363516, ack 9685, win 501, options [nop,nop,TS val 3769446311 ecr 827110504], length 260
16:57:25.482502 IP 68.183.205.32.ssh > cpe00fc8d483dd3-cm00fc8d483dd0.cpe.net.cable.rogers.com.54786: Flags [P.], seq 16363516:16363776, ack 9685, win 501, options [nop,nop,TS val 3769446311 ecr 827110504], length 260
16:57:25.482555 IP 68.183.205.32.ssh > cpe00fc8d483dd3-cm00fc8d483dd0.cpe.net.cable.rogers.com.54786: Flags [P.], seq 16363776:16364036, ack 9685, win 501, options [nop,nop,TS val 3769446311 ecr 827110504], length 260
16:57:25.482608 IP 68.183.205.32.ssh > cpe00fc8d483dd3-cm00fc8d483dd0.cpe.net.cable.rogers.com.54786: Flags [P.], seq 16364036:16364296, ack 9685, win 501, options [nop,nop,TS val 3769446312 ecr 827110504], length 260
16:57:25.482661 IP 68.183.205.32.ssh > cpe00fc8d483dd3-cm00fc8d483dd0.cpe.net.cable.rogers.com.54786: Flags [P.], seq 16364296:16364556, ack 9685, win 501, options [nop,nop,TS val 3769446312 ecr 827110504], length 260
16:57:25.482713 IP 68.183.205.32.ssh > cpe00fc8d483dd3-cm00fc8d483dd0.cpe.net.cable.rogers.com.54786: Flags [P.], seq 16364556:16364816, ack 9685, win 501, options [nop,nop,TS val 3769446312 ecr 827110504], length 260
16:57:25.482762 IP 68.183.205.32.ssh > cpe00fc8d483dd3-cm00fc8d483dd0.cpe.net.cable.rogers.com.54786: Flags [P.], seq 16364816:16365076, ack 9685, win 501, options [nop,nop,TS val 3769446312 ecr 827110504], length 260
16:57:25.482814 IP 68.183.205.32.ssh > cpe00fc8d483dd3-cm00fc8d483dd0.cpe.net.cable.rogers.com.54786: Flags [P.], seq 16365076:16365336, ack 9685, win 501, options [nop,nop,TS val 3769446312 ecr 827110504], length 260
16:57:25.482863 IP 68.183.205.32.ssh > cpe00fc8d483dd3-cm00fc8d483dd0.cpe.net.cable.rogers.com.54786: Flags [P.], seq 16365336:16365596, ack 9685, win 501, options [nop,nop,TS val 3769446312 ecr 827110504], length 260
16:57:25.482915 IP 68.183.205.32.ssh > cpe00fc8d483dd3-cm00fc8d483dd0.cpe.net.cable.rogers.com.54786: Flags [P.], seq 16365596:16365856, ack 9685, win 501, options [nop,nop,TS val 3769446312 ecr 827110504], length 260
16:57:25.482967 IP 68.183.205.32.ssh > cpe00fc8d483dd3-cm00fc8d483dd0.cpe.net.cable.rogers.com.54786: Flags [P.], seq 16365856:16366116, ack 9685, win 501, options [nop,nop,TS val 3769446312 ecr 827110504], length 260
16:57:25.483023 IP 68.183.205.32.ssh > cpe00fc8d483dd3-cm00fc8d483dd0.cpe.net.cable.rogers.com.54786: Flags [P.], seq 16366116:16366376, ack 9685, win 501, options [nop,nop,TS val 3769446312 ecr 827110504], length 260
16:57:25.483080 IP 68.183.205.32.ssh > cpe00fc8d483dd3-cm00fc8d483dd0.cpe.net.cable.rogers.com.54786: Flags [P.], seq 16366376:16366636, ack 9685, win 501, options [nop,nop,TS val 3769446312 ecr 827110504], length 260
16:57:25.483151 IP 68.183.205.32.ssh > cpe00fc8d483dd3-cm00fc8d483dd0.cpe.net.cable.rogers.com.54786: Flags [P.], seq 16366636:16366896, ack 9685, win 501, options [nop,nop,TS val 3769446312 ecr 827110504], length 260
16:57:25.483209 IP 68.183.205.32.ssh > cpe00fc8d483dd3-cm00fc8d483dd0.cpe.net.cable.rogers.com.54786: Flags [P.], seq 16366896:16367156, ack 9685, win 501, options [nop,nop,TS val 3769446312 ecr 827110504], length 260
16:57:25.483271 IP 68.183.205.32.ssh > cpe00fc8d483dd3-cm00fc8d483dd0.cpe.net.cable.rogers.com.54786: Flags [P.], seq 16367156:16367416, ack 9685, win 501, options [nop,nop,TS val 3769446312 ecr 827110504], length 260
16:57:25.483326 IP 68.183.205.32.ssh > cpe00fc8d483dd3-cm00fc8d483dd0.cpe.net.cable.rogers.com.54786: Flags [P.], seq 16367416:16367676, ack 9685, win 501, options [nop,nop,TS val 3769446312 ecr 827110504], length 260
16:57:25.483384 IP 68.183.205.32.ssh > cpe00fc8d483dd3-cm00fc8d483dd0.cpe.net.cable.rogers.com.54786: Flags [P.], seq 16367676:16367936, ack 9685, win 501, options [nop,nop,TS val 3769446312 ecr 827110504], length 260
16:57:25.483439 IP 68.183.205.32.ssh > cpe00fc8d483dd3-cm00fc8d483dd0.cpe.net.cable.rogers.com.54786: Flags [P.], seq 16367936:16368196, ack 9685, win 501, options [nop,nop,TS val 3769446312 ecr 827110504], length 260
16:57:25.483496 IP 68.183.205.32.ssh > cpe00fc8d483dd3-cm00fc8d483dd0.cpe.net.cable.rogers.com.54786: Flags [P.], seq 16368196:16368456, ack 9685, win 501, options [nop,nop,TS val 3769446312 ecr 827110504], length 260
16:57:25.483558 IP 68.183.205.32.ssh > cpe00fc8d483dd3-cm00fc8d483dd0.cpe.net.cable.rogers.com.54786: Flags [P.], seq 16368456:16368716, ack 9685, win 501, options [nop,nop,TS val 3769446312 ecr 827110504], length 260
16:57:25.483612 IP 68.183.205.32.ssh > cpe00fc8d483dd3-cm00fc8d483dd0.cpe.net.cable.rogers.com.54786: Flags [P.], seq 16368716:16368976, ack 9685, win 501, options [nop,nop,TS val 3769446313 ecr 827110504], length 260
16:57:25.483668 IP 68.183.205.32.ssh > cpe00fc8d483dd3-cm00fc8d483dd0.cpe.net.cable.rogers.com.54786: Flags [P.], seq 16368976:16369236, ack 9685, win 501, options [nop,nop,TS val 3769446313 ecr 827110504], length 260
16:57:25.483731 IP 68.183.205.32.ssh > cpe00fc8d483dd3-cm00fc8d483dd0.cpe.net.cable.rogers.com.54786: Flags [P.], seq 16369236:16369496, ack 9685, win 501, options [nop,nop,TS val 3769446313 ecr 827110504], length 260
16:57:25.483787 IP 68.183.205.32.ssh > cpe00fc8d483dd3-cm00fc8d483dd0.cpe.net.cable.rogers.com.54786: Flags [P.], seq 16369496:16369756, ack 9685, win 501, options [nop,nop,TS val 3769446313 ecr 827110504], length 260
16:57:25.483841 IP 68.183.205.32.ssh > cpe00fc8d483dd3-cm00fc8d483dd0.cpe.net.cable.rogers.com.54786: Flags [P.], seq 16369756:16370016, ack 9685, win 501, options [nop,nop,TS val 3769446313 ecr 827110504], length 260
16:57:25.483902 IP 68.183.205.32.ssh > cpe00fc8d483dd3-cm00fc8d483dd0.cpe.net.cable.rogers.com.54786: Flags [P.], seq 16370016:16370276, ack 9685, win 501, options [nop,nop,TS val 3769446313 ecr 827110504], length 260
16:57:25.483957 IP 68.183.205.32.ssh > cpe00fc8d483dd3-cm00fc8d483dd0.cpe.net.cable.rogers.com.54786: Flags [P.], seq 16370276:16370536, ack 9685, win 501, options [nop,nop,TS val 3769446313 ecr 827110504], length 260
16:57:25.484013 IP 68.183.205.32.ssh > cpe00fc8d483dd3-cm00fc8d483dd0.cpe.net.cable.rogers.com.54786: Flags [P.], seq 16370536:16370796, ack 9685, win 501, options [nop,nop,TS val 3769446313 ecr 827110504], length 260
16:57:25.484069 IP 68.183.205.32.ssh > cpe00fc8d483dd3-cm00fc8d483dd0.cpe.net.cable.rogers.com.54786: Flags [P.], seq 16370796:16371056, ack 9685, win 501, options [nop,nop,TS val 3769446313 ecr 827110504], length 260
16:57:25.484124 IP 68.183.205.32.ssh > cpe00fc8d483dd3-cm00fc8d483dd0.cpe.net.cable.rogers.com.54786: Flags [P.], seq 16371056:16371316, ack 9685, win 501, options [nop,nop,TS val 3769446313 ecr 827110504], length 260
16:57:25.484183 IP 68.183.205.32.ssh > cpe00fc8d483dd3-cm00fc8d483dd0.cpe.net.cable.rogers.com.54786: Flags [P.], seq 16371316:16371576, ack 9685, win 501, options [nop,nop,TS val 3769446313 ecr 827110504], length 260
16:57:25.484240 IP 68.183.205.32.ssh > cpe00fc8d483dd3-cm00fc8d483dd0.cpe.net.cable.rogers.com.54786: Flags [P.], seq 16371576:16371836, ack 9685, win 501, options [nop,nop,TS val 3769446313 ecr 827110504], length 260
16:57:25.484299 IP 68.183.205.32.ssh > cpe00fc8d483dd3-cm00fc8d483dd0.cpe.net.cable.rogers.com.54786: Flags [P.], seq 16371836:16372096, ack 9685, win 501, options [nop,nop,TS val 3769446313 ecr 827110504], length 260
16:57:25.484385 IP 68.183.205.32.ssh > cpe00fc8d483dd3-cm00fc8d483dd0.cpe.net.cable.rogers.com.54786: Flags [P.], seq 16372096:16372356, ack 9685, win 501, options [nop,nop,TS val 3769446313 ecr 827110504], length 260
16:57:25.484446 IP 68.183.205.32.ssh > cpe00fc8d483dd3-cm00fc8d483dd0.cpe.net.cable.rogers.com.54786: Flags [P.], seq 16372356:16372616, ack 9685, win 501, options [nop,nop,TS val 3769446313 ecr 827110504], length 260
16:57:25.484512 IP 68.183.205.32.ssh > cpe00fc8d483dd3-cm00fc8d483dd0.cpe.net.cable.rogers.com.54786: Flags [P.], seq 16372616:16372876, ack 9685, win 501, options [nop,nop,TS val 3769446313 ecr 827110504], length 260
16:57:25.484570 IP 68.183.205.32.ssh > cpe00fc8d483dd3-cm00fc8d483dd0.cpe.net.cable.rogers.com.54786: Flags [P.], seq 16372876:16373136, ack 9685, win 501, options [nop,nop,TS val 3769446314 ecr 827110504], length 260
16:57:25.484630 IP 68.183.205.32.ssh > cpe00fc8d483dd3-cm00fc8d483dd0.cpe.net.cable.rogers.com.54786: Flags [P.], seq 16373136:16373396, ack 9685, win 501, options [nop,nop,TS val 3769446314 ecr 827110504], length 260
16:57:25.484684 IP 68.183.205.32.ssh > cpe00fc8d483dd3-cm00fc8d483dd0.cpe.net.cable.rogers.com.54786: Flags [P.], seq 16373396:16373656, ack 9685, win 501, options [nop,nop,TS val 3769446314 ecr 827110504], length 260
16:57:25.484739 IP 68.183.205.32.ssh > cpe00fc8d483dd3-cm00fc8d483dd0.cpe.net.cable.rogers.com.54786: Flags [P.], seq 16373656:16373916, ack 9685, win 501, options [nop,nop,TS val 3769446314 ecr 827110504], length 260
16:57:25.484797 IP 68.183.205.32.ssh > cpe00fc8d483dd3-cm00fc8d483dd0.cpe.net.cable.rogers.com.54786: Flags [P.], seq 16373916:16374176, ack 9685, win 501, options [nop,nop,TS val 3769446314 ecr 827110504], length 260
16:57:25.484853 IP 68.183.205.32.ssh > cpe00fc8d483dd3-cm00fc8d483dd0.cpe.net.cable.rogers.com.54786: Flags [P.], seq 16374176:16374436, ack 9685, win 501, options [nop,nop,TS val 3769446314 ecr 827110504], length 260
16:57:25.484912 IP 68.183.205.32.ssh > cpe00fc8d483dd3-cm00fc8d483dd0.cpe.net.cable.rogers.com.54786: Flags [P.], seq 16374436:16374696, ack 9685, win 501, options [nop,nop,TS val 3769446314 ecr 827110504], length 260
16:57:25.484973 IP 68.183.205.32.ssh > cpe00fc8d483dd3-cm00fc8d483dd0.cpe.net.cable.rogers.com.54786: Flags [P.], seq 16374696:16374956, ack 9685, win 501, options [nop,nop,TS val 3769446314 ecr 827110504], length 260
16:57:25.485029 IP 68.183.205.32.ssh > cpe00fc8d483dd3-cm00fc8d483dd0.cpe.net.cable.rogers.com.54786: Flags [P.], seq 16374956:16375216, ack 9685, win 501, options [nop,nop,TS val 3769446314 ecr 827110504], length 260
16:57:25.485086 IP 68.183.205.32.ssh > cpe00fc8d483dd3-cm00fc8d483dd0.cpe.net.cable.rogers.com.54786: Flags [P.], seq 16375216:16375476, ack 9685, win 501, options [nop,nop,TS val 3769446314 ecr 827110504], length 260
16:57:25.485142 IP 68.183.205.32.ssh > cpe00fc8d483dd3-cm00fc8d483dd0.cpe.net.cable.rogers.com.54786: Flags [P.], seq 16375476:16375736, ack 9685, win 501, options [nop,nop,TS val 3769446314 ecr 827110504], length 260
16:57:25.485199 IP 68.183.205.32.ssh > cpe00fc8d483dd3-cm00fc8d483dd0.cpe.net.cable.rogers.com.54786: Flags [P.], seq 16375736:16375996, ack 9685, win 501, options [nop,nop,TS val 3769446314 ecr 827110504], length 260
16:57:25.485255 IP 68.183.205.32.ssh > cpe00fc8d483dd3-cm00fc8d483dd0.cpe.net.cable.rogers.com.54786: Flags [P.], seq 16375996:16376256, ack 9685, win 501, options [nop,nop,TS val 3769446314 ecr 827110504], length 260
16:57:25.485315 IP 68.183.205.32.ssh > cpe00fc8d483dd3-cm00fc8d483dd0.cpe.net.cable.rogers.com.54786: Flags [P.], seq 16376256:16376516, ack 9685, win 501, options [nop,nop,TS val 3769446314 ecr 827110504], length 260
16:57:25.485373 IP 68.183.205.32.ssh > cpe00fc8d483dd3-cm00fc8d483dd0.cpe.net.cable.rogers.com.54786: Flags [P.], seq 16376516:16376776, ack 9685, win 501, options [nop,nop,TS val 3769446314 ecr 827110504], length 260
16:57:25.485434 IP 68.183.205.32.ssh > cpe00fc8d483dd3-cm00fc8d483dd0.cpe.net.cable.rogers.com.54786: Flags [P.], seq 16376776:16377036, ack 9685, win 501, options [nop,nop,TS val 3769446314 ecr 827110504], length 260
16:57:25.485492 IP 68.183.205.32.ssh > cpe00fc8d483dd3-cm00fc8d483dd0.cpe.net.cable.rogers.com.54786: Flags [P.], seq 16377036:16377296, ack 9685, win 501, options [nop,nop,TS val 3769446314 ecr 827110504], length 260
16:57:25.485548 IP 68.183.205.32.ssh > cpe00fc8d483dd3-cm00fc8d483dd0.cpe.net.cable.rogers.com.54786: Flags [P.], seq 16377296:16377556, ack 9685, win 501, options [nop,nop,TS val 3769446314 ecr 827110504], length 260
16:57:25.485603 IP 68.183.205.32.ssh > cpe00fc8d483dd3-cm00fc8d483dd0.cpe.net.cable.rogers.com.54786: Flags [P.], seq 16377556:16377816, ack 9685, win 501, options [nop,nop,TS val 3769446315 ecr 827110504], length 260
16:57:25.485657 IP 68.183.205.32.ssh > cpe00fc8d483dd3-cm00fc8d483dd0.cpe.net.cable.rogers.com.54786: Flags [P.], seq 16377816:16378076, ack 9685, win 501, options [nop,nop,TS val 3769446315 ecr 827110504], length 260
16:57:25.485715 IP 68.183.205.32.ssh > cpe00fc8d483dd3-cm00fc8d483dd0.cpe.net.cable.rogers.com.54786: Flags [P.], seq 16378076:16378336, ack 9685, win 501, options [nop,nop,TS val 3769446315 ecr 827110504], length 260
16:57:25.485770 IP 68.183.205.32.ssh > cpe00fc8d483dd3-cm00fc8d483dd0.cpe.net.cable.rogers.com.54786: Flags [P.], seq 16378336:16378596, ack 9685, win 501, options [nop,nop,TS val 3769446315 ecr 827110504], length 260
16:57:25.485831 IP 68.183.205.32.ssh > cpe00fc8d483dd3-cm00fc8d483dd0.cpe.net.cable.rogers.com.54786: Flags [P.], seq 16378596:16378856, ack 9685, win 501, options [nop,nop,TS val 3769446315 ecr 827110504], length 260
16:57:25.485889 IP 68.183.205.32.ssh > cpe00fc8d483dd3-cm00fc8d483dd0.cpe.net.cable.rogers.com.54786: Flags [P.], seq 16378856:16379116, ack 9685, win 501, options [nop,nop,TS val 3769446315 ecr 827110504], length 260
16:57:25.485949 IP 68.183.205.32.ssh > cpe00fc8d483dd3-cm00fc8d483dd0.cpe.net.cable.rogers.com.54786: Flags [P.], seq 16379116:16379376, ack 9685, win 501, options [nop,nop,TS val 3769446315 ecr 827110504], length 260
16:57:25.486011 IP 68.183.205.32.ssh > cpe00fc8d483dd3-cm00fc8d483dd0.cpe.net.cable.rogers.com.54786: Flags [P.], seq 16379376:16379636, ack 9685, win 501, options [nop,nop,TS val 3769446315 ecr 827110504], length 260
16:57:25.486074 IP 68.183.205.32.ssh > cpe00fc8d483dd3-cm00fc8d483dd0.cpe.net.cable.rogers.com.54786: Flags [P.], seq 16379636:16379896, ack 9685, win 501, options [nop,nop,TS val 3769446315 ecr 827110504], length 260
16:57:25.486129 IP 68.183.205.32.ssh > cpe00fc8d483dd3-cm00fc8d483dd0.cpe.net.cable.rogers.com.54786: Flags [P.], seq 16379896:16380156, ack 9685, win 501, options [nop,nop,TS val 3769446315 ecr 827110504], length 260
16:57:25.486185 IP 68.183.205.32.ssh > cpe00fc8d483dd3-cm00fc8d483dd0.cpe.net.cable.rogers.com.54786: Flags [P.], seq 16380156:16380416, ack 9685, win 501, options [nop,nop,TS val 3769446315 ecr 827110504], length 260
16:57:25.486245 IP 68.183.205.32.ssh > cpe00fc8d483dd3-cm00fc8d483dd0.cpe.net.cable.rogers.com.54786: Flags [P.], seq 16380416:16380676, ack 9685, win 501, options [nop,nop,TS val 3769446315 ecr 827110504], length 260
16:57:25.486304 IP 68.183.205.32.ssh > cpe00fc8d483dd3-cm00fc8d483dd0.cpe.net.cable.rogers.com.54786: Flags [P.], seq 16380676:16380936, ack 9685, win 501, options [nop,nop,TS val 3769446315 ecr 827110504], length 260
16:57:25.486367 IP 68.183.205.32.ssh > cpe00fc8d483dd3-cm00fc8d483dd0.cpe.net.cable.rogers.com.54786: Flags [P.], seq 16380936:16381196, ack 9685, win 501, options [nop,nop,TS val 3769446315 ecr 827110504], length 260
16:57:25.486423 IP 68.183.205.32.ssh > cpe00fc8d483dd3-cm00fc8d483dd0.cpe.net.cable.rogers.com.54786: Flags [P.], seq 16381196:16381456, ack 9685, win 501, options [nop,nop,TS val 3769446315 ecr 827110504], length 260
16:57:25.486476 IP 68.183.205.32.ssh > cpe00fc8d483dd3-cm00fc8d483dd0.cpe.net.cable.rogers.com.54786: Flags [P.], seq 16381456:16381716, ack 9685, win 501, options [nop,nop,TS val 3769446315 ecr 827110504], length 260
16:57:25.486536 IP 68.183.205.32.ssh > cpe00fc8d483dd3-cm00fc8d483dd0.cpe.net.cable.rogers.com.54786: Flags [P.], seq 16381716:16381976, ack 9685, win 501, options [nop,nop,TS val 3769446315 ecr 827110504], length 260
16:57:25.486588 IP 68.183.205.32.ssh > cpe00fc8d483dd3-cm00fc8d483dd0.cpe.net.cable.rogers.com.54786: Flags [P.], seq 16381976:16382236, ack 9685, win 501, options [nop,nop,TS val 3769446316 ecr 827110504], length 260
16:57:25.486638 IP 68.183.205.32.ssh > cpe00fc8d483dd3-cm00fc8d483dd0.cpe.net.cable.rogers.com.54786: Flags [P.], seq 16382236:16382496, ack 9685, win 501, options [nop,nop,TS val 3769446316 ecr 827110504], length 260
16:57:25.486691 IP 68.183.205.32.ssh > cpe00fc8d483dd3-cm00fc8d483dd0.cpe.net.cable.rogers.com.54786: Flags [P.], seq 16382496:16382756, ack 9685, win 501, options [nop,nop,TS val 3769446316 ecr 827110504], length 260
16:57:25.486743 IP 68.183.205.32.ssh > cpe00fc8d483dd3-cm00fc8d483dd0.cpe.net.cable.rogers.com.54786: Flags [P.], seq 16382756:16383016, ack 9685, win 501, options [nop,nop,TS val 3769446316 ecr 827110504], length 260
16:57:25.486797 IP 68.183.205.32.ssh > cpe00fc8d483dd3-cm00fc8d483dd0.cpe.net.cable.rogers.com.54786: Flags [P.], seq 16383016:16383276, ack 9685, win 501, options [nop,nop,TS val 3769446316 ecr 827110504], length 260
16:57:25.486851 IP 68.183.205.32.ssh > cpe00fc8d483dd3-cm00fc8d483dd0.cpe.net.cable.rogers.com.54786: Flags [P.], seq 16383276:16383536, ack 9685, win 501, options [nop,nop,TS val 3769446316 ecr 827110504], length 260
16:57:25.486916 IP 68.183.205.32.ssh > cpe00fc8d483dd3-cm00fc8d483dd0.cpe.net.cable.rogers.com.54786: Flags [P.], seq 16383536:16383796, ack 9685, win 501, options [nop,nop,TS val 3769446316 ecr 827110504], length 260
16:57:25.486967 IP 68.183.205.32.ssh > cpe00fc8d483dd3-cm00fc8d483dd0.cpe.net.cable.rogers.com.54786: Flags [P.], seq 16383796:16384056, ack 9685, win 501, options [nop,nop,TS val 3769446316 ecr 827110504], length 260
16:57:25.487019 IP 68.183.205.32.ssh > cpe00fc8d483dd3-cm00fc8d483dd0.cpe.net.cable.rogers.com.54786: Flags [P.], seq 16384056:16384316, ack 9685, win 501, options [nop,nop,TS val 3769446316 ecr 827110504], length 260
16:57:25.487108 IP 68.183.205.32.ssh > cpe00fc8d483dd3-cm00fc8d483dd0.cpe.net.cable.rogers.com.54786: Flags [P.], seq 16384316:16384576, ack 9685, win 501, options [nop,nop,TS val 3769446316 ecr 827110504], length 260
16:57:25.487209 IP 68.183.205.32.ssh > cpe00fc8d483dd3-cm00fc8d483dd0.cpe.net.cable.rogers.com.54786: Flags [P.], seq 16384576:16384836, ack 9685, win 501, options [nop,nop,TS val 3769446316 ecr 827110504], length 260
16:57:25.487285 IP 68.183.205.32.ssh > cpe00fc8d483dd3-cm00fc8d483dd0.cpe.net.cable.rogers.com.54786: Flags [P.], seq 16384836:16385096, ack 9685, win 501, options [nop,nop,TS val 3769446316 ecr 827110504], length 260
16:57:25.487351 IP 68.183.205.32.ssh > cpe00fc8d483dd3-cm00fc8d483dd0.cpe.net.cable.rogers.com.54786: Flags [P.], seq 16385096:16385356, ack 9685, win 501, options [nop,nop,TS val 3769446316 ecr 827110504], length 260
16:57:25.487411 IP 68.183.205.32.ssh > cpe00fc8d483dd3-cm00fc8d483dd0.cpe.net.cable.rogers.com.54786: Flags [P.], seq 16385356:16385616, ack 9685, win 501, options [nop,nop,TS val 3769446316 ecr 827110504], length 260
16:57:25.487480 IP 68.183.205.32.ssh > cpe00fc8d483dd3-cm00fc8d483dd0.cpe.net.cable.rogers.com.54786: Flags [P.], seq 16385616:16385876, ack 9685, win 501, options [nop,nop,TS val 3769446316 ecr 827110504], length 260
16:57:25.487543 IP 68.183.205.32.ssh > cpe00fc8d483dd3-cm00fc8d483dd0.cpe.net.cable.rogers.com.54786: Flags [P.], seq 16385876:16386136, ack 9685, win 501, options [nop,nop,TS val 3769446316 ecr 827110504], length 260
16:57:25.487600 IP 68.183.205.32.ssh > cpe00fc8d483dd3-cm00fc8d483dd0.cpe.net.cable.rogers.com.54786: Flags [P.], seq 16386136:16386396, ack 9685, win 501, options [nop,nop,TS val 3769446317 ecr 827110504], length 260
16:57:25.487658 IP 68.183.205.32.ssh > cpe00fc8d483dd3-cm00fc8d483dd0.cpe.net.cable.rogers.com.54786: Flags [P.], seq 16386396:16386656, ack 9685, win 501, options [nop,nop,TS val 3769446317 ecr 827110504], length 260
16:57:25.487720 IP 68.183.205.32.ssh > cpe00fc8d483dd3-cm00fc8d483dd0.cpe.net.cable.rogers.com.54786: Flags [P.], seq 16386656:16386916, ack 9685, win 501, options [nop,nop,TS val 3769446317 ecr 827110504], length 260
16:57:25.487778 IP 68.183.205.32.ssh > cpe00fc8d483dd3-cm00fc8d483dd0.cpe.net.cable.rogers.com.54786: Flags [P.], seq 16386916:16387176, ack 9685, win 501, options [nop,nop,TS val 3769446317 ecr 827110504], length 260
16:57:25.487833 IP 68.183.205.32.ssh > cpe00fc8d483dd3-cm00fc8d483dd0.cpe.net.cable.rogers.com.54786: Flags [P.], seq 16387176:16387436, ack 9685, win 501, options [nop,nop,TS val 3769446317 ecr 827110504], length 260
16:57:25.487884 IP 68.183.205.32.ssh > cpe00fc8d483dd3-cm00fc8d483dd0.cpe.net.cable.rogers.com.54786: Flags [P.], seq 16387436:16387696, ack 9685, win 501, options [nop,nop,TS val 3769446317 ecr 827110504], length 260
16:57:25.487939 IP 68.183.205.32.ssh > cpe00fc8d483dd3-cm00fc8d483dd0.cpe.net.cable.rogers.com.54786: Flags [P.], seq 16387696:16387956, ack 9685, win 501, options [nop,nop,TS val 3769446317 ecr 827110504], length 260
16:57:25.487989 IP 68.183.205.32.ssh > cpe00fc8d483dd3-cm00fc8d483dd0.cpe.net.cable.rogers.com.54786: Flags [P.], seq 16387956:16388216, ack 9685, win 501, options [nop,nop,TS val 3769446317 ecr 827110504], length 260
16:57:25.488043 IP 68.183.205.32.ssh > cpe00fc8d483dd3-cm00fc8d483dd0.cpe.net.cable.rogers.com.54786: Flags [P.], seq 16388216:16388476, ack 9685, win 501, options [nop,nop,TS val 3769446317 ecr 827110504], length 260
16:57:25.488093 IP 68.183.205.32.ssh > cpe00fc8d483dd3-cm00fc8d483dd0.cpe.net.cable.rogers.com.54786: Flags [P.], seq 16388476:16388736, ack 9685, win 501, options [nop,nop,TS val 3769446317 ecr 827110504], length 260
16:57:25.488147 IP 68.183.205.32.ssh > cpe00fc8d483dd3-cm00fc8d483dd0.cpe.net.cable.rogers.com.54786: Flags [P.], seq 16388736:16388996, ack 9685, win 501, options [nop,nop,TS val 3769446317 ecr 827110504], length 260
16:57:25.488202 IP 68.183.205.32.ssh > cpe00fc8d483dd3-cm00fc8d483dd0.cpe.net.cable.rogers.com.54786: Flags [P.], seq 16388996:16389256, ack 9685, win 501, options [nop,nop,TS val 3769446317 ecr 827110504], length 260
16:57:25.488286 IP 68.183.205.32.ssh > cpe00fc8d483dd3-cm00fc8d483dd0.cpe.net.cable.rogers.com.54786: Flags [P.], seq 16389256:16389516, ack 9685, win 501, options [nop,nop,TS val 3769446317 ecr 827110504], length 260
16:57:25.488368 IP 68.183.205.32.ssh > cpe00fc8d483dd3-cm00fc8d483dd0.cpe.net.cable.rogers.com.54786: Flags [P.], seq 16389516:16389776, ack 9685, win 501, options [nop,nop,TS val 3769446317 ecr 827110504], length 260
16:57:25.488421 IP 68.183.205.32.ssh > cpe00fc8d483dd3-cm00fc8d483dd0.cpe.net.cable.rogers.com.54786: Flags [P.], seq 16389776:16390036, ack 9685, win 501, options [nop,nop,TS val 3769446317 ecr 827110504], length 260
16:57:25.488477 IP 68.183.205.32.ssh > cpe00fc8d483dd3-cm00fc8d483dd0.cpe.net.cable.rogers.com.54786: Flags [P.], seq 16390036:16390296, ack 9685, win 501, options [nop,nop,TS val 3769446317 ecr 827110504], length 260
16:57:25.488529 IP 68.183.205.32.ssh > cpe00fc8d483dd3-cm00fc8d483dd0.cpe.net.cable.rogers.com.54786: Flags [P.], seq 16390296:16390556, ack 9685, win 501, options [nop,nop,TS val 3769446317 ecr 827110504], length 260
16:57:25.488582 IP 68.183.205.32.ssh > cpe00fc8d483dd3-cm00fc8d483dd0.cpe.net.cable.rogers.com.54786: Flags [P.], seq 16390556:16390816, ack 9685, win 501, options [nop,nop,TS val 3769446318 ecr 827110504], length 260
16:57:25.488641 IP 68.183.205.32.ssh > cpe00fc8d483dd3-cm00fc8d483dd0.cpe.net.cable.rogers.com.54786: Flags [P.], seq 16390816:16391076, ack 9685, win 501, options [nop,nop,TS val 3769446318 ecr 827110504], length 260
16:57:25.488702 IP 68.183.205.32.ssh > cpe00fc8d483dd3-cm00fc8d483dd0.cpe.net.cable.rogers.com.54786: Flags [P.], seq 16391076:16391336, ack 9685, win 501, options [nop,nop,TS val 3769446318 ecr 827110504], length 260
16:57:25.488757 IP 68.183.205.32.ssh > cpe00fc8d483dd3-cm00fc8d483dd0.cpe.net.cable.rogers.com.54786: Flags [P.], seq 16391336:16391596, ack 9685, win 501, options [nop,nop,TS val 3769446318 ecr 827110504], length 260
16:57:25.488809 IP 68.183.205.32.ssh > cpe00fc8d483dd3-cm00fc8d483dd0.cpe.net.cable.rogers.com.54786: Flags [P.], seq 16391596:16391856, ack 9685, win 501, options [nop,nop,TS val 3769446318 ecr 827110504], length 260
16:57:25.488861 IP 68.183.205.32.ssh > cpe00fc8d483dd3-cm00fc8d483dd0.cpe.net.cable.rogers.com.54786: Flags [P.], seq 16391856:16392116, ack 9685, win 501, options [nop,nop,TS val 3769446318 ecr 827110504], length 260
16:57:25.488915 IP 68.183.205.32.ssh > cpe00fc8d483dd3-cm00fc8d483dd0.cpe.net.cable.rogers.com.54786: Flags [P.], seq 16392116:16392376, ack 9685, win 501, options [nop,nop,TS val 3769446318 ecr 827110504], length 260
16:57:25.488970 IP 68.183.205.32.ssh > cpe00fc8d483dd3-cm00fc8d483dd0.cpe.net.cable.rogers.com.54786: Flags [P.], seq 16392376:16392636, ack 9685, win 501, options [nop,nop,TS val 3769446318 ecr 827110504], length 260
16:57:25.489022 IP 68.183.205.32.ssh > cpe00fc8d483dd3-cm00fc8d483dd0.cpe.net.cable.rogers.com.54786: Flags [P.], seq 16392636:16392896, ack 9685, win 501, options [nop,nop,TS val 3769446318 ecr 827110504], length 260
16:57:25.489073 IP 68.183.205.32.ssh > cpe00fc8d483dd3-cm00fc8d483dd0.cpe.net.cable.rogers.com.54786: Flags [P.], seq 16392896:16393156, ack 9685, win 501, options [nop,nop,TS val 3769446318 ecr 827110504], length 260
16:57:25.489134 IP 68.183.205.32.ssh > cpe00fc8d483dd3-cm00fc8d483dd0.cpe.net.cable.rogers.com.54786: Flags [P.], seq 16393156:16393416, ack 9685, win 501, options [nop,nop,TS val 3769446318 ecr 827110504], length 260
16:57:25.489188 IP 68.183.205.32.ssh > cpe00fc8d483dd3-cm00fc8d483dd0.cpe.net.cable.rogers.com.54786: Flags [P.], seq 16393416:16393676, ack 9685, win 501, options [nop,nop,TS val 3769446318 ecr 827110504], length 260
16:57:25.489238 IP 68.183.205.32.ssh > cpe00fc8d483dd3-cm00fc8d483dd0.cpe.net.cable.rogers.com.54786: Flags [P.], seq 16393676:16393936, ack 9685, win 501, options [nop,nop,TS val 3769446318 ecr 827110504], length 260
16:57:25.489297 IP 68.183.205.32.ssh > cpe00fc8d483dd3-cm00fc8d483dd0.cpe.net.cable.rogers.com.54786: Flags [P.], seq 16393936:16394196, ack 9685, win 501, options [nop,nop,TS val 3769446318 ecr 827110504], length 260
16:57:25.489350 IP 68.183.205.32.ssh > cpe00fc8d483dd3-cm00fc8d483dd0.cpe.net.cable.rogers.com.54786: Flags [P.], seq 16394196:16394456, ack 9685, win 501, options [nop,nop,TS val 3769446318 ecr 827110504], length 260
16:57:25.489403 IP 68.183.205.32.ssh > cpe00fc8d483dd3-cm00fc8d483dd0.cpe.net.cable.rogers.com.54786: Flags [P.], seq 16394456:16394716, ack 9685, win 501, options [nop,nop,TS val 3769446318 ecr 827110504], length 260
16:57:25.489452 IP 68.183.205.32.ssh > cpe00fc8d483dd3-cm00fc8d483dd0.cpe.net.cable.rogers.com.54786: Flags [P.], seq 16394716:16394976, ack 9685, win 501, options [nop,nop,TS val 3769446318 ecr 827110504], length 260
16:57:25.489509 IP 68.183.205.32.ssh > cpe00fc8d483dd3-cm00fc8d483dd0.cpe.net.cable.rogers.com.54786: Flags [P.], seq 16394976:16395236, ack 9685, win 501, options [nop,nop,TS val 3769446318 ecr 827110504], length 260
16:57:25.489564 IP 68.183.205.32.ssh > cpe00fc8d483dd3-cm00fc8d483dd0.cpe.net.cable.rogers.com.54786: Flags [P.], seq 16395236:16395496, ack 9685, win 501, options [nop,nop,TS val 3769446318 ecr 827110504], length 260
16:57:25.489621 IP 68.183.205.32.ssh > cpe00fc8d483dd3-cm00fc8d483dd0.cpe.net.cable.rogers.com.54786: Flags [P.], seq 16395496:16395756, ack 9685, win 501, options [nop,nop,TS val 3769446319 ecr 827110504], length 260
16:57:25.489673 IP 68.183.205.32.ssh > cpe00fc8d483dd3-cm00fc8d483dd0.cpe.net.cable.rogers.com.54786: Flags [P.], seq 16395756:16396016, ack 9685, win 501, options [nop,nop,TS val 3769446319 ecr 827110504], length 260
16:57:25.489726 IP 68.183.205.32.ssh > cpe00fc8d483dd3-cm00fc8d483dd0.cpe.net.cable.rogers.com.54786: Flags [P.], seq 16396016:16396276, ack 9685, win 501, options [nop,nop,TS val 3769446319 ecr 827110504], length 260
16:57:25.489778 IP 68.183.205.32.ssh > cpe00fc8d483dd3-cm00fc8d483dd0.cpe.net.cable.rogers.com.54786: Flags [P.], seq 16396276:16396536, ack 9685, win 501, options [nop,nop,TS val 3769446319 ecr 827110504], length 260
16:57:25.489832 IP 68.183.205.32.ssh > cpe00fc8d483dd3-cm00fc8d483dd0.cpe.net.cable.rogers.com.54786: Flags [P.], seq 16396536:16396796, ack 9685, win 501, options [nop,nop,TS val 3769446319 ecr 827110504], length 260
16:57:25.489883 IP 68.183.205.32.ssh > cpe00fc8d483dd3-cm00fc8d483dd0.cpe.net.cable.rogers.com.54786: Flags [P.], seq 16396796:16397056, ack 9685, win 501, options [nop,nop,TS val 3769446319 ecr 827110504], length 260
16:57:25.489940 IP 68.183.205.32.ssh > cpe00fc8d483dd3-cm00fc8d483dd0.cpe.net.cable.rogers.com.54786: Flags [P.], seq 16397056:16397316, ack 9685, win 501, options [nop,nop,TS val 3769446319 ecr 827110504], length 260
16:57:25.489996 IP 68.183.205.32.ssh > cpe00fc8d483dd3-cm00fc8d483dd0.cpe.net.cable.rogers.com.54786: Flags [P.], seq 16397316:16397576, ack 9685, win 501, options [nop,nop,TS val 3769446319 ecr 827110504], length 260
16:57:25.490055 IP 68.183.205.32.ssh > cpe00fc8d483dd3-cm00fc8d483dd0.cpe.net.cable.rogers.com.54786: Flags [P.], seq 16397576:16397836, ack 9685, win 501, options [nop,nop,TS val 3769446319 ecr 827110504], length 260
16:57:25.490110 IP 68.183.205.32.ssh > cpe00fc8d483dd3-cm00fc8d483dd0.cpe.net.cable.rogers.com.54786: Flags [P.], seq 16397836:16398096, ack 9685, win 501, options [nop,nop,TS val 3769446319 ecr 827110504], length 260
16:57:25.490167 IP 68.183.205.32.ssh > cpe00fc8d483dd3-cm00fc8d483dd0.cpe.net.cable.rogers.com.54786: Flags [P.], seq 16398096:16398356, ack 9685, win 501, options [nop,nop,TS val 3769446319 ecr 827110504], length 260
16:57:25.490222 IP 68.183.205.32.ssh > cpe00fc8d483dd3-cm00fc8d483dd0.cpe.net.cable.rogers.com.54786: Flags [P.], seq 16398356:16398616, ack 9685, win 501, options [nop,nop,TS val 3769446319 ecr 827110504], length 260
16:57:25.490282 IP 68.183.205.32.ssh > cpe00fc8d483dd3-cm00fc8d483dd0.cpe.net.cable.rogers.com.54786: Flags [P.], seq 16398616:16398876, ack 9685, win 501, options [nop,nop,TS val 3769446319 ecr 827110504], length 260
16:57:25.490338 IP 68.183.205.32.ssh > cpe00fc8d483dd3-cm00fc8d483dd0.cpe.net.cable.rogers.com.54786: Flags [P.], seq 16398876:16399136, ack 9685, win 501, options [nop,nop,TS val 3769446319 ecr 827110504], length 260
16:57:25.490396 IP 68.183.205.32.ssh > cpe00fc8d483dd3-cm00fc8d483dd0.cpe.net.cable.rogers.com.54786: Flags [P.], seq 16399136:16399396, ack 9685, win 501, options [nop,nop,TS val 3769446319 ecr 827110504], length 260
16:57:25.490453 IP 68.183.205.32.ssh > cpe00fc8d483dd3-cm00fc8d483dd0.cpe.net.cable.rogers.com.54786: Flags [P.], seq 16399396:16399656, ack 9685, win 501, options [nop,nop,TS val 3769446319 ecr 827110504], length 260
16:57:25.490515 IP 68.183.205.32.ssh > cpe00fc8d483dd3-cm00fc8d483dd0.cpe.net.cable.rogers.com.54786: Flags [P.], seq 16399656:16399916, ack 9685, win 501, options [nop,nop,TS val 3769446319 ecr 827110504], length 260
16:57:25.490570 IP 68.183.205.32.ssh > cpe00fc8d483dd3-cm00fc8d483dd0.cpe.net.cable.rogers.com.54786: Flags [P.], seq 16399916:16400176, ack 9685, win 501, options [nop,nop,TS val 3769446320 ecr 827110504], length 260
16:57:25.490628 IP 68.183.205.32.ssh > cpe00fc8d483dd3-cm00fc8d483dd0.cpe.net.cable.rogers.com.54786: Flags [P.], seq 16400176:16400436, ack 9685, win 501, options [nop,nop,TS val 3769446320 ecr 827110504], length 260
16:57:25.490689 IP 68.183.205.32.ssh > cpe00fc8d483dd3-cm00fc8d483dd0.cpe.net.cable.rogers.com.54786: Flags [P.], seq 16400436:16400696, ack 9685, win 501, options [nop,nop,TS val 3769446320 ecr 827110504], length 260
16:57:25.490742 IP 68.183.205.32.ssh > cpe00fc8d483dd3-cm00fc8d483dd0.cpe.net.cable.rogers.com.54786: Flags [P.], seq 16400696:16400956, ack 9685, win 501, options [nop,nop,TS val 3769446320 ecr 827110504], length 260
16:57:25.490803 IP 68.183.205.32.ssh > cpe00fc8d483dd3-cm00fc8d483dd0.cpe.net.cable.rogers.com.54786: Flags [P.], seq 16400956:16401216, ack 9685, win 501, options [nop,nop,TS val 3769446320 ecr 827110504], length 260
16:57:25.490860 IP 68.183.205.32.ssh > cpe00fc8d483dd3-cm00fc8d483dd0.cpe.net.cable.rogers.com.54786: Flags [P.], seq 16401216:16401476, ack 9685, win 501, options [nop,nop,TS val 3769446320 ecr 827110504], length 260
16:57:25.490917 IP 68.183.205.32.ssh > cpe00fc8d483dd3-cm00fc8d483dd0.cpe.net.cable.rogers.com.54786: Flags [P.], seq 16401476:16401736, ack 9685, win 501, options [nop,nop,TS val 3769446320 ecr 827110504], length 260
16:57:25.490974 IP 68.183.205.32.ssh > cpe00fc8d483dd3-cm00fc8d483dd0.cpe.net.cable.rogers.com.54786: Flags [P.], seq 16401736:16401996, ack 9685, win 501, options [nop,nop,TS val 3769446320 ecr 827110504], length 260
16:57:25.491385 IP 68.183.205.32.ssh > cpe00fc8d483dd3-cm00fc8d483dd0.cpe.net.cable.rogers.com.54786: Flags [P.], seq 16401996:16402256, ack 9685, win 501, options [nop,nop,TS val 3769446320 ecr 827110504], length 260
16:57:25.491497 IP 68.183.205.32.ssh > cpe00fc8d483dd3-cm00fc8d483dd0.cpe.net.cable.rogers.com.54786: Flags [P.], seq 16402256:16402516, ack 9685, win 501, options [nop,nop,TS val 3769446320 ecr 827110504], length 260
16:57:25.491566 IP 68.183.205.32.ssh > cpe00fc8d483dd3-cm00fc8d483dd0.cpe.net.cable.rogers.com.54786: Flags [P.], seq 16402516:16402776, ack 9685, win 501, options [nop,nop,TS val 3769446320 ecr 827110504], length 260
16:57:25.491629 IP 68.183.205.32.ssh > cpe00fc8d483dd3-cm00fc8d483dd0.cpe.net.cable.rogers.com.54786: Flags [P.], seq 16402776:16403036, ack 9685, win 501, options [nop,nop,TS val 3769446321 ecr 827110504], length 260
16:57:25.491703 IP 68.183.205.32.ssh > cpe00fc8d483dd3-cm00fc8d483dd0.cpe.net.cable.rogers.com.54786: Flags [P.], seq 16403036:16403296, ack 9685, win 501, options [nop,nop,TS val 3769446321 ecr 827110504], length 260
16:57:25.491766 IP 68.183.205.32.ssh > cpe00fc8d483dd3-cm00fc8d483dd0.cpe.net.cable.rogers.com.54786: Flags [P.], seq 16403296:16403556, ack 9685, win 501, options [nop,nop,TS val 3769446321 ecr 827110504], length 260
16:57:25.491833 IP 68.183.205.32.ssh > cpe00fc8d483dd3-cm00fc8d483dd0.cpe.net.cable.rogers.com.54786: Flags [P.], seq 16403556:16403816, ack 9685, win 501, options [nop,nop,TS val 3769446321 ecr 827110504], length 260
16:57:25.491896 IP 68.183.205.32.ssh > cpe00fc8d483dd3-cm00fc8d483dd0.cpe.net.cable.rogers.com.54786: Flags [P.], seq 16403816:16404076, ack 9685, win 501, options [nop,nop,TS val 3769446321 ecr 827110504], length 260
16:57:25.492026 IP 68.183.205.32.ssh > cpe00fc8d483dd3-cm00fc8d483dd0.cpe.net.cable.rogers.com.54786: Flags [P.], seq 16404076:16404336, ack 9685, win 501, options [nop,nop,TS val 3769446321 ecr 827110504], length 260
16:57:25.492099 IP 68.183.205.32.ssh > cpe00fc8d483dd3-cm00fc8d483dd0.cpe.net.cable.rogers.com.54786: Flags [P.], seq 16404336:16404596, ack 9685, win 501, options [nop,nop,TS val 3769446321 ecr 827110504], length 260
16:57:25.492164 IP 68.183.205.32.ssh > cpe00fc8d483dd3-cm00fc8d483dd0.cpe.net.cable.rogers.com.54786: Flags [P.], seq 16404596:16404856, ack 9685, win 501, options [nop,nop,TS val 3769446321 ecr 827110504], length 260
16:57:25.492233 IP 68.183.205.32.ssh > cpe00fc8d483dd3-cm00fc8d483dd0.cpe.net.cable.rogers.com.54786: Flags [P.], seq 16404856:16405116, ack 9685, win 501, options [nop,nop,TS val 3769446321 ecr 827110504], length 260
16:57:25.492295 IP 68.183.205.32.ssh > cpe00fc8d483dd3-cm00fc8d483dd0.cpe.net.cable.rogers.com.54786: Flags [P.], seq 16405116:16405376, ack 9685, win 501, options [nop,nop,TS val 3769446321 ecr 827110504], length 260
16:57:25.492382 IP 68.183.205.32.ssh > cpe00fc8d483dd3-cm00fc8d483dd0.cpe.net.cable.rogers.com.54786: Flags [P.], seq 16405376:16405636, ack 9685, win 501, options [nop,nop,TS val 3769446321 ecr 827110504], length 260
16:57:25.492449 IP 68.183.205.32.ssh > cpe00fc8d483dd3-cm00fc8d483dd0.cpe.net.cable.rogers.com.54786: Flags [P.], seq 16405636:16405896, ack 9685, win 501, options [nop,nop,TS val 3769446321 ecr 827110504], length 260
16:57:25.492515 IP 68.183.205.32.ssh > cpe00fc8d483dd3-cm00fc8d483dd0.cpe.net.cable.rogers.com.54786: Flags [P.], seq 16405896:16406156, ack 9685, win 501, options [nop,nop,TS val 3769446321 ecr 827110504], length 260
16:57:25.492582 IP 68.183.205.32.ssh > cpe00fc8d483dd3-cm00fc8d483dd0.cpe.net.cable.rogers.com.54786: Flags [P.], seq 16406156:16406416, ack 9685, win 501, options [nop,nop,TS val 3769446322 ecr 827110504], length 260
16:57:25.492649 IP 68.183.205.32.ssh > cpe00fc8d483dd3-cm00fc8d483dd0.cpe.net.cable.rogers.com.54786: Flags [P.], seq 16406416:16406676, ack 9685, win 501, options [nop,nop,TS val 3769446322 ecr 827110504], length 260
16:57:25.492717 IP 68.183.205.32.ssh > cpe00fc8d483dd3-cm00fc8d483dd0.cpe.net.cable.rogers.com.54786: Flags [P.], seq 16406676:16406936, ack 9685, win 501, options [nop,nop,TS val 3769446322 ecr 827110504], length 260
16:57:25.492781 IP 68.183.205.32.ssh > cpe00fc8d483dd3-cm00fc8d483dd0.cpe.net.cable.rogers.com.54786: Flags [P.], seq 16406936:16407196, ack 9685, win 501, options [nop,nop,TS val 3769446322 ecr 827110504], length 260
16:57:25.492843 IP 68.183.205.32.ssh > cpe00fc8d483dd3-cm00fc8d483dd0.cpe.net.cable.rogers.com.54786: Flags [P.], seq 16407196:16407456, ack 9685, win 501, options [nop,nop,TS val 3769446322 ecr 827110504], length 260
16:57:25.492912 IP 68.183.205.32.ssh > cpe00fc8d483dd3-cm00fc8d483dd0.cpe.net.cable.rogers.com.54786: Flags [P.], seq 16407456:16407716, ack 9685, win 501, options [nop,nop,TS val 3769446322 ecr 827110504], length 260
16:57:25.492979 IP 68.183.205.32.ssh > cpe00fc8d483dd3-cm00fc8d483dd0.cpe.net.cable.rogers.com.54786: Flags [P.], seq 16407716:16407976, ack 9685, win 501, options [nop,nop,TS val 3769446322 ecr 827110504], length 260
16:57:25.493063 IP 68.183.205.32.ssh > cpe00fc8d483dd3-cm00fc8d483dd0.cpe.net.cable.rogers.com.54786: Flags [P.], seq 16407976:16408236, ack 9685, win 501, options [nop,nop,TS val 3769446322 ecr 827110504], length 260
16:57:25.493132 IP 68.183.205.32.ssh > cpe00fc8d483dd3-cm00fc8d483dd0.cpe.net.cable.rogers.com.54786: Flags [P.], seq 16408236:16408496, ack 9685, win 501, options [nop,nop,TS val 3769446322 ecr 827110504], length 260
16:57:25.493199 IP 68.183.205.32.ssh > cpe00fc8d483dd3-cm00fc8d483dd0.cpe.net.cable.rogers.com.54786: Flags [P.], seq 16408496:16408756, ack 9685, win 501, options [nop,nop,TS val 3769446322 ecr 827110504], length 260
16:57:25.493261 IP 68.183.205.32.ssh > cpe00fc8d483dd3-cm00fc8d483dd0.cpe.net.cable.rogers.com.54786: Flags [P.], seq 16408756:16409016, ack 9685, win 501, options [nop,nop,TS val 3769446322 ecr 827110504], length 260
16:57:25.493325 IP 68.183.205.32.ssh > cpe00fc8d483dd3-cm00fc8d483dd0.cpe.net.cable.rogers.com.54786: Flags [P.], seq 16409016:16409276, ack 9685, win 501, options [nop,nop,TS val 3769446322 ecr 827110504], length 260
16:57:25.493397 IP 68.183.205.32.ssh > cpe00fc8d483dd3-cm00fc8d483dd0.cpe.net.cable.rogers.com.54786: Flags [P.], seq 16409276:16409536, ack 9685, win 501, options [nop,nop,TS val 3769446322 ecr 827110504], length 260
16:57:25.493464 IP 68.183.205.32.ssh > cpe00fc8d483dd3-cm00fc8d483dd0.cpe.net.cable.rogers.com.54786: Flags [P.], seq 16409536:16409796, ack 9685, win 501, options [nop,nop,TS val 3769446322 ecr 827110504], length 260
16:57:25.493538 IP 68.183.205.32.ssh > cpe00fc8d483dd3-cm00fc8d483dd0.cpe.net.cable.rogers.com.54786: Flags [P.], seq 16409796:16410056, ack 9685, win 501, options [nop,nop,TS val 3769446322 ecr 827110504], length 260
16:57:25.493607 IP 68.183.205.32.ssh > cpe00fc8d483dd3-cm00fc8d483dd0.cpe.net.cable.rogers.com.54786: Flags [P.], seq 16410056:16410316, ack 9685, win 501, options [nop,nop,TS val 3769446323 ecr 827110504], length 260
16:57:25.493696 IP 68.183.205.32.ssh > cpe00fc8d483dd3-cm00fc8d483dd0.cpe.net.cable.rogers.com.54786: Flags [P.], seq 16410316:16410576, ack 9685, win 501, options [nop,nop,TS val 3769446323 ecr 827110504], length 260
16:57:25.493765 IP 68.183.205.32.ssh > cpe00fc8d483dd3-cm00fc8d483dd0.cpe.net.cable.rogers.com.54786: Flags [P.], seq 16410576:16410836, ack 9685, win 501, options [nop,nop,TS val 3769446323 ecr 827110504], length 260
16:57:25.493835 IP 68.183.205.32.ssh > cpe00fc8d483dd3-cm00fc8d483dd0.cpe.net.cable.rogers.com.54786: Flags [P.], seq 16410836:16411096, ack 9685, win 501, options [nop,nop,TS val 3769446323 ecr 827110504], length 260
16:57:25.493899 IP 68.183.205.32.ssh > cpe00fc8d483dd3-cm00fc8d483dd0.cpe.net.cable.rogers.com.54786: Flags [P.], seq 16411096:16411356, ack 9685, win 501, options [nop,nop,TS val 3769446323 ecr 827110504], length 260
16:57:25.493966 IP 68.183.205.32.ssh > cpe00fc8d483dd3-cm00fc8d483dd0.cpe.net.cable.rogers.com.54786: Flags [P.], seq 16411356:16411616, ack 9685, win 501, options [nop,nop,TS val 3769446323 ecr 827110504], length 260
16:57:25.494031 IP 68.183.205.32.ssh > cpe00fc8d483dd3-cm00fc8d483dd0.cpe.net.cable.rogers.com.54786: Flags [P.], seq 16411616:16411876, ack 9685, win 501, options [nop,nop,TS val 3769446323 ecr 827110504], length 260
16:57:25.494100 IP 68.183.205.32.ssh > cpe00fc8d483dd3-cm00fc8d483dd0.cpe.net.cable.rogers.com.54786: Flags [P.], seq 16411876:16412136, ack 9685, win 501, options [nop,nop,TS val 3769446323 ecr 827110504], length 260
16:57:25.494176 IP 68.183.205.32.ssh > cpe00fc8d483dd3-cm00fc8d483dd0.cpe.net.cable.rogers.com.54786: Flags [P.], seq 16412136:16412396, ack 9685, win 501, options [nop,nop,TS val 3769446323 ecr 827110504], length 260
16:57:25.494244 IP 68.183.205.32.ssh > cpe00fc8d483dd3-cm00fc8d483dd0.cpe.net.cable.rogers.com.54786: Flags [P.], seq 16412396:16412656, ack 9685, win 501, options [nop,nop,TS val 3769446323 ecr 827110504], length 260
16:57:25.494313 IP 68.183.205.32.ssh > cpe00fc8d483dd3-cm00fc8d483dd0.cpe.net.cable.rogers.com.54786: Flags [P.], seq 16412656:16412916, ack 9685, win 501, options [nop,nop,TS val 3769446323 ecr 827110504], length 260
16:57:25.494382 IP 68.183.205.32.ssh > cpe00fc8d483dd3-cm00fc8d483dd0.cpe.net.cable.rogers.com.54786: Flags [P.], seq 16412916:16413176, ack 9685, win 501, options [nop,nop,TS val 3769446323 ecr 827110504], length 260
16:57:25.494452 IP 68.183.205.32.ssh > cpe00fc8d483dd3-cm00fc8d483dd0.cpe.net.cable.rogers.com.54786: Flags [P.], seq 16413176:16413436, ack 9685, win 501, options [nop,nop,TS val 3769446323 ecr 827110504], length 260
16:57:25.494519 IP 68.183.205.32.ssh > cpe00fc8d483dd3-cm00fc8d483dd0.cpe.net.cable.rogers.com.54786: Flags [P.], seq 16413436:16413696, ack 9685, win 501, options [nop,nop,TS val 3769446323 ecr 827110504], length 260
16:57:25.494588 IP 68.183.205.32.ssh > cpe00fc8d483dd3-cm00fc8d483dd0.cpe.net.cable.rogers.com.54786: Flags [P.], seq 16413696:16413956, ack 9685, win 501, options [nop,nop,TS val 3769446324 ecr 827110504], length 260
16:57:25.494653 IP cpe00fc8d483dd3-cm00fc8d483dd0.cpe.net.cable.rogers.com.54786 > 68.183.205.32.ssh: Flags [P.], seq 9685:9757, ack 16329784, win 15322, options [nop,nop,TS val 827110515 ecr 3769446292], length 72
16:57:25.494805 IP cpe00fc8d483dd3-cm00fc8d483dd0.cpe.net.cable.rogers.com.54786 > 68.183.205.32.ssh: Flags [.], ack 16345124, win 16030, options [nop,nop,TS val 827110517 ecr 3769446306], length 0
16:57:25.494843 IP cpe00fc8d483dd3-cm00fc8d483dd0.cpe.net.cable.rogers.com.54786 > 68.183.205.32.ssh: Flags [P.], seq 9757:9793, ack 16345644, win 16022, options [nop,nop,TS val 827110517 ecr 3769446307], length 36
16:57:25.494850 IP cpe00fc8d483dd3-cm00fc8d483dd0.cpe.net.cable.rogers.com.54786 > 68.183.205.32.ssh: Flags [.], ack 16364296, win 16030, options [nop,nop,TS val 827110521 ecr 3769446311], length 0
^C
64546 packets captured
64556 packets received by filter
8 packets dropped by kernel